rowNumber,queueId,questionNumber,questionType,questionText,subject,grade,topic,subtopic,learningObjective,bloomsLevel,difficultyLevel,difficultyRating,summary,options,explanation,generationMetadata
23,tfat4ru-sasuf1of3-lscfay2cx-q23-mcq,Q23,mcq,A recipe uses 2/3 cup of oats in one bowl and 3/10 cup in another bowl. Choose the total amount of oats used.,Maths,5,Fraction Arithmetic,Adding & Subtracting Unlike Fractions,Students can find a common denominator to add and subtract fractions,Applying,medium,3,"MCQ for Grade 5 Fraction Arithmetic: Adding & Subtracting Unlike Fractions, aligned to Students can find a common denominator to add and subtract fractions.","[{""text"":""29/30 cup"",""correct"":true},{""text"":""5/13 cup"",""correct"":false},{""text"":""25/30 cup"",""correct"":false},{""text"":""1 cup"",""correct"":false}]","Use a common denominator of 30. Then 2/3 = 20/30 and 3/10 = 9/30. Add them to get 29/30 cup. The other options come from adding tops and bottoms, rewriting one fraction incorrectly, or rounding up to 1 cup.","{""questionNumber"":""Q23"",""questionType"":""mcq"",""subject"":""Maths"",""grade"":5,""topic"":""Fraction Arithmetic"",""subtopic"":""Adding & Subtracting Unlike Fractions"",""learning_objective"":""Students can find a common denominator to add and subtract fractions"",""focus"":""addition""}"
24,tfat4ru-sasuf1of3-lscfay2cx-q25-mcq,Q25,mcq,"Choose the equation that matches the sum of 1/6, 1/4, and 1/3 using one common denominator.",Maths,5,Fraction Arithmetic,Adding & Subtracting Unlike Fractions,Students can find a common denominator to add and subtract fractions,Applying,medium,3,"MCQ for Grade 5 Fraction Arithmetic: Adding & Subtracting Unlike Fractions, aligned to Students can find a common denominator to add and subtract fractions.","[{""text"":""1/6 + 1/4 + 1/3 = 2/12 + 3/12 + 4/12 = 9/12"",""correct"":true},{""text"":""1/6 + 1/4 + 1/3 = 1/13"",""correct"":false},{""text"":""1/6 + 1/4 + 1/3 = 1/18 + 1/18 + 1/18 = 3/18"",""correct"":false},{""text"":""1/6 + 1/4 + 1/3 = 2/6 + 1/6 + 1/6 = 4/6"",""correct"":false}]","A common denominator for 6, 4, and 3 is 12. Rewrite the fractions as 2/12, 3/12, and 4/12. Their sum is 9/12, which equals 3/4. The other options use incorrect common denominators or incorrect equivalent fractions.","{""questionNumber"":""Q25"",""questionType"":""mcq"",""subject"":""Maths"",""grade"":5,""topic"":""Fraction Arithmetic"",""subtopic"":""Adding & Subtracting Unlike Fractions"",""learning_objective"":""Students can find a common denominator to add and subtract fractions"",""focus"":""addition""}"
25,tfat4ru-sasuf1of3-lscfay2cx-q26-mcq,Q26,mcq,A water tank is 7/9 full. Then 5/12 of the whole tank is drained out. What fraction of the tank is still full?,Maths,5,Fraction Arithmetic,Adding & Subtracting Unlike Fractions,Students can find a common denominator to add and subtract fractions,Applying,medium,3,"MCQ for Grade 5 Fraction Arithmetic: Adding & Subtracting Unlike Fractions, aligned to Students can find a common denominator to add and subtract fractions.","[{""text"":""13/36"",""correct"":true},{""text"":""2/3"",""correct"":false},{""text"":""2/21"",""correct"":false},{""text"":""12/21"",""correct"":false}]","Find 7/9 - 5/12 using a common denominator of 36. Rewrite 7/9 as 28/36 and 5/12 as 15/36. Then 28/36 - 15/36 = 13/36. So 13/36 of the tank is still full. The other options come from incorrect subtraction methods, such as subtracting only numerators or subtracting numerators and denominators separately.","{""questionNumber"":""Q26"",""questionType"":""mcq"",""subject"":""Maths"",""grade"":5,""topic"":""Fraction Arithmetic"",""subtopic"":""Adding & Subtracting Unlike Fractions"",""learning_objective"":""Students can find a common denominator to add and subtract fractions"",""focus"":""subtraction""}"
26,tfat4ru-sasuf1of3-lscfay2cx-q27-mcq,Q27,mcq,Choose the sentence that is correct about 2/5 + 1/6.,Maths,5,Fraction Arithmetic,Adding & Subtracting Unlike Fractions,Students can find a common denominator to add and subtract fractions,Understanding,medium,3,"MCQ for Grade 5 Fraction Arithmetic: Adding & Subtracting Unlike Fractions, aligned to Students can find a common denominator to add and subtract fractions.","[{""text"":""Using thirtieths, the sum is 12/30 + 5/30 = 17/30."",""correct"":true},{""text"":""Using elevenths, the sum is 3/11."",""correct"":false},{""text"":""The sum is 3/5 because 2 + 1 = 3 and 5 stays the same."",""correct"":false},{""text"":""The sum is 13/30 because only 1/6 changes to 5/30."",""correct"":false}]",A common denominator for 5 and 6 is 30. Rewrite 2/5 as 12/30 and 1/6 as 5/30. Then add to get 17/30. The wrong choices show adding incorrectly or changing only one fraction.,"{""questionNumber"":""Q27"",""questionType"":""mcq"",""subject"":""Maths"",""grade"":5,""topic"":""Fraction Arithmetic"",""subtopic"":""Adding & Subtracting Unlike Fractions"",""learning_objective"":""Students can find a common denominator to add and subtract fractions"",""focus"":""addition""}"
27,tfat4ru-sasuf1of3-lscfay2cx-q28-mcq,Q28,mcq,"A water tank is filled to 11/12 of its capacity in the morning. By afternoon, 5/18 of the tank is used. Choose the fraction of the tank still filled.",Maths,5,Fraction Arithmetic,Adding & Subtracting Unlike Fractions,Students can find a common denominator to add and subtract fractions,Applying,medium,3,"MCQ for Grade 5 Fraction Arithmetic: Adding & Subtracting Unlike Fractions, aligned to Students can find a common denominator to add and subtract fractions.","[{""text"":""23/36"",""correct"":true},{""text"":""16/30"",""correct"":false},{""text"":""6/30"",""correct"":false},{""text"":""1/2"",""correct"":false}]",Use a common denominator of 36. Then 11/12 = 33/36 and 5/18 = 10/36. Subtract: 33/36 - 10/36 = 23/36. The distractors come from using the wrong denominator or subtracting incorrectly.,"{""questionNumber"":""Q28"",""questionType"":""mcq"",""subject"":""Maths"",""grade"":5,""topic"":""Fraction Arithmetic"",""subtopic"":""Adding & Subtracting Unlike Fractions"",""learning_objective"":""Students can find a common denominator to add and subtract fractions"",""focus"":""subtraction""}"
28,tfat4ru-sasuf1of3-lscfay2cx-q29-mcq,Q29,mcq,Compare the two ways of adding the juice used in one day: 2/3 liter in the morning and 3/4 liter in the afternoon. Method P changes the fractions to twelfths and gets 8/12 + 9/12 = 17/12. Method Q adds tops and bottoms to get 5/7. Choose the best judgment about these methods.,Maths,5,Fraction Arithmetic,Adding & Subtracting Unlike Fractions,Students can find a common denominator to add and subtract fractions,Evaluating,hard,4,"MCQ for Grade 5 Fraction Arithmetic: Adding & Subtracting Unlike Fractions, aligned to Students can find a common denominator to add and subtract fractions.","[{""text"":""Only Method P is correct because unlike fractions must be renamed with a common denominator before adding."",""correct"":true},{""text"":""Only Method Q is correct because 2 + 3 and 3 + 4 can be added directly."",""correct"":false},{""text"":""Both methods are correct because they both combine the same two fractions."",""correct"":false},{""text"":""Neither method is correct because the sum must be less than 1 liter."",""correct"":false}]","The correct choice is that only Method P is correct. To add 2/3 and 3/4, use a common denominator of 12: 2/3 = 8/12 and 3/4 = 9/12, so the sum is 17/12 or 1 5/12. Method Q shows a common mistake: adding numerators and denominators separately to get 5/7. That is not how fraction addition works. The sum can also be greater than 1, so the idea that it must be less than 1 liter is incorrect.","{""questionNumber"":""Q29"",""questionType"":""mcq"",""subject"":""Maths"",""grade"":5,""topic"":""Fraction Arithmetic"",""subtopic"":""Adding & Subtracting Unlike Fractions"",""learning_objective"":""Students can find a common denominator to add and subtract fractions"",""focus"":""compare_methods""}"
29,tfat4ru-sasuf1of3-lscfay2cx-q30-mcq,Q30,mcq,"Choose the equation that correctly matches this situation: A ribbon roll was 5/6 meter long, and 1/4 meter was cut off for a card. One method changes 5/6 to 10/12 and 1/4 to 3/12, then writes 10/12 - 3/12 = 7/12. Another method writes 5 - 1 over 6 - 4 and gets 4/2. Select the correct judgment.",Maths,5,Fraction Arithmetic,Adding & Subtracting Unlike Fractions,Students can find a common denominator to add and subtract fractions,Evaluating,hard,4,"MCQ for Grade 5 Fraction Arithmetic: Adding & Subtracting Unlike Fractions, aligned to Students can find a common denominator to add and subtract fractions.","[{""text"":""The first method is correct because both fractions were renamed using a common denominator before subtracting."",""correct"":true},{""text"":""The second method is correct because subtraction means subtracting top numbers and bottom numbers."",""correct"":false},{""text"":""Both methods are correct because they both subtract 1/4 from 5/6."",""correct"":false},{""text"":""Neither method is correct because 5/6 is smaller than 1/4."",""correct"":false}]","The correct answer is the first method. A common denominator of 12 is used: 5/6 = 10/12 and 1/4 = 3/12, so 10/12 - 3/12 = 7/12. The second method is wrong because you do not subtract denominators when subtracting fractions. The claim that 5/6 is smaller than 1/4 is also false, since 5/6 is much larger than 1/4.","{""questionNumber"":""Q30"",""questionType"":""mcq"",""subject"":""Maths"",""grade"":5,""topic"":""Fraction Arithmetic"",""subtopic"":""Adding & Subtracting Unlike Fractions"",""learning_objective"":""Students can find a common denominator to add and subtract fractions"",""focus"":""find_the_error""}"
30,tfat4ru-sasuf1of3-lscfay2cx-q31-mcq,Q31,mcq,A recipe used 7/8 cup of yogurt and some more milk so that the total liquid was 1 1/6 cups. Choose the amount of milk that makes the total correct.,Maths,5,Fraction Arithmetic,Adding & Subtracting Unlike Fractions,Students can find a common denominator to add and subtract fractions,Analyzing,hard,4,"MCQ for Grade 5 Fraction Arithmetic: Adding & Subtracting Unlike Fractions, aligned to Students can find a common denominator to add and subtract fractions.","[{""text"":""5/24 cup"",""correct"":false},{""text"":""7/24 cup"",""correct"":true},{""text"":""1/4 cup"",""correct"":false},{""text"":""13/48 cup"",""correct"":false}]",Work backward: milk = 1 1/6 - 7/8. Change 1 1/6 to 7/6. The common denominator of 6 and 8 is 24. Then 7/6 = 28/24 and 7/8 = 21/24. So the missing amount is 28/24 - 21/24 = 7/24 cup. A common mistake is choosing 1/4 by thinking 28 - 21 = 7 and turning that into fourths instead of twenty-fourths.,"{""questionNumber"":""Q31"",""questionType"":""mcq"",""subject"":""Maths"",""grade"":5,""topic"":""Fraction Arithmetic"",""subtopic"":""Adding & Subtracting Unlike Fractions"",""learning_objective"":""Students can find a common denominator to add and subtract fractions"",""focus"":""reverse_reasoning""}"
31,tfat4ru-sasuf1of3-lscfay2cx-q32-mcq,Q32,mcq,Select the true statement about the amount of paint left after 3/5 liter is used from a can holding 7/8 liter.,Maths,5,Fraction Arithmetic,Adding & Subtracting Unlike Fractions,Students can find a common denominator to add and subtract fractions,Evaluating,hard,4,"MCQ for Grade 5 Fraction Arithmetic: Adding & Subtracting Unlike Fractions, aligned to Students can find a common denominator to add and subtract fractions.","[{""text"":""The paint left is 11/40 liter because 7/8 = 35/40 and 3/5 = 24/40."",""correct"":true},{""text"":""The paint left is 4/3 liter because 7/8 - 3/5 means 7 - 3 over 8 - 5."",""correct"":false},{""text"":""The paint left is 10/13 liter because 7/8 and 3/5 can be combined by subtracting tops and bottoms."",""correct"":false},{""text"":""The paint left is 2/40 liter because only the denominators need to be made the same."",""correct"":false}]",The correct statement is that the paint left is 11/40 liter. Use a common denominator of 40: 7/8 = 35/40 and 3/5 = 24/40. Then subtract: 35/40 - 24/40 = 11/40. The answers 4/3 and 10/13 come from the incorrect idea of subtracting numerators and denominators directly. The answer 2/40 ignores the numerator values.,"{""questionNumber"":""Q32"",""questionType"":""mcq"",""subject"":""Maths"",""grade"":5,""topic"":""Fraction Arithmetic"",""subtopic"":""Adding & Subtracting Unlike Fractions"",""learning_objective"":""Students can find a common denominator to add and subtract fractions"",""focus"":""evaluate_a_claim""}"
32,tfat4ru-sasuf1of3-lscfay2cx-q33-mcq,Q33,mcq,"A class is making a fruit mix. One bowl has 3/4 kilogram of apples, and another bowl has 2/3 kilogram of pears. The mix must weigh more than 1 kilogram but less than 1 1/2 kilograms so it fits a container. Choose the result that proves the mix will fit.",Maths,5,Fraction Arithmetic,Adding & Subtracting Unlike Fractions,Students can find a common denominator to add and subtract fractions,Analyzing,hard,4,"MCQ for Grade 5 Fraction Arithmetic: Adding & Subtracting Unlike Fractions, aligned to Students can find a common denominator to add and subtract fractions.","[{""text"":""3/4 + 2/3 = 17/12, and 17/12 is between 1 and 1 1/2."",""correct"":true},{""text"":""3/4 + 2/3 = 5/7, and 5/7 is between 1 and 1 1/2."",""correct"":false},{""text"":""3/4 + 2/3 = 11/7, and 11/7 is between 1 and 1 1/2."",""correct"":false},{""text"":""3/4 + 2/3 = 5/12, and 5/12 is between 1 and 1 1/2."",""correct"":false}]","The correct result is 17/12. Use a common denominator of 12: 3/4 = 9/12 and 2/3 = 8/12, so the total is 17/12, which is 1 5/12. That is more than 1 and less than 1 1/2, so the mix fits. The other options come from common errors such as adding tops and bottoms, subtracting by mistake, or incorrect fraction sums. Also, 11/7 is actually greater than 1 1/2, so it would not fit the condition.","{""questionNumber"":""Q33"",""questionType"":""mcq"",""subject"":""Maths"",""grade"":5,""topic"":""Fraction Arithmetic"",""subtopic"":""Adding & Subtracting Unlike Fractions"",""learning_objective"":""Students can find a common denominator to add and subtract fractions"",""focus"":""multi_constraint_problem""}"
33,tfat4ru-sasuf1of3-lscfay2cx-q34-mcq,Q34,mcq,Look at the two subtraction results for the water left in a bottle after 5/12 liter is poured out from 7/9 liter. Result R says the answer is 13/36 liter. Result S says the answer is 2/3 liter. Decide which judgment is correct.,Maths,5,Fraction Arithmetic,Adding & Subtracting Unlike Fractions,Students can find a common denominator to add and subtract fractions,Evaluating,hard,4,"MCQ for Grade 5 Fraction Arithmetic: Adding & Subtracting Unlike Fractions, aligned to Students can find a common denominator to add and subtract fractions.","[{""text"":""Only Result R is correct because 7/9 = 28/36 and 5/12 = 15/36, so the difference is 13/36."",""correct"":true},{""text"":""Only Result S is correct because 7 - 5 over 9 - 12 simplifies to 2/3."",""correct"":false},{""text"":""Both results are correct because 13/36 and 2/3 are equivalent fractions."",""correct"":false},{""text"":""Neither result is correct because subtracting a smaller amount from a larger amount should give a whole number."",""correct"":false}]","The correct judgment is that only Result R is correct. Rename using a common denominator of 36: 7/9 = 28/36 and 5/12 = 15/36. Then 28/36 - 15/36 = 13/36. Result S is not correct and comes from an invalid method. Also, 13/36 and 2/3 are not equivalent, because 2/3 = 24/36. Subtracting fractions does not need to give a whole number.","{""questionNumber"":""Q34"",""questionType"":""mcq"",""subject"":""Maths"",""grade"":5,""topic"":""Fraction Arithmetic"",""subtopic"":""Adding & Subtracting Unlike Fractions"",""learning_objective"":""Students can find a common denominator to add and subtract fractions"",""focus"":""compare_methods""}"
34,tfat4ru-sasuf1of3-lscfay2cx-q35-mcq,Q35,mcq,Choose the equation that matches this packing problem and gives the correct total: a gift box holds 5/6 kilogram of books and 7/10 kilogram of toys. The shipping label allows at most 1 3/5 kilograms. Decide whether the packed box is within the limit.,Maths,5,Fraction Arithmetic,Adding & Subtracting Unlike Fractions,Students can find a common denominator to add and subtract fractions,Analyzing,hard,4,"MCQ for Grade 5 Fraction Arithmetic: Adding & Subtracting Unlike Fractions, aligned to Students can find a common denominator to add and subtract fractions.","[{""text"":""5/6 + 7/10 = 23/15, and 23/15 is less than 1 3/5, so the box is within the limit."",""correct"":true},{""text"":""5/6 + 7/10 = 12/16, and 12/16 is less than 1 3/5, so the box is within the limit."",""correct"":false},{""text"":""5/6 + 7/10 = 35/60, and 35/60 is less than 1 3/5, so the box is within the limit."",""correct"":false},{""text"":""5/6 + 7/10 = 12/15, and 12/15 is less than 1 3/5, so the box is within the limit."",""correct"":false}]","Use a common denominator of 30: 5/6 = 25/30 and 7/10 = 21/30. Then 25/30 + 21/30 = 46/30 = 23/15 = 1 8/15. The limit is 1 3/5 = 1 9/15, so 1 8/15 is less than 1 9/15. That means the box is within the limit. The other options come from common mistakes such as adding numerators and denominators directly or using only part of the equivalent-fraction work.","{""questionNumber"":""Q35"",""questionType"":""mcq"",""subject"":""Maths"",""grade"":5,""topic"":""Fraction Arithmetic"",""subtopic"":""Adding & Subtracting Unlike Fractions"",""learning_objective"":""Students can find a common denominator to add and subtract fractions"",""focus"":""multi_constraint_problem""}"