rowNumber,queueId,questionNumber,questionType,questionText,subject,grade,topic,subtopic,learningObjective,bloomsLevel,difficultyLevel,difficultyRating,summary,options,explanation,generationMetadata
95,tf4iq5-sasff1zw-lscsw1ikr-q96-mcq,Q96,mcq,"Choose the correct result for this jumping frog game: a frog jumped 7/8 of a log, then slipped back 3/8 of the log. How far along the log is the frog now?",Maths,4,Fractions,Adding & Subtracting Fractions,Students can solve word problems involving addition and subtraction of fractions,Applying,medium,2,"MCQ for Grade 4 Fractions: Adding & Subtracting Fractions, aligned to Students can solve word problems involving addition and subtraction of fractions.","[{""text"":""4/8"",""correct"":true},{""text"":""10/16"",""correct"":false},{""text"":""3/8"",""correct"":false},{""text"":""1/8"",""correct"":false}]","Nice work! The parts already match, so 7/8 - 3/8 = 4/8. You subtracted only the top numbers.","{""questionNumber"":""Q96"",""questionType"":""mcq"",""subject"":""Maths"",""grade"":4,""topic"":""Fractions"",""subtopic"":""Adding & Subtracting Fractions"",""learning_objective"":""Students can solve word problems involving addition and subtraction of fractions"",""focus"":""subtraction""}"
96,tf4iq5-sasff1zw-lscsw1ikr-q97-mcq,Q97,mcq,Select the true statement about adding 2/9 and 1/3 for a sticker album.,Maths,4,Fractions,Adding & Subtracting Fractions,Students can solve word problems involving addition and subtraction of fractions,Analyzing,medium,3,"MCQ for Grade 4 Fractions: Adding & Subtracting Fractions, aligned to Students can solve word problems involving addition and subtraction of fractions.","[{""text"":""The total is 3/12 because 9 + 3 = 12."",""correct"":false},{""text"":""The total is 5/9 because 1/3 = 3/9 and 2/9 + 3/9 = 5/9."",""correct"":true},{""text"":""The total is 3/9 because only the bottom number changes."",""correct"":false},{""text"":""The total is 2/12 because 2 + 1 = 3 and then simplify."",""correct"":false}]",You’re doing really well! Change 1/3 to 3/9 first. Then 2/9 + 3/9 = 5/9.,"{""questionNumber"":""Q97"",""questionType"":""mcq"",""subject"":""Maths"",""grade"":4,""topic"":""Fractions"",""subtopic"":""Adding & Subtracting Fractions"",""learning_objective"":""Students can solve word problems involving addition and subtraction of fractions"",""focus"":""addition""}"
97,tf4iq5-sasff1zw-lscsw1ikr-q98-mcq,Q98,mcq,"A toy robot had 5/6 of its battery full. After a long dance, it used 1/3 of the whole battery. How much battery was left?",Maths,4,Fractions,Adding & Subtracting Fractions,Students can solve word problems involving addition and subtraction of fractions,Applying,medium,3,"MCQ for Grade 4 Fractions: Adding & Subtracting Fractions, aligned to Students can solve word problems involving addition and subtraction of fractions.","[{""text"":""2/6"",""correct"":false},{""text"":""3/6"",""correct"":true},{""text"":""4/9"",""correct"":false},{""text"":""1/2"",""correct"":false}]",Good job! Turn 1/3 into 2/6. Then 5/6 - 2/6 = 3/6. That is the battery left.,"{""questionNumber"":""Q98"",""questionType"":""mcq"",""subject"":""Maths"",""grade"":4,""topic"":""Fractions"",""subtopic"":""Adding & Subtracting Fractions"",""learning_objective"":""Students can solve word problems involving addition and subtraction of fractions"",""focus"":""subtraction""}"
98,tf4iq5-sasff1zw-lscsw1ikr-q99-mcq,Q99,mcq,Compare the two sums in this pet shop: 3/8 + 1/4 and 1/2 + 1/8. Decide which comparison is correct.,Maths,4,Fractions,Adding & Subtracting Fractions,Students can solve word problems involving addition and subtraction of fractions,Analyzing,medium,3,"MCQ for Grade 4 Fractions: Adding & Subtracting Fractions, aligned to Students can solve word problems involving addition and subtraction of fractions.","[{""text"":""3/8 + 1/4 is greater."",""correct"":false},{""text"":""1/2 + 1/8 is greater."",""correct"":false},{""text"":""The two sums are equal."",""correct"":true},{""text"":""The first sum is 1/8 more."",""correct"":false}]","Fantastic comparing! 1/4 = 2/8, so 3/8 + 1/4 = 5/8. Also 1/2 = 4/8, so 1/2 + 1/8 = 5/8. They are equal.","{""questionNumber"":""Q99"",""questionType"":""mcq"",""subject"":""Maths"",""grade"":4,""topic"":""Fractions"",""subtopic"":""Adding & Subtracting Fractions"",""learning_objective"":""Students can solve word problems involving addition and subtraction of fractions"",""focus"":""addition""}"
99,tf4iq5-sasff1zw-lscsw1ikr-q100-mcq,Q100,mcq,"Choose the equation that matches this puzzle story: 7/12 of a picture was colored, and 1/4 of the whole picture was erased. Which equation shows the part still colored?",Maths,4,Fractions,Adding & Subtracting Fractions,Students can solve word problems involving addition and subtraction of fractions,Understanding,medium,3,"MCQ for Grade 4 Fractions: Adding & Subtracting Fractions, aligned to Students can solve word problems involving addition and subtraction of fractions.","[{""text"":""7/12 - 1/4 = 6/8"",""correct"":false},{""text"":""7/12 - 3/12 = 4/12"",""correct"":true},{""text"":""7/12 + 1/4 = 8/16"",""correct"":false},{""text"":""7/12 - 1/4 = 6/12"",""correct"":false}]","Great careful thinking! Since 1/4 = 3/12, subtract 7/12 - 3/12 = 4/12. That matches the story.","{""questionNumber"":""Q100"",""questionType"":""mcq"",""subject"":""Maths"",""grade"":4,""topic"":""Fractions"",""subtopic"":""Adding & Subtracting Fractions"",""learning_objective"":""Students can solve word problems involving addition and subtraction of fractions"",""focus"":""subtraction""}"
100,tf4iq5-sasff1zw-lscsw1ikr-q101-mcq,Q101,mcq,"Choose the correct total for this bakery tray: 2/3 of the cupcakes had sprinkles, and 1/9 had cherries. How many of the cupcakes had either sprinkles or cherries?",Maths,4,Fractions,Adding & Subtracting Fractions,Students can solve word problems involving addition and subtraction of fractions,Applying,medium,3,"MCQ for Grade 4 Fractions: Adding & Subtracting Fractions, aligned to Students can solve word problems involving addition and subtraction of fractions.","[{""text"":""3/12"",""correct"":false},{""text"":""7/9"",""correct"":true},{""text"":""3/9"",""correct"":false},{""text"":""8/12"",""correct"":false}]",Nice work! Change 2/3 to 6/9. Then 6/9 + 1/9 = 7/9. You got the total by using the same-sized parts.,"{""questionNumber"":""Q101"",""questionType"":""mcq"",""subject"":""Maths"",""grade"":4,""topic"":""Fractions"",""subtopic"":""Adding & Subtracting Fractions"",""learning_objective"":""Students can solve word problems involving addition and subtraction of fractions"",""focus"":""addition""}"
101,tf4iq5-sasff1zw-lscsw1ikr-q102-mcq,Q102,mcq,Choose the sentence that is correct about 3/4 - 1/8 for a chocolate bar.,Maths,4,Fractions,Adding & Subtracting Fractions,Students can solve word problems involving addition and subtraction of fractions,Analyzing,medium,3,"MCQ for Grade 4 Fractions: Adding & Subtracting Fractions, aligned to Students can solve word problems involving addition and subtraction of fractions.","[{""text"":""3/4 - 1/8 = 2/4 because only the tops change."",""correct"":false},{""text"":""3/4 - 1/8 = 5/8 because 3/4 = 6/8 and 6/8 - 1/8 = 5/8."",""correct"":true},{""text"":""3/4 - 1/8 = 2/8 because 3 - 1 = 2."",""correct"":false},{""text"":""3/4 - 1/8 = 2/12 because 4 + 8 = 12."",""correct"":false}]",Excellent! Turn 3/4 into 6/8 first. Then 6/8 - 1/8 = 5/8. That is the correct sentence.,"{""questionNumber"":""Q102"",""questionType"":""mcq"",""subject"":""Maths"",""grade"":4,""topic"":""Fractions"",""subtopic"":""Adding & Subtracting Fractions"",""learning_objective"":""Students can solve word problems involving addition and subtraction of fractions"",""focus"":""subtraction""}"
102,tf4iq5-sasff1zw-lscsw1ikr-q103-mcq,Q103,mcq,A trail walk reached 1/5 of the forest in the morning and 3/10 more in the afternoon. How much of the forest trail was covered in all?,Maths,4,Fractions,Adding & Subtracting Fractions,Students can solve word problems involving addition and subtraction of fractions,Applying,medium,3,"MCQ for Grade 4 Fractions: Adding & Subtracting Fractions, aligned to Students can solve word problems involving addition and subtraction of fractions.","[{""text"":""4/15"",""correct"":false},{""text"":""5/10"",""correct"":true},{""text"":""4/10"",""correct"":false},{""text"":""3/10"",""correct"":false}]",Well done! Change 1/5 to 2/10. Then 2/10 + 3/10 = 5/10. Great use of equal parts!,"{""questionNumber"":""Q103"",""questionType"":""mcq"",""subject"":""Maths"",""grade"":4,""topic"":""Fractions"",""subtopic"":""Adding & Subtracting Fractions"",""learning_objective"":""Students can solve word problems involving addition and subtraction of fractions"",""focus"":""addition""}"
103,tf4iq5-sasff1zw-lscsw1ikr-q105-mcq,Q105,mcq,"Choose the equation that correctly solves this marble jar story: 1/4 of the jar had red marbles, and 5/8 had blue marbles. Which equation gives the total part filled by red and blue marbles?",Maths,4,Fractions,Adding & Subtracting Fractions,Students can solve word problems involving addition and subtraction of fractions,Understanding,medium,3,"MCQ for Grade 4 Fractions: Adding & Subtracting Fractions, aligned to Students can solve word problems involving addition and subtraction of fractions.","[{""text"":""1/4 + 5/8 = 6/12"",""correct"":false},{""text"":""2/8 + 5/8 = 7/8"",""correct"":true},{""text"":""1/4 + 5/8 = 6/8"",""correct"":false},{""text"":""1/4 + 5/8 = 5/12"",""correct"":false}]","Super work! Since 1/4 = 2/8, the total is 2/8 + 5/8 = 7/8. That is the matching equation.","{""questionNumber"":""Q105"",""questionType"":""mcq"",""subject"":""Maths"",""grade"":4,""topic"":""Fractions"",""subtopic"":""Adding & Subtracting Fractions"",""learning_objective"":""Students can solve word problems involving addition and subtraction of fractions"",""focus"":""addition""}"
104,tf4iq5-sasff1zw-lscsw1ikr-q106-mcq,Q106,mcq,"Choose the correct result for this cookie plate: 11/12 of the cookies were on the plate, and 1/6 of the whole plate was taken away. How much stayed on the plate?",Maths,4,Fractions,Adding & Subtracting Fractions,Students can solve word problems involving addition and subtraction of fractions,Applying,medium,3,"MCQ for Grade 4 Fractions: Adding & Subtracting Fractions, aligned to Students can solve word problems involving addition and subtraction of fractions.","[{""text"":""9/12"",""correct"":true},{""text"":""10/18"",""correct"":false},{""text"":""8/12"",""correct"":false},{""text"":""5/6"",""correct"":false}]",Nice job! Change 1/6 to 2/12. Then 11/12 - 2/12 = 9/12. That is what stayed on the plate.,"{""questionNumber"":""Q106"",""questionType"":""mcq"",""subject"":""Maths"",""grade"":4,""topic"":""Fractions"",""subtopic"":""Adding & Subtracting Fractions"",""learning_objective"":""Students can solve word problems involving addition and subtraction of fractions"",""focus"":""subtraction""}"
105,tf4iq5-sasff1zw-lscsw1ikr-q107-mcq,Q107,mcq,Decide which claim about 2/6 + 1/3 is true for a paper chain craft.,Maths,4,Fractions,Adding & Subtracting Fractions,Students can solve word problems involving addition and subtraction of fractions,Analyzing,medium,3,"MCQ for Grade 4 Fractions: Adding & Subtracting Fractions, aligned to Students can solve word problems involving addition and subtraction of fractions.","[{""text"":""The total is 3/9 because the denominators add."",""correct"":false},{""text"":""The total is 4/6 because 1/3 = 2/6 and 2/6 + 2/6 = 4/6."",""correct"":true},{""text"":""The total is 3/6 because 2 + 1 = 3."",""correct"":false},{""text"":""The total is 2/9 because thirds are larger than sixths."",""correct"":false}]",Great thinking! Turn 1/3 into 2/6 first. Then 2/6 + 2/6 = 4/6. That makes the claim true.,"{""questionNumber"":""Q107"",""questionType"":""mcq"",""subject"":""Maths"",""grade"":4,""topic"":""Fractions"",""subtopic"":""Adding & Subtracting Fractions"",""learning_objective"":""Students can solve word problems involving addition and subtraction of fractions"",""focus"":""addition""}"
106,tf4iq5-sasff1zw-lscsw1ikr-q108-mcq,Q108,mcq,A lemonade jug was filled to 3/5. Then 1/10 of the whole jug was poured into cups. How much lemonade was left in the jug?,Maths,4,Fractions,Adding & Subtracting Fractions,Students can solve word problems involving addition and subtraction of fractions,Applying,medium,3,"MCQ for Grade 4 Fractions: Adding & Subtracting Fractions, aligned to Students can solve word problems involving addition and subtraction of fractions.","[{""text"":""2/10"",""correct"":false},{""text"":""5/10"",""correct"":true},{""text"":""4/10"",""correct"":false},{""text"":""3/15"",""correct"":false}]",Well done! Change 3/5 to 6/10. Then 6/10 - 1/10 = 5/10. That is the lemonade left.,"{""questionNumber"":""Q108"",""questionType"":""mcq"",""subject"":""Maths"",""grade"":4,""topic"":""Fractions"",""subtopic"":""Adding & Subtracting Fractions"",""learning_objective"":""Students can solve word problems involving addition and subtraction of fractions"",""focus"":""subtraction""}"
107,tf4iq5-sasff1zw-lscsw1ikr-q109-mcq,Q109,mcq,Compare the two sums for a toy shop: 4/7 + 1/7 and 2/7 + 1/2. Decide which sum is greater.,Maths,4,Fractions,Adding & Subtracting Fractions,Students can solve word problems involving addition and subtraction of fractions,Analyzing,medium,3,"MCQ for Grade 4 Fractions: Adding & Subtracting Fractions, aligned to Students can solve word problems involving addition and subtraction of fractions.","[{""text"":""4/7 + 1/7 is greater."",""correct"":false},{""text"":""2/7 + 1/2 is greater."",""correct"":true},{""text"":""The two sums are equal."",""correct"":false},{""text"":""Each sum equals 5/7."",""correct"":false}]","Good comparing! 4/7 + 1/7 = 5/7. For 2/7 + 1/2, use fourteenths: 4/14 + 7/14 = 11/14. Since 11/14 is more than 10/14, it is greater than 5/7.","{""questionNumber"":""Q109"",""questionType"":""mcq"",""subject"":""Maths"",""grade"":4,""topic"":""Fractions"",""subtopic"":""Adding & Subtracting Fractions"",""learning_objective"":""Students can solve word problems involving addition and subtraction of fractions"",""focus"":""addition""}"
108,tf4iq5-sasff1zw-lscsw1ikr-q110-mcq,Q110,mcq,"Choose the equation that matches this puzzle path story: 5/8 of the path was solved, then 1/4 of the whole path had to be erased. Which equation shows the solved part left?",Maths,4,Fractions,Adding & Subtracting Fractions,Students can solve word problems involving addition and subtraction of fractions,Understanding,medium,3,"MCQ for Grade 4 Fractions: Adding & Subtracting Fractions, aligned to Students can solve word problems involving addition and subtraction of fractions.","[{""text"":""5/8 - 1/4 = 4/8"",""correct"":false},{""text"":""5/8 - 2/8 = 3/8"",""correct"":true},{""text"":""5/8 + 1/4 = 6/12"",""correct"":false},{""text"":""5/8 - 1/4 = 5/12"",""correct"":false}]","Nice careful work! Since 1/4 = 2/8, subtract 5/8 - 2/8 = 3/8. That equation matches the story.","{""questionNumber"":""Q110"",""questionType"":""mcq"",""subject"":""Maths"",""grade"":4,""topic"":""Fractions"",""subtopic"":""Adding & Subtracting Fractions"",""learning_objective"":""Students can solve word problems involving addition and subtraction of fractions"",""focus"":""subtraction""}"
109,tf4iq5-sasff1zw-lscsw1ikr-q111-mcq,Q111,mcq,Choose the correct result for this puppy treat story: a bowl had 1/3 bag of crunchy treats and 1/6 bag of soft treats mixed together. Then 1/12 bag of treats spilled out. How much of a bag of treats was left in the bowl?,Maths,4,Fractions,Adding & Subtracting Fractions,Students can solve word problems involving addition and subtraction of fractions,Applying,medium,3,"MCQ for Grade 4 Fractions: Adding & Subtracting Fractions, aligned to Students can solve word problems involving addition and subtraction of fractions.","[{""text"":""5/12"",""correct"":true},{""text"":""7/12"",""correct"":false},{""text"":""1/2"",""correct"":false},{""text"":""3/4"",""correct"":false}]","Great job thinking in steps! First, 1/3 + 1/6 = 1/2. Then 1/2 - 1/12 = 6/12 - 1/12 = 5/12. The left amount is 5/12.","{""questionNumber"":""Q111"",""questionType"":""mcq"",""subject"":""Maths"",""grade"":4,""topic"":""Fractions"",""subtopic"":""Adding & Subtracting Fractions"",""learning_objective"":""Students can solve word problems involving addition and subtraction of fractions"",""focus"":""multi_step_application""}"
110,tf4iq5-sasff1zw-lscsw1ikr-q112-mcq,Q112,mcq,"A cup had 5/6 of a fruit smoothie. Then 1/4 of a cup spilled, and later 1/3 of a cup was added back. How much smoothie is in the cup now?",Maths,4,Fractions,Adding & Subtracting Fractions,Students can solve word problems involving addition and subtraction of fractions,Analyzing,medium,3,"MCQ for Grade 4 Fractions: Adding & Subtracting Fractions, aligned to Students can solve word problems involving addition and subtraction of fractions.","[{""text"":""7/12 cup"",""correct"":false},{""text"":""11/12 cup"",""correct"":true},{""text"":""9/12 cup"",""correct"":false},{""text"":""1 whole cup"",""correct"":false}]","Start with 5/6 cup, subtract 1/4 cup, then add 1/3 cup. Change all fractions to twelfths: 5/6 = 10/12, 1/4 = 3/12, and 1/3 = 4/12. Now compute: 10/12 - 3/12 + 4/12 = 11/12. So the cup now has 11/12 cup of smoothie. 7/12 comes from subtracting without adding back enough, 9/12 is the wrong total, and 1 whole cup is too much.","{""questionNumber"":""Q112"",""questionType"":""mcq"",""subject"":""Maths"",""grade"":4,""topic"":""Fractions"",""subtopic"":""Adding & Subtracting Fractions"",""learning_objective"":""Students can solve word problems involving addition and subtraction of fractions"",""focus"":""representation_translation""}"
111,tf4iq5-sasff1zw-lscsw1ikr-q113-mcq,Q113,mcq,"A toy shop packed 1/4 of a box with red marbles and 3/8 of the box with blue marbles. Later, 1/8 of the whole box of marbles was taken out to play. How much of the box was still filled?",Maths,4,Fractions,Adding & Subtracting Fractions,Students can solve word problems involving addition and subtraction of fractions,Applying,medium,3,"MCQ for Grade 4 Fractions: Adding & Subtracting Fractions, aligned to Students can solve word problems involving addition and subtraction of fractions.","[{""text"":""1/2"",""correct"":true},{""text"":""5/8"",""correct"":false},{""text"":""3/4"",""correct"":false},{""text"":""7/8"",""correct"":false}]","You can do this! First add: 1/4 + 3/8 = 2/8 + 3/8 = 5/8. Then subtract 1/8. That gives 4/8, which is 1/2.","{""questionNumber"":""Q113"",""questionType"":""mcq"",""subject"":""Maths"",""grade"":4,""topic"":""Fractions"",""subtopic"":""Adding & Subtracting Fractions"",""learning_objective"":""Students can solve word problems involving addition and subtraction of fractions"",""focus"":""context_interpretation""}"
112,tf4iq5-sasff1zw-lscsw1ikr-q114-mcq,Q114,mcq,"Two game paths collect fractions of candy. Path A gives 3/4 of a candy bar, then loses 1/6 of a bar, then gains 1/3 of a bar. Path B gives 5/6 of a candy bar, then loses 1/2 of a bar, then gains 1/4 of a bar. Which path ends with more candy?",Maths,4,Fractions,Adding & Subtracting Fractions,Students can solve word problems involving addition and subtraction of fractions,Analyzing,medium,3,"MCQ for Grade 4 Fractions: Adding & Subtracting Fractions, aligned to Students can solve word problems involving addition and subtraction of fractions.","[{""text"":""Path A ends with more candy."",""correct"":true},{""text"":""Path B ends with more candy."",""correct"":false},{""text"":""Both paths end with the same amount."",""correct"":false},{""text"":""Both paths end with 1 whole candy bar."",""correct"":false}]","Find each path's total using twelfths. Path A: 3/4 - 1/6 + 1/3 = 9/12 - 2/12 + 4/12 = 11/12. Path B: 5/6 - 1/2 + 1/4 = 10/12 - 6/12 + 3/12 = 7/12. Since 11/12 is greater than 7/12, Path A ends with more candy. The amounts are not equal, and neither path ends with 1 whole candy bar.","{""questionNumber"":""Q114"",""questionType"":""mcq"",""subject"":""Maths"",""grade"":4,""topic"":""Fractions"",""subtopic"":""Adding & Subtracting Fractions"",""learning_objective"":""Students can solve word problems involving addition and subtraction of fractions"",""focus"":""compare_or_judge""}"
113,tf4iq5-sasff1zw-lscsw1ikr-q115-mcq,Q115,mcq,"Choose the equation that matches this sticker book story and gives the final filled part: 2/5 of a page had animal stickers, 1/10 more of the page got star stickers, and then 1/5 of the whole page was left empty after some stickers were peeled off.",Maths,4,Fractions,Adding & Subtracting Fractions,Students can solve word problems involving addition and subtraction of fractions,Understanding,medium,3,"MCQ for Grade 4 Fractions: Adding & Subtracting Fractions, aligned to Students can solve word problems involving addition and subtraction of fractions.","[{""text"":""2/5 + 1/10 - 1/5"",""correct"":true},{""text"":""2/5 - 1/10 + 1/5"",""correct"":false},{""text"":""2/5 + 1/5 - 1/10"",""correct"":false},{""text"":""2/5 - 1/5 - 1/10"",""correct"":false}]","Great matching! The page starts with 2/5, then 1/10 is added, then 1/5 is taken away. So 2/5 + 1/10 - 1/5 is the right equation.","{""questionNumber"":""Q115"",""questionType"":""mcq"",""subject"":""Maths"",""grade"":4,""topic"":""Fractions"",""subtopic"":""Adding & Subtracting Fractions"",""learning_objective"":""Students can solve word problems involving addition and subtraction of fractions"",""focus"":""operation_reasoning""}"
114,tf4iq5-sasff1zw-lscsw1ikr-q116-mcq,Q116,mcq,"Choose the correct result for this rabbit path: a rabbit hopped 7/10 of a garden path, then hopped back 1/5 of the whole path, and then moved forward 1/10 of the path again. How far along the path is the rabbit now?",Maths,4,Fractions,Adding & Subtracting Fractions,Students can solve word problems involving addition and subtraction of fractions,Applying,medium,3,"MCQ for Grade 4 Fractions: Adding & Subtracting Fractions, aligned to Students can solve word problems involving addition and subtraction of fractions.","[{""text"":""3/5"",""correct"":true},{""text"":""4/5"",""correct"":false},{""text"":""1/2"",""correct"":false},{""text"":""7/10"",""correct"":false}]","Super job! Change 1/5 to 2/10. Then 7/10 - 2/10 + 1/10 = 6/10, which is 3/5.","{""questionNumber"":""Q116"",""questionType"":""mcq"",""subject"":""Maths"",""grade"":4,""topic"":""Fractions"",""subtopic"":""Adding & Subtracting Fractions"",""learning_objective"":""Students can solve word problems involving addition and subtraction of fractions"",""focus"":""multi_step_application""}"
115,tf4iq5-sasff1zw-lscsw1ikr-q117-mcq,Q117,mcq,"A popcorn bucket was filled to 1/2 of its capacity. Then 1/4 of the bucket more popcorn was added. After that, 1/8 of the bucket was eaten. How full is the bucket now?",Maths,4,Fractions,Adding & Subtracting Fractions,Students can solve word problems involving addition and subtraction of fractions,Analyzing,medium,3,"MCQ for Grade 4 Fractions: Adding & Subtracting Fractions, aligned to Students can solve word problems involving addition and subtraction of fractions.","[{""text"":""5/8 full"",""correct"":true},{""text"":""3/8 full"",""correct"":false},{""text"":""7/8 full"",""correct"":false},{""text"":""1/8 full"",""correct"":false}]","Change all fractions to eighths: 1/2 = 4/8 and 1/4 = 2/8. Then 4/8 + 2/8 = 6/8. After 1/8 is eaten, 6/8 - 1/8 = 5/8. So the bucket is 5/8 full, not 3/8, 7/8, or 1/8.","{""questionNumber"":""Q117"",""questionType"":""mcq"",""subject"":""Maths"",""grade"":4,""topic"":""Fractions"",""subtopic"":""Adding & Subtracting Fractions"",""learning_objective"":""Students can solve word problems involving addition and subtraction of fractions"",""focus"":""error_correction""}"
116,tf4iq5-sasff1zw-lscsw1ikr-q118-mcq,Q118,mcq,"A board game path was 11/12 finished. Then a rain splash washed away 1/3 of the whole path markings, and later 1/6 of the whole path was redrawn. How much of the path was finished at the end?",Maths,4,Fractions,Adding & Subtracting Fractions,Students can solve word problems involving addition and subtraction of fractions,Applying,medium,3,"MCQ for Grade 4 Fractions: Adding & Subtracting Fractions, aligned to Students can solve word problems involving addition and subtraction of fractions.","[{""text"":""3/4"",""correct"":true},{""text"":""5/6"",""correct"":false},{""text"":""7/12"",""correct"":false},{""text"":""11/12"",""correct"":false}]",Excellent work! Use twelfths: 11/12 - 1/3 + 1/6 = 11/12 - 4/12 + 2/12 = 9/12 = 3/4.,"{""questionNumber"":""Q118"",""questionType"":""mcq"",""subject"":""Maths"",""grade"":4,""topic"":""Fractions"",""subtopic"":""Adding & Subtracting Fractions"",""learning_objective"":""Students can solve word problems involving addition and subtraction of fractions"",""focus"":""context_interpretation""}"
