rowNumber,queueId,questionNumber,questionType,questionText,subject,grade,topic,subtopic,learningObjective,bloomsLevel,difficultyLevel,difficultyRating,summary,options,explanation,generationMetadata
100,tao1uc4-sd6157-lscir1jhx-q100-mcq,Q100,mcq,Thirty-nine biscuits are shared equally into 4 pet bowls. Each bowl must have the same number of biscuits. Which equation and interpretation both fit the story?,Maths,4,Arithmetic Operations,Division,Students can interpret remainders in context,Applying,medium,3,"MCQ for Grade 4 Arithmetic Operations: Division, aligned to Students can interpret remainders in context.","[{""text"":""39 ÷ 4 = 9 remainder 3, so each bowl gets 9 biscuits and 3 biscuits are left over."",""correct"":true},{""text"":""39 ÷ 4 = 10 remainder 1, so each bowl gets 10 biscuits and 1 biscuit is left over."",""correct"":false},{""text"":""39 ÷ 4 = 9 remainder 4, so each bowl gets 9 biscuits and 4 biscuits are left over."",""correct"":false},{""text"":""39 ÷ 4 = 8 remainder 7, so each bowl gets 8 biscuits and 7 biscuits are left over."",""correct"":false}]","4 × 9 = 36, and 39 - 36 = 3, so 39 ÷ 4 = 9 remainder 3. That means 9 biscuits can go into each bowl, with 3 left over. Choice 1 is correct. The other choices do not satisfy the division correctly, and some have remainders that are too large or the wrong quotient.","{""questionNumber"":""Q100"",""questionType"":""mcq"",""subject"":""Maths"",""grade"":4,""topic"":""Arithmetic Operations"",""subtopic"":""Division"",""learning_objective"":""Students can interpret remainders in context"",""focus"":""representation_translation""}"
101,tao1uc4-sd6157-lscir1jhx-q101-mcq,Q101,mcq,Choose the correct result for this toy shelf problem: 88 robot toys are arranged on shelves with 9 robots on each shelf. Some robots may not fit on a full shelf.,Maths,4,Arithmetic Operations,Division,Students can interpret remainders in context,Applying,medium,3,"MCQ for Grade 4 Arithmetic Operations: Division, aligned to Students can interpret remainders in context.","[{""text"":""9 full shelves and 7 robots left"",""correct"":true},{""text"":""8 full shelves and 16 robots left"",""correct"":false},{""text"":""10 full shelves and 2 robots left"",""correct"":false},{""text"":""9 full shelves and 9 robots left"",""correct"":false}]","Excellent! 9 × 9 = 81, and 88 - 81 = 7. So there are 9 full shelves and 7 robots left.","{""questionNumber"":""Q101"",""questionType"":""mcq"",""subject"":""Maths"",""grade"":4,""topic"":""Arithmetic Operations"",""subtopic"":""Division"",""learning_objective"":""Students can interpret remainders in context"",""focus"":""multi_step_application""}"
102,tao1uc4-sd6157-lscir1jhx-q102-mcq,Q102,mcq,Select the true statement about a remainder when 46 lollies are shared into bags of 6.,Maths,4,Arithmetic Operations,Division,Students can interpret remainders in context,Understanding,medium,3,"MCQ for Grade 4 Arithmetic Operations: Division, aligned to Students can interpret remainders in context.","[{""text"":""The answer can be 7 remainder 4 because 6 × 7 = 42 and 4 are left."",""correct"":true},{""text"":""The answer can be 7 remainder 6 because 6 × 7 = 42 and 6 are left."",""correct"":false},{""text"":""The answer can be 8 remainder 2 because 6 × 8 = 48."",""correct"":false},{""text"":""The answer can be 6 remainder 10 because 6 × 6 = 36."",""correct"":false}]","Great checking! 42 plus 4 makes 46, so 7 remainder 4 works. A remainder must also be smaller than 6.","{""questionNumber"":""Q102"",""questionType"":""mcq"",""subject"":""Maths"",""grade"":4,""topic"":""Arithmetic Operations"",""subtopic"":""Division"",""learning_objective"":""Students can interpret remainders in context"",""focus"":""constrained_selection""}"
103,tao1uc4-sd6157-lscir1jhx-q103-mcq,Q103,mcq,A game booth has 57 little prizes. They are packed into boxes of 8. Choose the best answer for full boxes and prizes left over.,Maths,4,Arithmetic Operations,Division,Students can interpret remainders in context,Applying,medium,3,"MCQ for Grade 4 Arithmetic Operations: Division, aligned to Students can interpret remainders in context.","[{""text"":""7 full boxes and 1 prize left"",""correct"":true},{""text"":""6 full boxes and 9 prizes left"",""correct"":false},{""text"":""7 full boxes and 8 prizes left"",""correct"":false},{""text"":""8 full boxes and 1 prize left"",""correct"":false}]","Nice work! 8 × 7 = 56, so 1 prize is left after 7 full boxes.","{""questionNumber"":""Q103"",""questionType"":""mcq"",""subject"":""Maths"",""grade"":4,""topic"":""Arithmetic Operations"",""subtopic"":""Division"",""learning_objective"":""Students can interpret remainders in context"",""focus"":""context_interpretation""}"
104,tao1uc4-sd6157-lscir1jhx-q104-mcq,Q104,mcq,A class has 68 crayons to pack into boxes of 7 crayons each. Every box except possibly the last must be full. Which statement correctly tells what 68 ÷ 7 means in this story?,Maths,4,Arithmetic Operations,Division,Students can interpret remainders in context,Analyzing,medium,3,"MCQ for Grade 4 Arithmetic Operations: Division, aligned to Students can interpret remainders in context.","[{""text"":""9 full boxes can be packed, and 5 crayons are left over."",""correct"":true},{""text"":""10 full boxes can be packed, and 2 crayons are left over."",""correct"":false},{""text"":""8 full boxes can be packed, and 12 crayons are left over."",""correct"":false},{""text"":""9 full boxes can be packed, and 7 crayons are left over."",""correct"":false}]","7 × 9 = 63, and 68 - 63 = 5, so 68 ÷ 7 = 9 remainder 5. That means 9 full boxes and 5 crayons left over. Choice 1 is correct. Choice 2 would need 72 crayons. Choice 3 does not use the greatest possible number of full boxes. Choice 4 is impossible because a remainder must be less than 7.","{""questionNumber"":""Q104"",""questionType"":""mcq"",""subject"":""Maths"",""grade"":4,""topic"":""Arithmetic Operations"",""subtopic"":""Division"",""learning_objective"":""Students can interpret remainders in context"",""focus"":""constrained_selection""}"
105,tao1uc4-sd6157-lscir1jhx-q105-mcq,Q105,mcq,"What does this result tell us? 75 ÷ 8 = 9 remainder 3, and the story is about beads put into 8 bracelets.",Maths,4,Arithmetic Operations,Division,Students can interpret remainders in context,Understanding,medium,3,"MCQ for Grade 4 Arithmetic Operations: Division, aligned to Students can interpret remainders in context.","[{""text"":""Each bracelet gets 9 beads and 3 beads are left over."",""correct"":true},{""text"":""Each bracelet gets 8 beads and 3 beads are left over."",""correct"":false},{""text"":""Each bracelet gets 9 beads and 8 beads are left over."",""correct"":false},{""text"":""Each bracelet gets 3 beads and 9 beads are left over."",""correct"":false}]","Great job reading the quotient and remainder! The 9 tells the equal amount in each bracelet, and 3 beads are left.","{""questionNumber"":""Q105"",""questionType"":""mcq"",""subject"":""Maths"",""grade"":4,""topic"":""Arithmetic Operations"",""subtopic"":""Division"",""learning_objective"":""Students can interpret remainders in context"",""focus"":""representation_translation""}"
106,tao1uc4-sd6157-lscir1jhx-q106-mcq,Q106,mcq,"Choose the correct result for this playground problem: 83 children ride in carts that hold 10 children each. How many full carts are used, and how many children are left?",Maths,4,Arithmetic Operations,Division,Students can interpret remainders in context,Applying,medium,3,"MCQ for Grade 4 Arithmetic Operations: Division, aligned to Students can interpret remainders in context.","[{""text"":""8 full carts and 3 children left"",""correct"":true},{""text"":""8 full carts and 10 children left"",""correct"":false},{""text"":""7 full carts and 13 children left"",""correct"":false},{""text"":""9 full carts and 3 children left"",""correct"":false}]","Fantastic! 10 × 8 = 80, and 3 children are left, so 8 full carts are used.","{""questionNumber"":""Q106"",""questionType"":""mcq"",""subject"":""Maths"",""grade"":4,""topic"":""Arithmetic Operations"",""subtopic"":""Division"",""learning_objective"":""Students can interpret remainders in context"",""focus"":""multi_step_application""}"
107,tao1uc4-sd6157-lscir1jhx-q107-mcq,Q107,mcq,Choose the sentence that is correct about 91 ÷ 12 in a packing story.,Maths,4,Arithmetic Operations,Division,Students can interpret remainders in context,Understanding,medium,3,"MCQ for Grade 4 Arithmetic Operations: Division, aligned to Students can interpret remainders in context.","[{""text"":""There are 7 full groups and 7 left over."",""correct"":true},{""text"":""There are 8 full groups and 3 left over."",""correct"":false},{""text"":""There are 7 full groups and 12 left over."",""correct"":false},{""text"":""There are 6 full groups and 19 left over."",""correct"":false}]","Lovely work! 12 × 7 = 84, and 91 - 84 = 7, so 7 full groups and 7 left over is right.","{""questionNumber"":""Q107"",""questionType"":""mcq"",""subject"":""Maths"",""grade"":4,""topic"":""Arithmetic Operations"",""subtopic"":""Division"",""learning_objective"":""Students can interpret remainders in context"",""focus"":""context_interpretation""}"
108,tao1uc4-sd6157-lscir1jhx-q108-mcq,Q108,mcq,A bag of 49 jellybeans is shared equally among 6 children. Decide which comparison is correct for the story.,Maths,4,Arithmetic Operations,Division,Students can interpret remainders in context,Analyzing,medium,3,"MCQ for Grade 4 Arithmetic Operations: Division, aligned to Students can interpret remainders in context.","[{""text"":""8 each and 1 left is correct because 6 × 8 = 48."",""correct"":true},{""text"":""7 each and 7 left is correct because 6 × 7 = 42."",""correct"":false},{""text"":""8 each and 6 left is correct because 6 × 8 = 48."",""correct"":false},{""text"":""9 each and 4 left is correct because 6 × 9 = 54."",""correct"":false}]","Excellent comparing! 48 is close to 49, so each child gets 8 and 1 jellybean is left.","{""questionNumber"":""Q108"",""questionType"":""mcq"",""subject"":""Maths"",""grade"":4,""topic"":""Arithmetic Operations"",""subtopic"":""Division"",""learning_objective"":""Students can interpret remainders in context"",""focus"":""compare_or_judge""}"
109,tao1uc4-sd6157-lscir1jhx-q109-mcq,Q109,mcq,Adventure camp has 54 flashlights packed into crates of 7. A helper writes 54 ÷ 7 = 7 remainder 5. What does this mean in the story?,Maths,4,Arithmetic Operations,Division,Students can interpret remainders in context,Applying,medium,3,"MCQ for Grade 4 Arithmetic Operations: Division, aligned to Students can interpret remainders in context.","[{""text"":""7 crates can be filled completely, and 5 flashlights do not fit into a full crate."",""correct"":true},{""text"":""5 crates can be filled completely, and 7 flashlights do not fit."",""correct"":false},{""text"":""8 crates can be filled completely, and 2 flashlights do not fit."",""correct"":false},{""text"":""7 crates can be filled completely, and another full crate can be made from the 5 left."",""correct"":false}]","Because 7 × 7 = 49 and 54 - 49 = 5, the equation 54 ÷ 7 = 7 remainder 5 means 7 full crates and 5 extra flashlights. Choice 1 is correct. Choice 2 swaps quotient and remainder. Choice 3 gives the wrong division result. Choice 4 is wrong because 5 flashlights are not enough to fill another crate of 7.","{""questionNumber"":""Q109"",""questionType"":""mcq"",""subject"":""Maths"",""grade"":4,""topic"":""Arithmetic Operations"",""subtopic"":""Division"",""learning_objective"":""Students can interpret remainders in context"",""focus"":""representation_translation""}"
110,tao1uc4-sd6157-lscir1jhx-q110-mcq,Q110,mcq,Choose the correct result for this hamster snack problem: 66 carrot sticks are shared equally among 5 hamsters for a party. Pick the answer that fits.,Maths,4,Arithmetic Operations,Division,Students can interpret remainders in context,Applying,medium,3,"MCQ for Grade 4 Arithmetic Operations: Division, aligned to Students can interpret remainders in context.","[{""text"":""13 each and 1 left"",""correct"":true},{""text"":""12 each and 6 left"",""correct"":false},{""text"":""13 each and 5 left"",""correct"":false},{""text"":""14 each and 1 left"",""correct"":false}]","You got it! 5 × 13 = 65, so 1 carrot stick is left. That makes the first choice correct.","{""questionNumber"":""Q110"",""questionType"":""mcq"",""subject"":""Maths"",""grade"":4,""topic"":""Arithmetic Operations"",""subtopic"":""Division"",""learning_objective"":""Students can interpret remainders in context"",""focus"":""context_interpretation""}"
111,tao1uc4-sd6157-lscir1jhx-q111-mcq,Q111,mcq,"Choose the correct result for this puppy toy problem: 74 squeaky toys are packed into gift bags that hold 6 toys each. One extra ribbon is tied on every full bag. How many ribbons are used, and how many toys are left over?",Maths,4,Arithmetic Operations,Division,Students can interpret remainders in context,Applying,medium,3,"MCQ for Grade 4 Arithmetic Operations: Division, aligned to Students can interpret remainders in context.","[{""text"":""12 ribbons and 2 toys left"",""correct"":true},{""text"":""12 ribbons and 4 toys left"",""correct"":false},{""text"":""11 ribbons and 8 toys left"",""correct"":false},{""text"":""13 ribbons and 2 toys left"",""correct"":false}]","Nice work thinking in two steps! 74 ÷ 6 = 12 remainder 2, so there are 12 full bags. That means 12 ribbons and 2 toys left.","{""questionNumber"":""Q111"",""questionType"":""mcq"",""subject"":""Maths"",""grade"":4,""topic"":""Arithmetic Operations"",""subtopic"":""Division"",""learning_objective"":""Students can interpret remainders in context"",""focus"":""multi_step_application""}"
112,tao1uc4-sd6157-lscir1jhx-q112-mcq,Q112,mcq,Select the true statement about 52 jellybeans shared equally among 7 children at a picnic.,Maths,4,Arithmetic Operations,Division,Students can interpret remainders in context,Understanding,medium,3,"MCQ for Grade 4 Arithmetic Operations: Division, aligned to Students can interpret remainders in context.","[{""text"":""Each child gets 7 jellybeans, and 3 are left over."",""correct"":true},{""text"":""Each child gets 7 jellybeans, and 1 is left over."",""correct"":false},{""text"":""Each child gets 8 jellybeans, and 4 are left over."",""correct"":false},{""text"":""Each child gets 6 jellybeans, and 10 are left over."",""correct"":false}]","Great job! Since 7 × 7 = 49, there are 3 jellybeans left. So each child gets 7, with 3 left over.","{""questionNumber"":""Q112"",""questionType"":""mcq"",""subject"":""Maths"",""grade"":4,""topic"":""Arithmetic Operations"",""subtopic"":""Division"",""learning_objective"":""Students can interpret remainders in context"",""focus"":""context_interpretation""}"
113,tao1uc4-sd6157-lscir1jhx-q113-mcq,Q113,mcq,A rabbit café bakes 65 carrot cookies. They go onto plates with 8 cookies on each plate. Then the leftover cookies are put in a small bowl. Choose the answer that matches the story.,Maths,4,Arithmetic Operations,Division,Students can interpret remainders in context,Applying,medium,3,"MCQ for Grade 4 Arithmetic Operations: Division, aligned to Students can interpret remainders in context.","[{""text"":""8 full plates and 1 cookie in the bowl"",""correct"":true},{""text"":""7 full plates and 9 cookies in the bowl"",""correct"":false},{""text"":""8 full plates and 9 cookies in the bowl"",""correct"":false},{""text"":""9 full plates and 1 cookie in the bowl"",""correct"":false}]","You’ve got this! 65 ÷ 8 = 8 remainder 1, so 8 full plates can be made and 1 cookie is left for the bowl.","{""questionNumber"":""Q113"",""questionType"":""mcq"",""subject"":""Maths"",""grade"":4,""topic"":""Arithmetic Operations"",""subtopic"":""Division"",""learning_objective"":""Students can interpret remainders in context"",""focus"":""multi_step_application""}"
114,tao1uc4-sd6157-lscir1jhx-q114-mcq,Q114,mcq,"Look at this method for a bead bracelet problem: 43 beads are put on bracelets with 5 beads on each bracelet. The work says, ""5 × 9 = 45, so the answer is 9 remainder 2."" Choose the best judgment.",Maths,4,Arithmetic Operations,Division,Students can interpret remainders in context,Analyzing,medium,3,"MCQ for Grade 4 Arithmetic Operations: Division, aligned to Students can interpret remainders in context.","[{""text"":""The method is wrong because 45 is more than 43, so 9 full bracelets cannot be made."",""correct"":true},{""text"":""The method is correct because 45 is close to 43."",""correct"":false},{""text"":""The method is wrong because the remainder should always be 5."",""correct"":false},{""text"":""The method is correct, but there should be 2 more full bracelets."",""correct"":false}]","Good checking! A full-group total cannot go past 43. Since 5 × 8 = 40, the correct result is 8 remainder 3.","{""questionNumber"":""Q114"",""questionType"":""mcq"",""subject"":""Maths"",""grade"":4,""topic"":""Arithmetic Operations"",""subtopic"":""Division"",""learning_objective"":""Students can interpret remainders in context"",""focus"":""error_correction""}"
115,tao1uc4-sd6157-lscir1jhx-q115-mcq,Q115,mcq,"Sixty-one shiny stickers are shared equally among 9 children. Which equation correctly shows the number each child gets and the number left over, using total = (group size × number of groups) + remainder with the remainder less than 9?",Maths,4,Arithmetic Operations,Division,Students can interpret remainders in context,Understanding,medium,3,"MCQ for Grade 4 Arithmetic Operations: Division, aligned to Students can interpret remainders in context.","[{""text"":""61 = 9 × 6 + 7"",""correct"":true},{""text"":""61 = 9 × 7 + 2"",""correct"":false},{""text"":""61 = 9 × 5 + 16"",""correct"":false},{""text"":""61 = 9 × 6 + 9"",""correct"":false}]","To share 61 stickers among 9 children, find the greatest multiple of 9 that is not more than 61. 9 × 6 = 54, and 61 - 54 = 7, so the correct equation is 61 = 9 × 6 + 7. Choice 1 is correct. Choice 2 is wrong because 9 × 7 + 2 = 65. Choice 3 is wrong because the remainder 16 is too large and the total is wrong. Choice 4 is wrong because a remainder must be less than 9.","{""questionNumber"":""Q115"",""questionType"":""mcq"",""subject"":""Maths"",""grade"":4,""topic"":""Arithmetic Operations"",""subtopic"":""Division"",""learning_objective"":""Students can interpret remainders in context"",""focus"":""representation_translation""}"
116,tao1uc4-sd6157-lscir1jhx-q116-mcq,Q116,mcq,"Choose the correct result for this hamster wheel ticket game: 97 tickets are packed into envelopes of 12. After the full envelopes are made, the extra tickets stay on the table. Pick the best answer.",Maths,4,Arithmetic Operations,Division,Students can interpret remainders in context,Applying,medium,3,"MCQ for Grade 4 Arithmetic Operations: Division, aligned to Students can interpret remainders in context.","[{""text"":""8 full envelopes and 1 ticket left"",""correct"":true},{""text"":""7 full envelopes and 13 tickets left"",""correct"":false},{""text"":""8 full envelopes and 5 tickets left"",""correct"":false},{""text"":""9 full envelopes and 1 ticket left"",""correct"":false}]","Well done! 12 × 8 = 96, so 97 ÷ 12 is 8 remainder 1. That means 8 full envelopes and 1 extra ticket.","{""questionNumber"":""Q116"",""questionType"":""mcq"",""subject"":""Maths"",""grade"":4,""topic"":""Arithmetic Operations"",""subtopic"":""Division"",""learning_objective"":""Students can interpret remainders in context"",""focus"":""context_interpretation""}"
117,tao1uc4-sd6157-lscir1jhx-q117-mcq,Q117,mcq,Choose the sentence that is correct about 68 ÷ 9 in a story about sharing mini muffins equally onto 9 plates.,Maths,4,Arithmetic Operations,Division,Students can interpret remainders in context,Understanding,medium,3,"MCQ for Grade 4 Arithmetic Operations: Division, aligned to Students can interpret remainders in context.","[{""text"":""Each plate gets 7 muffins, and 5 muffins are left over."",""correct"":true},{""text"":""Each plate gets 8 muffins, and 4 muffins are left over."",""correct"":false},{""text"":""Each plate gets 7 muffins, and 4 muffins are left over."",""correct"":false},{""text"":""Each plate gets 6 muffins, and 14 muffins are left over."",""correct"":false}]","Great thinking! 9 × 7 = 63, and 68 - 63 = 5. So the right story is 7 on each plate with 5 left over.","{""questionNumber"":""Q117"",""questionType"":""mcq"",""subject"":""Maths"",""grade"":4,""topic"":""Arithmetic Operations"",""subtopic"":""Division"",""learning_objective"":""Students can interpret remainders in context"",""focus"":""context_interpretation""}"
118,tao1uc4-sd6157-lscir1jhx-q118-mcq,Q118,mcq,A toy train has 86 animal passengers. Each carriage can hold 11 animals. A shiny flag goes on every full carriage. Choose the answer that tells how many flags are needed and how many animals do not fit in a full carriage.,Maths,4,Arithmetic Operations,Division,Students can interpret remainders in context,Applying,medium,3,"MCQ for Grade 4 Arithmetic Operations: Division, aligned to Students can interpret remainders in context.","[{""text"":""7 flags and 9 animals left"",""correct"":true},{""text"":""8 flags and 2 animals left"",""correct"":false},{""text"":""7 flags and 7 animals left"",""correct"":false},{""text"":""6 flags and 20 animals left"",""correct"":false}]",Fantastic! 86 ÷ 11 = 7 remainder 9 because 11 × 7 = 77. So there are 7 full carriages and 9 animals left.,"{""questionNumber"":""Q118"",""questionType"":""mcq"",""subject"":""Maths"",""grade"":4,""topic"":""Arithmetic Operations"",""subtopic"":""Division"",""learning_objective"":""Students can interpret remainders in context"",""focus"":""multi_step_application""}"
119,tao1uc4-sd6157-lscir1jhx-q119-mcq,Q119,mcq,Compare these ideas for 55 lollies packed into party cups of 8. One idea says 6 remainder 7. Another idea says 7 remainder 1. Decide which idea fits the story.,Maths,4,Arithmetic Operations,Division,Students can interpret remainders in context,Analyzing,medium,3,"MCQ for Grade 4 Arithmetic Operations: Division, aligned to Students can interpret remainders in context.","[{""text"":""6 remainder 7, because 8 × 6 = 48 and 7 more make 55"",""correct"":true},{""text"":""7 remainder 1, because 8 × 7 = 56 is close to 55"",""correct"":false},{""text"":""Both ideas fit, because remainders can change"",""correct"":false},{""text"":""Neither idea fits, because 55 cannot be divided by 8"",""correct"":false}]","Nice comparing! 8 × 6 = 48 and 55 - 48 = 7, so 6 remainder 7 is correct. The other idea uses 56, which is too many.","{""questionNumber"":""Q119"",""questionType"":""mcq"",""subject"":""Maths"",""grade"":4,""topic"":""Arithmetic Operations"",""subtopic"":""Division"",""learning_objective"":""Students can interpret remainders in context"",""focus"":""compare_or_judge""}"
120,tao1uc4-sd6157-lscir1jhx-q120-mcq,Q120,mcq,"What does this result tell us? 72 ÷ 10 = 7 remainder 2, and the story is about toy ducks packed into boxes of 10.",Maths,4,Arithmetic Operations,Division,Students can interpret remainders in context,Understanding,medium,3,"MCQ for Grade 4 Arithmetic Operations: Division, aligned to Students can interpret remainders in context.","[{""text"":""7 full boxes can be packed, and 2 ducks are left over."",""correct"":true},{""text"":""10 full boxes can be packed, and 7 ducks are left over."",""correct"":false},{""text"":""7 boxes are needed for all 72 ducks with none left."",""correct"":false},{""text"":""Each box gets 2 ducks, and 7 ducks are left."",""correct"":false}]",Super job! The quotient tells the full boxes: 7. The remainder tells the leftovers: 2 ducks.,"{""questionNumber"":""Q120"",""questionType"":""mcq"",""subject"":""Maths"",""grade"":4,""topic"":""Arithmetic Operations"",""subtopic"":""Division"",""learning_objective"":""Students can interpret remainders in context"",""focus"":""representation_translation""}"
121,tao1uc4-sd6157-lscir1jhx-q121-mcq,Q121,mcq,Choose the correct result for this adventure map problem: 84 treasure stamps are placed into books with 13 stamps on each page. Some stamps may stay loose. Pick the best answer.,Maths,4,Arithmetic Operations,Division,Students can interpret remainders in context,Applying,medium,3,"MCQ for Grade 4 Arithmetic Operations: Division, aligned to Students can interpret remainders in context.","[{""text"":""6 full pages and 6 stamps left"",""correct"":true},{""text"":""7 full pages and 3 stamps left"",""correct"":false},{""text"":""6 full pages and 7 stamps left"",""correct"":false},{""text"":""5 full pages and 19 stamps left"",""correct"":false}]","You’re doing great! 13 × 6 = 78, and 84 - 78 = 6. So there are 6 full pages and 6 stamps left.","{""questionNumber"":""Q121"",""questionType"":""mcq"",""subject"":""Maths"",""grade"":4,""topic"":""Arithmetic Operations"",""subtopic"":""Division"",""learning_objective"":""Students can interpret remainders in context"",""focus"":""context_interpretation""}"
