queueId,questionNumber,questionText,subject,grade,topic,subtopic,learningObjective,issues,sourceJobId
tf4iq5-sefjr6e-lscsf1a24-q1-mcq-fresh1,Q1,"Choose the correct result for this toy robot card: the fraction starts as 36/48, then changes to 18/24, and the card must end in lowest terms before the game begins. Which answer should be printed last?",Maths,4,Fractions,Equivalent Fractions,Students can simplify fractions to their lowest terms,"[difficulty_mismatch] | The item is mathematically correct, but the cognitive demand does not match hard difficulty. | Students only need to continue simplifying equivalent fractions to lowest terms; this is a straightforward direct process rather than multi-step reasoning or evaluating a claim in a non-trivial context. | Fix: Relabel the item as medium, or increase complexity by asking students to analyze an error, justify why multiple intermediate forms are not lowest terms, or compare different simplification strategies.",a3123917-1ffb-48af-8bdb-c737b8c2b170
tf4iq5-sefjr6e-lscsf1a24-q5-mcq-fresh3,Q5,"Which method correctly solves this sticker puzzle? A page shows 32/56, and the page number can only use the final lowest-term fraction.",Maths,4,Fractions,Equivalent Fractions,Students can simplify fractions to their lowest terms,"[difficulty_mismatch] | The item is mathematically correct, but it does not meet the stated hard difficulty. | It mainly asks students to identify the correctly simplified method for one fraction, which is solvable in one or two direct steps without non-trivial reasoning or context. | Fix: Relabel as medium, or make it harder by requiring students to identify and explain the specific error in each incorrect method or determine whether more than one method can lead to the same lowest terms.",a3123917-1ffb-48af-8bdb-c737b8c2b170
tf4iq5-sefjr6e-lscsf1a24-q6-mcq-fresh4,Q6,"Choose the correct result for this cupcake box puzzle: the simplest form is 5/8, and the original denominator was 56. Which original fraction fits both clues?",Maths,4,Fractions,Equivalent Fractions,Students can simplify fractions to their lowest terms,"[difficulty_mismatch] | The item is mathematically correct, but reverse reasoning here is still a simple scale-factor step and does not justify a hard label. | Students only need to notice that 8 to 56 is multiply by 7 and apply the same factor to the numerator. | Fix: Relabel as medium, or increase complexity by adding an extra condition, requiring justification, or including multiple possible denominators/numerators to eliminate.",a3123917-1ffb-48af-8bdb-c737b8c2b170
tf4iq5-sefjr6e-lscsf1a24-q10-mcq-fresh6,Q10,Choose the equation that matches a correct full simplification for 18/30 on a zoo map and ends in lowest terms.,Maths,4,Fractions,Equivalent Fractions,Students can simplify fractions to their lowest terms,"[difficulty_mismatch] | The item is mathematically correct, but the task is only choosing a valid simplification chain, which is not hard by the provided definition. | The context is superficial and does not add non-trivial reasoning demand. | Fix: Relabel as medium, or make the item harder by asking students to diagnose exactly where each incorrect equation becomes invalid or to compare multiple full solution paths.",a3123917-1ffb-48af-8bdb-c737b8c2b170
tf4iq5-sefjr6e-lscsf1a24-q11-mcq-fresh7,Q11,"Choose the correct result for this teddy-bear basket: the final simplest fraction is 2/9, and the original numerator was 16. Which original fraction belongs on the basket tag?",Maths,4,Fractions,Equivalent Fractions,Students can simplify fractions to their lowest terms,"[difficulty_mismatch] | The item is mathematically correct, but it is a straightforward reverse scale-factor problem rather than a hard task. | Students can solve it directly by noticing that 2 becomes 16 by multiplying by 8. | Fix: Relabel as medium, or add another constraint so students must reason through multiple candidate fractions rather than use a single direct scale factor.",a3123917-1ffb-48af-8bdb-c737b8c2b170
tf4iq5-sefjr6e-lscsf1a24-q15-mcq-fresh10,Q15,Which method correctly solves this snack-table fraction? The card starts with 28/63 and must end in lowest terms before snack time.,Maths,4,Fractions,Equivalent Fractions,Students can simplify fractions to their lowest terms,"[difficulty_mismatch, distractor_quality] | The item is mathematically correct, but it does not meet hard difficulty because the correct method is a direct simplification by a common factor. | Two distractors use non-integer results such as 31.5 and 4.5, which are not plausible grade 4 fraction-simplification misconceptions and weaken distractor quality. | Fix: Relabel as medium, or redesign the task to require deeper analysis of multiple valid and invalid methods. | Fix: Replace non-integer distractors with realistic student errors, such as stopping at 9/21 or dividing numerator and denominator by different factors.",a3123917-1ffb-48af-8bdb-c737b8c2b170
tf4iq5-sefjr6e-lscsf1a24-q16-mcq-fresh11,Q16,"Choose the correct result for this mini-golf ticket: the original fraction had denominator 66, and after simplifying all the way it became 7/11. Which original fraction matches?",Maths,4,Fractions,Equivalent Fractions,Students can simplify fractions to their lowest terms,"[difficulty_mismatch] | The item is mathematically correct, but the reasoning required is a single direct scale-factor step and does not fit hard difficulty. | The context does not create substantial additional reasoning demand. | Fix: Relabel as medium, or make it harder by adding competing conditions or requiring students to justify why the other options do not simplify to 7/11.",a3123917-1ffb-48af-8bdb-c737b8c2b170