rowNumber,queueId,questionNumber,questionType,questionText,subject,grade,topic,subtopic,learningObjective,bloomsLevel,difficultyLevel,difficultyRating,summary,options,explanation,generationMetadata
51,tfmp1lss-spcn1oje-lscip7c85-q53-mcq,Q53,mcq,A jar has 81 jellybeans. They can be shared into 9 equal little bags. What does that show about 81?,Maths,4,"Factors, Multiples & Primes",Prime & Composite Numbers,Students can identify prime numbers up to 100,Understanding,medium,3,"MCQ for Grade 4 Factors, Multiples & Primes: Prime & Composite Numbers, aligned to Students can identify prime numbers up to 100.","[{""text"":""81 is prime because 9 is odd."",""correct"":false},{""text"":""81 is composite because it can be divided by 9 exactly."",""correct"":true},{""text"":""81 is prime because it is greater than 80."",""correct"":false},{""text"":""81 is composite because all odd numbers are composite."",""correct"":false}]","Nice job! Since 81 can be divided by 9 exactly, it has more than 2 factors. So 81 is composite.","{""questionNumber"":""Q53"",""questionType"":""mcq"",""subject"":""Maths"",""grade"":4,""topic"":""Factors, Multiples & Primes"",""subtopic"":""Prime & Composite Numbers"",""learning_objective"":""Students can identify prime numbers up to 100"",""focus"":""context_interpretation""}"
52,tfmp1lss-spcn1oje-lscip7c85-q54-mcq,Q54,mcq,"Look at the four numbers 41, 51, 61, and 91. Choose the set judgment that is correct.",Maths,4,"Factors, Multiples & Primes",Prime & Composite Numbers,Students can identify prime numbers up to 100,Analyzing,medium,3,"MCQ for Grade 4 Factors, Multiples & Primes: Prime & Composite Numbers, aligned to Students can identify prime numbers up to 100.","[{""text"":""Only 41 is prime."",""correct"":false},{""text"":""41 and 61 are prime, but 51 and 91 are composite."",""correct"":true},{""text"":""41, 51, and 61 are prime."",""correct"":false},{""text"":""All four numbers are prime."",""correct"":false}]","Great checking! 41 and 61 are prime. But 51 = 3 × 17 and 91 = 7 × 13, so those are composite.","{""questionNumber"":""Q54"",""questionType"":""mcq"",""subject"":""Maths"",""grade"":4,""topic"":""Factors, Multiples & Primes"",""subtopic"":""Prime & Composite Numbers"",""learning_objective"":""Students can identify prime numbers up to 100"",""focus"":""compare_or_judge""}"
53,tfmp1lss-spcn1oje-lscip7c85-q55-mcq,Q55,mcq,Choose the method that correctly proves 69 is composite.,Maths,4,"Factors, Multiples & Primes",Prime & Composite Numbers,Students can identify prime numbers up to 100,Evaluating,medium,3,"MCQ for Grade 4 Factors, Multiples & Primes: Prime & Composite Numbers, aligned to Students can identify prime numbers up to 100.","[{""text"":""69 is odd, so it is composite."",""correct"":false},{""text"":""69 ends in 9, so it is prime."",""correct"":false},{""text"":""6 + 9 = 15, so 69 is divisible by 3."",""correct"":true},{""text"":""69 is close to 70, so it is composite."",""correct"":false}]","Wonderful! The digits add to 15, and 15 is a multiple of 3, so 69 is divisible by 3. That means 69 is composite.","{""questionNumber"":""Q55"",""questionType"":""mcq"",""subject"":""Maths"",""grade"":4,""topic"":""Factors, Multiples & Primes"",""subtopic"":""Prime & Composite Numbers"",""learning_objective"":""Students can identify prime numbers up to 100"",""focus"":""operation_reasoning""}"
54,tfmp1lss-spcn1oje-lscip7c85-q56-mcq,Q56,mcq,Pick the number that is prime and also 2 less than 81.,Maths,4,"Factors, Multiples & Primes",Prime & Composite Numbers,Students can identify prime numbers up to 100,Applying,medium,3,"MCQ for Grade 4 Factors, Multiples & Primes: Prime & Composite Numbers, aligned to Students can identify prime numbers up to 100.","[{""text"":""75"",""correct"":false},{""text"":""76"",""correct"":false},{""text"":""79"",""correct"":true},{""text"":""78"",""correct"":false}]","2 less than 81 is 79. The number 79 is prime because its only factors are 1 and 79. 75, 76, and 78 are all composite.","{""questionNumber"":""Q56"",""questionType"":""mcq"",""subject"":""Maths"",""grade"":4,""topic"":""Factors, Multiples & Primes"",""subtopic"":""Prime & Composite Numbers"",""learning_objective"":""Students can identify prime numbers up to 100"",""focus"":""multi_step_application""}"
55,tfmp1lss-spcn1oje-lscip7c85-q57-mcq,Q57,mcq,Which sentence correctly explains why 51 is not a prime number?,Maths,4,"Factors, Multiples & Primes",Prime & Composite Numbers,Students can identify prime numbers up to 100,Understanding,medium,3,"MCQ for Grade 4 Factors, Multiples & Primes: Prime & Composite Numbers, aligned to Students can identify prime numbers up to 100.","[{""text"":""51 is prime because it is odd."",""correct"":false},{""text"":""51 is not prime because it has factors 1, 3, 17, and 51."",""correct"":true},{""text"":""51 is prime because it does not end in 0 or 5."",""correct"":false},{""text"":""51 is not prime because all numbers greater than 50 are composite."",""correct"":false}]","51 is not prime because 51 = 3 × 17, so it has more than 2 factors: 1, 3, 17, and 51. Odd numbers are not always prime, numbers that do not end in 0 or 5 can still be composite, and not all numbers greater than 50 are composite.","{""questionNumber"":""Q57"",""questionType"":""mcq"",""subject"":""Maths"",""grade"":4,""topic"":""Factors, Multiples & Primes"",""subtopic"":""Prime & Composite Numbers"",""learning_objective"":""Students can identify prime numbers up to 100"",""focus"":""which_statement""}"
56,tfmp1lss-spcn1oje-lscip7c85-q58-mcq,Q58,mcq,"A treasure map has steps numbered 58, 59, 60, and 61. The treasure is on the smallest prime number step. Choose it.",Maths,4,"Factors, Multiples & Primes",Prime & Composite Numbers,Students can identify prime numbers up to 100,Applying,medium,3,"MCQ for Grade 4 Factors, Multiples & Primes: Prime & Composite Numbers, aligned to Students can identify prime numbers up to 100.","[{""text"":""58"",""correct"":false},{""text"":""59"",""correct"":true},{""text"":""60"",""correct"":false},{""text"":""61"",""correct"":false}]","Great work! Both 59 and 61 are prime, but the smallest prime step is 59. So 59 is the right choice.","{""questionNumber"":""Q58"",""questionType"":""mcq"",""subject"":""Maths"",""grade"":4,""topic"":""Factors, Multiples & Primes"",""subtopic"":""Prime & Composite Numbers"",""learning_objective"":""Students can identify prime numbers up to 100"",""focus"":""constrained_selection""}"
57,tfmp1lss-spcn1oje-lscip7c85-q59-mcq,Q59,mcq,"Look at this check: ""57 is prime because it does not divide by 2."" Decide the best answer.",Maths,4,"Factors, Multiples & Primes",Prime & Composite Numbers,Students can identify prime numbers up to 100,Analyzing,medium,3,"MCQ for Grade 4 Factors, Multiples & Primes: Prime & Composite Numbers, aligned to Students can identify prime numbers up to 100.","[{""text"":""It is correct because numbers not divisible by 2 are prime."",""correct"":false},{""text"":""It is not correct because 57 divides by 3 and 19."",""correct"":true},{""text"":""It is correct because 57 is odd."",""correct"":false},{""text"":""It is not correct because prime numbers must be even."",""correct"":false}]","Excellent spotting! 57 = 3 × 19, so it is composite. Not dividing by 2 does not automatically make a number prime.","{""questionNumber"":""Q59"",""questionType"":""mcq"",""subject"":""Maths"",""grade"":4,""topic"":""Factors, Multiples & Primes"",""subtopic"":""Prime & Composite Numbers"",""learning_objective"":""Students can identify prime numbers up to 100"",""focus"":""error_correction""}"
58,tfmp1lss-spcn1oje-lscip7c85-q60-mcq,Q60,mcq,"Choose the equation that matches a prime number from this set: 22, 31, 39, 49.",Maths,4,"Factors, Multiples & Primes",Prime & Composite Numbers,Students can identify prime numbers up to 100,Applying,medium,3,"MCQ for Grade 4 Factors, Multiples & Primes: Prime & Composite Numbers, aligned to Students can identify prime numbers up to 100.","[{""text"":""22 = 2 × 11"",""correct"":false},{""text"":""31 = 1 × 31 only"",""correct"":true},{""text"":""39 = 3 × 13"",""correct"":false},{""text"":""49 = 7 × 7"",""correct"":false}]","You got it! 31 has only 1 and 31 as factors, so it is prime. The other numbers have extra factors.","{""questionNumber"":""Q60"",""questionType"":""mcq"",""subject"":""Maths"",""grade"":4,""topic"":""Factors, Multiples & Primes"",""subtopic"":""Prime & Composite Numbers"",""learning_objective"":""Students can identify prime numbers up to 100"",""focus"":""operation_reasoning""}"
59,tfmp1lss-spcn1oje-lscip7c85-q62-mcq,Q62,mcq,Four students talk about the number 91 on a sticker pack. Which student gives a reason that is enough to prove whether 91 is prime or composite?,Maths,4,"Factors, Multiples & Primes",Prime & Composite Numbers,Students can identify prime numbers up to 100,Evaluating,hard,4,"MCQ for Grade 4 Factors, Multiples & Primes: Prime & Composite Numbers, aligned to Students can identify prime numbers up to 100.","[{""text"":""91 is prime because it is odd."",""correct"":false},{""text"":""91 is composite because 91 = 7 × 13."",""correct"":true},{""text"":""91 is prime because it does not end in 0, 2, 4, 5, 6, or 8."",""correct"":false},{""text"":""91 is composite because all numbers greater than 90 are composite."",""correct"":false}]","The statement '91 is composite because 91 = 7 × 13' is enough to prove the answer. It shows 91 has factors other than 1 and 91, so it is composite. Being odd does not prove a number is prime, not ending in an even digit or 5 does not guarantee a number is prime, and numbers greater than 90 are not all composite.","{""questionNumber"":""Q62"",""questionType"":""mcq"",""subject"":""Maths"",""grade"":4,""topic"":""Factors, Multiples & Primes"",""subtopic"":""Prime & Composite Numbers"",""learning_objective"":""Students can identify prime numbers up to 100"",""focus"":""evaluate_a_claim""}"
60,tfmp1lss-spcn1oje-lscip7c85-q64-mcq,Q64,mcq,"Look at these zoo ticket checks for 57. Step 1: 57 is odd, so it is not divisible by 2. Step 2: 57 does not end in 5 or 0, so it is not divisible by 5. Step 3: 57 is prime. Choose the best judgment.",Maths,4,"Factors, Multiples & Primes",Prime & Composite Numbers,Students can identify prime numbers up to 100,Evaluating,hard,4,"MCQ for Grade 4 Factors, Multiples & Primes: Prime & Composite Numbers, aligned to Students can identify prime numbers up to 100.","[{""text"":""All the steps are correct."",""correct"":false},{""text"":""The first wrong step is Step 1."",""correct"":false},{""text"":""The first wrong step is Step 2."",""correct"":false},{""text"":""The first wrong step is Step 3 because 57 = 3 × 19."",""correct"":true}]","Excellent checking! Steps 1 and 2 are true, but Step 3 is wrong. 57 is composite because 3 × 19 = 57.","{""questionNumber"":""Q64"",""questionType"":""mcq"",""subject"":""Maths"",""grade"":4,""topic"":""Factors, Multiples & Primes"",""subtopic"":""Prime & Composite Numbers"",""learning_objective"":""Students can identify prime numbers up to 100"",""focus"":""find_the_error""}"
61,tfmp1lss-spcn1oje-lscip7c85-q68-mcq,Q68,mcq,"A snack shop puts a star on a number card only if the number is prime. To check carefully, you must rule out numbers that are divisible by 3 or have another factor pair. Which card should get the star: 67, 69, 77, or 87?",Maths,4,"Factors, Multiples & Primes",Prime & Composite Numbers,Students can identify prime numbers up to 100,Analyzing,hard,4,"MCQ for Grade 4 Factors, Multiples & Primes: Prime & Composite Numbers, aligned to Students can identify prime numbers up to 100.","[{""text"":""67"",""correct"":true},{""text"":""69"",""correct"":false},{""text"":""77"",""correct"":false},{""text"":""87"",""correct"":false}]","67 should get the star because it is prime. The others can be ruled out with factor checks: 69 is divisible by 3 because 6 + 9 = 15, 77 = 7 × 11, and 87 is divisible by 3 because 8 + 7 = 15. Since each of those has factors besides 1 and itself, they are composite.","{""questionNumber"":""Q68"",""questionType"":""mcq"",""subject"":""Maths"",""grade"":4,""topic"":""Factors, Multiples & Primes"",""subtopic"":""Prime & Composite Numbers"",""learning_objective"":""Students can identify prime numbers up to 100"",""focus"":""multi_constraint_problem""}"
62,tfmp1lss-spcn1oje-lscip7c85-q69-mcq,Q69,mcq,"Compare these two treasure-map rules for spotting primes under 100. Rule A: If a number is odd, it is prime. Rule B: A prime number has exactly 2 factors. Choose the correct judgment.",Maths,4,"Factors, Multiples & Primes",Prime & Composite Numbers,Students can identify prime numbers up to 100,Evaluating,hard,4,"MCQ for Grade 4 Factors, Multiples & Primes: Prime & Composite Numbers, aligned to Students can identify prime numbers up to 100.","[{""text"":""Both rules are correct."",""correct"":false},{""text"":""Only Rule A is correct."",""correct"":false},{""text"":""Only Rule B is correct."",""correct"":true},{""text"":""Neither rule is correct."",""correct"":false}]","Great comparing! Only Rule B is correct. Rule A is wrong because some odd numbers, like 9 or 15, are composite.","{""questionNumber"":""Q69"",""questionType"":""mcq"",""subject"":""Maths"",""grade"":4,""topic"":""Factors, Multiples & Primes"",""subtopic"":""Prime & Composite Numbers"",""learning_objective"":""Students can identify prime numbers up to 100"",""focus"":""compare_methods""}"
63,tfmp1lss-spcn1oje-lscip7c85-q70-mcq,Q70,mcq,Choose the method that correctly shows 83 is prime for a number hunt under 100.,Maths,4,"Factors, Multiples & Primes",Prime & Composite Numbers,Students can identify prime numbers up to 100,Evaluating,hard,5,"MCQ for Grade 4 Factors, Multiples & Primes: Prime & Composite Numbers, aligned to Students can identify prime numbers up to 100.","[{""text"":""83 is odd, so it is prime."",""correct"":false},{""text"":""83 does not end in 0 or 5, so it is prime."",""correct"":false},{""text"":""83 is not divisible by 2, 3, 5, or 7, so it is prime."",""correct"":true},{""text"":""83 is greater than 80, so it is prime."",""correct"":false}]","Excellent reasoning! For 83, checking 2, 3, 5, and 7 is enough here, and none divide it. The other methods miss important checks.","{""questionNumber"":""Q70"",""questionType"":""mcq"",""subject"":""Maths"",""grade"":4,""topic"":""Factors, Multiples & Primes"",""subtopic"":""Prime & Composite Numbers"",""learning_objective"":""Students can identify prime numbers up to 100"",""focus"":""compare_methods""}"
64,tfmp1lss-spcn1oje-lscip7c85-q72-mcq,Q72,mcq,Four students make claims about the numbers 1 and 2. Which claim is correct?,Maths,4,"Factors, Multiples & Primes",Prime & Composite Numbers,Students can identify prime numbers up to 100,Evaluating,hard,4,"MCQ for Grade 4 Factors, Multiples & Primes: Prime & Composite Numbers, aligned to Students can identify prime numbers up to 100.","[{""text"":""1 is prime, and 2 is composite because 2 is even."",""correct"":false},{""text"":""1 is composite, and 2 is not prime because 2 has more than 1 factor."",""correct"":false},{""text"":""1 is neither prime nor composite, and 2 is prime because 2 has exactly 2 factors."",""correct"":true},{""text"":""1 and 2 are both prime because both numbers can be divided by 1."",""correct"":false}]","A prime number has exactly 2 factors. The number 2 has exactly 2 factors, 1 and 2, so 2 is prime. The number 1 has only 1 factor, so it is neither prime nor composite. That makes the third claim correct. The other claims are wrong because being even does not make 2 composite, having more than 1 factor is not enough to prove a number is composite, and every whole number can be divided by 1, so that fact alone does not make a number prime.","{""questionNumber"":""Q72"",""questionType"":""mcq"",""subject"":""Maths"",""grade"":4,""topic"":""Factors, Multiples & Primes"",""subtopic"":""Prime & Composite Numbers"",""learning_objective"":""Students can identify prime numbers up to 100"",""focus"":""evaluate_a_claim""}"
65,tfmp1lss-spcn1oje-lscip7c85-q74-mcq,Q74,mcq,"Look at the number checks for 71. Check 1: it is not even. Check 2: its digits make 8, so it is not divisible by 3. Check 3: it does not end in 0 or 5, so it is not divisible by 5. Check 4: that means 71 is composite. Choose the best answer.",Maths,4,"Factors, Multiples & Primes",Prime & Composite Numbers,Students can identify prime numbers up to 100,Evaluating,hard,5,"MCQ for Grade 4 Factors, Multiples & Primes: Prime & Composite Numbers, aligned to Students can identify prime numbers up to 100.","[{""text"":""All four checks are correct."",""correct"":false},{""text"":""Check 2 is the first wrong check."",""correct"":false},{""text"":""Check 4 is the first wrong check because 71 is prime."",""correct"":true},{""text"":""Check 1 is the first wrong check."",""correct"":false}]","Wonderful checking! Checks 1, 2, and 3 are right. Check 4 is wrong because 71 has no factors other than 1 and 71, so it is prime.","{""questionNumber"":""Q74"",""questionType"":""mcq"",""subject"":""Maths"",""grade"":4,""topic"":""Factors, Multiples & Primes"",""subtopic"":""Prime & Composite Numbers"",""learning_objective"":""Students can identify prime numbers up to 100"",""focus"":""find_the_error""}"
66,tfmp1lss-spcn1oje-lscip7c85-q35-mcq-fresh1,Q35,mcq,Choose the method that correctly checks whether 47 on a sticker card is a prime number.,Maths,4,"Factors, Multiples & Primes",Prime & Composite Numbers,Students can identify prime numbers up to 100,Applying,medium,2,"MCQ for Grade 4 Factors, Multiples & Primes: Prime & Composite Numbers, aligned to Students can identify prime numbers up to 100.","[{""text"":""47 is odd, so it is prime."",""correct"":false},{""text"":""47 is not even, its digits make 11 so it is not divisible by 3, and it does not end in 0 or 5, so 47 is prime."",""correct"":true},{""text"":""47 ends in 7, so it is divisible by 7 and is composite."",""correct"":false},{""text"":""4 + 7 = 11, and 11 is prime, so 47 is composite."",""correct"":false}]","Nice careful thinking! To check 47, rule out easy factors: it is not divisible by 2, 3, or 5, so it is prime. The other choices use rules that are not true, like saying every odd number is prime.","{""questionNumber"":""Q35"",""questionType"":""mcq"",""subject"":""Maths"",""grade"":4,""topic"":""Factors, Multiples & Primes"",""subtopic"":""Prime & Composite Numbers"",""learning_objective"":""Students can identify prime numbers up to 100"",""focus"":""error_correction""}"
67,tfmp1lss-spcn1oje-lscip7c85-q37-mcq-fresh2,Q37,mcq,Select the true statement about a toy box number that is more than 60 and less than 70.,Maths,4,"Factors, Multiples & Primes",Prime & Composite Numbers,Students can identify prime numbers up to 100,Analyzing,medium,2,"MCQ for Grade 4 Factors, Multiples & Primes: Prime & Composite Numbers, aligned to Students can identify prime numbers up to 100.","[{""text"":""61 is the number, and it is prime."",""correct"":true},{""text"":""63 is the number, and it is prime."",""correct"":false},{""text"":""65 is the number, and it is prime."",""correct"":false},{""text"":""69 is the number, and it is prime."",""correct"":false}]","Great job checking each number! 61 has no factors other than 1 and 61, so it is prime. But 63, 65, and 69 are composite because they can be divided by other numbers.","{""questionNumber"":""Q37"",""questionType"":""mcq"",""subject"":""Maths"",""grade"":4,""topic"":""Factors, Multiples & Primes"",""subtopic"":""Prime & Composite Numbers"",""learning_objective"":""Students can identify prime numbers up to 100"",""focus"":""constrained_selection""}"
68,tfmp1lss-spcn1oje-lscip7c85-q63-mcq-fresh2,Q63,mcq,A bag of stickers has the number 91 on it. The shop says 91 is prime because it is odd and does not end in 5 or 0. Pick the best answer about that idea.,Maths,4,"Factors, Multiples & Primes",Prime & Composite Numbers,Students can identify prime numbers up to 100,Evaluating,hard,4,"MCQ for Grade 4 Factors, Multiples & Primes: Prime & Composite Numbers, aligned to Students can identify prime numbers up to 100.","[{""text"":""The idea is correct, because all odd numbers are prime."",""correct"":false},{""text"":""The idea is not enough, because 91 = 7 × 13, so 91 is composite."",""correct"":true},{""text"":""The idea is correct, because 9 + 1 = 10 and 10 is not a multiple of 3."",""correct"":false},{""text"":""The idea is not enough, because every number above 90 is composite."",""correct"":false}]","Nice thinking! Being odd and not ending in 5 or 0 does not prove a number is prime. Since 91 = 7 × 13, it has more than 2 factors, so it is composite.","{""questionNumber"":""Q63"",""questionType"":""mcq"",""subject"":""Maths"",""grade"":4,""topic"":""Factors, Multiples & Primes"",""subtopic"":""Prime & Composite Numbers"",""learning_objective"":""Students can identify prime numbers up to 100"",""focus"":""evaluate_a_claim""}"
69,tfmp1lss-spcn1oje-lscip7c85-q73-mcq-fresh7,Q73,mcq,"A monkey snack machine lights up only for prime numbers. For the number 49, one check says, ""49 is odd, so it is prime."" Pick the best answer.",Maths,4,"Factors, Multiples & Primes",Prime & Composite Numbers,Students can identify prime numbers up to 100,Evaluating,hard,4,"MCQ for Grade 4 Factors, Multiples & Primes: Prime & Composite Numbers, aligned to Students can identify prime numbers up to 100.","[{""text"":""The check is correct, because odd numbers are always prime."",""correct"":false},{""text"":""The check is wrong, because 49 = 7 × 7, so 49 is composite."",""correct"":true},{""text"":""The check is correct, because 4 + 9 = 13 and 13 is prime."",""correct"":false},{""text"":""The check is wrong, because all numbers near 50 are composite."",""correct"":false}]","Nice careful thinking! Odd does not always mean prime. Since 49 = 7 × 7, it has more than 2 factors, so it is composite.","{""questionNumber"":""Q73"",""questionType"":""mcq"",""subject"":""Maths"",""grade"":4,""topic"":""Factors, Multiples & Primes"",""subtopic"":""Prime & Composite Numbers"",""learning_objective"":""Students can identify prime numbers up to 100"",""focus"":""find_the_error""}"
70,tfmp1lss-spcn1oje-lscip7c85-q6-mcq-fresh2,Q6,mcq,"At the zoo snack stand, the keeper checks number 91 on a banana box like this: Step 1: 91 is odd, so it is not divisible by 2. Step 2: 9 + 1 = 10, so it is not divisible by 3. Step 3: 91 does not end in 0 or 5, so it is not divisible by 5. Step 4: 91 is prime. Choose the best answer about this check.",Maths,4,"Factors, Multiples & Primes",Prime & Composite Numbers,Students can identify prime numbers up to 100,Evaluating,hard,4,"MCQ for Grade 4 Factors, Multiples & Primes: Prime & Composite Numbers, aligned to Students can identify prime numbers up to 100.","[{""text"":""The check is correct because 91 is not divisible by 2, 3, or 5, so it must be prime."",""correct"":false},{""text"":""Step 1 is the first mistake because odd numbers can still be divisible by 2."",""correct"":false},{""text"":""Step 4 is the first mistake because 91 has another factor pair: 7 × 13."",""correct"":true},{""text"":""Step 2 is the first mistake because adding digits only works for even numbers."",""correct"":false}]","Great job checking the steps! Step 4 is the first wrong step. 91 is not prime because 7 × 13 = 91, so it has more than 2 factors. The earlier steps are true, but they are not enough to prove a number is prime.","{""questionNumber"":""Q6"",""questionType"":""mcq"",""subject"":""Maths"",""grade"":4,""topic"":""Factors, Multiples & Primes"",""subtopic"":""Prime & Composite Numbers"",""learning_objective"":""Students can identify prime numbers up to 100"",""focus"":""find_the_error""}"
71,tfmp1lss-spcn1oje-lscip7c85-q1-mcq,Q1,mcq,"Choose the prime number on these toy blocks: 21, 23, 25, 27.",Maths,4,"Factors, Multiples & Primes",Prime & Composite Numbers,Students can identify prime numbers up to 100,Knowing,easy,1,"MCQ for Grade 4 Factors, Multiples & Primes: Prime & Composite Numbers, aligned to Students can identify prime numbers up to 100.","[{""text"":""21"",""correct"":false},{""text"":""23"",""correct"":true},{""text"":""25"",""correct"":false},{""text"":""27"",""correct"":false}]","Great job! 23 is prime because it has only 2 factors: 1 and 23. The others can be split into more equal groups, so they are composite.","{""questionNumber"":""Q1"",""questionType"":""mcq"",""subject"":""Maths"",""grade"":4,""topic"":""Factors, Multiples & Primes"",""subtopic"":""Prime & Composite Numbers"",""learning_objective"":""Students can identify prime numbers up to 100"",""focus"":""identify a prime number from a small set""}"
72,tfmp1lss-spcn1oje-lscip7c85-q2-mcq,Q2,mcq,Select the true statement about the number 31 on a sticker card.,Maths,4,"Factors, Multiples & Primes",Prime & Composite Numbers,Students can identify prime numbers up to 100,Understanding,easy,1,"MCQ for Grade 4 Factors, Multiples & Primes: Prime & Composite Numbers, aligned to Students can identify prime numbers up to 100.","[{""text"":""31 is an even number."",""correct"":false},{""text"":""31 is a prime number."",""correct"":true},{""text"":""31 has more than 2 factors."",""correct"":false},{""text"":""31 can be made by 5 × 6."",""correct"":false}]","Nice thinking! 31 is a prime number, so it has exactly 2 factors: 1 and 31. That makes the other statements not true.","{""questionNumber"":""Q2"",""questionType"":""mcq"",""subject"":""Maths"",""grade"":4,""topic"":""Factors, Multiples & Primes"",""subtopic"":""Prime & Composite Numbers"",""learning_objective"":""Students can identify prime numbers up to 100"",""focus"":""recognise a correct statement about a prime number""}"
