rowNumber,queueId,questionNumber,questionType,questionText,subject,grade,topic,subtopic,learningObjective,bloomsLevel,difficultyLevel,difficultyRating,summary,options,explanation,generationMetadata
68,tvei4t7-seekm5z-lscsa1ybu-q68-mcq,Q68,mcq,"A bunny hop game gives 2h + 1 points. A player has h = 7 hops, then earns 2 extra bonus points. Choose the final score.",Maths,4,Variables & Expressions,Evaluating Expressions,Students can substitute a value for a variable and evaluate a simple expression,Applying,medium,3,"MCQ for Grade 4 Variables & Expressions: Evaluating Expressions, aligned to Students can substitute a value for a variable and evaluate a simple expression.","[{""text"":""15"",""correct"":false},{""text"":""16"",""correct"":false},{""text"":""17"",""correct"":true},{""text"":""19"",""correct"":false}]",Nice one! 2 × 7 + 1 = 15. Then add 2 more bonus points to get 17. Keep going—you’re doing really well.,"{""questionNumber"":""Q68"",""questionType"":""mcq"",""subject"":""Maths"",""grade"":4,""topic"":""Variables & Expressions"",""subtopic"":""Evaluating Expressions"",""learning_objective"":""Students can substitute a value for a variable and evaluate a simple expression"",""focus"":""context_interpretation""}"
69,tvei4t7-seekm5z-lscsa1ybu-q69-mcq,Q69,mcq,Evaluate c - 3 and 2c - 12 for c = 8. Which expression has the greater value?,Maths,4,Variables & Expressions,Evaluating Expressions,Students can substitute a value for a variable and evaluate a simple expression,Analyzing,medium,3,"MCQ for Grade 4 Variables & Expressions: Evaluating Expressions, aligned to Students can substitute a value for a variable and evaluate a simple expression.","[{""text"":""c - 3 is greater."",""correct"":true},{""text"":""2c - 12 is greater."",""correct"":false},{""text"":""The two expressions have the same value."",""correct"":false},{""text"":""One result is 0."",""correct"":false}]","Substitute c = 8. Then c - 3 = 8 - 3 = 5. Also, 2c - 12 = 2 × 8 - 12 = 16 - 12 = 4. Since 5 is greater than 4, c - 3 is greater. Neither result is 0.","{""questionNumber"":""Q69"",""questionType"":""mcq"",""subject"":""Maths"",""grade"":4,""topic"":""Variables & Expressions"",""subtopic"":""Evaluating Expressions"",""learning_objective"":""Students can substitute a value for a variable and evaluate a simple expression"",""focus"":""compare_or_judge""}"
70,tvei4t7-seekm5z-lscsa1ybu-q70-mcq,Q70,mcq,Choose the method that correctly solves 3k + 4 when k = 6.,Maths,4,Variables & Expressions,Evaluating Expressions,Students can substitute a value for a variable and evaluate a simple expression,Analyzing,medium,3,"MCQ for Grade 4 Variables & Expressions: Evaluating Expressions, aligned to Students can substitute a value for a variable and evaluate a simple expression.","[{""text"":""Multiply 3 × 6, then add 4 to get 22."",""correct"":true},{""text"":""Add 3 + 6 + 4 to get 13."",""correct"":false},{""text"":""Write 36 + 4 to get 40."",""correct"":false},{""text"":""Multiply 6 × 4, then add 3 to get 27."",""correct"":false}]","Yes! The correct method is 3 × 6 = 18, then 18 + 4 = 22. The other choices mix up multiplication and place value.","{""questionNumber"":""Q70"",""questionType"":""mcq"",""subject"":""Maths"",""grade"":4,""topic"":""Variables & Expressions"",""subtopic"":""Evaluating Expressions"",""learning_objective"":""Students can substitute a value for a variable and evaluate a simple expression"",""focus"":""error_correction""}"
71,tvei4t7-seekm5z-lscsa1ybu-q71-mcq,Q71,mcq,"Decide the correct value of 5r + 2 when r = 3, then subtract 4 marbles that rolled away. Which number is left?",Maths,4,Variables & Expressions,Evaluating Expressions,Students can substitute a value for a variable and evaluate a simple expression,Applying,medium,3,"MCQ for Grade 4 Variables & Expressions: Evaluating Expressions, aligned to Students can substitute a value for a variable and evaluate a simple expression.","[{""text"":""11"",""correct"":false},{""text"":""13"",""correct"":true},{""text"":""17"",""correct"":false},{""text"":""19"",""correct"":false}]",Fantastic! 5 × 3 + 2 = 15 + 2 = 17. Then 17 - 4 = 13. Some choices forgot the last step.,"{""questionNumber"":""Q71"",""questionType"":""mcq"",""subject"":""Maths"",""grade"":4,""topic"":""Variables & Expressions"",""subtopic"":""Evaluating Expressions"",""learning_objective"":""Students can substitute a value for a variable and evaluate a simple expression"",""focus"":""multi_step_application""}"
72,tvei4t7-seekm5z-lscsa1ybu-q72-mcq,Q72,mcq,Decide which claim about 4 + x + x when x = 2 is true.,Maths,4,Variables & Expressions,Evaluating Expressions,Students can substitute a value for a variable and evaluate a simple expression,Understanding,medium,3,"MCQ for Grade 4 Variables & Expressions: Evaluating Expressions, aligned to Students can substitute a value for a variable and evaluate a simple expression.","[{""text"":""Its value is the same as 4 + 2 × 2, which is 8."",""correct"":true},{""text"":""Its value is the same as 42 + 2, which is 44."",""correct"":false},{""text"":""Its value is the same as 4 + 2, which is 6."",""correct"":false},{""text"":""Its value is the same as 4 × 2 × 2, which is 16."",""correct"":false}]","Great thinking! x + x means 2 + 2, so 4 + x + x = 4 + 4 = 8. That matches 4 + 2 × 2 here.","{""questionNumber"":""Q72"",""questionType"":""mcq"",""subject"":""Maths"",""grade"":4,""topic"":""Variables & Expressions"",""subtopic"":""Evaluating Expressions"",""learning_objective"":""Students can substitute a value for a variable and evaluate a simple expression"",""focus"":""representation_translation""}"
73,tvei4t7-seekm5z-lscsa1ybu-q73-mcq,Q73,mcq,"A sticker sheet has 8 stars and s hearts. There are 3 sheets. When s = 4, each sheet has 8 + s stickers. Choose the total stickers on all 3 sheets.",Maths,4,Variables & Expressions,Evaluating Expressions,Students can substitute a value for a variable and evaluate a simple expression,Applying,medium,3,"MCQ for Grade 4 Variables & Expressions: Evaluating Expressions, aligned to Students can substitute a value for a variable and evaluate a simple expression.","[{""text"":""12"",""correct"":false},{""text"":""24"",""correct"":false},{""text"":""36"",""correct"":true},{""text"":""84"",""correct"":false}]",Awesome! Each sheet has 8 + 4 = 12 stickers. Then 3 sheets have 3 × 12 = 36 stickers. You used two smart steps!,"{""questionNumber"":""Q73"",""questionType"":""mcq"",""subject"":""Maths"",""grade"":4,""topic"":""Variables & Expressions"",""subtopic"":""Evaluating Expressions"",""learning_objective"":""Students can substitute a value for a variable and evaluate a simple expression"",""focus"":""context_interpretation""}"
74,tvei4t7-seekm5z-lscsa1ybu-q74-mcq,Q74,mcq,Evaluate 2p + 9 and 3p + 3 for p = 5. Which expression has the greater value?,Maths,4,Variables & Expressions,Evaluating Expressions,Students can substitute a value for a variable and evaluate a simple expression,Analyzing,medium,3,"MCQ for Grade 4 Variables & Expressions: Evaluating Expressions, aligned to Students can substitute a value for a variable and evaluate a simple expression.","[{""text"":""2p + 9 is greater."",""correct"":true},{""text"":""3p + 3 is greater."",""correct"":false},{""text"":""The two expressions have the same value."",""correct"":false},{""text"":""Both values are 20."",""correct"":false}]","Substitute p = 5. Then 2p + 9 = 2 × 5 + 9 = 10 + 9 = 19. Next, 3p + 3 = 3 × 5 + 3 = 15 + 3 = 18. Since 19 is greater than 18, 2p + 9 is greater. The values are not equal, and they are not both 20.","{""questionNumber"":""Q74"",""questionType"":""mcq"",""subject"":""Maths"",""grade"":4,""topic"":""Variables & Expressions"",""subtopic"":""Evaluating Expressions"",""learning_objective"":""Students can substitute a value for a variable and evaluate a simple expression"",""focus"":""compare_or_judge""}"
75,tvei4t7-seekm5z-lscsa1ybu-q75-mcq,Q75,mcq,"Choose the equation that matches this toy train story: each train has 4 carriages, and there are t trains, plus 2 extra carriages in the station. If t = 3, which value is correct?",Maths,4,Variables & Expressions,Evaluating Expressions,Students can substitute a value for a variable and evaluate a simple expression,Applying,medium,3,"MCQ for Grade 4 Variables & Expressions: Evaluating Expressions, aligned to Students can substitute a value for a variable and evaluate a simple expression.","[{""text"":""4t + 2 = 14"",""correct"":true},{""text"":""4 + t + 2 = 9"",""correct"":false},{""text"":""t + 2 = 5"",""correct"":false},{""text"":""4t + 2 = 18"",""correct"":false}]","You got it! 4 × 3 = 12, and 12 + 2 = 14. The story matches 4t + 2 exactly.","{""questionNumber"":""Q75"",""questionType"":""mcq"",""subject"":""Maths"",""grade"":4,""topic"":""Variables & Expressions"",""subtopic"":""Evaluating Expressions"",""learning_objective"":""Students can substitute a value for a variable and evaluate a simple expression"",""focus"":""operation_reasoning""}"
76,tvei4t7-seekm5z-lscsa1ybu-q76-mcq,Q76,mcq,"Pick the correct result for 7a - 6 when a = 4, then add 1 more jellybean. Which total is right?",Maths,4,Variables & Expressions,Evaluating Expressions,Students can substitute a value for a variable and evaluate a simple expression,Applying,medium,3,"MCQ for Grade 4 Variables & Expressions: Evaluating Expressions, aligned to Students can substitute a value for a variable and evaluate a simple expression.","[{""text"":""22"",""correct"":false},{""text"":""23"",""correct"":true},{""text"":""24"",""correct"":false},{""text"":""29"",""correct"":false}]",Brilliant! 7 × 4 - 6 = 28 - 6 = 22. Then add 1 more to get 23. Nice careful work.,"{""questionNumber"":""Q76"",""questionType"":""mcq"",""subject"":""Maths"",""grade"":4,""topic"":""Variables & Expressions"",""subtopic"":""Evaluating Expressions"",""learning_objective"":""Students can substitute a value for a variable and evaluate a simple expression"",""focus"":""multi_step_application""}"
77,tvei4t7-seekm5z-lscsa1ybu-q77-mcq,Q77,mcq,Select the true statement about 3n + 3 when n = 5.,Maths,4,Variables & Expressions,Evaluating Expressions,Students can substitute a value for a variable and evaluate a simple expression,Understanding,medium,3,"MCQ for Grade 4 Variables & Expressions: Evaluating Expressions, aligned to Students can substitute a value for a variable and evaluate a simple expression.","[{""text"":""Its value is odd and greater than 15."",""correct"":false},{""text"":""Its value is even and less than 20."",""correct"":true},{""text"":""Its value is odd and less than 15."",""correct"":false},{""text"":""Its value is even and greater than 20."",""correct"":false}]",Nice job! 3 × 5 + 3 = 15 + 3 = 18. Eighteen is even and less than 20. You checked both clues!,"{""questionNumber"":""Q77"",""questionType"":""mcq"",""subject"":""Maths"",""grade"":4,""topic"":""Variables & Expressions"",""subtopic"":""Evaluating Expressions"",""learning_objective"":""Students can substitute a value for a variable and evaluate a simple expression"",""focus"":""constrained_selection""}"
78,tvei4t7-seekm5z-lscsa1ybu-q78-mcq,Q78,mcq,"A snack robot makes 2m + 5 raisins in a box. When m = 6, the box is packed, and then 4 raisins are eaten. Choose the number left.",Maths,4,Variables & Expressions,Evaluating Expressions,Students can substitute a value for a variable and evaluate a simple expression,Applying,medium,3,"MCQ for Grade 4 Variables & Expressions: Evaluating Expressions, aligned to Students can substitute a value for a variable and evaluate a simple expression.","[{""text"":""13"",""correct"":true},{""text"":""17"",""correct"":false},{""text"":""21"",""correct"":false},{""text"":""27"",""correct"":false}]",Great! 2 × 6 + 5 = 12 + 5 = 17. Then 17 - 4 = 13. You followed both steps carefully.,"{""questionNumber"":""Q78"",""questionType"":""mcq"",""subject"":""Maths"",""grade"":4,""topic"":""Variables & Expressions"",""subtopic"":""Evaluating Expressions"",""learning_objective"":""Students can substitute a value for a variable and evaluate a simple expression"",""focus"":""context_interpretation""}"
79,tvei4t7-seekm5z-lscsa1ybu-q79-mcq,Q79,mcq,Evaluate q + q + 5 and 3q + 2 for q = 4. Which expression has the greater value?,Maths,4,Variables & Expressions,Evaluating Expressions,Students can substitute a value for a variable and evaluate a simple expression,Analyzing,medium,3,"MCQ for Grade 4 Variables & Expressions: Evaluating Expressions, aligned to Students can substitute a value for a variable and evaluate a simple expression.","[{""text"":""q + q + 5 is greater."",""correct"":false},{""text"":""3q + 2 is greater."",""correct"":true},{""text"":""The two expressions have the same value."",""correct"":false},{""text"":""Both values are 12."",""correct"":false}]","Substitute q = 4. Then q + q + 5 = 4 + 4 + 5 = 13. Also, 3q + 2 = 3 × 4 + 2 = 12 + 2 = 14. Since 14 is greater than 13, 3q + 2 is greater. The values are not the same, and they are not both 12.","{""questionNumber"":""Q79"",""questionType"":""mcq"",""subject"":""Maths"",""grade"":4,""topic"":""Variables & Expressions"",""subtopic"":""Evaluating Expressions"",""learning_objective"":""Students can substitute a value for a variable and evaluate a simple expression"",""focus"":""compare_or_judge""}"
80,tvei4t7-seekm5z-lscsa1ybu-q80-mcq,Q80,mcq,Choose the method that correctly solves 8 - 2x when x = 3.,Maths,4,Variables & Expressions,Evaluating Expressions,Students can substitute a value for a variable and evaluate a simple expression,Analyzing,medium,3,"MCQ for Grade 4 Variables & Expressions: Evaluating Expressions, aligned to Students can substitute a value for a variable and evaluate a simple expression.","[{""text"":""Multiply 2 × 3, then subtract from 8 to get 2."",""correct"":true},{""text"":""Subtract 2 from 8, then multiply by 3 to get 18."",""correct"":false},{""text"":""Add 8 + 2 + 3 to get 13."",""correct"":false},{""text"":""Write 8 - 23 to get 15."",""correct"":false}]","Excellent! 2 × 3 = 6, and 8 - 6 = 2. The other methods mix up the order or join digits together.","{""questionNumber"":""Q80"",""questionType"":""mcq"",""subject"":""Maths"",""grade"":4,""topic"":""Variables & Expressions"",""subtopic"":""Evaluating Expressions"",""learning_objective"":""Students can substitute a value for a variable and evaluate a simple expression"",""focus"":""error_correction""}"
81,tvei4t7-seekm5z-lscsa1ybu-q81-mcq,Q81,mcq,"Choose the correct result for 9 - y + 4 when y = 6, then add 3 more points from a bonus turn. Which total matches?",Maths,4,Variables & Expressions,Evaluating Expressions,Students can substitute a value for a variable and evaluate a simple expression,Applying,medium,3,"MCQ for Grade 4 Variables & Expressions: Evaluating Expressions, aligned to Students can substitute a value for a variable and evaluate a simple expression.","[{""text"":""7"",""correct"":false},{""text"":""10"",""correct"":true},{""text"":""12"",""correct"":false},{""text"":""16"",""correct"":false}]",Good job! 9 - 6 + 4 = 3 + 4 = 7. Then add 3 more to get 10. You kept track of both parts.,"{""questionNumber"":""Q81"",""questionType"":""mcq"",""subject"":""Maths"",""grade"":4,""topic"":""Variables & Expressions"",""subtopic"":""Evaluating Expressions"",""learning_objective"":""Students can substitute a value for a variable and evaluate a simple expression"",""focus"":""multi_step_application""}"
82,tvei4t7-seekm5z-lscsa1ybu-q82-mcq,Q82,mcq,Decide which claim about 2( x + 3 ) when x = 4 is true.,Maths,4,Variables & Expressions,Evaluating Expressions,Students can substitute a value for a variable and evaluate a simple expression,Understanding,medium,3,"MCQ for Grade 4 Variables & Expressions: Evaluating Expressions, aligned to Students can substitute a value for a variable and evaluate a simple expression.","[{""text"":""It means 2 × 4 + 3, so the value is 11."",""correct"":false},{""text"":""It means 2 groups of 4 + 3, so the value is 14."",""correct"":true},{""text"":""It means 24 + 3, so the value is 27."",""correct"":false},{""text"":""It means 2 + 4 + 3, so the value is 9."",""correct"":false}]",Great thinking! First do the bracket: 4 + 3 = 7. Then 2 × 7 = 14. Some choices forgot that the 2 multiplies the whole bracket.,"{""questionNumber"":""Q82"",""questionType"":""mcq"",""subject"":""Maths"",""grade"":4,""topic"":""Variables & Expressions"",""subtopic"":""Evaluating Expressions"",""learning_objective"":""Students can substitute a value for a variable and evaluate a simple expression"",""focus"":""representation_translation""}"
83,tvei4t7-seekm5z-lscsa1ybu-q83-mcq,Q83,mcq,"A box of sweets has g gummy bears and 6 lollies. There are 2 boxes. When g = 5, choose the total sweets in both boxes.",Maths,4,Variables & Expressions,Evaluating Expressions,Students can substitute a value for a variable and evaluate a simple expression,Applying,medium,3,"MCQ for Grade 4 Variables & Expressions: Evaluating Expressions, aligned to Students can substitute a value for a variable and evaluate a simple expression.","[{""text"":""11"",""correct"":false},{""text"":""16"",""correct"":false},{""text"":""22"",""correct"":true},{""text"":""56"",""correct"":false}]",Super! One box has 5 + 6 = 11 sweets. Two boxes have 2 × 11 = 22. You used the expression in a real story.,"{""questionNumber"":""Q83"",""questionType"":""mcq"",""subject"":""Maths"",""grade"":4,""topic"":""Variables & Expressions"",""subtopic"":""Evaluating Expressions"",""learning_objective"":""Students can substitute a value for a variable and evaluate a simple expression"",""focus"":""context_interpretation""}"
84,tvei4t7-seekm5z-lscsa1ybu-q84-mcq,Q84,mcq,Evaluate 6d + 1 and 5d + 4 for d = 2. Which expression has the greater value?,Maths,4,Variables & Expressions,Evaluating Expressions,Students can substitute a value for a variable and evaluate a simple expression,Analyzing,medium,3,"MCQ for Grade 4 Variables & Expressions: Evaluating Expressions, aligned to Students can substitute a value for a variable and evaluate a simple expression.","[{""text"":""6d + 1 is greater."",""correct"":false},{""text"":""5d + 4 is greater."",""correct"":true},{""text"":""The two expressions have the same value."",""correct"":false},{""text"":""One value is 9 and the other is 12."",""correct"":false}]","Substitute d = 2. Then 6d + 1 = 6 × 2 + 1 = 12 + 1 = 13. Also, 5d + 4 = 5 × 2 + 4 = 10 + 4 = 14. Since 14 is greater than 13, 5d + 4 is greater. The expressions are not equal, and the values are 13 and 14, not 9 and 12.","{""questionNumber"":""Q84"",""questionType"":""mcq"",""subject"":""Maths"",""grade"":4,""topic"":""Variables & Expressions"",""subtopic"":""Evaluating Expressions"",""learning_objective"":""Students can substitute a value for a variable and evaluate a simple expression"",""focus"":""compare_or_judge""}"
85,tvei4t7-seekm5z-lscsa1ybu-q85-mcq,Q85,mcq,"Choose the equation that matches this pet shop story: there are 5 fish bowls with f fish in each bowl and 1 extra fish in a small tank. If f = 2, which option is correct?",Maths,4,Variables & Expressions,Evaluating Expressions,Students can substitute a value for a variable and evaluate a simple expression,Applying,medium,3,"MCQ for Grade 4 Variables & Expressions: Evaluating Expressions, aligned to Students can substitute a value for a variable and evaluate a simple expression.","[{""text"":""5f + 1 = 11"",""correct"":true},{""text"":""5 + f + 1 = 8"",""correct"":false},{""text"":""f + 1 = 3"",""correct"":false},{""text"":""5f + 1 = 16"",""correct"":false}]","Wonderful! 5 × 2 = 10, and 10 + 1 = 11. That matches 5f + 1 perfectly.","{""questionNumber"":""Q85"",""questionType"":""mcq"",""subject"":""Maths"",""grade"":4,""topic"":""Variables & Expressions"",""subtopic"":""Evaluating Expressions"",""learning_objective"":""Students can substitute a value for a variable and evaluate a simple expression"",""focus"":""operation_reasoning""}"
86,tvei4t7-seekm5z-lscsa1ybu-q86-mcq,Q86,mcq,"Pick the correct value of 3w + 8 when w = 7, then take away 5 balloons that popped. Which number is left?",Maths,4,Variables & Expressions,Evaluating Expressions,Students can substitute a value for a variable and evaluate a simple expression,Applying,medium,3,"MCQ for Grade 4 Variables & Expressions: Evaluating Expressions, aligned to Students can substitute a value for a variable and evaluate a simple expression.","[{""text"":""19"",""correct"":false},{""text"":""21"",""correct"":false},{""text"":""24"",""correct"":true},{""text"":""29"",""correct"":false}]",Great work! 3 × 7 + 8 = 21 + 8 = 29. Then 29 - 5 = 24. You did both steps like a star.,"{""questionNumber"":""Q86"",""questionType"":""mcq"",""subject"":""Maths"",""grade"":4,""topic"":""Variables & Expressions"",""subtopic"":""Evaluating Expressions"",""learning_objective"":""Students can substitute a value for a variable and evaluate a simple expression"",""focus"":""multi_step_application""}"
87,tvei4t7-seekm5z-lscsa1ybu-q87-mcq,Q87,mcq,Choose the sentence that is correct about 10 - z - z when z = 3.,Maths,4,Variables & Expressions,Evaluating Expressions,Students can substitute a value for a variable and evaluate a simple expression,Understanding,medium,3,"MCQ for Grade 4 Variables & Expressions: Evaluating Expressions, aligned to Students can substitute a value for a variable and evaluate a simple expression.","[{""text"":""It has the same value as 10 - 2 × 3, which is 4."",""correct"":true},{""text"":""It has the same value as 10 - 3, which is 7."",""correct"":false},{""text"":""It has the same value as 10 - 33, which is 23."",""correct"":false},{""text"":""It has the same value as 10 - 2 + 3, which is 11."",""correct"":false}]",Excellent! Subtract 3 two times: 10 - 3 - 3 = 4. That matches 10 - 2 × 3 here. Some choices only subtracted once.,"{""questionNumber"":""Q87"",""questionType"":""mcq"",""subject"":""Maths"",""grade"":4,""topic"":""Variables & Expressions"",""subtopic"":""Evaluating Expressions"",""learning_objective"":""Students can substitute a value for a variable and evaluate a simple expression"",""focus"":""representation_translation""}"
88,tvei4t7-seekm5z-lscsa1ybu-q88-mcq,Q88,mcq,"A game machine gives 4r + 2 points. When r = 5, the score shows on the screen, and then 6 extra points are added for a treasure chest. Choose the final score.",Maths,4,Variables & Expressions,Evaluating Expressions,Students can substitute a value for a variable and evaluate a simple expression,Applying,medium,3,"MCQ for Grade 4 Variables & Expressions: Evaluating Expressions, aligned to Students can substitute a value for a variable and evaluate a simple expression.","[{""text"":""22"",""correct"":false},{""text"":""26"",""correct"":false},{""text"":""28"",""correct"":true},{""text"":""32"",""correct"":false}]",Nice! 4 × 5 + 2 = 20 + 2 = 22. Then add 6 more to get 28. You followed the adventure perfectly.,"{""questionNumber"":""Q88"",""questionType"":""mcq"",""subject"":""Maths"",""grade"":4,""topic"":""Variables & Expressions"",""subtopic"":""Evaluating Expressions"",""learning_objective"":""Students can substitute a value for a variable and evaluate a simple expression"",""focus"":""context_interpretation""}"
89,tvei4t7-seekm5z-lscsa1ybu-q89-mcq,Q89,mcq,Look at the expressions below with x = 6: 2x + 7 and x + 13. Decide which comparison is correct.,Maths,4,Variables & Expressions,Evaluating Expressions,Students can substitute a value for a variable and evaluate a simple expression,Analyzing,medium,3,"MCQ for Grade 4 Variables & Expressions: Evaluating Expressions, aligned to Students can substitute a value for a variable and evaluate a simple expression.","[{""text"":""2x + 7 is greater."",""correct"":false},{""text"":""x + 13 is greater."",""correct"":false},{""text"":""The two expressions have the same value."",""correct"":true},{""text"":""Both values are 20."",""correct"":false}]","Well done! 2 × 6 + 7 = 12 + 7 = 19, and 6 + 13 = 19. Same value—great checking!","{""questionNumber"":""Q89"",""questionType"":""mcq"",""subject"":""Maths"",""grade"":4,""topic"":""Variables & Expressions"",""subtopic"":""Evaluating Expressions"",""learning_objective"":""Students can substitute a value for a variable and evaluate a simple expression"",""focus"":""compare_or_judge""}"
90,tvei4t7-seekm5z-lscsa1ybu-q90-mcq,Q90,mcq,Choose the method that correctly solves 2( m + 1 ) when m = 8.,Maths,4,Variables & Expressions,Evaluating Expressions,Students can substitute a value for a variable and evaluate a simple expression,Analyzing,medium,3,"MCQ for Grade 4 Variables & Expressions: Evaluating Expressions, aligned to Students can substitute a value for a variable and evaluate a simple expression.","[{""text"":""Add inside the bracket first: 8 + 1 = 9, then multiply by 2 to get 18."",""correct"":true},{""text"":""Multiply 2 × 8, then add 1 to get 17."",""correct"":false},{""text"":""Add 2 + 8 + 1 to get 11."",""correct"":false},{""text"":""Write 28 + 1 to get 29."",""correct"":false}]","Brilliant! Brackets come first, so 8 + 1 = 9, then 2 × 9 = 18. The other methods forget the bracket rule.","{""questionNumber"":""Q90"",""questionType"":""mcq"",""subject"":""Maths"",""grade"":4,""topic"":""Variables & Expressions"",""subtopic"":""Evaluating Expressions"",""learning_objective"":""Students can substitute a value for a variable and evaluate a simple expression"",""focus"":""error_correction""}"
