rowNumber,queueId,questionNumber,questionType,questionText,subject,grade,topic,subtopic,learningObjective,bloomsLevel,difficultyLevel,difficultyRating,summary,options,explanation,generationMetadata
49,tfmp1lss-sfm6nhg-lscim18h4-q52-mcq,Q52,mcq,Choose the sentence that is correct about 45 and 6.,Maths,4,"Factors, Multiples & Primes",Factors & Multiples,Students can identify multiples of a given number,Understanding,medium,3,"MCQ for Grade 4 Factors, Multiples & Primes: Factors & Multiples, aligned to Students can identify multiples of a given number.","[{""text"":""45 is a multiple of 6 because it ends in 5."",""correct"":false},{""text"":""45 is not a multiple of 6 because 6, 12, 18, 24, 30, 36, 42, 48 skip past 45."",""correct"":true},{""text"":""45 is a multiple of 6 because 4 + 5 = 9."",""correct"":false},{""text"":""45 is a multiple of 6 because it is odd."",""correct"":false}]","Good checking! Counting by 6 shows 42 then 48, so 45 is not a multiple of 6.","{""questionNumber"":""Q52"",""questionType"":""mcq"",""subject"":""Maths"",""grade"":4,""topic"":""Factors, Multiples & Primes"",""subtopic"":""Factors & Multiples"",""learning_objective"":""Students can identify multiples of a given number"",""focus"":""statement_evaluation""}"
50,tfmp1lss-sfm6nhg-lscim18h4-q53-mcq,Q53,mcq,"A pirate map marks treasure every 10 steps. The marks shown are 10, 20, 30, 40, and one more mark. Choose the next mark.",Maths,4,"Factors, Multiples & Primes",Factors & Multiples,Students can identify multiples of a given number,Applying,medium,3,"MCQ for Grade 4 Factors, Multiples & Primes: Factors & Multiples, aligned to Students can identify multiples of a given number.","[{""text"":""45"",""correct"":false},{""text"":""50"",""correct"":true},{""text"":""55"",""correct"":false},{""text"":""60"",""correct"":false}]","Great counting by 10s! After 10, 20, 30, 40 comes 50. That is the next multiple of 10.","{""questionNumber"":""Q53"",""questionType"":""mcq"",""subject"":""Maths"",""grade"":4,""topic"":""Factors, Multiples & Primes"",""subtopic"":""Factors & Multiples"",""learning_objective"":""Students can identify multiples of a given number"",""focus"":""representation_translation""}"
51,tfmp1lss-sfm6nhg-lscim18h4-q54-mcq,Q54,mcq,"A pattern should count by 9s: 27, 36, 45, __. Which choice does not fit and would break the pattern?",Maths,4,"Factors, Multiples & Primes",Factors & Multiples,Students can identify multiples of a given number,Analyzing,medium,3,"MCQ for Grade 4 Factors, Multiples & Primes: Factors & Multiples, aligned to Students can identify multiples of a given number.","[{""text"":""27"",""correct"":false},{""text"":""36"",""correct"":false},{""text"":""45"",""correct"":false},{""text"":""52"",""correct"":true}]","27, 36, and 45 are multiples of 9 because they are 9×3, 9×4, and 9×5. The next number in that pattern should be 54, not 52. So 52 would break the pattern because it is not a multiple of 9.","{""questionNumber"":""Q54"",""questionType"":""mcq"",""subject"":""Maths"",""grade"":4,""topic"":""Factors, Multiples & Primes"",""subtopic"":""Factors & Multiples"",""learning_objective"":""Students can identify multiples of a given number"",""focus"":""compare_or_judge""}"
52,tfmp1lss-sfm6nhg-lscim18h4-q55-mcq,Q55,mcq,"Choose the equation that matches this story: 7 toy cars are packed into each box, and 28 toy cars fill some whole boxes. This shows 28 is a multiple of 7.",Maths,4,"Factors, Multiples & Primes",Factors & Multiples,Students can identify multiples of a given number,Applying,medium,3,"MCQ for Grade 4 Factors, Multiples & Primes: Factors & Multiples, aligned to Students can identify multiples of a given number.","[{""text"":""7 × 4 = 28"",""correct"":true},{""text"":""7 + 4 = 28"",""correct"":false},{""text"":""28 - 7 = 4"",""correct"":false},{""text"":""28 + 7 = 35"",""correct"":false}]","Excellent! 7 × 4 = 28 means 28 is made from equal groups of 7, so it is a multiple of 7.","{""questionNumber"":""Q55"",""questionType"":""mcq"",""subject"":""Maths"",""grade"":4,""topic"":""Factors, Multiples & Primes"",""subtopic"":""Factors & Multiples"",""learning_objective"":""Students can identify multiples of a given number"",""focus"":""context_interpretation""}"
53,tfmp1lss-sfm6nhg-lscim18h4-q56-mcq,Q56,mcq,A shop packs pencils in boxes of 4. An order must be more than 17 pencils. What is the smallest number of pencils the shop can send using full boxes?,Maths,4,"Factors, Multiples & Primes",Factors & Multiples,Students can identify multiples of a given number,Applying,medium,3,"MCQ for Grade 4 Factors, Multiples & Primes: Factors & Multiples, aligned to Students can identify multiples of a given number.","[{""text"":""18"",""correct"":false},{""text"":""19"",""correct"":false},{""text"":""20"",""correct"":true},{""text"":""21"",""correct"":false}]","The shop must send a multiple of 4 that is greater than 17. The multiples of 4 around 17 are 16 and 20. Since 16 is not greater than 17, the smallest possible number is 20.","{""questionNumber"":""Q56"",""questionType"":""mcq"",""subject"":""Maths"",""grade"":4,""topic"":""Factors, Multiples & Primes"",""subtopic"":""Factors & Multiples"",""learning_objective"":""Students can identify multiples of a given number"",""focus"":""constrained_selection""}"
54,tfmp1lss-sfm6nhg-lscim18h4-q57-mcq,Q57,mcq,Decide which claim about the number 32 is true.,Maths,4,"Factors, Multiples & Primes",Factors & Multiples,Students can identify multiples of a given number,Understanding,medium,3,"MCQ for Grade 4 Factors, Multiples & Primes: Factors & Multiples, aligned to Students can identify multiples of a given number.","[{""text"":""32 is a multiple of 8 because 8 × 4 = 32."",""correct"":true},{""text"":""32 is not a multiple of 8 because it has two digits."",""correct"":false},{""text"":""32 is a multiple of 8 because 8 + 4 = 32."",""correct"":false},{""text"":""32 is not a multiple of 8 because it is even."",""correct"":false}]","Great job! 8 × 4 = 32, so 32 is a multiple of 8. The number of digits does not matter.","{""questionNumber"":""Q57"",""questionType"":""mcq"",""subject"":""Maths"",""grade"":4,""topic"":""Factors, Multiples & Primes"",""subtopic"":""Factors & Multiples"",""learning_objective"":""Students can identify multiples of a given number"",""focus"":""statement_evaluation""}"
55,tfmp1lss-sfm6nhg-lscim18h4-q58-mcq,Q58,mcq,"A game gives 6 stars every time a level is finished. After finishing 6 levels, choose the total stars and say if that number is a multiple of 6.",Maths,4,"Factors, Multiples & Primes",Factors & Multiples,Students can identify multiples of a given number,Applying,medium,3,"MCQ for Grade 4 Factors, Multiples & Primes: Factors & Multiples, aligned to Students can identify multiples of a given number.","[{""text"":""36, and yes it is a multiple of 6"",""correct"":true},{""text"":""30, and yes it is a multiple of 6"",""correct"":false},{""text"":""36, and no it is not a multiple of 6"",""correct"":false},{""text"":""42, and yes it is a multiple of 6"",""correct"":false}]","Fantastic! 6 levels with 6 stars each make 36. Since 6 × 6 = 36, it is a multiple of 6.","{""questionNumber"":""Q58"",""questionType"":""mcq"",""subject"":""Maths"",""grade"":4,""topic"":""Factors, Multiples & Primes"",""subtopic"":""Factors & Multiples"",""learning_objective"":""Students can identify multiples of a given number"",""focus"":""context_interpretation""}"
56,tfmp1lss-sfm6nhg-lscim18h4-q59-mcq,Q59,mcq,Four students wrote skip-counting trails for multiples of 3. Which trail is correct all the way through?,Maths,4,"Factors, Multiples & Primes",Factors & Multiples,Students can identify multiples of a given number,Analyzing,medium,3,"MCQ for Grade 4 Factors, Multiples & Primes: Factors & Multiples, aligned to Students can identify multiples of a given number.","[{""text"":""3, 6, 9, 13, 15"",""correct"":false},{""text"":""3, 6, 9, 12, 15"",""correct"":true},{""text"":""3, 5, 9, 12, 15"",""correct"":false},{""text"":""3, 6, 10, 12, 15"",""correct"":false}]","The correct trail is 3, 6, 9, 12, 15 because each number is 3 more than the one before. In the other trails, one number breaks the pattern: 13, 5, and 10 are not the correct multiples in those places.","{""questionNumber"":""Q59"",""questionType"":""mcq"",""subject"":""Maths"",""grade"":4,""topic"":""Factors, Multiples & Primes"",""subtopic"":""Factors & Multiples"",""learning_objective"":""Students can identify multiples of a given number"",""focus"":""representation_translation""}"
57,tfmp1lss-sfm6nhg-lscim18h4-q60-mcq,Q60,mcq,"A swimmer completes 8 laps each round. After 5 rounds, which equation shows the total number of laps?",Maths,4,"Factors, Multiples & Primes",Factors & Multiples,Students can identify multiples of a given number,Applying,medium,3,"MCQ for Grade 4 Factors, Multiples & Primes: Factors & Multiples, aligned to Students can identify multiples of a given number.","[{""text"":""8 × 5 = 40"",""correct"":true},{""text"":""8 × 4 = 32"",""correct"":false},{""text"":""8 + 5 = 13"",""correct"":false},{""text"":""5 × 5 = 25"",""correct"":false}]","The swimmer does 8 laps in each of 5 rounds, so the total is 8 × 5 = 40. This matches the 5th multiple of 8. 8 × 4 = 32 is only 4 rounds, and the other equations do not represent 5 groups of 8.","{""questionNumber"":""Q60"",""questionType"":""mcq"",""subject"":""Maths"",""grade"":4,""topic"":""Factors, Multiples & Primes"",""subtopic"":""Factors & Multiples"",""learning_objective"":""Students can identify multiples of a given number"",""focus"":""multi_step_application""}"
58,tfmp1lss-sfm6nhg-lscim18h4-q65-mcq,Q65,mcq,"A number must be a multiple of 9, greater than 30, less than 50, and have digits that add to an odd number. Which statement is correct?",Maths,4,"Factors, Multiples & Primes",Factors & Multiples,Students can identify multiples of a given number,Analyzing,hard,4,"MCQ for Grade 4 Factors, Multiples & Primes: Factors & Multiples, aligned to Students can identify multiples of a given number.","[{""text"":""45 is the only number that fits because it is between 30 and 50."",""correct"":false},{""text"":""36 is the only number that fits because 3 + 6 = 9."",""correct"":false},{""text"":""36 and 45 both fit because they are multiples of 9 in the range, and each has an odd digit sum."",""correct"":true},{""text"":""No number fits because multiples of 9 cannot be between 30 and 50."",""correct"":false}]","First find the multiples of 9 between 30 and 50: 36 and 45. Now add the digits. For 36, 3 + 6 = 9, which is odd. For 45, 4 + 5 = 9, which is also odd. So both 36 and 45 fit all the clues. That is why the statement saying both numbers fit is correct.","{""questionNumber"":""Q65"",""questionType"":""mcq"",""subject"":""Maths"",""grade"":4,""topic"":""Factors, Multiples & Primes"",""subtopic"":""Factors & Multiples"",""learning_objective"":""Students can identify multiples of a given number"",""focus"":""multi_constraint_problem""}"
59,tfmp1lss-sfm6nhg-lscim18h4-q72-mcq,Q72,mcq,"The numbers are 14, 21, 27, and 35. Which sentence correctly judges the claim, ""All the odd numbers here are not multiples of 7""?",Maths,4,"Factors, Multiples & Primes",Factors & Multiples,Students can identify multiples of a given number,Evaluating,hard,4,"MCQ for Grade 4 Factors, Multiples & Primes: Factors & Multiples, aligned to Students can identify multiples of a given number.","[{""text"":""The claim is true because all four numbers are multiples of 7."",""correct"":false},{""text"":""The claim is false because 21 and 35 are odd and are multiples of 7, while 27 is not."",""correct"":true},{""text"":""The claim is true because 27 is odd."",""correct"":false},{""text"":""The claim is false because 14 is even."",""correct"":false}]","Check the odd numbers in the list: 21, 27, and 35. 21 = 7 × 3 and 35 = 7 × 5, so they are multiples of 7. But 27 is not in the 7 times table. Since some odd numbers in the list are multiples of 7, the claim is false.","{""questionNumber"":""Q72"",""questionType"":""mcq"",""subject"":""Maths"",""grade"":4,""topic"":""Factors, Multiples & Primes"",""subtopic"":""Factors & Multiples"",""learning_objective"":""Students can identify multiples of a given number"",""focus"":""evaluate_a_claim""}"
60,tfmp1lss-sfm6nhg-lscim18h4-q75-mcq,Q75,mcq,"A toy car puzzle says the total number of cars is a multiple of 6, greater than 25, less than 40, and not 36. Ben says the answer must be 24 because it is close to 25. Which method correctly solves the puzzle?",Maths,4,"Factors, Multiples & Primes",Factors & Multiples,Students can identify multiples of a given number,Evaluating,hard,5,"MCQ for Grade 4 Factors, Multiples & Primes: Factors & Multiples, aligned to Students can identify multiples of a given number.","[{""text"":""Use 24, because being close to 25 is enough."",""correct"":false},{""text"":""List the multiples of 6 near the range: 24, 30, 36, 42. Then keep only those greater than 25 and less than 40, which are 30 and 36. Since it is not 36, the answer is 30."",""correct"":true},{""text"":""Use 36, because every multiple of 6 between 25 and 40 works."",""correct"":false},{""text"":""Use 42, because it is a multiple of 6 and greater than 25."",""correct"":false}]","Start by listing nearby multiples of 6: 24, 30, 36, 42. Now apply the clues carefully. Greater than 25 and less than 40 leaves 30 and 36. The last clue says the number is not 36, so only 30 fits all the conditions. That is why the method in the second option is correct. The other choices ignore one or more clues.","{""questionNumber"":""Q75"",""questionType"":""mcq"",""subject"":""Maths"",""grade"":4,""topic"":""Factors, Multiples & Primes"",""subtopic"":""Factors & Multiples"",""learning_objective"":""Students can identify multiples of a given number"",""focus"":""multi_constraint_problem""}"
61,tfmp1lss-sfm6nhg-lscim18h4-q34-mcq-fresh1,Q34,mcq,"Look at this skip-counting trail for toy drums: 6, 12, 18, 25, 30. One number does not belong because the trail should show only multiples of 6. Choose the best reason.",Maths,4,"Factors, Multiples & Primes",Factors & Multiples,Students can identify multiples of a given number,Analyzing,medium,3,"MCQ for Grade 4 Factors, Multiples & Primes: Factors & Multiples, aligned to Students can identify multiples of a given number.","[{""text"":""25 is wrong because 25 is not 6 groups of a whole number."",""correct"":true},{""text"":""18 is wrong because 18 is too small to be a multiple of 6."",""correct"":false},{""text"":""30 is wrong because multiples of 6 must end in 6 or 2."",""correct"":false},{""text"":""12 is wrong because 12 is only a multiple of 3."",""correct"":false}]","Nice thinking! Multiples of 6 are 6, 12, 18, 24, 30, and so on. The number 25 breaks the pattern, so the first option is correct. Great job checking the whole trail carefully!","{""questionNumber"":""Q34"",""questionType"":""mcq"",""subject"":""Maths"",""grade"":4,""topic"":""Factors, Multiples & Primes"",""subtopic"":""Factors & Multiples"",""learning_objective"":""Students can identify multiples of a given number"",""focus"":""error_correction""}"
62,tfmp1lss-sfm6nhg-lscim18h4-q40-mcq-fresh2,Q40,mcq,"At a snack party, juice boxes are packed in sets of 8. A helper wants a total that is more than 20 and less than 40. Choose the total that fits all the rules and is a multiple of 8.",Maths,4,"Factors, Multiples & Primes",Factors & Multiples,Students can identify multiples of a given number,Applying,medium,3,"MCQ for Grade 4 Factors, Multiples & Primes: Factors & Multiples, aligned to Students can identify multiples of a given number.","[{""text"":""22"",""correct"":false},{""text"":""28"",""correct"":false},{""text"":""32"",""correct"":true},{""text"":""36"",""correct"":false}]","Well done! Multiples of 8 are 8, 16, 24, 32, 40. The only one greater than 20 and less than 40 is 32. 28 and 36 are in the range, but they are not multiples of 8.","{""questionNumber"":""Q40"",""questionType"":""mcq"",""subject"":""Maths"",""grade"":4,""topic"":""Factors, Multiples & Primes"",""subtopic"":""Factors & Multiples"",""learning_objective"":""Students can identify multiples of a given number"",""focus"":""constrained_selection""}"
63,tfmp1lss-sfm6nhg-lscim18h4-q50-mcq-fresh3,Q50,mcq,"Choose the equation that matches this sticker adventure: 4 pages in a book hold 7 stickers on each page, and then 6 more stickers are added. The total number of stickers is checked to see if it is a multiple of 7.",Maths,4,"Factors, Multiples & Primes",Factors & Multiples,Students can identify multiples of a given number,Applying,medium,3,"MCQ for Grade 4 Factors, Multiples & Primes: Factors & Multiples, aligned to Students can identify multiples of a given number.","[{""text"":""4 × 7 = 28, and 28 is a multiple of 7."",""correct"":false},{""text"":""4 × 7 + 6 = 34, and 34 is not a multiple of 7."",""correct"":true},{""text"":""7 + 6 = 13, and 13 is a multiple of 7."",""correct"":false},{""text"":""4 + 7 + 6 = 17, and 17 is a multiple of 7."",""correct"":false}]","You’ve got this! First work out the stickers on the pages: 4 × 7 = 28. Then add 6 more to get 34. Since 34 is not in the 7 times table, it is not a multiple of 7. Super job following both steps!","{""questionNumber"":""Q50"",""questionType"":""mcq"",""subject"":""Maths"",""grade"":4,""topic"":""Factors, Multiples & Primes"",""subtopic"":""Factors & Multiples"",""learning_objective"":""Students can identify multiples of a given number"",""focus"":""multi_step_application""}"
64,tfmp1lss-sfm6nhg-lscim18h4-q71-mcq-fresh10,Q71,mcq,"Choose the correct result for this zoo gate puzzle. The penguin parade enters in groups of 3. The total number of penguins is a multiple of 3, bigger than 25, smaller than 35, and the digits add to 6. Which number fits all the clues?",Maths,4,"Factors, Multiples & Primes",Factors & Multiples,Students can identify multiples of a given number,Analyzing,hard,4,"MCQ for Grade 4 Factors, Multiples & Primes: Factors & Multiples, aligned to Students can identify multiples of a given number.","[{""text"":""24"",""correct"":false},{""text"":""30"",""correct"":true},{""text"":""33"",""correct"":false},{""text"":""36"",""correct"":false}]","Great clue-hunting! Between 25 and 35, the multiples of 3 are 27, 30, and 33. Only 30 has digits that add to 6.","{""questionNumber"":""Q71"",""questionType"":""mcq"",""subject"":""Maths"",""grade"":4,""topic"":""Factors, Multiples & Primes"",""subtopic"":""Factors & Multiples"",""learning_objective"":""Students can identify multiples of a given number"",""focus"":""multi_constraint_problem""}"
65,tfmp1lss-sfm6nhg-lscim18h4-q74-mcq-fresh12,Q74,mcq,"Look at the number choices for a marble game: 27, 36, 45, and 54. The winning number must be a multiple of 9, greater than 30, less than 50, and not the one with digits that add to 9. Decide which judgment is correct.",Maths,4,"Factors, Multiples & Primes",Factors & Multiples,Students can identify multiples of a given number,Evaluating,hard,5,"MCQ for Grade 4 Factors, Multiples & Primes: Factors & Multiples, aligned to Students can identify multiples of a given number.","[{""text"":""36 is the winning number."",""correct"":false},{""text"":""45 is the winning number."",""correct"":true},{""text"":""54 is the winning number."",""correct"":false},{""text"":""27 is the winning number."",""correct"":false}]","Excellent work! Between 30 and 50, the multiples of 9 are 36 and 45. But the rule says not the one with digits adding to 9. For 36, 3 + 6 = 9, so 45 is the winner.","{""questionNumber"":""Q74"",""questionType"":""mcq"",""subject"":""Maths"",""grade"":4,""topic"":""Factors, Multiples & Primes"",""subtopic"":""Factors & Multiples"",""learning_objective"":""Students can identify multiples of a given number"",""focus"":""multi_constraint_problem""}"
66,tfmp1lss-sfm6nhg-lscim18h4-q9-mcq-fresh2,Q9,mcq,"Look at this toy drum counting trail: 8, 16, 24, 31, 40. The trail is supposed to show only multiples of 8. Choose the best judgment about the trail.",Maths,4,"Factors, Multiples & Primes",Factors & Multiples,Students can identify multiples of a given number,Analyzing,hard,4,"MCQ for Grade 4 Factors, Multiples & Primes: Factors & Multiples, aligned to Students can identify multiples of a given number.","[{""text"":""The first wrong number is 24 because 2 + 4 = 6, not 8."",""correct"":false},{""text"":""The first wrong number is 31 because the multiples of 8 go 8, 16, 24, 32, 40."",""correct"":true},{""text"":""The first wrong number is 40 because 40 is too big to be a multiple of 8."",""correct"":false},{""text"":""There is no mistake because all the numbers are even."",""correct"":false}]","Great job checking the pattern! Multiples of 8 are 8, 16, 24, 32, 40. So 31 is the first number that breaks the trail. Some wrong choices use common mix-ups: being even is not enough, and 40 really is a multiple of 8.","{""questionNumber"":""Q9"",""questionType"":""mcq"",""subject"":""Maths"",""grade"":4,""topic"":""Factors, Multiples & Primes"",""subtopic"":""Factors & Multiples"",""learning_objective"":""Students can identify multiples of a given number"",""focus"":""find_the_error""}"
67,tfmp1lss-sfm6nhg-lscim18h4-q1-mcq,Q1,mcq,"Choose the correct result for this toy train trail that counts by 6: 6, 12, 18, 24, 30. Which number is also a multiple of 6?",Maths,4,"Factors, Multiples & Primes",Factors & Multiples,Students can identify multiples of a given number,Knowing,easy,1,"MCQ for Grade 4 Factors, Multiples & Primes: Factors & Multiples, aligned to Students can identify multiples of a given number.","[{""text"":""32"",""correct"":false},{""text"":""36"",""correct"":true},{""text"":""37"",""correct"":false},{""text"":""38"",""correct"":false}]","Great job! 36 is in the 6-times table, so it is a multiple of 6. The other numbers are not in that pattern.","{""questionNumber"":""Q1"",""questionType"":""mcq"",""subject"":""Maths"",""grade"":4,""topic"":""Factors, Multiples & Primes"",""subtopic"":""Factors & Multiples"",""learning_objective"":""Students can identify multiples of a given number"",""focus"":""identify a multiple of 6""}"
68,tfmp1lss-sfm6nhg-lscim18h4-q2-mcq,Q2,mcq,Select the true statement about 20.,Maths,4,"Factors, Multiples & Primes",Factors & Multiples,Students can identify multiples of a given number,Understanding,easy,1,"MCQ for Grade 4 Factors, Multiples & Primes: Factors & Multiples, aligned to Students can identify multiples of a given number.","[{""text"":""20 is a multiple of 5."",""correct"":true},{""text"":""20 is not a multiple of 2."",""correct"":false},{""text"":""20 is a multiple of 3."",""correct"":false},{""text"":""20 is not a multiple of 10."",""correct"":false}]","Nice thinking! 20 is a multiple of 5 because 5, 10, 15, 20. It is also a multiple of 2 and 10, but not of 3.","{""questionNumber"":""Q2"",""questionType"":""mcq"",""subject"":""Maths"",""grade"":4,""topic"":""Factors, Multiples & Primes"",""subtopic"":""Factors & Multiples"",""learning_objective"":""Students can identify multiples of a given number"",""focus"":""recognise a true statement about multiples""}"
69,tfmp1lss-sfm6nhg-lscim18h4-q3-mcq,Q3,mcq,"A snack shop packs 4 cookies in each little bag. After making 6 full bags, choose the total number of cookies.",Maths,4,"Factors, Multiples & Primes",Factors & Multiples,Students can identify multiples of a given number,Applying,easy,1,"MCQ for Grade 4 Factors, Multiples & Primes: Factors & Multiples, aligned to Students can identify multiples of a given number.","[{""text"":""20"",""correct"":false},{""text"":""22"",""correct"":false},{""text"":""24"",""correct"":true},{""text"":""26"",""correct"":false}]",Well done! 6 bags of 4 cookies makes 24. That means 24 is a multiple of 4.,"{""questionNumber"":""Q3"",""questionType"":""mcq"",""subject"":""Maths"",""grade"":4,""topic"":""Factors, Multiples & Primes"",""subtopic"":""Factors & Multiples"",""learning_objective"":""Students can identify multiples of a given number"",""focus"":""find a multiple from equal groups""}"
70,tfmp1lss-sfm6nhg-lscim18h4-q4-mcq,Q4,mcq,"Look at these numbers for a sticker game: 14, 16, 18, 20. Decide which number is a multiple of 9.",Maths,4,"Factors, Multiples & Primes",Factors & Multiples,Students can identify multiples of a given number,Knowing,easy,1,"MCQ for Grade 4 Factors, Multiples & Primes: Factors & Multiples, aligned to Students can identify multiples of a given number.","[{""text"":""14"",""correct"":false},{""text"":""16"",""correct"":false},{""text"":""18"",""correct"":true},{""text"":""20"",""correct"":false}]","Super! 18 is 2 groups of 9, so it is a multiple of 9. The other numbers do not fit the 9 pattern.","{""questionNumber"":""Q4"",""questionType"":""mcq"",""subject"":""Maths"",""grade"":4,""topic"":""Factors, Multiples & Primes"",""subtopic"":""Factors & Multiples"",""learning_objective"":""Students can identify multiples of a given number"",""focus"":""identify a multiple of 9 from a set""}"
