rowNumber,queueId,questionNumber,questionType,questionText,subject,grade,topic,subtopic,learningObjective,bloomsLevel,difficultyLevel,difficultyRating,summary,options,explanation,generationMetadata
75,tmcags0-spa18xr-lscftp3n2-q76-mcq,Q76,mcq,"Pick the perimeter of this castle-shaped floor design: top 11 cm, right 3 cm, inner horizontal 2 cm, inner vertical 4 cm, bottom 13 cm, left 7 cm.",Maths,4,Measurement & Conversion,Perimeter & Area,Students can find the perimeter of rectilinear shapes,Applying,medium,2,"MCQ for Grade 4 Measurement & Conversion: Perimeter & Area, aligned to Students can find the perimeter of rectilinear shapes.","[{""text"":""40 cm"",""correct"":true},{""text"":""36 cm"",""correct"":false},{""text"":""29 cm"",""correct"":false},{""text"":""20 cm"",""correct"":false}]",You did it! Add all the outside sides: 11 + 3 + 2 + 4 + 13 + 7 = 40 cm.,"{""questionNumber"":""Q76"",""questionType"":""mcq"",""subject"":""Maths"",""grade"":4,""topic"":""Measurement & Conversion"",""subtopic"":""Perimeter & Area"",""learning_objective"":""Students can find the perimeter of rectilinear shapes"",""focus"":""multi_step_application""}"
76,tmcags0-spa18xr-lscftp3n2-q77-mcq,Q77,mcq,"Decide which claim about these two shapes is true. Shape P has sides 6 cm, 5 cm, 4 cm, 3 cm, 10 cm, and 8 cm. Shape Q has sides 7 cm, 4 cm, 5 cm, 2 cm, 11 cm, and 7 cm.",Maths,4,Measurement & Conversion,Perimeter & Area,Students can find the perimeter of rectilinear shapes,Analyzing,medium,3,"MCQ for Grade 4 Measurement & Conversion: Perimeter & Area, aligned to Students can find the perimeter of rectilinear shapes.","[{""text"":""Shape P and Shape Q have the same perimeter."",""correct"":true},{""text"":""Shape P is 2 cm longer around."",""correct"":false},{""text"":""Shape Q is 3 cm longer around."",""correct"":false},{""text"":""There is not enough information to compare them."",""correct"":false}]",Super! Shape P is 36 cm and Shape Q is also 36 cm. So they are the same around the outside.,"{""questionNumber"":""Q77"",""questionType"":""mcq"",""subject"":""Maths"",""grade"":4,""topic"":""Measurement & Conversion"",""subtopic"":""Perimeter & Area"",""learning_objective"":""Students can find the perimeter of rectilinear shapes"",""focus"":""compare_or_judge""}"
77,tmcags0-spa18xr-lscftp3n2-q78-mcq,Q78,mcq,A sweet shop makes a giant lollipop sign shaped like an L. The top side is 18 cm and the left side is 12 cm. A corner cut-out is 6 cm by 5 cm. Choose the perimeter.,Maths,4,Measurement & Conversion,Perimeter & Area,Students can find the perimeter of rectilinear shapes,Applying,medium,3,"MCQ for Grade 4 Measurement & Conversion: Perimeter & Area, aligned to Students can find the perimeter of rectilinear shapes.","[{""text"":""60 cm"",""correct"":true},{""text"":""30 cm"",""correct"":false},{""text"":""51 cm"",""correct"":false},{""text"":""66 cm"",""correct"":false}]","Great work! This L-shape comes from an 18 by 12 rectangle with a corner cut out, so the perimeter stays 2 × (18 + 12) = 60 cm.","{""questionNumber"":""Q78"",""questionType"":""mcq"",""subject"":""Maths"",""grade"":4,""topic"":""Measurement & Conversion"",""subtopic"":""Perimeter & Area"",""learning_objective"":""Students can find the perimeter of rectilinear shapes"",""focus"":""context_interpretation""}"
78,tmcags0-spa18xr-lscftp3n2-q79-mcq,Q79,mcq,"Compare the two perimeter results. One shape has sides 8 m, 3 m, 2 m, 5 m, 10 m, and 7 m. Another shape has sides 9 m, 4 m, 1 m, 5 m, 10 m, and 6 m. Choose the correct answer.",Maths,4,Measurement & Conversion,Perimeter & Area,Students can find the perimeter of rectilinear shapes,Analyzing,medium,3,"MCQ for Grade 4 Measurement & Conversion: Perimeter & Area, aligned to Students can find the perimeter of rectilinear shapes.","[{""text"":""Both perimeters are 35 m."",""correct"":true},{""text"":""The first shape is longer around."",""correct"":false},{""text"":""The second shape is longer around."",""correct"":false},{""text"":""The first is 2 m shorter around."",""correct"":false}]",Nice comparing! First shape: 8 + 3 + 2 + 5 + 10 + 7 = 35 m. Second shape: 9 + 4 + 1 + 5 + 10 + 6 = 35 m too.,"{""questionNumber"":""Q79"",""questionType"":""mcq"",""subject"":""Maths"",""grade"":4,""topic"":""Measurement & Conversion"",""subtopic"":""Perimeter & Area"",""learning_objective"":""Students can find the perimeter of rectilinear shapes"",""focus"":""compare_or_judge""}"
79,tmcags0-spa18xr-lscftp3n2-q81-mcq,Q81,mcq,"A rectilinear shape has 6 outside sides and a perimeter of 42 cm. One side is 12 cm, and the other 5 side lengths are listed in each option. Which set could complete the shape?",Maths,4,Measurement & Conversion,Perimeter & Area,Students can find the perimeter of rectilinear shapes,Analyzing,medium,3,"MCQ for Grade 4 Measurement & Conversion: Perimeter & Area, aligned to Students can find the perimeter of rectilinear shapes.","[{""text"":""7 cm, 4 cm, 3 cm, 9 cm, 7 cm"",""correct"":true},{""text"":""7 cm, 4 cm, 3 cm, 9 cm, 6 cm"",""correct"":false},{""text"":""6 cm, 4 cm, 3 cm, 9 cm, 7 cm"",""correct"":false},{""text"":""7 cm, 5 cm, 3 cm, 9 cm, 7 cm"",""correct"":false}]","The full perimeter is 42 cm, and one side is already 12 cm. So the other 5 sides must add to 42 − 12 = 30 cm. In the first option, 7 + 4 + 3 + 9 + 7 = 30, so it works. In the second option, the total is 29. In the third option, the total is 29. In the fourth option, the total is 31. So only the first set can complete the shape.","{""questionNumber"":""Q81"",""questionType"":""mcq"",""subject"":""Maths"",""grade"":4,""topic"":""Measurement & Conversion"",""subtopic"":""Perimeter & Area"",""learning_objective"":""Students can find the perimeter of rectilinear shapes"",""focus"":""constrained_selection""}"
80,tmcags0-spa18xr-lscftp3n2-q82-mcq,Q82,mcq,"A tiny robot drives around a shape with sides 17 cm, 9 cm, 6 cm, 2 cm, 11 cm, and 8 cm. Choose how far the robot travels for one lap.",Maths,4,Measurement & Conversion,Perimeter & Area,Students can find the perimeter of rectilinear shapes,Applying,medium,2,"MCQ for Grade 4 Measurement & Conversion: Perimeter & Area, aligned to Students can find the perimeter of rectilinear shapes.","[{""text"":""53 cm"",""correct"":true},{""text"":""44 cm"",""correct"":false},{""text"":""27 cm"",""correct"":false},{""text"":""36 cm"",""correct"":false}]","Fantastic! One lap is the perimeter, so add all the sides: 17 + 9 + 6 + 2 + 11 + 8 = 53 cm.","{""questionNumber"":""Q82"",""questionType"":""mcq"",""subject"":""Maths"",""grade"":4,""topic"":""Measurement & Conversion"",""subtopic"":""Perimeter & Area"",""learning_objective"":""Students can find the perimeter of rectilinear shapes"",""focus"":""context_interpretation""}"
81,tmcags0-spa18xr-lscftp3n2-q83-mcq,Q83,mcq,"Look at this idea for a block shape with sides 9 cm, 6 cm, 4 cm, 1 cm, 5 cm, and 7 cm: ""9 + 6 + 4 + 1 + 5 + 7 = 32, so the perimeter is 32 cm."" Decide if the idea is correct.",Maths,4,Measurement & Conversion,Perimeter & Area,Students can find the perimeter of rectilinear shapes,Evaluating,medium,3,"MCQ for Grade 4 Measurement & Conversion: Perimeter & Area, aligned to Students can find the perimeter of rectilinear shapes.","[{""text"":""Yes, it is correct because all outside sides were added."",""correct"":true},{""text"":""No, it should be 31 cm."",""correct"":false},{""text"":""No, perimeter should be found by multiplying 9 and 6."",""correct"":false},{""text"":""No, only the longest four sides should be used."",""correct"":false}]","Great checking! The idea is correct. All six outside sides were added, and they make 32 cm.","{""questionNumber"":""Q83"",""questionType"":""mcq"",""subject"":""Maths"",""grade"":4,""topic"":""Measurement & Conversion"",""subtopic"":""Perimeter & Area"",""learning_objective"":""Students can find the perimeter of rectilinear shapes"",""focus"":""error_correction""}"
82,tmcags0-spa18xr-lscftp3n2-q84-mcq,Q84,mcq,"Which method correctly finds the perimeter of this L-shape? A rectangle is 20 m long and 9 m wide, and a 5 m by 3 m corner is cut out.",Maths,4,Measurement & Conversion,Perimeter & Area,Students can find the perimeter of rectilinear shapes,Evaluating,medium,3,"MCQ for Grade 4 Measurement & Conversion: Perimeter & Area, aligned to Students can find the perimeter of rectilinear shapes.","[{""text"":""Use 2 × (20 + 9) to get 58 m."",""correct"":true},{""text"":""Use 20 + 9 + 5 + 3 to get 37 m."",""correct"":false},{""text"":""Use 20 × 9 to get 180 m."",""correct"":false},{""text"":""Use 20 + 20 + 9 to get 49 m."",""correct"":false}]","The large rectangle has perimeter 2 × (20 + 9) = 58 m. Cutting out a corner does not change the total perimeter, because the lengths removed from the outside are replaced by equal new edges inside the cut-out. So 58 m is correct.","{""questionNumber"":""Q84"",""questionType"":""mcq"",""subject"":""Maths"",""grade"":4,""topic"":""Measurement & Conversion"",""subtopic"":""Perimeter & Area"",""learning_objective"":""Students can find the perimeter of rectilinear shapes"",""focus"":""operation_reasoning""}"
83,tmcags0-spa18xr-lscftp3n2-q85-mcq,Q85,mcq,A stepping-stone path has 6 outside side lengths. Four of them total 25 cm. The other two side lengths are 4 cm and 5 cm. What is the perimeter of the path?,Maths,4,Measurement & Conversion,Perimeter & Area,Students can find the perimeter of rectilinear shapes,Applying,medium,2,"MCQ for Grade 4 Measurement & Conversion: Perimeter & Area, aligned to Students can find the perimeter of rectilinear shapes.","[{""text"":""34 cm"",""correct"":true},{""text"":""30 cm"",""correct"":false},{""text"":""25 cm"",""correct"":false},{""text"":""17 cm"",""correct"":false}]","Add the total of the four known sides and the two missing side lengths: 25 + 4 + 5 = 34 cm. So the perimeter is 34 cm. 30 cm would mean adding only one of the extra sides. 25 cm is just the total of four sides, not all six. 17 cm is far too small for the full distance around the shape.","{""questionNumber"":""Q85"",""questionType"":""mcq"",""subject"":""Maths"",""grade"":4,""topic"":""Measurement & Conversion"",""subtopic"":""Perimeter & Area"",""learning_objective"":""Students can find the perimeter of rectilinear shapes"",""focus"":""multi_step_application""}"
84,tmcags0-spa18xr-lscftp3n2-q86-mcq,Q86,mcq,What is the perimeter of an L-shaped bookshelf made from a 15 cm by 10 cm rectangle with a corner cut out?,Maths,4,Measurement & Conversion,Perimeter & Area,Students can find the perimeter of rectilinear shapes,Understanding,medium,3,"MCQ for Grade 4 Measurement & Conversion: Perimeter & Area, aligned to Students can find the perimeter of rectilinear shapes.","[{""text"":""50 cm"",""correct"":true},{""text"":""Less than 50 cm because a piece is missing."",""correct"":false},{""text"":""25 cm"",""correct"":false},{""text"":""It cannot be worked out from the rectangle size."",""correct"":false}]","The original rectangle has perimeter 2 × (15 + 10) = 50 cm. When a corner is cut out, the lengths taken away on the outside are replaced by equal new edges around the cut-out, so the total perimeter stays 50 cm. That rules out the idea that it must be less than 50 cm.","{""questionNumber"":""Q86"",""questionType"":""mcq"",""subject"":""Maths"",""grade"":4,""topic"":""Measurement & Conversion"",""subtopic"":""Perimeter & Area"",""learning_objective"":""Students can find the perimeter of rectilinear shapes"",""focus"":""representation_translation""}"
85,tmcags0-spa18xr-lscftp3n2-q87-mcq,Q87,mcq,"A snack table has side lengths 13 m, 4 m, 3 m, 5 m, 16 m, and 8 m around the edge. Choose the distance all the way around.",Maths,4,Measurement & Conversion,Perimeter & Area,Students can find the perimeter of rectilinear shapes,Applying,medium,2,"MCQ for Grade 4 Measurement & Conversion: Perimeter & Area, aligned to Students can find the perimeter of rectilinear shapes.","[{""text"":""49 m"",""correct"":true},{""text"":""41 m"",""correct"":false},{""text"":""29 m"",""correct"":false},{""text"":""24 m"",""correct"":false}]",Well done! 13 + 4 + 3 + 5 + 16 + 8 = 49 m. That is the full distance around.,"{""questionNumber"":""Q87"",""questionType"":""mcq"",""subject"":""Maths"",""grade"":4,""topic"":""Measurement & Conversion"",""subtopic"":""Perimeter & Area"",""learning_objective"":""Students can find the perimeter of rectilinear shapes"",""focus"":""context_interpretation""}"
86,tmcags0-spa18xr-lscftp3n2-q88-mcq,Q88,mcq,"Compare the perimeters of Shape M and Shape N. Shape M has sides 10 cm, 5 cm, 2 cm, 4 cm, 12 cm, and 7 cm. Shape N has sides 11 cm, 4 cm, 3 cm, 4 cm, 12 cm, and 6 cm. Which statement is correct?",Maths,4,Measurement & Conversion,Perimeter & Area,Students can find the perimeter of rectilinear shapes,Analyzing,medium,3,"MCQ for Grade 4 Measurement & Conversion: Perimeter & Area, aligned to Students can find the perimeter of rectilinear shapes.","[{""text"":""The two shapes have equal perimeters."",""correct"":true},{""text"":""Shape M has a perimeter 2 cm greater."",""correct"":false},{""text"":""Shape N has a perimeter 3 cm greater."",""correct"":false},{""text"":""Shape N has a perimeter 1 cm smaller."",""correct"":false}]","Add Shape M: 10 + 5 + 2 + 4 + 12 + 7 = 40 cm. Add Shape N: 11 + 4 + 3 + 4 + 12 + 6 = 40 cm. Since both totals are 40 cm, the two shapes have equal perimeters.","{""questionNumber"":""Q88"",""questionType"":""mcq"",""subject"":""Maths"",""grade"":4,""topic"":""Measurement & Conversion"",""subtopic"":""Perimeter & Area"",""learning_objective"":""Students can find the perimeter of rectilinear shapes"",""focus"":""compare_or_judge""}"
87,tmcags0-spa18xr-lscftp3n2-q90-mcq,Q90,mcq,Pick the perimeter of a puzzle-piece shape made from a 14 cm by 8 cm rectangle with a corner cut out.,Maths,4,Measurement & Conversion,Perimeter & Area,Students can find the perimeter of rectilinear shapes,Applying,medium,3,"MCQ for Grade 4 Measurement & Conversion: Perimeter & Area, aligned to Students can find the perimeter of rectilinear shapes.","[{""text"":""44 cm"",""correct"":true},{""text"":""22 cm"",""correct"":false},{""text"":""38 cm"",""correct"":false},{""text"":""50 cm"",""correct"":false}]",Lovely thinking! The L-shape keeps the same perimeter as the 14 by 8 rectangle: 2 × (14 + 8) = 44 cm.,"{""questionNumber"":""Q90"",""questionType"":""mcq"",""subject"":""Maths"",""grade"":4,""topic"":""Measurement & Conversion"",""subtopic"":""Perimeter & Area"",""learning_objective"":""Students can find the perimeter of rectilinear shapes"",""focus"":""multi_step_application""}"
88,tmcags0-spa18xr-lscftp3n2-q91-mcq,Q91,mcq,Choose the correct result for this toy-road shape. It is an L-shape made from a 12 cm by 9 cm rectangle with a 4 cm by 3 cm corner cut out. What is the perimeter?,Maths,4,Measurement & Conversion,Perimeter & Area,Students can find the perimeter of rectilinear shapes,Applying,medium,3,"MCQ for Grade 4 Measurement & Conversion: Perimeter & Area, aligned to Students can find the perimeter of rectilinear shapes.","[{""text"":""42 cm"",""correct"":true},{""text"":""36 cm"",""correct"":false},{""text"":""30 cm"",""correct"":false},{""text"":""54 cm"",""correct"":false}]","Nice work! For this L-shape, the cut-out corner adds two new sides but removes the same lengths from the outside, so the perimeter stays the same as the 12 by 9 rectangle: 2 × (12 + 9) = 42 cm. The other answers come from missing sides or adding extra ones.","{""questionNumber"":""Q91"",""questionType"":""mcq"",""subject"":""Maths"",""grade"":4,""topic"":""Measurement & Conversion"",""subtopic"":""Perimeter & Area"",""learning_objective"":""Students can find the perimeter of rectilinear shapes"",""focus"":""multi_step_application""}"
89,tmcags0-spa18xr-lscftp3n2-q92-mcq,Q92,mcq,"What is the perimeter of a puppy pen shaped like an L? The full top is 14 m, the full left side is 10 m, and the corner cut-out is 5 m across and 4 m down.",Maths,4,Measurement & Conversion,Perimeter & Area,Students can find the perimeter of rectilinear shapes,Understanding,medium,3,"MCQ for Grade 4 Measurement & Conversion: Perimeter & Area, aligned to Students can find the perimeter of rectilinear shapes.","[{""text"":""48 m, because it matches the perimeter of the 14 m by 10 m rectangle"",""correct"":true},{""text"":""38 m, because 5 m and 4 m were cut away"",""correct"":false},{""text"":""19 m, because 14 + 5 + 4 gives the needed lengths"",""correct"":false},{""text"":""33 m, because only the full outside width and height matter once each"",""correct"":false}]","The full outside width is 14 m and the full outside height is 10 m, so the matching rectangle has perimeter 2 × (14 + 10) = 48 m. For a corner cut-out, the removed 5 m and 4 m on the outside are replaced by new inside edges of 5 m and 4 m, so the total perimeter stays 48 m. The other options subtract lengths that are still replaced on the boundary or count only part of the distance around.","{""questionNumber"":""Q92"",""questionType"":""mcq"",""subject"":""Maths"",""grade"":4,""topic"":""Measurement & Conversion"",""subtopic"":""Perimeter & Area"",""learning_objective"":""Students can find the perimeter of rectilinear shapes"",""focus"":""representation_translation""}"
90,tmcags0-spa18xr-lscftp3n2-q93-mcq,Q93,mcq,"A sticker path goes around a blocky shape. The side lengths around the edge are 6 cm, 4 cm, 3 cm, 5 cm, 9 cm, and 7 cm. Choose the total distance the sticker path goes.",Maths,4,Measurement & Conversion,Perimeter & Area,Students can find the perimeter of rectilinear shapes,Applying,medium,3,"MCQ for Grade 4 Measurement & Conversion: Perimeter & Area, aligned to Students can find the perimeter of rectilinear shapes.","[{""text"":""34 cm"",""correct"":true},{""text"":""28 cm"",""correct"":false},{""text"":""31 cm"",""correct"":false},{""text"":""29 cm"",""correct"":false}]",Well done! Add all the outside sides: 6 + 4 + 3 + 5 + 9 + 7 = 34 cm. Some wrong answers miss one side or add only some of them.,"{""questionNumber"":""Q93"",""questionType"":""mcq"",""subject"":""Maths"",""grade"":4,""topic"":""Measurement & Conversion"",""subtopic"":""Perimeter & Area"",""learning_objective"":""Students can find the perimeter of rectilinear shapes"",""focus"":""context_interpretation""}"
91,tmcags0-spa18xr-lscftp3n2-q94-mcq,Q94,mcq,"Compare the two playground tracks. Track A has side lengths 8 m, 5 m, 2 m, 4 m, 10 m, and 7 m. Track B is a 9 m by 6 m rectangle with a 3 m by 2 m corner cut out. Pick the correct comparison.",Maths,4,Measurement & Conversion,Perimeter & Area,Students can find the perimeter of rectilinear shapes,Analyzing,medium,3,"MCQ for Grade 4 Measurement & Conversion: Perimeter & Area, aligned to Students can find the perimeter of rectilinear shapes.","[{""text"":""Track A has the greater perimeter."",""correct"":true},{""text"":""Track B has the greater perimeter."",""correct"":false},{""text"":""Both tracks have perimeter 34 m."",""correct"":false},{""text"":""Both tracks have perimeter 28 m."",""correct"":false}]","Super job! Track A is 8 + 5 + 2 + 4 + 10 + 7 = 36 m. Track B matches the 9 by 6 rectangle, so 2 × (9 + 6) = 30 m. That means Track A is longer around.","{""questionNumber"":""Q94"",""questionType"":""mcq"",""subject"":""Maths"",""grade"":4,""topic"":""Measurement & Conversion"",""subtopic"":""Perimeter & Area"",""learning_objective"":""Students can find the perimeter of rectilinear shapes"",""focus"":""compare_or_judge""}"
92,tmcags0-spa18xr-lscftp3n2-q95-mcq,Q95,mcq,Choose the equation that matches the perimeter of a snack-table shape made from an 11 cm by 8 cm rectangle with a 3 cm by 2 cm corner cut out.,Maths,4,Measurement & Conversion,Perimeter & Area,Students can find the perimeter of rectilinear shapes,Applying,medium,3,"MCQ for Grade 4 Measurement & Conversion: Perimeter & Area, aligned to Students can find the perimeter of rectilinear shapes.","[{""text"":""2 × (11 + 8)"",""correct"":true},{""text"":""11 + 8 + 3 + 2"",""correct"":false},{""text"":""2 × (11 + 8) - (3 + 2)"",""correct"":false},{""text"":""11 × 8"",""correct"":false}]",Excellent! An L-shape made by cutting a corner from a rectangle keeps the same perimeter as the full rectangle. So the matching equation is 2 × (11 + 8). The other choices subtract or use area.,"{""questionNumber"":""Q95"",""questionType"":""mcq"",""subject"":""Maths"",""grade"":4,""topic"":""Measurement & Conversion"",""subtopic"":""Perimeter & Area"",""learning_objective"":""Students can find the perimeter of rectilinear shapes"",""focus"":""operation_reasoning""}"
93,tmcags0-spa18xr-lscftp3n2-q97-mcq,Q97,mcq,"What is the perimeter of an animal puzzle shape with outside side lengths 12 cm, 5 cm, 4 cm, 3 cm, 8 cm, and 9 cm?",Maths,4,Measurement & Conversion,Perimeter & Area,Students can find the perimeter of rectilinear shapes,Analyzing,medium,3,"MCQ for Grade 4 Measurement & Conversion: Perimeter & Area, aligned to Students can find the perimeter of rectilinear shapes.","[{""text"":""41 cm, because all six outside sides are added"",""correct"":true},{""text"":""29 cm, because only the longest sides matter"",""correct"":false},{""text"":""24 cm, because opposite sides cancel out"",""correct"":false},{""text"":""36 cm, because 12 + 5 + 4 + 3 + 8 + 9 must be halved"",""correct"":false}]","Add every outside side: 12 + 5 + 4 + 3 + 8 + 9 = 41 cm. That is why 41 cm is correct. The 29 cm option ignores some sides. Opposite sides do not cancel when finding perimeter, so 24 cm is wrong. You do not halve the total for perimeter, so 36 cm is also incorrect.","{""questionNumber"":""Q97"",""questionType"":""mcq"",""subject"":""Maths"",""grade"":4,""topic"":""Measurement & Conversion"",""subtopic"":""Perimeter & Area"",""learning_objective"":""Students can find the perimeter of rectilinear shapes"",""focus"":""which_statement""}"
94,tmcags0-spa18xr-lscftp3n2-q98-mcq,Q98,mcq,A rabbit hops around an L-shaped garden made from a 13 m by 8 m rectangle with a 4 m by 3 m corner cut out. Choose the distance for one lap.,Maths,4,Measurement & Conversion,Perimeter & Area,Students can find the perimeter of rectilinear shapes,Applying,medium,3,"MCQ for Grade 4 Measurement & Conversion: Perimeter & Area, aligned to Students can find the perimeter of rectilinear shapes.","[{""text"":""42 m"",""correct"":true},{""text"":""35 m"",""correct"":false},{""text"":""28 m"",""correct"":false},{""text"":""49 m"",""correct"":false}]",Lovely work! The L-shape has the same perimeter as the 13 m by 8 m rectangle: 2 × (13 + 8) = 42 m. Subtracting the cut-out gives a common mistake.,"{""questionNumber"":""Q98"",""questionType"":""mcq"",""subject"":""Maths"",""grade"":4,""topic"":""Measurement & Conversion"",""subtopic"":""Perimeter & Area"",""learning_objective"":""Students can find the perimeter of rectilinear shapes"",""focus"":""context_interpretation""}"
95,tmcags0-spa18xr-lscftp3n2-q99-mcq,Q99,mcq,"Look at the idea for a toy-box shape with side lengths 10 cm, 6 cm, 3 cm, 4 cm, 7 cm, and 8 cm: 10 + 6 + 3 + 4 = 23 cm. Decide what is wrong.",Maths,4,Measurement & Conversion,Perimeter & Area,Students can find the perimeter of rectilinear shapes,Analyzing,medium,3,"MCQ for Grade 4 Measurement & Conversion: Perimeter & Area, aligned to Students can find the perimeter of rectilinear shapes.","[{""text"":""Two sides were missed; all six outside sides should be added for 38 cm."",""correct"":true},{""text"":""The sides should be multiplied, not added."",""correct"":false},{""text"":""The answer is right because perimeter uses only four sides."",""correct"":false},{""text"":""Only the biggest two sides should be added."",""correct"":false}]","Nice spotting! Perimeter means adding every outside side. Here that is 10 + 6 + 3 + 4 + 7 + 8 = 38 cm, so two sides were left out.","{""questionNumber"":""Q99"",""questionType"":""mcq"",""subject"":""Maths"",""grade"":4,""topic"":""Measurement & Conversion"",""subtopic"":""Perimeter & Area"",""learning_objective"":""Students can find the perimeter of rectilinear shapes"",""focus"":""error_correction""}"
96,tmcags0-spa18xr-lscftp3n2-q100-mcq,Q100,mcq,Choose the method correctly solves this stepping-stone shape made from a 15 cm by 9 cm rectangle with a 5 cm by 2 cm corner cut out.,Maths,4,Measurement & Conversion,Perimeter & Area,Students can find the perimeter of rectilinear shapes,Applying,medium,3,"MCQ for Grade 4 Measurement & Conversion: Perimeter & Area, aligned to Students can find the perimeter of rectilinear shapes.","[{""text"":""Add 15 + 9 + 15 + 9 to get 48 cm."",""correct"":true},{""text"":""Add 15 + 9 + 5 + 2 to get 31 cm."",""correct"":false},{""text"":""Multiply 15 × 9 to get 135 cm."",""correct"":false},{""text"":""Do 48 - 5 - 2 to get 41 cm."",""correct"":false}]",Fantastic! The corner cut-out does not change the total distance around from the full rectangle. So 15 + 9 + 15 + 9 = 48 cm is the correct method.,"{""questionNumber"":""Q100"",""questionType"":""mcq"",""subject"":""Maths"",""grade"":4,""topic"":""Measurement & Conversion"",""subtopic"":""Perimeter & Area"",""learning_objective"":""Students can find the perimeter of rectilinear shapes"",""focus"":""operation_reasoning""}"
