rowNumber,queueId,questionNumber,questionType,questionText,subject,grade,topic,subtopic,learningObjective,bloomsLevel,difficultyLevel,difficultyRating,summary,options,explanation,generationMetadata
96,tfps1hnq-sbb1jxd-lscuaoge2-q96-mcq,Q96,mcq,Pick the shopping plan that stays under a $50 budget and leaves more than $8.,Maths,4,Financial Problem Solving,Budgeting Basics,Students can understand and apply the concept of a simple budget,Analyzing,medium,3,"MCQ for Grade 4 Financial Problem Solving: Budgeting Basics, aligned to Students can understand and apply the concept of a simple budget.","[{""text"":""Board game $19, book $12, snack $10"",""correct"":true},{""text"":""Board game $22, book $11, snack $10"",""correct"":false},{""text"":""Board game $18, book $14, snack $10"",""correct"":false},{""text"":""Board game $20, book $13, snack $9"",""correct"":false}]","Smart work! Leaving more than $8 means spending less than $42. Only $19 + $12 + $10 = $41, so $9 is left.","{""questionNumber"":""Q96"",""questionType"":""mcq"",""subject"":""Maths"",""grade"":4,""topic"":""Financial Problem Solving"",""subtopic"":""Budgeting Basics"",""learning_objective"":""Students can understand and apply the concept of a simple budget"",""focus"":""constrained_selection""}"
97,tfps1hnq-sbb1jxd-lscuaoge2-q97-mcq,Q97,mcq,"Choose the sentence that is correct about a $28 budget for craft time with glue for $6, beads for $9, and ribbon for $8.",Maths,4,Financial Problem Solving,Budgeting Basics,Students can understand and apply the concept of a simple budget,Understanding,medium,3,"MCQ for Grade 4 Financial Problem Solving: Budgeting Basics, aligned to Students can understand and apply the concept of a simple budget.","[{""text"":""The total is $23, so there is enough money and $5 is left."",""correct"":true},{""text"":""The total is $24, so there is enough money and $4 is left."",""correct"":false},{""text"":""The total is $21, so $7 is left."",""correct"":false},{""text"":""The total is $29, so the budget works exactly."",""correct"":false}]",Well done! $6 + $9 + $8 = $23. Then $28 - $23 = $5 left.,"{""questionNumber"":""Q97"",""questionType"":""mcq"",""subject"":""Maths"",""grade"":4,""topic"":""Financial Problem Solving"",""subtopic"":""Budgeting Basics"",""learning_objective"":""Students can understand and apply the concept of a simple budget"",""focus"":""context_interpretation""}"
98,tfps1hnq-sbb1jxd-lscuaoge2-q98-mcq,Q98,mcq,A box of crayons costs $7. A puzzle costs $16. Two erasers cost $3 each. There is a $35 budget. Pick the best answer.,Maths,4,Financial Problem Solving,Budgeting Basics,Students can understand and apply the concept of a simple budget,Applying,medium,3,"MCQ for Grade 4 Financial Problem Solving: Budgeting Basics, aligned to Students can understand and apply the concept of a simple budget.","[{""text"":""The budget works with $6 left."",""correct"":true},{""text"":""The budget works with $9 left."",""correct"":false},{""text"":""The budget is short by $1."",""correct"":false},{""text"":""The total cost is $26."",""correct"":false}]","Great! Two erasers cost $6. Then $7 + $16 + $6 = $29, and $35 - $29 = $6 left.","{""questionNumber"":""Q98"",""questionType"":""mcq"",""subject"":""Maths"",""grade"":4,""topic"":""Financial Problem Solving"",""subtopic"":""Budgeting Basics"",""learning_objective"":""Students can understand and apply the concept of a simple budget"",""focus"":""multi_step_application""}"
99,tfps1hnq-sbb1jxd-lscuaoge2-q99-mcq,Q99,mcq,"Compare these two totals for a $44 budget: skateboard sticker pack $13, cap $17, and juice $6. Decide which choice is correct.",Maths,4,Financial Problem Solving,Budgeting Basics,Students can understand and apply the concept of a simple budget,Analyzing,medium,3,"MCQ for Grade 4 Financial Problem Solving: Budgeting Basics, aligned to Students can understand and apply the concept of a simple budget.","[{""text"":""Adding the costs gives $36, so $8 is left."",""correct"":true},{""text"":""Adding the costs gives $35, so $9 is left."",""correct"":false},{""text"":""Subtracting 17 from 13 first gives the right answer."",""correct"":false},{""text"":""The budget is not enough because 13 + 17 is already over 44."",""correct"":false}]","Excellent checking! $13 + $17 + $6 = $36. From $44, that leaves $8.","{""questionNumber"":""Q99"",""questionType"":""mcq"",""subject"":""Maths"",""grade"":4,""topic"":""Financial Problem Solving"",""subtopic"":""Budgeting Basics"",""learning_objective"":""Students can understand and apply the concept of a simple budget"",""focus"":""error_correction""}"
100,tfps1hnq-sbb1jxd-lscuaoge2-q100-mcq,Q100,mcq,"A child saves $38 for a picnic. Sandwiches cost $15, apples cost $7, and two juices cost $4 each. Is there any money left, and if so, how much?",Maths,4,Financial Problem Solving,Budgeting Basics,Students can understand and apply the concept of a simple budget,Understanding,medium,3,"MCQ for Grade 4 Financial Problem Solving: Budgeting Basics, aligned to Students can understand and apply the concept of a simple budget.","[{""text"":""Yes, $8 is left."",""correct"":true},{""text"":""Yes, $12 is left."",""correct"":false},{""text"":""Yes, $4 is left."",""correct"":false},{""text"":""No, the budget is short by $4."",""correct"":false}]","Two juices cost $8 because $4 + $4 = $8. The total cost is $15 + $7 + $8 = $30. Then $38 - $30 = $8, so there is money left, and the amount left is $8. $12 would count only one juice, and $4 does not match the correct subtraction.","{""questionNumber"":""Q100"",""questionType"":""mcq"",""subject"":""Maths"",""grade"":4,""topic"":""Financial Problem Solving"",""subtopic"":""Budgeting Basics"",""learning_objective"":""Students can understand and apply the concept of a simple budget"",""focus"":""representation_translation""}"
101,tfps1hnq-sbb1jxd-lscuaoge2-q101-mcq,Q101,mcq,"Decide which claim about a $52 birthday budget is true when a cake costs $25, candles cost $6, and party hats cost $13.",Maths,4,Financial Problem Solving,Budgeting Basics,Students can understand and apply the concept of a simple budget,Analyzing,medium,3,"MCQ for Grade 4 Financial Problem Solving: Budgeting Basics, aligned to Students can understand and apply the concept of a simple budget.","[{""text"":""The total is $44, so $8 is left."",""correct"":true},{""text"":""The total is $43, so $9 is left."",""correct"":false},{""text"":""The total is $46, so $6 is left."",""correct"":false},{""text"":""The budget is short by $8."",""correct"":false}]",Great reasoning! $25 + $6 + $13 = $44. Then $52 - $44 = $8 left.,"{""questionNumber"":""Q101"",""questionType"":""mcq"",""subject"":""Maths"",""grade"":4,""topic"":""Financial Problem Solving"",""subtopic"":""Budgeting Basics"",""learning_objective"":""Students can understand and apply the concept of a simple budget"",""focus"":""context_interpretation""}"
102,tfps1hnq-sbb1jxd-lscuaoge2-q102-mcq,Q102,mcq,A pet toy costs $11. A bag of treats costs $8. Two chew ropes cost $5 each. There is a $35 budget. Pick the correct answer.,Maths,4,Financial Problem Solving,Budgeting Basics,Students can understand and apply the concept of a simple budget,Applying,medium,3,"MCQ for Grade 4 Financial Problem Solving: Budgeting Basics, aligned to Students can understand and apply the concept of a simple budget.","[{""text"":""$6 left"",""correct"":true},{""text"":""$1 left"",""correct"":false},{""text"":""$11 left"",""correct"":false},{""text"":""Not enough money"",""correct"":false}]","Lovely work! Two chew ropes cost $10. Then $11 + $8 + $10 = $29, and $35 - $29 = $6.","{""questionNumber"":""Q102"",""questionType"":""mcq"",""subject"":""Maths"",""grade"":4,""topic"":""Financial Problem Solving"",""subtopic"":""Budgeting Basics"",""learning_objective"":""Students can understand and apply the concept of a simple budget"",""focus"":""multi_step_application""}"
103,tfps1hnq-sbb1jxd-lscuaoge2-q103-mcq,Q103,mcq,"Choose the sentence that is correct about a $46 budget for a school fair with tokens for $14, popcorn for $7, and two rides at $9 each.",Maths,4,Financial Problem Solving,Budgeting Basics,Students can understand and apply the concept of a simple budget,Understanding,medium,3,"MCQ for Grade 4 Financial Problem Solving: Budgeting Basics, aligned to Students can understand and apply the concept of a simple budget.","[{""text"":""The total is $39, so $7 is left."",""correct"":true},{""text"":""The total is $30, so $16 is left."",""correct"":false},{""text"":""The total is $41, so $5 is left."",""correct"":false},{""text"":""The budget is short by $3."",""correct"":false}]","Well done! Two rides cost $18. Then $14 + $7 + $18 = $39, and $46 - $39 = $7 left.","{""questionNumber"":""Q103"",""questionType"":""mcq"",""subject"":""Maths"",""grade"":4,""topic"":""Financial Problem Solving"",""subtopic"":""Budgeting Basics"",""learning_objective"":""Students can understand and apply the concept of a simple budget"",""focus"":""context_interpretation""}"
104,tfps1hnq-sbb1jxd-lscuaoge2-q104-mcq,Q104,mcq,"Look at this budget idea: use $34 to buy a doll for $15 and hair clips for $12, then say there is $8 left. Decide which judgment is correct.",Maths,4,Financial Problem Solving,Budgeting Basics,Students can understand and apply the concept of a simple budget,Analyzing,medium,3,"MCQ for Grade 4 Financial Problem Solving: Budgeting Basics, aligned to Students can understand and apply the concept of a simple budget.","[{""text"":""It is wrong because the total spent is $27, so $7 is left."",""correct"":true},{""text"":""It is correct because 15 + 12 = 26."",""correct"":false},{""text"":""It is wrong because the budget is not enough."",""correct"":false},{""text"":""It is correct because 34 - 15 = 19 and 19 - 12 = 8."",""correct"":false}]","Nice catching! $15 + $12 = $27, and $34 - $27 = $7. The plan saying $8 left is one dollar too high.","{""questionNumber"":""Q104"",""questionType"":""mcq"",""subject"":""Maths"",""grade"":4,""topic"":""Financial Problem Solving"",""subtopic"":""Budgeting Basics"",""learning_objective"":""Students can understand and apply the concept of a simple budget"",""focus"":""error_correction""}"
105,tfps1hnq-sbb1jxd-lscuaoge2-q105-mcq,Q105,mcq,"Choose the method that correctly solves this budget question: $49 is saved for a game day. A soccer ball costs $18, cones cost $11, and water bottles cost $9.",Maths,4,Financial Problem Solving,Budgeting Basics,Students can understand and apply the concept of a simple budget,Analyzing,medium,3,"MCQ for Grade 4 Financial Problem Solving: Budgeting Basics, aligned to Students can understand and apply the concept of a simple budget.","[{""text"":""Add 18, 11, and 9 to get 38, then subtract from 49 to get 11 left."",""correct"":true},{""text"":""Subtract 18 from 11, then add 9 to get 2 left."",""correct"":false},{""text"":""Add 49 and 18 and 11 and 9 to get the money left."",""correct"":false},{""text"":""Subtract only the biggest cost from 49 to get 31 left."",""correct"":false}]","Excellent method choice! In a budget, add all the costs first. Then subtract the total spent from the starting money.","{""questionNumber"":""Q105"",""questionType"":""mcq"",""subject"":""Maths"",""grade"":4,""topic"":""Financial Problem Solving"",""subtopic"":""Budgeting Basics"",""learning_objective"":""Students can understand and apply the concept of a simple budget"",""focus"":""operation_reasoning""}"
106,tfps1hnq-sbb1jxd-lscuaoge2-q106-mcq,Q106,mcq,Pick the set of prices that can be bought with a $40 budget and leaves exactly $2.,Maths,4,Financial Problem Solving,Budgeting Basics,Students can understand and apply the concept of a simple budget,Analyzing,medium,3,"MCQ for Grade 4 Financial Problem Solving: Budgeting Basics, aligned to Students can understand and apply the concept of a simple budget.","[{""text"":""Toy train $14, book $9, snack $15"",""correct"":true},{""text"":""Toy train $13, book $9, snack $15"",""correct"":false},{""text"":""Toy train $14, book $8, snack $15"",""correct"":false},{""text"":""Toy train $12, book $9, snack $15"",""correct"":false}]","Great thinking! To leave exactly $2 from $40, the total must be $38. Only $14 + $9 + $15 = $38.","{""questionNumber"":""Q106"",""questionType"":""mcq"",""subject"":""Maths"",""grade"":4,""topic"":""Financial Problem Solving"",""subtopic"":""Budgeting Basics"",""learning_objective"":""Students can understand and apply the concept of a simple budget"",""focus"":""constrained_selection""}"
107,tfps1hnq-sbb1jxd-lscuaoge2-q107-mcq,Q107,mcq,"Select the true statement about a $31 budget for an art box with paint for $8, brushes for $9, and paper for $6.",Maths,4,Financial Problem Solving,Budgeting Basics,Students can understand and apply the concept of a simple budget,Understanding,medium,3,"MCQ for Grade 4 Financial Problem Solving: Budgeting Basics, aligned to Students can understand and apply the concept of a simple budget.","[{""text"":""The total is $23, so $8 is left."",""correct"":true},{""text"":""The total is $24, so $7 is left."",""correct"":false},{""text"":""The total is $21, so $10 is left."",""correct"":false},{""text"":""The budget is short by $2."",""correct"":false}]",Good job! $8 + $9 + $6 = $23. Then $31 - $23 = $8 left.,"{""questionNumber"":""Q107"",""questionType"":""mcq"",""subject"":""Maths"",""grade"":4,""topic"":""Financial Problem Solving"",""subtopic"":""Budgeting Basics"",""learning_objective"":""Students can understand and apply the concept of a simple budget"",""focus"":""context_interpretation""}"
108,tfps1hnq-sbb1jxd-lscuaoge2-q108-mcq,Q108,mcq,A game booth prize costs $16. Two snack bags cost $5 each. A juice costs $4. There is a $35 budget. Pick the correct budget result.,Maths,4,Financial Problem Solving,Budgeting Basics,Students can understand and apply the concept of a simple budget,Applying,medium,3,"MCQ for Grade 4 Financial Problem Solving: Budgeting Basics, aligned to Students can understand and apply the concept of a simple budget.","[{""text"":""$5 left"",""correct"":true},{""text"":""$9 left"",""correct"":false},{""text"":""$15 left"",""correct"":false},{""text"":""Not enough money"",""correct"":false}]","You’re doing great! Two snack bags cost $10. Then $16 + $10 + $4 = $30, so $35 - $30 = $5 left.","{""questionNumber"":""Q108"",""questionType"":""mcq"",""subject"":""Maths"",""grade"":4,""topic"":""Financial Problem Solving"",""subtopic"":""Budgeting Basics"",""learning_objective"":""Students can understand and apply the concept of a simple budget"",""focus"":""multi_step_application""}"
109,tfps1hnq-sbb1jxd-lscuaoge2-q109-mcq,Q109,mcq,"A budget is $47 and the costs are $19, $12, and $8. Which statement correctly shows the total cost and the money left?",Maths,4,Financial Problem Solving,Budgeting Basics,Students can understand and apply the concept of a simple budget,Analyzing,medium,3,"MCQ for Grade 4 Financial Problem Solving: Budgeting Basics, aligned to Students can understand and apply the concept of a simple budget.","[{""text"":""The total cost is $39, and the money left is $8."",""correct"":true},{""text"":""The total cost is $38, and the money left is $9."",""correct"":false},{""text"":""The total cost is $29, and the money left is $18."",""correct"":false},{""text"":""The total cost is $49, so the budget works exactly."",""correct"":false}]",Add the costs: $19 + $12 + $8 = $39. Then subtract from the budget: $47 - $39 = $8. So the correct statement is that the total cost is $39 and the money left is $8. The other options use incorrect totals or incorrect subtraction.,"{""questionNumber"":""Q109"",""questionType"":""mcq"",""subject"":""Maths"",""grade"":4,""topic"":""Financial Problem Solving"",""subtopic"":""Budgeting Basics"",""learning_objective"":""Students can understand and apply the concept of a simple budget"",""focus"":""error_correction""}"
110,tfps1hnq-sbb1jxd-lscuaoge2-q110-mcq,Q110,mcq,"Choose the equation that matches this shopping story: $54 is the budget. A stuffed panda costs $22, a picture book costs $13, and two candy packs cost $4 each. The question asks for the money left.",Maths,4,Financial Problem Solving,Budgeting Basics,Students can understand and apply the concept of a simple budget,Understanding,medium,3,"MCQ for Grade 4 Financial Problem Solving: Budgeting Basics, aligned to Students can understand and apply the concept of a simple budget.","[{""text"":""54 - (22 + 13 + 4 + 4)"",""correct"":true},{""text"":""54 + 22 + 13 + 4 + 4"",""correct"":false},{""text"":""22 + 13 + 4 + 4 - 54"",""correct"":false},{""text"":""54 - 22 - 13 + 4 + 4"",""correct"":false}]","Nice work matching the story to math! Add all the costs first, including both candy packs, then subtract from $54.","{""questionNumber"":""Q110"",""questionType"":""mcq"",""subject"":""Maths"",""grade"":4,""topic"":""Financial Problem Solving"",""subtopic"":""Budgeting Basics"",""learning_objective"":""Students can understand and apply the concept of a simple budget"",""focus"":""representation_translation""}"
111,tfps1hnq-sbb1jxd-lscuaoge2-q111-mcq,Q111,mcq,"Choose the correct result for this toy-shop budget: Mia has $36. A kite costs $14, and 2 packs of glow stickers cost $5 each. She also wants a juice for $4. Can she buy all 3 things, and how much money will be left?",Maths,4,Financial Problem Solving,Budgeting Basics,Students can understand and apply the concept of a simple budget,Applying,medium,3,"MCQ for Grade 4 Financial Problem Solving: Budgeting Basics, aligned to Students can understand and apply the concept of a simple budget.","[{""text"":""Yes, and $8 will be left."",""correct"":true},{""text"":""Yes, and $3 will be left."",""correct"":false},{""text"":""No, she is $2 over budget."",""correct"":false},{""text"":""Yes, and $13 will be left."",""correct"":false}]","Nice job thinking step by step! The total cost is $14 + $10 + $4 = $28. Then $36 - $28 = $8, so she can buy everything and have $8 left.","{""questionNumber"":""Q111"",""questionType"":""mcq"",""subject"":""Maths"",""grade"":4,""topic"":""Financial Problem Solving"",""subtopic"":""Budgeting Basics"",""learning_objective"":""Students can understand and apply the concept of a simple budget"",""focus"":""multi_step_application""}"
112,tfps1hnq-sbb1jxd-lscuaoge2-q112-mcq,Q112,mcq,"Select the true statement about a snack budget of $29. Popcorn costs $7, fruit slices cost $6, and 2 cookies cost $4 each.",Maths,4,Financial Problem Solving,Budgeting Basics,Students can understand and apply the concept of a simple budget,Analyzing,medium,3,"MCQ for Grade 4 Financial Problem Solving: Budgeting Basics, aligned to Students can understand and apply the concept of a simple budget.","[{""text"":""The snacks cost $21, so $8 is left."",""correct"":true},{""text"":""The snacks cost $17, so $12 is left."",""correct"":false},{""text"":""The snacks cost $25, so $4 is left."",""correct"":false},{""text"":""The snacks cost $29, so no money is left."",""correct"":false}]","Great work! Two cookies cost $8, so the total is $7 + $6 + $8 = $21. Then $29 - $21 = $8 left.","{""questionNumber"":""Q112"",""questionType"":""mcq"",""subject"":""Maths"",""grade"":4,""topic"":""Financial Problem Solving"",""subtopic"":""Budgeting Basics"",""learning_objective"":""Students can understand and apply the concept of a simple budget"",""focus"":""context_interpretation""}"
113,tfps1hnq-sbb1jxd-lscuaoge2-q113-mcq,Q113,mcq,A zoo gift stand gives Leo $40 to spend. He buys a monkey toy for $16 and 3 animal erasers for $4 each. He wants a balloon that costs $11. Choose the best answer about his budget.,Maths,4,Financial Problem Solving,Budgeting Basics,Students can understand and apply the concept of a simple budget,Applying,medium,3,"MCQ for Grade 4 Financial Problem Solving: Budgeting Basics, aligned to Students can understand and apply the concept of a simple budget.","[{""text"":""He can buy the balloon and will have $1 left."",""correct"":true},{""text"":""He can buy the balloon and will have $5 left."",""correct"":false},{""text"":""He cannot buy the balloon because he is $1 short."",""correct"":false},{""text"":""He cannot buy the balloon because he is $3 short."",""correct"":false}]","You’re doing super! First, 3 erasers cost $12. Then $16 + $12 = $28. Add the balloon: $28 + $11 = $39. That fits in $40, so $1 is left.","{""questionNumber"":""Q113"",""questionType"":""mcq"",""subject"":""Maths"",""grade"":4,""topic"":""Financial Problem Solving"",""subtopic"":""Budgeting Basics"",""learning_objective"":""Students can understand and apply the concept of a simple budget"",""focus"":""multi_step_application""}"
114,tfps1hnq-sbb1jxd-lscuaoge2-q114-mcq,Q114,mcq,"Look at this budget check for a pet shop trip: start with $34, add $9 for cat treats, add $8 for a toy mouse, and add $7 for a tiny bell collar. Then the work says $34 - $24 = $12 left. Decide what should be fixed.",Maths,4,Financial Problem Solving,Budgeting Basics,Students can understand and apply the concept of a simple budget,Analyzing,medium,3,"MCQ for Grade 4 Financial Problem Solving: Budgeting Basics, aligned to Students can understand and apply the concept of a simple budget.","[{""text"":""The subtraction is wrong. It should be $34 - $24 = $10 left."",""correct"":true},{""text"":""The total cost is wrong. It should be $22."",""correct"":false},{""text"":""The budget should be added, not subtracted."",""correct"":false},{""text"":""The collar should not be counted."",""correct"":false}]","Well spotted! The costs do add to $24, but $34 - $24 = $10, not $12. That is the step that needs fixing.","{""questionNumber"":""Q114"",""questionType"":""mcq"",""subject"":""Maths"",""grade"":4,""topic"":""Financial Problem Solving"",""subtopic"":""Budgeting Basics"",""learning_objective"":""Students can understand and apply the concept of a simple budget"",""focus"":""error_correction""}"
115,tfps1hnq-sbb1jxd-lscuaoge2-q115-mcq,Q115,mcq,"Choose the equation that matches this budget story: Nora saved $45 for a fun park day. She spends $18 on ride tickets, $7 on popcorn, and 2 ice creams cost $5 each. The question asks for the money left.",Maths,4,Financial Problem Solving,Budgeting Basics,Students can understand and apply the concept of a simple budget,Understanding,medium,3,"MCQ for Grade 4 Financial Problem Solving: Budgeting Basics, aligned to Students can understand and apply the concept of a simple budget.","[{""text"":""45 - (18 + 7 + 2×5)"",""correct"":true},{""text"":""45 + 18 + 7 + 2×5"",""correct"":false},{""text"":""(45 - 18) + 7 + 2×5"",""correct"":false},{""text"":""2×(45 - 18 - 7 - 5)"",""correct"":false}]","Excellent thinking! Money left means start with $45 and subtract all the costs: $18, $7, and 2 groups of $5.","{""questionNumber"":""Q115"",""questionType"":""mcq"",""subject"":""Maths"",""grade"":4,""topic"":""Financial Problem Solving"",""subtopic"":""Budgeting Basics"",""learning_objective"":""Students can understand and apply the concept of a simple budget"",""focus"":""representation_translation""}"
116,tfps1hnq-sbb1jxd-lscuaoge2-q116-mcq,Q116,mcq,"Choose the correct result for this sticker budget: $27 is saved. A rainbow sticker sheet costs $6, a glitter pen costs $5, and 2 tiny notebooks cost $4 each. What happens to the budget?",Maths,4,Financial Problem Solving,Budgeting Basics,Students can understand and apply the concept of a simple budget,Applying,medium,3,"MCQ for Grade 4 Financial Problem Solving: Budgeting Basics, aligned to Students can understand and apply the concept of a simple budget.","[{""text"":""The total is $19, so $8 is left."",""correct"":true},{""text"":""The total is $15, so $12 is left."",""correct"":false},{""text"":""The total is $23, so $4 is left."",""correct"":false},{""text"":""The total is $27, so no money is left."",""correct"":false}]","Nice careful adding! Two notebooks cost $8. Then $6 + $5 + $8 = $19. From $27, that leaves $8.","{""questionNumber"":""Q116"",""questionType"":""mcq"",""subject"":""Maths"",""grade"":4,""topic"":""Financial Problem Solving"",""subtopic"":""Budgeting Basics"",""learning_objective"":""Students can understand and apply the concept of a simple budget"",""focus"":""multi_step_application""}"
117,tfps1hnq-sbb1jxd-lscuaoge2-q117-mcq,Q117,mcq,"Decide which claim about a game corner budget of $33 is true when a beanbag toss costs $9, a ring toss costs $8, and 2 prize tokens cost $6 each.",Maths,4,Financial Problem Solving,Budgeting Basics,Students can understand and apply the concept of a simple budget,Analyzing,medium,3,"MCQ for Grade 4 Financial Problem Solving: Budgeting Basics, aligned to Students can understand and apply the concept of a simple budget.","[{""text"":""All the costs together are $29, so $4 is left."",""correct"":true},{""text"":""All the costs together are $23, so $10 is left."",""correct"":false},{""text"":""All the costs together are $35, so the budget is not enough."",""correct"":false},{""text"":""All the costs together are $27, so $6 is left."",""correct"":false}]",Great job! Two prize tokens cost $12. Then $9 + $8 + $12 = $29. So $33 - $29 = $4 left.,"{""questionNumber"":""Q117"",""questionType"":""mcq"",""subject"":""Maths"",""grade"":4,""topic"":""Financial Problem Solving"",""subtopic"":""Budgeting Basics"",""learning_objective"":""Students can understand and apply the concept of a simple budget"",""focus"":""context_interpretation""}"
