rowNumber,queueId,questionNumber,questionType,questionText,subject,grade,topic,subtopic,learningObjective,bloomsLevel,difficultyLevel,difficultyRating,summary,options,explanation,generationMetadata
160,tfps1hnq-sbb1jxd-lscuaoge2-q160-mcq,Q160,mcq,"Choose the method that correctly solves this budget puzzle: $37 is saved for an animal park day. A bird toy costs $14, 2 seed packs cost $5 each, and an ice pop costs $4. The question asks whether the budget is enough and how much is left.",Maths,4,Financial Problem Solving,Budgeting Basics,Students can understand and apply the concept of a simple budget,Understanding,medium,3,"MCQ for Grade 4 Financial Problem Solving: Budgeting Basics, aligned to Students can understand and apply the concept of a simple budget.","[{""text"":""Add 14 + 5 + 5 + 4, then subtract from 37."",""correct"":true},{""text"":""Add 14 + 5 + 4, then subtract from 37."",""correct"":false},{""text"":""Subtract 14 from 37 and stop there."",""correct"":false},{""text"":""Add 37 + 14 + 5 + 5 + 4."",""correct"":false}]","You’ve got it! Both seed packs must be counted, so add all costs first. Then subtract that total from $37 to check the budget and the money left.","{""questionNumber"":""Q160"",""questionType"":""mcq"",""subject"":""Maths"",""grade"":4,""topic"":""Financial Problem Solving"",""subtopic"":""Budgeting Basics"",""learning_objective"":""Students can understand and apply the concept of a simple budget"",""focus"":""operation_reasoning""}"
161,tfps1hnq-sbb1jxd-lscuaoge2-q163-mcq,Q163,mcq,"At the zoo gift stand, a child has $25. A tiger toy costs $8 and a juice costs $3. The child wants to buy one more item, have exactly $6 left, and spend more on the last item than on the juice. Which price must the last item be?",Maths,4,Financial Problem Solving,Budgeting Basics,Students can understand and apply the concept of a simple budget,Analyzing,hard,4,"MCQ for Grade 4 Financial Problem Solving: Budgeting Basics, aligned to Students can understand and apply the concept of a simple budget.","[{""text"":""$5"",""correct"":false},{""text"":""$8"",""correct"":true},{""text"":""$11"",""correct"":false},{""text"":""$14"",""correct"":false}]","If $6 must be left from $25, then the total spent must be $25 - $6 = $19. The tiger toy and juice already cost $8 + $3 = $11. So the last item must cost $19 - $11 = $8. This also satisfies the extra condition because $8 is more than the $3 juice. $5 would leave too much money, and $11 or $14 would leave too little.","{""questionNumber"":""Q163"",""questionType"":""mcq"",""subject"":""Maths"",""grade"":4,""topic"":""Financial Problem Solving"",""subtopic"":""Budgeting Basics"",""learning_objective"":""Students can understand and apply the concept of a simple budget"",""focus"":""reverse_reasoning""}"
162,tfps1hnq-sbb1jxd-lscuaoge2-q164-mcq,Q164,mcq,"A snack budget is $18 for fruit slices at $6 and two muffins at $4 each. Method 1 adds first: $6 + $4 + $4 = $14, then finds $18 - $14 = $4 left. Method 2 subtracts one item at a time: $18 - $6 = $12, $12 - $4 = $8, $8 - $4 = $4. Which judgment is correct?",Maths,4,Financial Problem Solving,Budgeting Basics,Students can understand and apply the concept of a simple budget,Evaluating,hard,4,"MCQ for Grade 4 Financial Problem Solving: Budgeting Basics, aligned to Students can understand and apply the concept of a simple budget.","[{""text"":""Both methods are correct and show that $4 is left."",""correct"":true},{""text"":""Only Method 1 is correct because subtracting step by step changes the answer."",""correct"":false},{""text"":""Only Method 2 is correct because adding first gives the wrong total."",""correct"":false},{""text"":""Neither method is correct because the items cost $16 altogether."",""correct"":false}]","Method 1 is correct because $6 + $4 + $4 = $14 and $18 - $14 = $4. Method 2 is also correct because subtracting each cost one at a time gives $18 - $6 = $12, then $12 - $4 = $8, then $8 - $4 = $4. Both methods show the same correct result: $4 is left.","{""questionNumber"":""Q164"",""questionType"":""mcq"",""subject"":""Maths"",""grade"":4,""topic"":""Financial Problem Solving"",""subtopic"":""Budgeting Basics"",""learning_objective"":""Students can understand and apply the concept of a simple budget"",""focus"":""compare_methods""}"
163,tfps1hnq-sbb1jxd-lscuaoge2-q165-mcq,Q165,mcq,A child has $24 to spend on 2 toy cars that cost the same amount and 1 balloon that costs $4. The child spends all the money. Which choice both shows the correct number sentence and gives the correct price of one toy car? Let □ be the price of one toy car.,Maths,4,Financial Problem Solving,Budgeting Basics,Students can understand and apply the concept of a simple budget,Analyzing,hard,4,"MCQ for Grade 4 Financial Problem Solving: Budgeting Basics, aligned to Students can understand and apply the concept of a simple budget.","[{""text"":""2 × □ + 4 = 24, so one toy car costs $10"",""correct"":true},{""text"":""2 × □ + 4 = 24, so one toy car costs $12"",""correct"":false},{""text"":""□ + 2 + 4 = 24, so one toy car costs $18"",""correct"":false},{""text"":""24 - 2 = □ + 4, so one toy car costs $18"",""correct"":false}]","Two equal toy cars cost 2 × □, and the balloon costs $4, so the correct equation is 2 × □ + 4 = 24. Solve it: 24 - 4 = 20, and 20 ÷ 2 = 10. So one toy car costs $10. The option with $12 does not solve the equation correctly, and the other equations do not represent 2 equal toy cars.","{""questionNumber"":""Q165"",""questionType"":""mcq"",""subject"":""Maths"",""grade"":4,""topic"":""Financial Problem Solving"",""subtopic"":""Budgeting Basics"",""learning_objective"":""Students can understand and apply the concept of a simple budget"",""focus"":""reverse_reasoning""}"
164,tfps1hnq-sbb1jxd-lscuaoge2-q166-mcq,Q166,mcq,Noor has $40. She buys 3 candy bags for $6 each and 1 lollipop pack for $9. One claim says she has $15 left. Which answer correctly checks the claim and gives the reason?,Maths,4,Financial Problem Solving,Budgeting Basics,Students can understand and apply the concept of a simple budget,Evaluating,hard,4,"MCQ for Grade 4 Financial Problem Solving: Budgeting Basics, aligned to Students can understand and apply the concept of a simple budget.","[{""text"":""The claim is correct because 3 × 6 = 18 and 40 - 18 = 22."",""correct"":false},{""text"":""The claim is correct because 18 + 9 = 25, so $15 is left."",""correct"":false},{""text"":""The claim is not correct because 3 × 6 + 9 = 27, so $13 is left."",""correct"":true},{""text"":""The claim is not correct because the total cost is $31, so $9 is left."",""correct"":false}]","First find the total spent: 3 × $6 = $18, and $18 + $9 = $27. Then subtract from the budget: $40 - $27 = $13. So the claim of $15 left is not correct. The first wrong choice forgets the lollipop pack, the second subtracts incorrectly after finding $25, and the last uses the wrong total cost.","{""questionNumber"":""Q166"",""questionType"":""mcq"",""subject"":""Maths"",""grade"":4,""topic"":""Financial Problem Solving"",""subtopic"":""Budgeting Basics"",""learning_objective"":""Students can understand and apply the concept of a simple budget"",""focus"":""evaluate_a_claim""}"
165,tfps1hnq-sbb1jxd-lscuaoge2-q167-mcq,Q167,mcq,"There is $22 to spend at a pet shop. Fish food costs $5, a toy shell costs $8, and pebbles cost $9. You must buy exactly 2 different items and leave the smallest amount of money possible without going over budget. Which choice should you make?",Maths,4,Financial Problem Solving,Budgeting Basics,Students can understand and apply the concept of a simple budget,Evaluating,hard,4,"MCQ for Grade 4 Financial Problem Solving: Budgeting Basics, aligned to Students can understand and apply the concept of a simple budget.","[{""text"":""Fish food and toy shell"",""correct"":false},{""text"":""Fish food and pebbles"",""correct"":false},{""text"":""Toy shell and pebbles"",""correct"":true},{""text"":""All 3 items"",""correct"":false}]","Check each allowed pair. Fish food and shell cost $5 + $8 = $13, leaving $9. Fish food and pebbles cost $5 + $9 = $14, leaving $8. Shell and pebbles cost $8 + $9 = $17, leaving $5. Since $5 is the smallest amount left without going over budget, toy shell and pebbles is the best choice. Buying all 3 items is not allowed because the rule says exactly 2 different items.","{""questionNumber"":""Q167"",""questionType"":""mcq"",""subject"":""Maths"",""grade"":4,""topic"":""Financial Problem Solving"",""subtopic"":""Budgeting Basics"",""learning_objective"":""Students can understand and apply the concept of a simple budget"",""focus"":""multi_constraint_problem""}"
166,tfps1hnq-sbb1jxd-lscuaoge2-q168-mcq,Q168,mcq,"At a playground snack stand, Sam has $26. He buys 1 popcorn for $7 and 2 juices for $4 each. He wants to buy 1 more snack, have exactly $3 left, and spend more on that snack than on one juice. Which price should the snack be?",Maths,4,Financial Problem Solving,Budgeting Basics,Students can understand and apply the concept of a simple budget,Analyzing,hard,4,"MCQ for Grade 4 Financial Problem Solving: Budgeting Basics, aligned to Students can understand and apply the concept of a simple budget.","[{""text"":""$7"",""correct"":false},{""text"":""$8"",""correct"":true},{""text"":""$11"",""correct"":false},{""text"":""$12"",""correct"":false}]","If Sam wants $3 left from $26, then he can spend $23 altogether. He already spent $7 + $4 + $4 = $15. So the last snack must cost $23 - $15 = $8. This also fits the extra condition because $8 is more than the $4 cost of one juice. $7 would leave $4, and $11 or $12 would leave less than $3.","{""questionNumber"":""Q168"",""questionType"":""mcq"",""subject"":""Maths"",""grade"":4,""topic"":""Financial Problem Solving"",""subtopic"":""Budgeting Basics"",""learning_objective"":""Students can understand and apply the concept of a simple budget"",""focus"":""reverse_reasoning""}"
167,tfps1hnq-sbb1jxd-lscuaoge2-q169-mcq,Q169,mcq,"A budget is $35. Plan A buys a kite for $12, a ball for $9, and a juice for $5. Plan B buys a kite for $12 and 2 balls for $9 each. Which comparison is correct if the better plan is the one that stays within budget and leaves less money unused?",Maths,4,Financial Problem Solving,Budgeting Basics,Students can understand and apply the concept of a simple budget,Evaluating,hard,4,"MCQ for Grade 4 Financial Problem Solving: Budgeting Basics, aligned to Students can understand and apply the concept of a simple budget.","[{""text"":""Plan A is better because it costs $26 and leaves $9."",""correct"":false},{""text"":""Plan B is better because it costs $30 and leaves $5."",""correct"":true},{""text"":""Both plans are equally good because both stay within budget."",""correct"":false},{""text"":""Neither plan is good because neither uses the whole budget."",""correct"":false}]","Find each plan's total. Plan A costs $12 + $9 + $5 = $26, so it leaves $35 - $26 = $9. Plan B costs $12 + $9 + $9 = $30, so it leaves $35 - $30 = $5. Both are within budget, but the rule says the better plan leaves less money unused. Since $5 is less than $9, Plan B is better.","{""questionNumber"":""Q169"",""questionType"":""mcq"",""subject"":""Maths"",""grade"":4,""topic"":""Financial Problem Solving"",""subtopic"":""Budgeting Basics"",""learning_objective"":""Students can understand and apply the concept of a simple budget"",""focus"":""compare_methods""}"
168,tfps1hnq-sbb1jxd-lscuaoge2-q170-mcq,Q170,mcq,"A child has $31. After buying a board game for $17, the child uses the rest to buy 2 packs of crayons that cost the same. No money is left. Which choice shows the correct number sentence and the correct price of one crayon pack? Let □ be the price of one crayon pack.",Maths,4,Financial Problem Solving,Budgeting Basics,Students can understand and apply the concept of a simple budget,Analyzing,hard,4,"MCQ for Grade 4 Financial Problem Solving: Budgeting Basics, aligned to Students can understand and apply the concept of a simple budget.","[{""text"":""17 + 2 × □ = 31, so one crayon pack costs $7"",""correct"":true},{""text"":""17 + 2 × □ = 31, so one crayon pack costs $14"",""correct"":false},{""text"":""2 + □ = 31 - 17, so one crayon pack costs $12"",""correct"":false},{""text"":""17 × □ + 2 = 31, so one crayon pack costs $1"",""correct"":false}]","The board game costs $17 and the 2 equal crayon packs cost 2 × □, so the story is 17 + 2 × □ = 31. Solve it: 31 - 17 = 14, and 14 ÷ 2 = 7. So one crayon pack costs $7. The option with $14 forgets there are 2 packs, and the other equations do not correctly match the story.","{""questionNumber"":""Q170"",""questionType"":""mcq"",""subject"":""Maths"",""grade"":4,""topic"":""Financial Problem Solving"",""subtopic"":""Budgeting Basics"",""learning_objective"":""Students can understand and apply the concept of a simple budget"",""focus"":""operation_reasoning""}"
169,tfps1hnq-sbb1jxd-lscuaoge2-q171-mcq,Q171,mcq,Ava has $27. She buys a yo-yo for $5 and a comic for $8. Then she buys one more toy and has exactly $4 left. The last toy must cost more than the yo-yo and less than $12. What is the price of the last toy?,Maths,4,Financial Problem Solving,Budgeting Basics,Students can understand and apply the concept of a simple budget,Analyzing,hard,4,"MCQ for Grade 4 Financial Problem Solving: Budgeting Basics, aligned to Students can understand and apply the concept of a simple budget.","[{""text"":""$9"",""correct"":false},{""text"":""$10"",""correct"":true},{""text"":""$11"",""correct"":false},{""text"":""$14"",""correct"":false}]","If Ava has $4 left from $27, then she spent $23 altogether. She already spent $5 + $8 = $13. So the last toy costs $23 - $13 = $10. This fits both extra conditions because $10 is more than $5 and less than $12. $9 and $11 do not give the exact leftover, and $14 is too large.","{""questionNumber"":""Q171"",""questionType"":""mcq"",""subject"":""Maths"",""grade"":4,""topic"":""Financial Problem Solving"",""subtopic"":""Budgeting Basics"",""learning_objective"":""Students can understand and apply the concept of a simple budget"",""focus"":""reverse_reasoning""}"
170,tfps1hnq-sbb1jxd-lscuaoge2-q172-mcq,Q172,mcq,"A birthday shop budget is $18. A balloon costs $3, a cupcake costs $4, and a party hat costs $5. You must choose a combination that uses more than $13 but less than $16. Which option has the correct total cost and correct money left?",Maths,4,Financial Problem Solving,Budgeting Basics,Students can understand and apply the concept of a simple budget,Analyzing,hard,4,"MCQ for Grade 4 Financial Problem Solving: Budgeting Basics, aligned to Students can understand and apply the concept of a simple budget.","[{""text"":""Two hats and one cupcake cost $14 and leave $4."",""correct"":true},{""text"":""Three balloons and one cupcake cost $13 and leave $5."",""correct"":false},{""text"":""One hat, one cupcake, and one balloon cost $12 and leave $6."",""correct"":false},{""text"":""Two cupcakes and two balloons cost $14 and leave $5."",""correct"":false}]","The combination must use more than $13 but less than $16. Two hats and one cupcake cost $5 + $5 + $4 = $14, and $18 - $14 = $4, so that works. Three balloons and one cupcake cost $13, which is not more than $13. One hat, one cupcake, and one balloon cost $12, so it is too small. Two cupcakes and two balloons do cost $14, but from $18 they leave $4, not $5.","{""questionNumber"":""Q172"",""questionType"":""mcq"",""subject"":""Maths"",""grade"":4,""topic"":""Financial Problem Solving"",""subtopic"":""Budgeting Basics"",""learning_objective"":""Students can understand and apply the concept of a simple budget"",""focus"":""multi_constraint_problem""}"
171,tfps1hnq-sbb1jxd-lscuaoge2-q173-mcq,Q173,mcq,"A toy chest shop used all $29 on a doll, a coloring book for $6, and a pack of stickers for $5. The doll cost more than each of the other two items but less than $20. What was the price of the doll?",Maths,4,Financial Problem Solving,Budgeting Basics,Students can understand and apply the concept of a simple budget,Analyzing,hard,4,"MCQ for Grade 4 Financial Problem Solving: Budgeting Basics, aligned to Students can understand and apply the concept of a simple budget.","[{""text"":""$18"",""correct"":true},{""text"":""$17"",""correct"":false},{""text"":""$23"",""correct"":false},{""text"":""$24"",""correct"":false}]","Add the known prices: $6 + $5 = $11. Then subtract from the total: $29 - $11 = $18. So the doll costs $18. This matches the extra conditions because $18 is more than $6 and $5, and it is less than $20. The other prices would not make the total $29.","{""questionNumber"":""Q173"",""questionType"":""mcq"",""subject"":""Maths"",""grade"":4,""topic"":""Financial Problem Solving"",""subtopic"":""Budgeting Basics"",""learning_objective"":""Students can understand and apply the concept of a simple budget"",""focus"":""reverse_reasoning""}"
172,tfps1hnq-sbb1jxd-lscuaoge2-q174-mcq,Q174,mcq,"Look at the budget check below. A child has $20 and wants a toy plane for $11 and two sticker sheets for $3 each. One check says 11 + 3 = 14, so $6 is left. Decide where the first mistake happens.",Maths,4,Financial Problem Solving,Budgeting Basics,Students can understand and apply the concept of a simple budget,Analyzing,hard,4,"MCQ for Grade 4 Financial Problem Solving: Budgeting Basics, aligned to Students can understand and apply the concept of a simple budget.","[{""text"":""The mistake is using only one $3 sticker sheet instead of two."",""correct"":true},{""text"":""The mistake is that 20 - 14 should be 5."",""correct"":false},{""text"":""The mistake is that 11 + 3 is really 15."",""correct"":false},{""text"":""There is no mistake."",""correct"":false}]","Nice spotting! There are two sticker sheets, so the cost should be 11 + 3 + 3 = 17. The first mistake is counting only one $3 sheet.","{""questionNumber"":""Q174"",""questionType"":""mcq"",""subject"":""Maths"",""grade"":4,""topic"":""Financial Problem Solving"",""subtopic"":""Budgeting Basics"",""learning_objective"":""Students can understand and apply the concept of a simple budget"",""focus"":""find_the_error""}"
173,tfps1hnq-sbb1jxd-lscuaoge2-q175-mcq,Q175,mcq,A child spends all $36 on 4 small robot toys that cost the same and 1 packet of sweets for $8. Which choice shows the correct number sentence and the correct price of one robot toy? Let □ be the price of one robot toy.,Maths,4,Financial Problem Solving,Budgeting Basics,Students can understand and apply the concept of a simple budget,Analyzing,hard,4,"MCQ for Grade 4 Financial Problem Solving: Budgeting Basics, aligned to Students can understand and apply the concept of a simple budget.","[{""text"":""4 × □ + 8 = 36, so one robot toy costs $7"",""correct"":true},{""text"":""4 × □ + 8 = 36, so one robot toy costs $9"",""correct"":false},{""text"":""4 + □ + 8 = 36, so one robot toy costs $24"",""correct"":false},{""text"":""4 × □ = 36 + 8, so one robot toy costs $11"",""correct"":false}]","Four equal robot toys cost 4 × □, and the sweets cost $8, so the total is 4 × □ + 8 = 36. Solve it: 36 - 8 = 28, and 28 ÷ 4 = 7. So one robot toy costs $7. The option with $9 solves the equation incorrectly, and the other equations do not match the story.","{""questionNumber"":""Q175"",""questionType"":""mcq"",""subject"":""Maths"",""grade"":4,""topic"":""Financial Problem Solving"",""subtopic"":""Budgeting Basics"",""learning_objective"":""Students can understand and apply the concept of a simple budget"",""focus"":""operation_reasoning""}"
174,tfps1hnq-sbb1jxd-lscuaoge2-q176-mcq,Q176,mcq,"Ella has $32. She buys apples for $7, bread for $6, and 2 yogurts for $4 each. One claim says she has $16 left. Which answer correctly checks the claim and explains why?",Maths,4,Financial Problem Solving,Budgeting Basics,Students can understand and apply the concept of a simple budget,Evaluating,hard,4,"MCQ for Grade 4 Financial Problem Solving: Budgeting Basics, aligned to Students can understand and apply the concept of a simple budget.","[{""text"":""The claim is correct because 7 + 6 + 4 + 4 = 16."",""correct"":false},{""text"":""The claim is not correct because the total cost is $21, so $11 is left."",""correct"":true},{""text"":""The claim is not correct because the total cost is $20, so $12 is left."",""correct"":false},{""text"":""The claim is correct because 32 - 7 - 6 = 19, and that is close to 16."",""correct"":false}]","Add the costs: $7 + $6 + $4 + $4 = $21. Then subtract from the budget: $32 - $21 = $11. So the claim that she has $16 left is not correct. One wrong option stops before subtracting all the costs, another uses the wrong total cost, and saying a number is close to 16 does not make the claim true.","{""questionNumber"":""Q176"",""questionType"":""mcq"",""subject"":""Maths"",""grade"":4,""topic"":""Financial Problem Solving"",""subtopic"":""Budgeting Basics"",""learning_objective"":""Students can understand and apply the concept of a simple budget"",""focus"":""evaluate_a_claim""}"
175,tfps1hnq-sbb1jxd-lscuaoge2-q179-mcq,Q179,mcq,A pet treat budget is $21. Plan A buys 3 chew toys at $4 each and 1 biscuit bag at $6. Plan B buys 2 chew toys at $4 each and 2 biscuit bags at $6 each. Which comparison is correct if the better plan is the one that stays within budget and leaves the least money unused?,Maths,4,Financial Problem Solving,Budgeting Basics,Students can understand and apply the concept of a simple budget,Evaluating,hard,4,"MCQ for Grade 4 Financial Problem Solving: Budgeting Basics, aligned to Students can understand and apply the concept of a simple budget.","[{""text"":""Plan A is better because it costs $18 and leaves $3."",""correct"":false},{""text"":""Plan B is better because it costs $20 and leaves $1."",""correct"":true},{""text"":""Both plans are equally good because both are within budget."",""correct"":false},{""text"":""Neither plan is within budget."",""correct"":false}]","Find each total. Plan A costs 3 × $4 + $6 = $12 + $6 = $18, so it leaves $21 - $18 = $3. Plan B costs 2 × $4 + 2 × $6 = $8 + $12 = $20, so it leaves $21 - $20 = $1. Both are within budget, but the rule says the better plan leaves the least money unused. Since $1 is less than $3, Plan B is better.","{""questionNumber"":""Q179"",""questionType"":""mcq"",""subject"":""Maths"",""grade"":4,""topic"":""Financial Problem Solving"",""subtopic"":""Budgeting Basics"",""learning_objective"":""Students can understand and apply the concept of a simple budget"",""focus"":""compare_methods""}"
176,tfps1hnq-sbb1jxd-lscuaoge2-q184-mcq,Q184,mcq,"Look at the budget check for a toy train set. There is $33. A train car costs $9 and a whistle costs $6. The check says, ""3 train cars and 1 whistle fit because 9 + 9 + 6 = 24."" Decide where the first mistake is.",Maths,4,Financial Problem Solving,Budgeting Basics,Students can understand and apply the concept of a simple budget,Analyzing,hard,4,"MCQ for Grade 4 Financial Problem Solving: Budgeting Basics, aligned to Students can understand and apply the concept of a simple budget.","[{""text"":""Only 2 train cars were counted instead of 3."",""correct"":true},{""text"":""9 + 9 + 6 should be 23."",""correct"":false},{""text"":""The whistle should cost $9."",""correct"":false},{""text"":""There is no mistake because $24 fits in $33."",""correct"":false}]","Excellent spotting! Three train cars should be 9 + 9 + 9, not just 9 + 9. The first mistake is missing one train car.","{""questionNumber"":""Q184"",""questionType"":""mcq"",""subject"":""Maths"",""grade"":4,""topic"":""Financial Problem Solving"",""subtopic"":""Budgeting Basics"",""learning_objective"":""Students can understand and apply the concept of a simple budget"",""focus"":""find_the_error""}"
177,tfps1hnq-sbb1jxd-lscuaoge2-q186-mcq,Q186,mcq,"Choose the correct result for this fun fair budget. Oli has $38. He buys 2 game tickets at $9 each, a cookie for $4, and a toy duck for $7. He thinks he is $1 over budget.",Maths,4,Financial Problem Solving,Budgeting Basics,Students can understand and apply the concept of a simple budget,Evaluating,hard,4,"MCQ for Grade 4 Financial Problem Solving: Budgeting Basics, aligned to Students can understand and apply the concept of a simple budget.","[{""text"":""He is right because 18 + 4 + 7 = 39."",""correct"":false},{""text"":""He is not right because the total is $29 and $9 is left."",""correct"":true},{""text"":""He is not right because the total is $30 and $8 is left."",""correct"":false},{""text"":""He is right because two tickets cost $9 together."",""correct"":false}]","Nice checking! Two tickets cost 18, then 18 + 4 + 7 = 29. From $38, that leaves $9, so he is not over budget.","{""questionNumber"":""Q186"",""questionType"":""mcq"",""subject"":""Maths"",""grade"":4,""topic"":""Financial Problem Solving"",""subtopic"":""Budgeting Basics"",""learning_objective"":""Students can understand and apply the concept of a simple budget"",""focus"":""evaluate_a_claim""}"
