rowNumber,queueId,questionNumber,questionType,questionText,subject,grade,topic,subtopic,learningObjective,bloomsLevel,difficultyLevel,difficultyRating,summary,options,explanation,generationMetadata
91,tvei4t7-seekm5z-lscsa1ybu-q91-mcq,Q91,mcq,"Choose the correct result for 2x + 4 when x = 3, then add 5 more toy blocks to that result. Which total should you pick?",Maths,4,Variables & Expressions,Evaluating Expressions,Students can substitute a value for a variable and evaluate a simple expression,Applying,medium,2,"MCQ for Grade 4 Variables & Expressions: Evaluating Expressions, aligned to Students can substitute a value for a variable and evaluate a simple expression.","[{""text"":""15"",""correct"":true},{""text"":""13"",""correct"":false},{""text"":""11"",""correct"":false},{""text"":""10"",""correct"":false}]",Nice work! Put 3 in for x: 2 × 3 + 4 = 10. Then add 5 more to get 15. Some wrong answers come from missing the last step or mixing up the order.,"{""questionNumber"":""Q91"",""questionType"":""mcq"",""subject"":""Maths"",""grade"":4,""topic"":""Variables & Expressions"",""subtopic"":""Evaluating Expressions"",""learning_objective"":""Students can substitute a value for a variable and evaluate a simple expression"",""focus"":""multi_step_application""}"
92,tvei4t7-seekm5z-lscsa1ybu-q92-mcq,Q92,mcq,Select the true statement about 3p + 1 when p = 4 and then 2 stickers are taken away.,Maths,4,Variables & Expressions,Evaluating Expressions,Students can substitute a value for a variable and evaluate a simple expression,Understanding,medium,2,"MCQ for Grade 4 Variables & Expressions: Evaluating Expressions, aligned to Students can substitute a value for a variable and evaluate a simple expression.","[{""text"":""The final number is 11."",""correct"":true},{""text"":""The final number is 13."",""correct"":false},{""text"":""The final number is 9."",""correct"":false},{""text"":""The final number is 7."",""correct"":false}]","Great thinking! First, 3 × 4 + 1 = 13. Then take away 2, so the final number is 11.","{""questionNumber"":""Q92"",""questionType"":""mcq"",""subject"":""Maths"",""grade"":4,""topic"":""Variables & Expressions"",""subtopic"":""Evaluating Expressions"",""learning_objective"":""Students can substitute a value for a variable and evaluate a simple expression"",""focus"":""statement_evaluation""}"
93,tvei4t7-seekm5z-lscsa1ybu-q93-mcq,Q93,mcq,"A bag has 5 jellybeans and j gummy bears. There are 2 bags. When j = 3, 4 extra sweets are added at the end. Choose the total number of sweets.",Maths,4,Variables & Expressions,Evaluating Expressions,Students can substitute a value for a variable and evaluate a simple expression,Applying,medium,2,"MCQ for Grade 4 Variables & Expressions: Evaluating Expressions, aligned to Students can substitute a value for a variable and evaluate a simple expression.","[{""text"":""20"",""correct"":true},{""text"":""16"",""correct"":false},{""text"":""12"",""correct"":false},{""text"":""18"",""correct"":false}]","Well done! Each bag has 5 + 3 = 8 sweets. Two bags make 16, and 4 more gives 20.","{""questionNumber"":""Q93"",""questionType"":""mcq"",""subject"":""Maths"",""grade"":4,""topic"":""Variables & Expressions"",""subtopic"":""Evaluating Expressions"",""learning_objective"":""Students can substitute a value for a variable and evaluate a simple expression"",""focus"":""context_interpretation""}"
94,tvei4t7-seekm5z-lscsa1ybu-q94-mcq,Q94,mcq,"Look at the two expressions with r = 5: r + 7 and 2r. After you work them out, choose the sentence that matches the results.",Maths,4,Variables & Expressions,Evaluating Expressions,Students can substitute a value for a variable and evaluate a simple expression,Analyzing,medium,2,"MCQ for Grade 4 Variables & Expressions: Evaluating Expressions, aligned to Students can substitute a value for a variable and evaluate a simple expression.","[{""text"":""r + 7 is greater than 2r."",""correct"":true},{""text"":""r + 7 is less than 2r."",""correct"":false},{""text"":""r + 7 and 2r are equal."",""correct"":false},{""text"":""Both expressions are 7."",""correct"":false}]","You got it! With r = 5, r + 7 = 12 and 2r = 10, so r + 7 is greater.","{""questionNumber"":""Q94"",""questionType"":""mcq"",""subject"":""Maths"",""grade"":4,""topic"":""Variables & Expressions"",""subtopic"":""Evaluating Expressions"",""learning_objective"":""Students can substitute a value for a variable and evaluate a simple expression"",""focus"":""compare_or_judge""}"
95,tvei4t7-seekm5z-lscsa1ybu-q95-mcq,Q95,mcq,Choose the method that correctly solves 2(m + 3) when m = 4 for a robot's beep score.,Maths,4,Variables & Expressions,Evaluating Expressions,Students can substitute a value for a variable and evaluate a simple expression,Analyzing,medium,2,"MCQ for Grade 4 Variables & Expressions: Evaluating Expressions, aligned to Students can substitute a value for a variable and evaluate a simple expression.","[{""text"":""Put in 4 first: 2(4 + 3) = 2 × 7 = 14"",""correct"":true},{""text"":""Do 2 × 4 + 3 = 11"",""correct"":false},{""text"":""Add 3 + 4 = 7 and stop"",""correct"":false},{""text"":""Do 2 + 4 + 3 = 9"",""correct"":false}]","Excellent! The brackets mean add first: 4 + 3 = 7, then multiply by 2 to get 14. The other methods skip the brackets.","{""questionNumber"":""Q95"",""questionType"":""mcq"",""subject"":""Maths"",""grade"":4,""topic"":""Variables & Expressions"",""subtopic"":""Evaluating Expressions"",""learning_objective"":""Students can substitute a value for a variable and evaluate a simple expression"",""focus"":""operation_reasoning""}"
96,tvei4t7-seekm5z-lscsa1ybu-q96-mcq,Q96,mcq,"Pick the correct value of 4n - 3 when n = 6, and then share that number equally into 3 small bowls. What number goes in each bowl?",Maths,4,Variables & Expressions,Evaluating Expressions,Students can substitute a value for a variable and evaluate a simple expression,Applying,medium,2,"MCQ for Grade 4 Variables & Expressions: Evaluating Expressions, aligned to Students can substitute a value for a variable and evaluate a simple expression.","[{""text"":""7"",""correct"":true},{""text"":""21"",""correct"":false},{""text"":""9"",""correct"":false},{""text"":""5"",""correct"":false}]","Super job! First, 4 × 6 - 3 = 24 - 3 = 21. Then 21 shared into 3 bowls is 7 each.","{""questionNumber"":""Q96"",""questionType"":""mcq"",""subject"":""Maths"",""grade"":4,""topic"":""Variables & Expressions"",""subtopic"":""Evaluating Expressions"",""learning_objective"":""Students can substitute a value for a variable and evaluate a simple expression"",""focus"":""multi_step_application""}"
97,tvei4t7-seekm5z-lscsa1ybu-q97-mcq,Q97,mcq,Decide which claim about y + y + 2 when y = 5 is true after 3 more marbles are added.,Maths,4,Variables & Expressions,Evaluating Expressions,Students can substitute a value for a variable and evaluate a simple expression,Understanding,medium,2,"MCQ for Grade 4 Variables & Expressions: Evaluating Expressions, aligned to Students can substitute a value for a variable and evaluate a simple expression.","[{""text"":""The new total is 15."",""correct"":true},{""text"":""The new total is 12."",""correct"":false},{""text"":""The new total is 10."",""correct"":false},{""text"":""The new total is 17."",""correct"":false}]",Great job! y + y + 2 becomes 5 + 5 + 2 = 12. Then 3 more makes 15.,"{""questionNumber"":""Q97"",""questionType"":""mcq"",""subject"":""Maths"",""grade"":4,""topic"":""Variables & Expressions"",""subtopic"":""Evaluating Expressions"",""learning_objective"":""Students can substitute a value for a variable and evaluate a simple expression"",""focus"":""statement_evaluation""}"
98,tvei4t7-seekm5z-lscsa1ybu-q98-mcq,Q98,mcq,"A penguin game gives 3h + 2 points. When h = 4, a treasure chest gives 5 extra points. Choose the final score.",Maths,4,Variables & Expressions,Evaluating Expressions,Students can substitute a value for a variable and evaluate a simple expression,Applying,medium,2,"MCQ for Grade 4 Variables & Expressions: Evaluating Expressions, aligned to Students can substitute a value for a variable and evaluate a simple expression.","[{""text"":""19"",""correct"":true},{""text"":""14"",""correct"":false},{""text"":""17"",""correct"":false},{""text"":""12"",""correct"":false}]","Nice one! First, 3 × 4 + 2 = 14. Then add 5 more points to get 19.","{""questionNumber"":""Q98"",""questionType"":""mcq"",""subject"":""Maths"",""grade"":4,""topic"":""Variables & Expressions"",""subtopic"":""Evaluating Expressions"",""learning_objective"":""Students can substitute a value for a variable and evaluate a simple expression"",""focus"":""context_interpretation""}"
99,tvei4t7-seekm5z-lscsa1ybu-q99-mcq,Q99,mcq,Compare the two results when t = 3: 5t - 1 and 3t + 4. Then choose the correct comparison.,Maths,4,Variables & Expressions,Evaluating Expressions,Students can substitute a value for a variable and evaluate a simple expression,Analyzing,medium,2,"MCQ for Grade 4 Variables & Expressions: Evaluating Expressions, aligned to Students can substitute a value for a variable and evaluate a simple expression.","[{""text"":""5t - 1 is greater than 3t + 4."",""correct"":true},{""text"":""5t - 1 is less than 3t + 4."",""correct"":false},{""text"":""The two expressions are equal."",""correct"":false},{""text"":""Both expressions equal 10."",""correct"":false}]","Well spotted! 5 × 3 - 1 = 14 and 3 × 3 + 4 = 13, so the first expression is greater.","{""questionNumber"":""Q99"",""questionType"":""mcq"",""subject"":""Maths"",""grade"":4,""topic"":""Variables & Expressions"",""subtopic"":""Evaluating Expressions"",""learning_objective"":""Students can substitute a value for a variable and evaluate a simple expression"",""focus"":""compare_or_judge""}"
100,tvei4t7-seekm5z-lscsa1ybu-q100-mcq,Q100,mcq,"Each train track set has 2 loops and b bridges. There are 3 sets. When b = 4, first find the total pieces in the 3 sets, then add 2 bonus flags. What is the total number of pieces?",Maths,4,Variables & Expressions,Evaluating Expressions,Students can substitute a value for a variable and evaluate a simple expression,Applying,medium,2,"MCQ for Grade 4 Variables & Expressions: Evaluating Expressions, aligned to Students can substitute a value for a variable and evaluate a simple expression.","[{""text"":""20"",""correct"":true},{""text"":""18"",""correct"":false},{""text"":""14"",""correct"":false},{""text"":""12"",""correct"":false}]","Substitute b = 4. Each set has 2 + 4 = 6 pieces. For 3 sets, 3 × 6 = 18 pieces. Then add 2 bonus flags: 18 + 2 = 20. So the total number of pieces is 20. 18 forgets to add the bonus flags.","{""questionNumber"":""Q100"",""questionType"":""mcq"",""subject"":""Maths"",""grade"":4,""topic"":""Variables & Expressions"",""subtopic"":""Evaluating Expressions"",""learning_objective"":""Students can substitute a value for a variable and evaluate a simple expression"",""focus"":""representation_translation""}"
101,tvei4t7-seekm5z-lscsa1ybu-q101-mcq,Q101,mcq,"Choose the correct result for 7 + 2c when c = 5, then take away 6 crackers that were eaten. Which number is left?",Maths,4,Variables & Expressions,Evaluating Expressions,Students can substitute a value for a variable and evaluate a simple expression,Applying,medium,2,"MCQ for Grade 4 Variables & Expressions: Evaluating Expressions, aligned to Students can substitute a value for a variable and evaluate a simple expression.","[{""text"":""11"",""correct"":true},{""text"":""17"",""correct"":false},{""text"":""9"",""correct"":false},{""text"":""6"",""correct"":false}]","Good job! First, 7 + 2 × 5 = 17. Then 17 - 6 = 11.","{""questionNumber"":""Q101"",""questionType"":""mcq"",""subject"":""Maths"",""grade"":4,""topic"":""Variables & Expressions"",""subtopic"":""Evaluating Expressions"",""learning_objective"":""Students can substitute a value for a variable and evaluate a simple expression"",""focus"":""multi_step_application""}"
102,tvei4t7-seekm5z-lscsa1ybu-q102-mcq,Q102,mcq,Choose the sentence that is correct about 2(q + 1) when q = 6 and then 4 more buttons are added.,Maths,4,Variables & Expressions,Evaluating Expressions,Students can substitute a value for a variable and evaluate a simple expression,Understanding,medium,2,"MCQ for Grade 4 Variables & Expressions: Evaluating Expressions, aligned to Students can substitute a value for a variable and evaluate a simple expression.","[{""text"":""The final number is 18."",""correct"":true},{""text"":""The final number is 14."",""correct"":false},{""text"":""The final number is 16."",""correct"":false},{""text"":""The final number is 12."",""correct"":false}]","Lovely work! Inside the brackets first: 6 + 1 = 7. Then 2 × 7 = 14, and 4 more makes 18.","{""questionNumber"":""Q102"",""questionType"":""mcq"",""subject"":""Maths"",""grade"":4,""topic"":""Variables & Expressions"",""subtopic"":""Evaluating Expressions"",""learning_objective"":""Students can substitute a value for a variable and evaluate a simple expression"",""focus"":""statement_evaluation""}"
103,tvei4t7-seekm5z-lscsa1ybu-q103-mcq,Q103,mcq,"A zoo snack stand packs 4 apple slices and s banana chips in each cup. There are 3 cups. When s = 2, 5 extra grapes are dropped in. Choose the total number of snack pieces.",Maths,4,Variables & Expressions,Evaluating Expressions,Students can substitute a value for a variable and evaluate a simple expression,Applying,medium,2,"MCQ for Grade 4 Variables & Expressions: Evaluating Expressions, aligned to Students can substitute a value for a variable and evaluate a simple expression.","[{""text"":""23"",""correct"":true},{""text"":""18"",""correct"":false},{""text"":""21"",""correct"":false},{""text"":""17"",""correct"":false}]","Great! Each cup has 4 + 2 = 6 pieces. Three cups make 18, then 5 more gives 23.","{""questionNumber"":""Q103"",""questionType"":""mcq"",""subject"":""Maths"",""grade"":4,""topic"":""Variables & Expressions"",""subtopic"":""Evaluating Expressions"",""learning_objective"":""Students can substitute a value for a variable and evaluate a simple expression"",""focus"":""context_interpretation""}"
104,tvei4t7-seekm5z-lscsa1ybu-q104-mcq,Q104,mcq,"Look at the expressions below with k = 4: 2k + 8 and 5k - 4. After evaluating both, pick the right sentence.",Maths,4,Variables & Expressions,Evaluating Expressions,Students can substitute a value for a variable and evaluate a simple expression,Analyzing,medium,2,"MCQ for Grade 4 Variables & Expressions: Evaluating Expressions, aligned to Students can substitute a value for a variable and evaluate a simple expression.","[{""text"":""The two expressions are equal."",""correct"":true},{""text"":""2k + 8 is greater."",""correct"":false},{""text"":""5k - 4 is greater."",""correct"":false},{""text"":""Both expressions equal 8."",""correct"":false}]","Excellent checking! 2 × 4 + 8 = 16 and 5 × 4 - 4 = 16, so they are equal.","{""questionNumber"":""Q104"",""questionType"":""mcq"",""subject"":""Maths"",""grade"":4,""topic"":""Variables & Expressions"",""subtopic"":""Evaluating Expressions"",""learning_objective"":""Students can substitute a value for a variable and evaluate a simple expression"",""focus"":""compare_or_judge""}"
105,tvei4t7-seekm5z-lscsa1ybu-q105-mcq,Q105,mcq,"Choose the method that correctly solves 9 - 2g when g = 3, and then doubles the answer for a game prize.",Maths,4,Variables & Expressions,Evaluating Expressions,Students can substitute a value for a variable and evaluate a simple expression,Analyzing,medium,2,"MCQ for Grade 4 Variables & Expressions: Evaluating Expressions, aligned to Students can substitute a value for a variable and evaluate a simple expression.","[{""text"":""Substitute 3: 9 - 2 × 3 = 3, then double to get 6"",""correct"":true},{""text"":""Do 9 - 2 = 7, then 7 × 3 = 21"",""correct"":false},{""text"":""Do 9 - 6 = 6, then double to get 12"",""correct"":false},{""text"":""Do 2 × 3 = 5, then 9 - 5 = 4, then double to get 8"",""correct"":false}]","Brilliant! First 2 × 3 = 6, then 9 - 6 = 3, and doubling 3 gives 6. The other choices make a step mistake.","{""questionNumber"":""Q105"",""questionType"":""mcq"",""subject"":""Maths"",""grade"":4,""topic"":""Variables & Expressions"",""subtopic"":""Evaluating Expressions"",""learning_objective"":""Students can substitute a value for a variable and evaluate a simple expression"",""focus"":""error_correction""}"
106,tvei4t7-seekm5z-lscsa1ybu-q106-mcq,Q106,mcq,Find the value of a + 6 when a = 6. Then split that total into 2 equal teams. How many are on each team?,Maths,4,Variables & Expressions,Evaluating Expressions,Students can substitute a value for a variable and evaluate a simple expression,Applying,medium,2,"MCQ for Grade 4 Variables & Expressions: Evaluating Expressions, aligned to Students can substitute a value for a variable and evaluate a simple expression.","[{""text"":""6"",""correct"":true},{""text"":""12"",""correct"":false},{""text"":""7"",""correct"":false},{""text"":""3"",""correct"":false}]","First substitute a = 6 into a + 6. This gives 6 + 6 = 12. Then split 12 into 2 equal teams: 12 ÷ 2 = 6. So each team has 6. 12 is the total before splitting, not the number on each team.","{""questionNumber"":""Q106"",""questionType"":""mcq"",""subject"":""Maths"",""grade"":4,""topic"":""Variables & Expressions"",""subtopic"":""Evaluating Expressions"",""learning_objective"":""Students can substitute a value for a variable and evaluate a simple expression"",""focus"":""multi_step_application""}"
107,tvei4t7-seekm5z-lscsa1ybu-q107-mcq,Q107,mcq,Select the true statement about 4m + 2 when m = 2 and then 3 more toy cars are added.,Maths,4,Variables & Expressions,Evaluating Expressions,Students can substitute a value for a variable and evaluate a simple expression,Understanding,medium,2,"MCQ for Grade 4 Variables & Expressions: Evaluating Expressions, aligned to Students can substitute a value for a variable and evaluate a simple expression.","[{""text"":""The final total is 13."",""correct"":true},{""text"":""The final total is 10."",""correct"":false},{""text"":""The final total is 11."",""correct"":false},{""text"":""The final total is 8."",""correct"":false}]","You’re doing great! 4 × 2 + 2 = 10, and 3 more makes 13.","{""questionNumber"":""Q107"",""questionType"":""mcq"",""subject"":""Maths"",""grade"":4,""topic"":""Variables & Expressions"",""subtopic"":""Evaluating Expressions"",""learning_objective"":""Students can substitute a value for a variable and evaluate a simple expression"",""focus"":""statement_evaluation""}"
108,tvei4t7-seekm5z-lscsa1ybu-q108-mcq,Q108,mcq,"A pirate chest holds c gold coins and 3 silver coins. There are 4 chests. When c = 2, 6 shiny gems are added too. Choose the total number of things in all the chests and gems.",Maths,4,Variables & Expressions,Evaluating Expressions,Students can substitute a value for a variable and evaluate a simple expression,Applying,medium,2,"MCQ for Grade 4 Variables & Expressions: Evaluating Expressions, aligned to Students can substitute a value for a variable and evaluate a simple expression.","[{""text"":""26"",""correct"":true},{""text"":""20"",""correct"":false},{""text"":""14"",""correct"":false},{""text"":""24"",""correct"":false}]","Great solving! Each chest has 2 + 3 = 5 things. Four chests make 20, and 6 more gems make 26.","{""questionNumber"":""Q108"",""questionType"":""mcq"",""subject"":""Maths"",""grade"":4,""topic"":""Variables & Expressions"",""subtopic"":""Evaluating Expressions"",""learning_objective"":""Students can substitute a value for a variable and evaluate a simple expression"",""focus"":""context_interpretation""}"
109,tvei4t7-seekm5z-lscsa1ybu-q109-mcq,Q109,mcq,"Decide which comparison is correct when w = 6: 2w + 1 and w + 8. After evaluating, choose the right answer.",Maths,4,Variables & Expressions,Evaluating Expressions,Students can substitute a value for a variable and evaluate a simple expression,Analyzing,medium,2,"MCQ for Grade 4 Variables & Expressions: Evaluating Expressions, aligned to Students can substitute a value for a variable and evaluate a simple expression.","[{""text"":""2w + 1 is less than w + 8."",""correct"":true},{""text"":""2w + 1 is greater than w + 8."",""correct"":false},{""text"":""The two expressions are equal."",""correct"":false},{""text"":""Both expressions equal 12."",""correct"":false}]","Good thinking! 2 × 6 + 1 = 13 and 6 + 8 = 14, so 2w + 1 is less.","{""questionNumber"":""Q109"",""questionType"":""mcq"",""subject"":""Maths"",""grade"":4,""topic"":""Variables & Expressions"",""subtopic"":""Evaluating Expressions"",""learning_objective"":""Students can substitute a value for a variable and evaluate a simple expression"",""focus"":""compare_or_judge""}"
110,tvei4t7-seekm5z-lscsa1ybu-q110-mcq,Q110,mcq,"Choose the equation that matches this playground story: each hopscotch path has h squares and 2 stars painted on it. There are 2 paths. When h = 5, 3 extra stars are painted later. Which total is correct?",Maths,4,Variables & Expressions,Evaluating Expressions,Students can substitute a value for a variable and evaluate a simple expression,Applying,medium,2,"MCQ for Grade 4 Variables & Expressions: Evaluating Expressions, aligned to Students can substitute a value for a variable and evaluate a simple expression.","[{""text"":""17"",""correct"":true},{""text"":""14"",""correct"":false},{""text"":""13"",""correct"":false},{""text"":""10"",""correct"":false}]","Excellent! Each path has 5 + 2 = 7. Two paths make 14, then 3 more stars give 17.","{""questionNumber"":""Q110"",""questionType"":""mcq"",""subject"":""Maths"",""grade"":4,""topic"":""Variables & Expressions"",""subtopic"":""Evaluating Expressions"",""learning_objective"":""Students can substitute a value for a variable and evaluate a simple expression"",""focus"":""representation_translation""}"
111,tvei4t7-seekm5z-lscsa1ybu-q111-mcq,Q111,mcq,"Pick the correct value of 3d + 5 when d = 3, and then subtract 2 balloons that floated away. Which number is left?",Maths,4,Variables & Expressions,Evaluating Expressions,Students can substitute a value for a variable and evaluate a simple expression,Applying,medium,2,"MCQ for Grade 4 Variables & Expressions: Evaluating Expressions, aligned to Students can substitute a value for a variable and evaluate a simple expression.","[{""text"":""12"",""correct"":true},{""text"":""14"",""correct"":false},{""text"":""11"",""correct"":false},{""text"":""7"",""correct"":false}]","Well done! 3 × 3 + 5 = 14, and 14 - 2 = 12.","{""questionNumber"":""Q111"",""questionType"":""mcq"",""subject"":""Maths"",""grade"":4,""topic"":""Variables & Expressions"",""subtopic"":""Evaluating Expressions"",""learning_objective"":""Students can substitute a value for a variable and evaluate a simple expression"",""focus"":""multi_step_application""}"
112,tvei4t7-seekm5z-lscsa1ybu-q112-mcq,Q112,mcq,Decide which claim about 10 - 2f when f = 4 is true after 5 bonus points are added.,Maths,4,Variables & Expressions,Evaluating Expressions,Students can substitute a value for a variable and evaluate a simple expression,Understanding,medium,2,"MCQ for Grade 4 Variables & Expressions: Evaluating Expressions, aligned to Students can substitute a value for a variable and evaluate a simple expression.","[{""text"":""The final number is 7."",""correct"":true},{""text"":""The final number is 13."",""correct"":false},{""text"":""The final number is 3."",""correct"":false},{""text"":""The final number is 9."",""correct"":false}]",Great job! 10 - 2 × 4 = 10 - 8 = 2. Then add 5 to get 7.,"{""questionNumber"":""Q112"",""questionType"":""mcq"",""subject"":""Maths"",""grade"":4,""topic"":""Variables & Expressions"",""subtopic"":""Evaluating Expressions"",""learning_objective"":""Students can substitute a value for a variable and evaluate a simple expression"",""focus"":""statement_evaluation""}"
113,tvei4t7-seekm5z-lscsa1ybu-q113-mcq,Q113,mcq,"A sticker robot prints 2s + 3 stickers. When s = 6, 4 stickers peel off. Choose the number of stickers left.",Maths,4,Variables & Expressions,Evaluating Expressions,Students can substitute a value for a variable and evaluate a simple expression,Applying,medium,2,"MCQ for Grade 4 Variables & Expressions: Evaluating Expressions, aligned to Students can substitute a value for a variable and evaluate a simple expression.","[{""text"":""11"",""correct"":true},{""text"":""15"",""correct"":false},{""text"":""13"",""correct"":false},{""text"":""9"",""correct"":false}]",Nice work! 2 × 6 + 3 = 15. Then 15 - 4 = 11 stickers left.,"{""questionNumber"":""Q113"",""questionType"":""mcq"",""subject"":""Maths"",""grade"":4,""topic"":""Variables & Expressions"",""subtopic"":""Evaluating Expressions"",""learning_objective"":""Students can substitute a value for a variable and evaluate a simple expression"",""focus"":""context_interpretation""}"
114,tvei4t7-seekm5z-lscsa1ybu-q114-mcq,Q114,mcq,Look at the two expressions with x = 7: x + 5 and 2x - 1. Choose the sentence that matches both results.,Maths,4,Variables & Expressions,Evaluating Expressions,Students can substitute a value for a variable and evaluate a simple expression,Analyzing,medium,2,"MCQ for Grade 4 Variables & Expressions: Evaluating Expressions, aligned to Students can substitute a value for a variable and evaluate a simple expression.","[{""text"":""2x - 1 is greater by 1."",""correct"":true},{""text"":""x + 5 is greater by 1."",""correct"":false},{""text"":""The two expressions are equal."",""correct"":false},{""text"":""2x - 1 is greater by 2."",""correct"":false}]","Super! x + 5 = 12 and 2x - 1 = 13, so 2x - 1 is greater by 1.","{""questionNumber"":""Q114"",""questionType"":""mcq"",""subject"":""Maths"",""grade"":4,""topic"":""Variables & Expressions"",""subtopic"":""Evaluating Expressions"",""learning_objective"":""Students can substitute a value for a variable and evaluate a simple expression"",""focus"":""compare_or_judge""}"
