rowNumber,queueId,questionNumber,questionType,questionText,subject,grade,topic,subtopic,learningObjective,bloomsLevel,difficultyLevel,difficultyRating,summary,options,explanation,generationMetadata
97,tmcags0-spa18xr-lscftp3n2-q101-mcq,Q101,mcq,"Choose the correct result for this sweet-shop sign. The shape has side lengths 14 cm, 4 cm, 5 cm, 3 cm, 9 cm, and 7 cm around the outside. Pick the perimeter.",Maths,4,Measurement & Conversion,Perimeter & Area,Students can find the perimeter of rectilinear shapes,Applying,medium,3,"MCQ for Grade 4 Measurement & Conversion: Perimeter & Area, aligned to Students can find the perimeter of rectilinear shapes.","[{""text"":""42 cm"",""correct"":true},{""text"":""35 cm"",""correct"":false},{""text"":""28 cm"",""correct"":false},{""text"":""46 cm"",""correct"":false}]",Great work! Add all the side lengths: 14 + 4 + 5 + 3 + 9 + 7 = 42 cm. The other answers come from missing or overcounting sides.,"{""questionNumber"":""Q101"",""questionType"":""mcq"",""subject"":""Maths"",""grade"":4,""topic"":""Measurement & Conversion"",""subtopic"":""Perimeter & Area"",""learning_objective"":""Students can find the perimeter of rectilinear shapes"",""focus"":""which_value""}"
98,tmcags0-spa18xr-lscftp3n2-q102-mcq,Q102,mcq,"Two toy mats have these shapes. Shape R has side lengths 7 cm, 5 cm, 4 cm, 2 cm, 9 cm, and 8 cm. Shape S is a 10 cm by 7 cm rectangle with a 3 cm by 2 cm corner cut out. Which statement is correct?",Maths,4,Measurement & Conversion,Perimeter & Area,Students can find the perimeter of rectilinear shapes,Analyzing,medium,3,"MCQ for Grade 4 Measurement & Conversion: Perimeter & Area, aligned to Students can find the perimeter of rectilinear shapes.","[{""text"":""Shape R has a perimeter 1 cm larger than Shape S."",""correct"":true},{""text"":""Shape S has a perimeter 1 cm larger than Shape R."",""correct"":false},{""text"":""Both shapes have perimeter 35 cm."",""correct"":false},{""text"":""Shape R has a perimeter 5 cm smaller than Shape S."",""correct"":false}]","Shape R has perimeter 7 + 5 + 4 + 2 + 9 + 8 = 35 cm. Shape S has the same perimeter as the 10 cm by 7 cm rectangle, so 2 × (10 + 7) = 34 cm. Therefore, Shape R is 1 cm larger than Shape S. That rules out the choices saying Shape S is larger, both are 35 cm, or Shape R is smaller.","{""questionNumber"":""Q102"",""questionType"":""mcq"",""subject"":""Maths"",""grade"":4,""topic"":""Measurement & Conversion"",""subtopic"":""Perimeter & Area"",""learning_objective"":""Students can find the perimeter of rectilinear shapes"",""focus"":""compare_or_judge""}"
99,tmcags0-spa18xr-lscftp3n2-q103-mcq,Q103,mcq,"A snack trail goes around a blocky path with side lengths 11 m, 6 m, 2 m, 5 m, 8 m, and 9 m. Choose the distance around the whole path.",Maths,4,Measurement & Conversion,Perimeter & Area,Students can find the perimeter of rectilinear shapes,Applying,medium,3,"MCQ for Grade 4 Measurement & Conversion: Perimeter & Area, aligned to Students can find the perimeter of rectilinear shapes.","[{""text"":""41 m"",""correct"":true},{""text"":""32 m"",""correct"":false},{""text"":""30 m"",""correct"":false},{""text"":""47 m"",""correct"":false}]",Nice job! Add all the outside sides: 11 + 6 + 2 + 5 + 8 + 9 = 41 m. Perimeter is the total distance all the way around.,"{""questionNumber"":""Q103"",""questionType"":""mcq"",""subject"":""Maths"",""grade"":4,""topic"":""Measurement & Conversion"",""subtopic"":""Perimeter & Area"",""learning_objective"":""Students can find the perimeter of rectilinear shapes"",""focus"":""context_interpretation""}"
100,tmcags0-spa18xr-lscftp3n2-q104-mcq,Q104,mcq,Compare these two answers for a puzzle shape made from a 16 cm by 11 cm rectangle with a 6 cm by 4 cm corner cut out: one answer is 54 cm and another answer is 44 cm. Decide which answer is correct.,Maths,4,Measurement & Conversion,Perimeter & Area,Students can find the perimeter of rectilinear shapes,Evaluating,medium,3,"MCQ for Grade 4 Measurement & Conversion: Perimeter & Area, aligned to Students can find the perimeter of rectilinear shapes.","[{""text"":""44 cm is correct."",""correct"":false},{""text"":""54 cm is correct."",""correct"":true},{""text"":""Both answers are correct."",""correct"":false},{""text"":""Neither answer can be found from this information."",""correct"":false}]","Excellent checking! The L-shape keeps the same perimeter as the 16 by 11 rectangle: 2 × (16 + 11) = 54 cm. The 44 cm answer came from subtracting the cut-out, which is a common mistake.","{""questionNumber"":""Q104"",""questionType"":""mcq"",""subject"":""Maths"",""grade"":4,""topic"":""Measurement & Conversion"",""subtopic"":""Perimeter & Area"",""learning_objective"":""Students can find the perimeter of rectilinear shapes"",""focus"":""error_correction""}"
101,tmcags0-spa18xr-lscftp3n2-q106-mcq,Q106,mcq,Choose the correct result for this castle floor shape made from an 18 cm by 12 cm rectangle with a 5 cm by 3 cm corner cut out.,Maths,4,Measurement & Conversion,Perimeter & Area,Students can find the perimeter of rectilinear shapes,Applying,medium,3,"MCQ for Grade 4 Measurement & Conversion: Perimeter & Area, aligned to Students can find the perimeter of rectilinear shapes.","[{""text"":""60 cm"",""correct"":true},{""text"":""52 cm"",""correct"":false},{""text"":""38 cm"",""correct"":false},{""text"":""66 cm"",""correct"":false}]",Super! Use the full rectangle: 2 × (18 + 12) = 60 cm. The cut-out does not change the total distance around.,"{""questionNumber"":""Q106"",""questionType"":""mcq"",""subject"":""Maths"",""grade"":4,""topic"":""Measurement & Conversion"",""subtopic"":""Perimeter & Area"",""learning_objective"":""Students can find the perimeter of rectilinear shapes"",""focus"":""multi_step_application""}"
102,tmcags0-spa18xr-lscftp3n2-q107-mcq,Q107,mcq,"Select the true statement about this sticker shape. Its side lengths around the outside are 5 cm, 8 cm, 2 cm, 6 cm, 7 cm, and 10 cm.",Maths,4,Measurement & Conversion,Perimeter & Area,Students can find the perimeter of rectilinear shapes,Understanding,medium,3,"MCQ for Grade 4 Measurement & Conversion: Perimeter & Area, aligned to Students can find the perimeter of rectilinear shapes.","[{""text"":""The perimeter is 38 cm."",""correct"":true},{""text"":""The perimeter is 19 cm because opposite sides match."",""correct"":false},{""text"":""The perimeter is 30 cm because only longer sides count."",""correct"":false},{""text"":""The perimeter is 48 cm because 10 gets counted twice."",""correct"":false}]","Great thinking! Add every outside side: 5 + 8 + 2 + 6 + 7 + 10 = 38 cm. Perimeter means all the way around, not just some sides.","{""questionNumber"":""Q107"",""questionType"":""mcq"",""subject"":""Maths"",""grade"":4,""topic"":""Measurement & Conversion"",""subtopic"":""Perimeter & Area"",""learning_objective"":""Students can find the perimeter of rectilinear shapes"",""focus"":""which_statement""}"
103,tmcags0-spa18xr-lscftp3n2-q108-mcq,Q108,mcq,"A monkey swings around a jungle gym path shaped like an L. The full top is 17 m, the full left side is 9 m, and the corner cut-out is 4 m across and 2 m down. Choose the perimeter.",Maths,4,Measurement & Conversion,Perimeter & Area,Students can find the perimeter of rectilinear shapes,Applying,medium,3,"MCQ for Grade 4 Measurement & Conversion: Perimeter & Area, aligned to Students can find the perimeter of rectilinear shapes.","[{""text"":""52 m"",""correct"":true},{""text"":""46 m"",""correct"":false},{""text"":""32 m"",""correct"":false},{""text"":""56 m"",""correct"":false}]",You’re doing great! The perimeter matches the 17 m by 9 m rectangle: 2 × (17 + 9) = 52 m. Taking away the cut-out lengths would be a mistake here.,"{""questionNumber"":""Q108"",""questionType"":""mcq"",""subject"":""Maths"",""grade"":4,""topic"":""Measurement & Conversion"",""subtopic"":""Perimeter & Area"",""learning_objective"":""Students can find the perimeter of rectilinear shapes"",""focus"":""context_interpretation""}"
104,tmcags0-spa18xr-lscftp3n2-q109-mcq,Q109,mcq,"Look at the two methods for a block path with side lengths 9 cm, 5 cm, 4 cm, 2 cm, 7 cm, and 8 cm. Method 1 adds all six numbers. Method 2 adds only 9, 5, 7, and 8. Pick the better method.",Maths,4,Measurement & Conversion,Perimeter & Area,Students can find the perimeter of rectilinear shapes,Evaluating,medium,3,"MCQ for Grade 4 Measurement & Conversion: Perimeter & Area, aligned to Students can find the perimeter of rectilinear shapes.","[{""text"":""Method 1, because perimeter uses every outside side."",""correct"":true},{""text"":""Method 2, because short sides do not matter."",""correct"":false},{""text"":""Both methods are correct because they use side lengths."",""correct"":false},{""text"":""Neither method works because perimeter needs multiplication."",""correct"":false}]","Nice reasoning! Perimeter is the total around the shape, so every outside side must be added. Method 1 is correct.","{""questionNumber"":""Q109"",""questionType"":""mcq"",""subject"":""Maths"",""grade"":4,""topic"":""Measurement & Conversion"",""subtopic"":""Perimeter & Area"",""learning_objective"":""Students can find the perimeter of rectilinear shapes"",""focus"":""error_correction""}"
105,tmcags0-spa18xr-lscftp3n2-q110-mcq,Q110,mcq,Choose the method correctly solves this toy shelf shape made from a 14 cm by 8 cm rectangle with a 2 cm by 5 cm corner cut out.,Maths,4,Measurement & Conversion,Perimeter & Area,Students can find the perimeter of rectilinear shapes,Applying,medium,3,"MCQ for Grade 4 Measurement & Conversion: Perimeter & Area, aligned to Students can find the perimeter of rectilinear shapes.","[{""text"":""2 × (14 + 8) = 44 cm"",""correct"":true},{""text"":""14 + 8 + 2 + 5 = 29 cm"",""correct"":false},{""text"":""44 - 2 - 5 = 37 cm"",""correct"":false},{""text"":""14 × 8 = 112 cm"",""correct"":false}]","Wonderful! The cut-out corner keeps the perimeter the same as the full rectangle, so 2 × (14 + 8) = 44 cm is right.","{""questionNumber"":""Q110"",""questionType"":""mcq"",""subject"":""Maths"",""grade"":4,""topic"":""Measurement & Conversion"",""subtopic"":""Perimeter & Area"",""learning_objective"":""Students can find the perimeter of rectilinear shapes"",""focus"":""operation_reasoning""}"
106,tmcags0-spa18xr-lscftp3n2-q112-mcq,Q112,mcq,"Compare the perimeters of these two rectilinear shapes. Shape A has side lengths 6 cm, 6 cm, 3 cm, 4 cm, 7 cm, and 8 cm. Shape B has side lengths 9 cm, 5 cm, 2 cm, 4 cm, 8 cm, and 6 cm. Which option correctly describes their perimeters?",Maths,4,Measurement & Conversion,Perimeter & Area,Students can find the perimeter of rectilinear shapes,Analyzing,medium,3,"MCQ for Grade 4 Measurement & Conversion: Perimeter & Area, aligned to Students can find the perimeter of rectilinear shapes.","[{""text"":""Shape B has the greater perimeter by 1 cm."",""correct"":false},{""text"":""Shape A has the greater perimeter by 1 cm."",""correct"":false},{""text"":""Both shapes have perimeter 34 cm."",""correct"":true},{""text"":""Both shapes have perimeter 30 cm."",""correct"":false}]","Shape A has perimeter 6 + 6 + 3 + 4 + 7 + 8 = 34 cm. Shape B has perimeter 9 + 5 + 2 + 4 + 8 + 6 = 34 cm. Since both totals are 34 cm, the correct description is that both shapes have perimeter 34 cm. That means neither shape is greater by 1 cm.","{""questionNumber"":""Q112"",""questionType"":""mcq"",""subject"":""Maths"",""grade"":4,""topic"":""Measurement & Conversion"",""subtopic"":""Perimeter & Area"",""learning_objective"":""Students can find the perimeter of rectilinear shapes"",""focus"":""compare_or_judge""}"
107,tmcags0-spa18xr-lscftp3n2-q113-mcq,Q113,mcq,A tray of cookies is shaped like an L. It comes from a 19 cm by 10 cm rectangle with a 6 cm by 4 cm corner cut out. Choose the distance all the way around the tray.,Maths,4,Measurement & Conversion,Perimeter & Area,Students can find the perimeter of rectilinear shapes,Applying,medium,3,"MCQ for Grade 4 Measurement & Conversion: Perimeter & Area, aligned to Students can find the perimeter of rectilinear shapes.","[{""text"":""58 cm"",""correct"":true},{""text"":""48 cm"",""correct"":false},{""text"":""39 cm"",""correct"":false},{""text"":""68 cm"",""correct"":false}]","Yay, nice work! The perimeter stays the same as the 19 by 10 rectangle: 2 × (19 + 10) = 58 cm. The cut-out does not make it smaller around.","{""questionNumber"":""Q113"",""questionType"":""mcq"",""subject"":""Maths"",""grade"":4,""topic"":""Measurement & Conversion"",""subtopic"":""Perimeter & Area"",""learning_objective"":""Students can find the perimeter of rectilinear shapes"",""focus"":""context_interpretation""}"
108,tmcags0-spa18xr-lscftp3n2-q114-mcq,Q114,mcq,"Compare the two results for a toy maze. One result adds 7 cm, 5 cm, 3 cm, 4 cm, 9 cm, and 8 cm to get 36 cm. Another result says 24 cm because only four sides were used. Decide which result should be chosen.",Maths,4,Measurement & Conversion,Perimeter & Area,Students can find the perimeter of rectilinear shapes,Evaluating,medium,3,"MCQ for Grade 4 Measurement & Conversion: Perimeter & Area, aligned to Students can find the perimeter of rectilinear shapes.","[{""text"":""36 cm should be chosen because all outside sides were added."",""correct"":true},{""text"":""24 cm should be chosen because shapes only have four sides."",""correct"":false},{""text"":""Both results should be chosen."",""correct"":false},{""text"":""Neither result should be chosen because area is needed."",""correct"":false}]","Excellent checking! Perimeter means add every outside side. The 36 cm result uses all six sides, so it is the correct one.","{""questionNumber"":""Q114"",""questionType"":""mcq"",""subject"":""Maths"",""grade"":4,""topic"":""Measurement & Conversion"",""subtopic"":""Perimeter & Area"",""learning_objective"":""Students can find the perimeter of rectilinear shapes"",""focus"":""error_correction""}"
109,tmcags0-spa18xr-lscftp3n2-q115-mcq,Q115,mcq,An L-shaped reading corner is made from a 20 m by 12 m rectangle with a 7 m by 5 m corner cut out. Which equation gives its perimeter?,Maths,4,Measurement & Conversion,Perimeter & Area,Students can find the perimeter of rectilinear shapes,Understanding,medium,3,"MCQ for Grade 4 Measurement & Conversion: Perimeter & Area, aligned to Students can find the perimeter of rectilinear shapes.","[{""text"":""2 × (20 + 12)"",""correct"":true},{""text"":""20 + 12 + 7 + 5"",""correct"":false},{""text"":""2 × (20 + 12) - (7 + 5)"",""correct"":false},{""text"":""20 × 12"",""correct"":false}]","A corner cut-out from a rectangle does not change the total perimeter because the removed 7 m and 5 m edges are replaced by new inside edges of 7 m and 5 m. So the perimeter is still the same as the 20 m by 12 m rectangle: 2 × (20 + 12). Option B counts only some lengths, Option C subtracts lengths that are replaced, and Option D finds area, not perimeter.","{""questionNumber"":""Q115"",""questionType"":""mcq"",""subject"":""Maths"",""grade"":4,""topic"":""Measurement & Conversion"",""subtopic"":""Perimeter & Area"",""learning_objective"":""Students can find the perimeter of rectilinear shapes"",""focus"":""representation_translation""}"
110,tmcags0-spa18xr-lscftp3n2-q117-mcq,Q117,mcq,"Select the true statement about a blocky snack shape with side lengths 8 cm, 4 cm, 2 cm, 7 cm, 9 cm, and 6 cm.",Maths,4,Measurement & Conversion,Perimeter & Area,Students can find the perimeter of rectilinear shapes,Understanding,medium,3,"MCQ for Grade 4 Measurement & Conversion: Perimeter & Area, aligned to Students can find the perimeter of rectilinear shapes.","[{""text"":""Its perimeter is 36 cm."",""correct"":true},{""text"":""Its perimeter is 30 cm because the smallest sides do not count."",""correct"":false},{""text"":""Its perimeter is 18 cm because the total should be halved."",""correct"":false},{""text"":""Its perimeter is 56 cm because 8 and 9 are doubled."",""correct"":false}]",Well done! Add all six sides: 8 + 4 + 2 + 7 + 9 + 6 = 36 cm. Every outside side counts in perimeter.,"{""questionNumber"":""Q117"",""questionType"":""mcq"",""subject"":""Maths"",""grade"":4,""topic"":""Measurement & Conversion"",""subtopic"":""Perimeter & Area"",""learning_objective"":""Students can find the perimeter of rectilinear shapes"",""focus"":""which_statement""}"
111,tmcags0-spa18xr-lscftp3n2-q118-mcq,Q118,mcq,"A squirrel runs around a treehouse deck shaped like an L. The full top is 21 m, the full left side is 13 m, and the corner cut-out is 8 m across and 4 m down. Choose the perimeter of the deck.",Maths,4,Measurement & Conversion,Perimeter & Area,Students can find the perimeter of rectilinear shapes,Applying,medium,3,"MCQ for Grade 4 Measurement & Conversion: Perimeter & Area, aligned to Students can find the perimeter of rectilinear shapes.","[{""text"":""68 m"",""correct"":true},{""text"":""56 m"",""correct"":false},{""text"":""46 m"",""correct"":false},{""text"":""76 m"",""correct"":false}]","Fantastic! Use the full rectangle: 2 × (21 + 13) = 68 m. The cut-out changes the shape, but not the total distance around.","{""questionNumber"":""Q118"",""questionType"":""mcq"",""subject"":""Maths"",""grade"":4,""topic"":""Measurement & Conversion"",""subtopic"":""Perimeter & Area"",""learning_objective"":""Students can find the perimeter of rectilinear shapes"",""focus"":""context_interpretation""}"
112,tmcags0-spa18xr-lscftp3n2-q119-mcq,Q119,mcq,A puzzle path is made from a 12 cm by 7 cm rectangle with a 3 cm by 2 cm corner cut out. Which expression gives the perimeter?,Maths,4,Measurement & Conversion,Perimeter & Area,Students can find the perimeter of rectilinear shapes,Analyzing,medium,3,"MCQ for Grade 4 Measurement & Conversion: Perimeter & Area, aligned to Students can find the perimeter of rectilinear shapes.","[{""text"":""12 + 7 + 12 + 7"",""correct"":true},{""text"":""12 + 7 + 3 + 2"",""correct"":false},{""text"":""12 × 7"",""correct"":false},{""text"":""12 + 12 + 7 + 7 - 3 - 2"",""correct"":false}]","The corner cut-out replaces a 3 cm and a 2 cm outside section with new inside edges of the same lengths, so the total perimeter stays the same as the 12 cm by 7 cm rectangle. That gives 12 + 7 + 12 + 7. Option B does not include the full distance around. Option C is area. Option D subtracts lengths that should not be removed from the perimeter total.","{""questionNumber"":""Q119"",""questionType"":""mcq"",""subject"":""Maths"",""grade"":4,""topic"":""Measurement & Conversion"",""subtopic"":""Perimeter & Area"",""learning_objective"":""Students can find the perimeter of rectilinear shapes"",""focus"":""representation_translation""}"
113,tmcags0-spa18xr-lscftp3n2-q120-mcq,Q120,mcq,"Choose the method correctly solves a toy-block shape with side lengths 9 cm, 4 cm, 5 cm, 2 cm, 11 cm, and 6 cm.",Maths,4,Measurement & Conversion,Perimeter & Area,Students can find the perimeter of rectilinear shapes,Applying,medium,3,"MCQ for Grade 4 Measurement & Conversion: Perimeter & Area, aligned to Students can find the perimeter of rectilinear shapes.","[{""text"":""Add all six side lengths to get 37 cm."",""correct"":true},{""text"":""Multiply 9 × 11 to get 99 cm."",""correct"":false},{""text"":""Add only 9 + 4 + 11 + 6 to get 30 cm."",""correct"":false},{""text"":""Double 9 + 4 to get 26 cm."",""correct"":false}]",Terrific! Perimeter is found by adding every outside side: 9 + 4 + 5 + 2 + 11 + 6 = 37 cm. The other methods leave sides out or use area thinking.,"{""questionNumber"":""Q120"",""questionType"":""mcq"",""subject"":""Maths"",""grade"":4,""topic"":""Measurement & Conversion"",""subtopic"":""Perimeter & Area"",""learning_objective"":""Students can find the perimeter of rectilinear shapes"",""focus"":""operation_reasoning""}"
114,tmcags0-spa18xr-lscftp3n2-q121-mcq,Q121,mcq,"A toy train mat is an L-shape made from a rectangle 9 m long and 7 m wide, with a 3 m by 2 m corner cut out. A label says the perimeter is 32 m. Which option best checks the label?",Maths,4,Measurement & Conversion,Perimeter & Area,Students can find the perimeter of rectilinear shapes,Evaluating,hard,3,"MCQ for Grade 4 Measurement & Conversion: Perimeter & Area, aligned to Students can find the perimeter of rectilinear shapes.","[{""text"":""The label is correct because the rectangle's perimeter is 9 + 7 + 9 + 7 = 32 m, and a corner cut-out replaces removed edges with equal new edges."",""correct"":true},{""text"":""The label is wrong because cutting out the corner always adds both new sides to the old perimeter, making 37 m."",""correct"":false},{""text"":""The label is wrong because the perimeter should be 30 m after subtracting 3 m and 2 m."",""correct"":false},{""text"":""The label is wrong because the perimeter should be 36 m since 3 m and 2 m are counted twice."",""correct"":false}]","First find the rectangle's perimeter: 9 + 7 + 9 + 7 = 32 m. When a corner is cut out, the 3 m and 2 m removed from the outer edge are replaced by new inside edges of 3 m and 2 m, so there is no net change. The perimeter stays 32 m, so the label is correct. The other options wrongly add extra length or subtract lengths that are still replaced on the boundary.","{""questionNumber"":""Q121"",""questionType"":""mcq"",""subject"":""Maths"",""grade"":4,""topic"":""Measurement & Conversion"",""subtopic"":""Perimeter & Area"",""learning_objective"":""Students can find the perimeter of rectilinear shapes"",""focus"":""evaluate_a_claim""}"
115,tmcags0-spa18xr-lscftp3n2-q122-mcq,Q122,mcq,"Select the true statement about this sticker path. The shape is L-shaped. The top side is 11 cm, the left side is 8 cm, the short bottom side is 4 cm, and the short right side is 3 cm. The missing inside sides can be worked out. Choose the correct sentence.",Maths,4,Measurement & Conversion,Perimeter & Area,Students can find the perimeter of rectilinear shapes,Analyzing,hard,3,"MCQ for Grade 4 Measurement & Conversion: Perimeter & Area, aligned to Students can find the perimeter of rectilinear shapes.","[{""text"":""The perimeter is 26 cm because 11 + 8 + 4 + 3 = 26."",""correct"":false},{""text"":""The perimeter is 38 cm because the missing sides are 7 cm and 5 cm."",""correct"":true},{""text"":""The perimeter is 32 cm because the missing sides are 4 cm and 6 cm."",""correct"":false},{""text"":""The perimeter is 44 cm because you double 11 and double 8."",""correct"":false}]","Great job! The missing horizontal side is 11 - 4 = 7 cm, and the missing vertical side is 8 - 3 = 5 cm. Then 11 + 3 + 7 + 5 + 4 + 8 = 38 cm.","{""questionNumber"":""Q122"",""questionType"":""mcq"",""subject"":""Maths"",""grade"":4,""topic"":""Measurement & Conversion"",""subtopic"":""Perimeter & Area"",""learning_objective"":""Students can find the perimeter of rectilinear shapes"",""focus"":""reverse_reasoning""}"
116,tmcags0-spa18xr-lscftp3n2-q123-mcq,Q123,mcq,A bunny garden has an L-shaped fence made from a 12 m by 10 m rectangle with a 4 m by 3 m corner removed. Which explanation correctly shows the perimeter of the fence?,Maths,4,Measurement & Conversion,Perimeter & Area,Students can find the perimeter of rectilinear shapes,Evaluating,hard,3,"MCQ for Grade 4 Measurement & Conversion: Perimeter & Area, aligned to Students can find the perimeter of rectilinear shapes.","[{""text"":""44 m, because the 4 m and 3 m removed from the outside are replaced by new boundary sides of 4 m and 3 m."",""correct"":true},{""text"":""51 m, because you add 12 + 10 + 12 + 10 + 4 + 3."",""correct"":false},{""text"":""37 m, because you subtract the missing corner sides from the rectangle perimeter: 44 − 4 − 3."",""correct"":false},{""text"":""50 m, because a missing corner always adds both new sides to the rectangle perimeter."",""correct"":false}]","The original 12 m by 10 m rectangle has perimeter 2 × (12 + 10) = 44 m. Removing a 4 m by 3 m corner takes away 4 m and 3 m from the outer boundary, but it also creates new boundary sides of 4 m and 3 m. So the total perimeter stays 44 m. Option B incorrectly adds the cut-out lengths on top of the rectangle perimeter idea. Option C subtracts the removed lengths but forgets the new inside boundary. Option D wrongly assumes the corner removal always increases perimeter.","{""questionNumber"":""Q123"",""questionType"":""mcq"",""subject"":""Maths"",""grade"":4,""topic"":""Measurement & Conversion"",""subtopic"":""Perimeter & Area"",""learning_objective"":""Students can find the perimeter of rectilinear shapes"",""focus"":""compare_methods""}"
