rowNumber,queueId,questionNumber,questionType,questionText,subject,grade,topic,subtopic,learningObjective,bloomsLevel,difficultyLevel,difficultyRating,summary,options,explanation,generationMetadata
159,tf4iq5-sasff1zw-lscsw1ikr-q161-mcq,Q161,mcq,"A trail mix bag started with some raisins. Then 1/4 cup of nuts was added. After that, 1/8 cup of trail mix spilled out. The bag ended with 5/8 cup of trail mix. How much raisins were in the bag at the start?",Maths,4,Fractions,Adding & Subtracting Fractions,Students can solve word problems involving addition and subtraction of fractions,Analyzing,hard,4,"MCQ for Grade 4 Fractions: Adding & Subtracting Fractions, aligned to Students can solve word problems involving addition and subtraction of fractions.","[{""text"":""1/4 cup"",""correct"":false},{""text"":""1/2 cup"",""correct"":true},{""text"":""3/8 cup"",""correct"":false},{""text"":""3/4 cup"",""correct"":false}]","Let the starting amount of raisins be the unknown amount. The story means start + 1/4 - 1/8 = 5/8. Change 1/4 to eighths: 1/4 = 2/8. So start + 2/8 - 1/8 = 5/8, which becomes start + 1/8 = 5/8. Therefore start = 4/8 = 1/2 cup. Check: 1/2 + 1/4 = 3/4, and 3/4 - 1/8 = 6/8 - 1/8 = 5/8. The other options do not give the ending amount of 5/8 cup.","{""questionNumber"":""Q161"",""questionType"":""mcq"",""subject"":""Maths"",""grade"":4,""topic"":""Fractions"",""subtopic"":""Adding & Subtracting Fractions"",""learning_objective"":""Students can solve word problems involving addition and subtraction of fractions"",""focus"":""reverse_reasoning with addition and subtraction""}"
160,tf4iq5-sasff1zw-lscsw1ikr-q162-mcq,Q162,mcq,"A box had 7/10 of a set of blocks. Then 2/10 was given away, and after that 1/10 was put back. A claim says the box ends with 5/10 because the changes should be combined first and 3/10 should be subtracted from 7/10. Which statement correctly evaluates that claim?",Maths,4,Fractions,Adding & Subtracting Fractions,Students can solve word problems involving addition and subtraction of fractions,Evaluating,hard,4,"MCQ for Grade 4 Fractions: Adding & Subtracting Fractions, aligned to Students can solve word problems involving addition and subtraction of fractions.","[{""text"":""The claim is correct because 2/10 and 1/10 make a total change of 3/10."",""correct"":false},{""text"":""The claim is incorrect because giving away 2/10 and putting back 1/10 means 7/10 - 2/10 + 1/10 = 6/10."",""correct"":true},{""text"":""The claim is correct because subtraction should always be done before addition."",""correct"":false},{""text"":""The claim is incorrect because the final amount must be 4/10."",""correct"":false}]","The claim is incorrect because the two changes are not both subtraction. Giving away 2/10 means subtract 2/10, but putting back 1/10 means add 1/10. So the correct calculation is 7/10 - 2/10 + 1/10 = 5/10 + 1/10 = 6/10. The answer 5/10 comes from treating the added 1/10 as if it were also taken away.","{""questionNumber"":""Q162"",""questionType"":""mcq"",""subject"":""Maths"",""grade"":4,""topic"":""Fractions"",""subtopic"":""Adding & Subtracting Fractions"",""learning_objective"":""Students can solve word problems involving addition and subtraction of fractions"",""focus"":""evaluate_a_claim""}"
161,tf4iq5-sasff1zw-lscsw1ikr-q164-mcq,Q164,mcq,"A sticker sheet was 3/4 used. In Situation A, 1/6 more of the whole sheet was used. In Situation B, 1/3 of the whole sheet was taken back and became unused again. Which statement correctly compares the two results and explains why?",Maths,4,Fractions,Adding & Subtracting Fractions,Students can solve word problems involving addition and subtraction of fractions,Analyzing,hard,4,"MCQ for Grade 4 Fractions: Adding & Subtracting Fractions, aligned to Students can solve word problems involving addition and subtraction of fractions.","[{""text"":""Situation A gives the greater result because 3/4 + 1/6 = 11/12, while 3/4 - 1/3 = 5/12 in Situation B."",""correct"":true},{""text"":""The two results are equal because both situations start with 3/4 of a sheet used."",""correct"":false},{""text"":""Situation B gives the greater result because subtraction makes the used amount larger here."",""correct"":false},{""text"":""Situation A gives the smaller result because 11/12 is less than 5/12."",""correct"":false}]","Convert to twelfths. In Situation A, 3/4 = 9/12 and 1/6 = 2/12, so 9/12 + 2/12 = 11/12. In Situation B, 1/3 = 4/12, so 9/12 - 4/12 = 5/12. Since 11/12 is greater than 5/12, Situation A gives the greater result. Starting with the same fraction does not make the results equal because one situation adds and the other subtracts.","{""questionNumber"":""Q164"",""questionType"":""mcq"",""subject"":""Maths"",""grade"":4,""topic"":""Fractions"",""subtopic"":""Adding & Subtracting Fractions"",""learning_objective"":""Students can solve word problems involving addition and subtraction of fractions"",""focus"":""compare_methods""}"
162,tf4iq5-sasff1zw-lscsw1ikr-q166-mcq,Q166,mcq,"A cupcake tray had 11/12 of its spaces filled. Then 5/12 of the whole tray were eaten, and later 2/12 of the whole tray were added back. A claim says the tray ends with 14/12 because 11, 5, and 2 were added. Which answer correctly evaluates that reasoning?",Maths,4,Fractions,Adding & Subtracting Fractions,Students can solve word problems involving addition and subtraction of fractions,Analyzing,hard,4,"MCQ for Grade 4 Fractions: Adding & Subtracting Fractions, aligned to Students can solve word problems involving addition and subtraction of fractions.","[{""text"":""The reasoning is correct; the tray ends with 14/12."",""correct"":false},{""text"":""The reasoning is incorrect; the tray ends with 8/12 because 11/12 - 5/12 + 2/12 = 8/12."",""correct"":true},{""text"":""The reasoning is incorrect; the tray ends with 6/12 because only the subtraction matters."",""correct"":false},{""text"":""The reasoning is incorrect; the tray ends with 4/12 because both later changes should be subtracted."",""correct"":false}]","The reasoning is incorrect because the story has one subtraction and one addition. Start with 11/12. After 5/12 are eaten, 11/12 - 5/12 = 6/12. Then add back 2/12: 6/12 + 2/12 = 8/12. So the tray ends with 8/12, not 14/12. The answer 6/12 ignores the amount added back, and 4/12 wrongly subtracts both later changes.","{""questionNumber"":""Q166"",""questionType"":""mcq"",""subject"":""Maths"",""grade"":4,""topic"":""Fractions"",""subtopic"":""Adding & Subtracting Fractions"",""learning_objective"":""Students can solve word problems involving addition and subtraction of fractions"",""focus"":""multi-step subtraction and addition""}"
163,tf4iq5-sasff1zw-lscsw1ikr-q167-mcq,Q167,mcq,"A candy jar was 4/9 full of jelly beans. Then 3/9 more of the jar was filled, and after that 2/9 of the jar was eaten. A claim says the jar ends at 7/9 full because only the adding changes the fullness. Which statement correctly evaluates the claim?",Maths,4,Fractions,Adding & Subtracting Fractions,Students can solve word problems involving addition and subtraction of fractions,Evaluating,hard,4,"MCQ for Grade 4 Fractions: Adding & Subtracting Fractions, aligned to Students can solve word problems involving addition and subtraction of fractions.","[{""text"":""The claim is correct because 4/9 + 3/9 = 7/9."",""correct"":false},{""text"":""The claim is incorrect because the 2/9 eaten must also be subtracted, so the jar ends at 5/9 full."",""correct"":true},{""text"":""The claim is correct because eating does not change the fraction of a jar."",""correct"":false},{""text"":""The claim is incorrect because the jar ends at 1/9 full."",""correct"":false}]","First add the amount filled: 4/9 + 3/9 = 7/9. Then subtract the amount eaten: 7/9 - 2/9 = 5/9. So the claim is incorrect. The jar does not stay at 7/9 because eating changes the amount in the jar, and 1/9 ignores the starting amount and the amount added.","{""questionNumber"":""Q167"",""questionType"":""mcq"",""subject"":""Maths"",""grade"":4,""topic"":""Fractions"",""subtopic"":""Adding & Subtracting Fractions"",""learning_objective"":""Students can solve word problems involving addition and subtraction of fractions"",""focus"":""evaluate_a_claim""}"
164,tf4iq5-sasff1zw-lscsw1ikr-q168-mcq,Q168,mcq,"A pirate walked 10/15 of a treasure path in the morning. In the afternoon, the pirate walked back 4/15 of the whole path. At sunset, the pirate walked forward again and finished 9/15 of the whole path in total. How far forward did the pirate walk at sunset?",Maths,4,Fractions,Adding & Subtracting Fractions,Students can solve word problems involving addition and subtraction of fractions,Analyzing,hard,5,"MCQ for Grade 4 Fractions: Adding & Subtracting Fractions, aligned to Students can solve word problems involving addition and subtraction of fractions.","[{""text"":""3/15 of the path"",""correct"":true},{""text"":""17/15 of the path"",""correct"":false},{""text"":""7/15 of the path"",""correct"":false},{""text"":""1/15 of the path"",""correct"":false}]","After walking back 4/15 from 10/15, the pirate had covered 6/15 of the path. To end at 9/15, the pirate must walk forward 9/15 - 6/15 = 3/15. So the sunset walk was 3/15. The other answers do not make the final total equal 9/15.","{""questionNumber"":""Q168"",""questionType"":""mcq"",""subject"":""Maths"",""grade"":4,""topic"":""Fractions"",""subtopic"":""Adding & Subtracting Fractions"",""learning_objective"":""Students can solve word problems involving addition and subtraction of fractions"",""focus"":""word problem with multiple changes""}"
165,tf4iq5-sasff1zw-lscsw1ikr-q169-mcq,Q169,mcq,"Compare the two cookie plate methods. Method 1 adds 2/7 and 3/7, then subtracts 1/7. Method 2 subtracts 1/7 from 3/7 first, then adds 2/7. Decide which judgment is correct.",Maths,4,Fractions,Adding & Subtracting Fractions,Students can solve word problems involving addition and subtraction of fractions,Evaluating,hard,4,"MCQ for Grade 4 Fractions: Adding & Subtracting Fractions, aligned to Students can solve word problems involving addition and subtraction of fractions.","[{""text"":""Both methods are valid and both give 4/7"",""correct"":true},{""text"":""Only Method 1 is valid, because subtraction must always come last"",""correct"":false},{""text"":""Only Method 2 is valid, because addition cannot happen first"",""correct"":false},{""text"":""The methods give different answers: 4/7 and 5/7"",""correct"":false}]","Awesome comparing! Method 1 gives 2/7 + 3/7 - 1/7 = 4/7. Method 2 gives 3/7 - 1/7 = 2/7, then 2/7 + 2/7 = 4/7 too.","{""questionNumber"":""Q169"",""questionType"":""mcq"",""subject"":""Maths"",""grade"":4,""topic"":""Fractions"",""subtopic"":""Adding & Subtracting Fractions"",""learning_objective"":""Students can solve word problems involving addition and subtraction of fractions"",""focus"":""compare_methods""}"
166,tf4iq5-sasff1zw-lscsw1ikr-q171-mcq,Q171,mcq,"A duck started at the edge of a pond path. It floated forward 5/6 of the path, then 2/6 more, so it passed the end of the path. Then it splashed back 3/6 of the whole path. Which statement correctly describes where the duck ended?",Maths,4,Fractions,Adding & Subtracting Fractions,Students can solve word problems involving addition and subtraction of fractions,Analyzing,hard,4,"MCQ for Grade 4 Fractions: Adding & Subtracting Fractions, aligned to Students can solve word problems involving addition and subtraction of fractions.","[{""text"":""The duck ended 4/6 of the path from the start because 5/6 + 2/6 = 7/6, and 7/6 - 3/6 = 4/6."",""correct"":true},{""text"":""The duck ended at the end of the path, 6/6, because once it passed the end it could not move back."",""correct"":false},{""text"":""The duck ended 10/6 of the path from the start because all the fractions should be added."",""correct"":false},{""text"":""The duck ended 3/6 of the path from the start because the last move was 3/6."",""correct"":false}]","First add the forward moves: 5/6 + 2/6 = 7/6. That means the duck went 1/6 past the end of the path. Then it moved back 3/6, so 7/6 - 3/6 = 4/6. So the duck ended 4/6 of the path from the start. It is not 6/6 because the duck can move back after going past the end, not 10/6 because the last move is backward, and not 3/6 because 3/6 is only the distance of the backward splash.","{""questionNumber"":""Q171"",""questionType"":""mcq"",""subject"":""Maths"",""grade"":4,""topic"":""Fractions"",""subtopic"":""Adding & Subtracting Fractions"",""learning_objective"":""Students can solve word problems involving addition and subtraction of fractions"",""focus"":""multi-step reasoning""}"
167,tf4iq5-sasff1zw-lscsw1ikr-q172-mcq,Q172,mcq,"At a pizza party, 5/6 of a pizza was left. Then 1/3 of a pizza was eaten and after that 1/6 more was eaten. A claim says there are 1/2 left because 1/3 + 1/6 = 1/2 and 5/6 is close to 1 whole. Which statement correctly evaluates this thinking?",Maths,4,Fractions,Adding & Subtracting Fractions,Students can solve word problems involving addition and subtraction of fractions,Evaluating,hard,4,"MCQ for Grade 4 Fractions: Adding & Subtracting Fractions, aligned to Students can solve word problems involving addition and subtraction of fractions.","[{""text"":""The claim is incorrect. The total eaten is 1/2, so the pizza left is 5/6 - 1/2 = 2/6 = 1/3."",""correct"":true},{""text"":""The claim is correct because adding 1/3 and 1/6 gives 1/2 left."",""correct"":false},{""text"":""The claim is incorrect because the pizza left is 4/6 after subtracting only 1/6."",""correct"":false},{""text"":""The claim is correct because 1 whole minus 1/2 is 1/2."",""correct"":false}]",First find the total eaten: 1/3 + 1/6 = 2/6 + 1/6 = 3/6 = 1/2. But the pizza did not start with 1 whole left; it started with 5/6 left. So subtract from 5/6: 5/6 - 1/2 = 5/6 - 3/6 = 2/6 = 1/3. The claim is wrong because it replaces 5/6 with 1 whole.,"{""questionNumber"":""Q172"",""questionType"":""mcq"",""subject"":""Maths"",""grade"":4,""topic"":""Fractions"",""subtopic"":""Adding & Subtracting Fractions"",""learning_objective"":""Students can solve word problems involving addition and subtraction of fractions"",""focus"":""evaluate_a_claim""}"
168,tf4iq5-sasff1zw-lscsw1ikr-q174-mcq,Q174,mcq,Look at the expressions for a lemonade jug. One plan is 7/8 - 3/8 + 2/8. Another plan is 7/8 - (3/8 + 2/8). Decide which comparison is correct.,Maths,4,Fractions,Adding & Subtracting Fractions,Students can solve word problems involving addition and subtraction of fractions,Analyzing,hard,5,"MCQ for Grade 4 Fractions: Adding & Subtracting Fractions, aligned to Students can solve word problems involving addition and subtraction of fractions.","[{""text"":""The first plan gives more, because it equals 6/8 and the second equals 2/8"",""correct"":true},{""text"":""The second plan gives more, because brackets always make the answer larger"",""correct"":false},{""text"":""Both plans give 4/8, because the same numbers are used"",""correct"":false},{""text"":""The first plan gives less, because subtraction comes first"",""correct"":false}]","Excellent comparing! The first plan is 7/8 - 3/8 + 2/8 = 6/8. The second is 7/8 - 5/8 = 2/8, so the first is greater.","{""questionNumber"":""Q174"",""questionType"":""mcq"",""subject"":""Maths"",""grade"":4,""topic"":""Fractions"",""subtopic"":""Adding & Subtracting Fractions"",""learning_objective"":""Students can solve word problems involving addition and subtraction of fractions"",""focus"":""compare_or_judge""}"
169,tf4iq5-sasff1zw-lscsw1ikr-q175-mcq,Q175,mcq,"A toy train moved 6/9 of the track, rolled back 2/9, then moved forward 4/9 more. Leo writes 6/9 + 4/9 - 2/9 and says his equation is wrong because he did not follow the story order. Which judgment is correct?",Maths,4,Fractions,Adding & Subtracting Fractions,Students can solve word problems involving addition and subtraction of fractions,Applying,hard,4,"MCQ for Grade 4 Fractions: Adding & Subtracting Fractions, aligned to Students can solve word problems involving addition and subtraction of fractions.","[{""text"":""Leo's equation is correct because it uses the right changes, and it gives the same final position: 8/9."",""correct"":true},{""text"":""Leo's equation is wrong because the train must end at 10/9 when the forward moves are grouped first."",""correct"":false},{""text"":""Leo's equation is wrong because rolling back should be added, not subtracted."",""correct"":false},{""text"":""Leo's equation is wrong because only 6/9 - 2/9 + 4/9 can ever model the trip."",""correct"":false}]","The train's changes are +6/9, -2/9, and +4/9. Leo wrote 6/9 + 4/9 - 2/9, which uses the same three changes. Calculate it: 6/9 + 4/9 = 10/9, and 10/9 - 2/9 = 8/9. The story order also gives 6/9 - 2/9 + 4/9 = 4/9 + 4/9 = 8/9. So Leo's equation is still correct. The backward move must be subtracted, and the final position is 8/9, not 10/9.","{""questionNumber"":""Q175"",""questionType"":""mcq"",""subject"":""Maths"",""grade"":4,""topic"":""Fractions"",""subtopic"":""Adding & Subtracting Fractions"",""learning_objective"":""Students can solve word problems involving addition and subtraction of fractions"",""focus"":""operation_reasoning""}"
170,tf4iq5-sasff1zw-lscsw1ikr-q176-mcq,Q176,mcq,"A bucket was 13/14 full of shells. Then 5/14 of the bucket was emptied out. Later, some shells were filled back in, and the bucket ended 11/14 full. Which expression shows how much was filled back in, and what is the amount?",Maths,4,Fractions,Adding & Subtracting Fractions,Students can solve word problems involving addition and subtraction of fractions,Analyzing,hard,4,"MCQ for Grade 4 Fractions: Adding & Subtracting Fractions, aligned to Students can solve word problems involving addition and subtraction of fractions.","[{""text"":""11/14 - (13/14 - 5/14) = 3/14"",""correct"":true},{""text"":""13/14 - 11/14 = 2/14"",""correct"":false},{""text"":""13/14 - 5/14 = 5/14"",""correct"":false},{""text"":""11/14 - 5/14 = 8/14"",""correct"":false}]","First find how full the bucket was after shells were emptied: 13/14 - 5/14 = 8/14. Then compare that with the final amount: 11/14 - 8/14 = 3/14. So the amount filled back in is 3/14, and the matching expression is 11/14 - (13/14 - 5/14). The other expressions leave out one step or compare the wrong amounts.","{""questionNumber"":""Q176"",""questionType"":""mcq"",""subject"":""Maths"",""grade"":4,""topic"":""Fractions"",""subtopic"":""Adding & Subtracting Fractions"",""learning_objective"":""Students can solve word problems involving addition and subtraction of fractions"",""focus"":""multi-step subtraction and addition""}"
171,tf4iq5-sasff1zw-lscsw1ikr-q177-mcq,Q177,mcq,"A hamster wheel was used for 3/11 of an hour before lunch and 5/11 of an hour after lunch. Later, 2/11 of an hour on the chart was erased by mistake. Which mistake would lead someone to get 8/11 instead of the final total shown on the chart?",Maths,4,Fractions,Adding & Subtracting Fractions,Students can solve word problems involving addition and subtraction of fractions,Evaluating,hard,4,"MCQ for Grade 4 Fractions: Adding & Subtracting Fractions, aligned to Students can solve word problems involving addition and subtraction of fractions.","[{""text"":""They added 3/11 and 5/11 but forgot to subtract the erased 2/11."",""correct"":true},{""text"":""They subtracted 5/11 from 3/11 and then added 2/11."",""correct"":false},{""text"":""They added all three fractions and got 10/11."",""correct"":false},{""text"":""They used only the erased amount and wrote 2/11."",""correct"":false}]","The real total shown on the chart is 3/11 + 5/11 - 2/11 = 6/11. Someone who got 8/11 must have added the two used times, 3/11 + 5/11 = 8/11, and then stopped without subtracting the erased 2/11. The other options describe different mistakes that would lead to different answers, not 8/11.","{""questionNumber"":""Q177"",""questionType"":""mcq"",""subject"":""Maths"",""grade"":4,""topic"":""Fractions"",""subtopic"":""Adding & Subtracting Fractions"",""learning_objective"":""Students can solve word problems involving addition and subtraction of fractions"",""focus"":""evaluate_a_claim""}"
172,tf4iq5-sasff1zw-lscsw1ikr-q178-mcq,Q178,mcq,"A game board had 12/13 of its spaces decorated. Then 4/13 of the spaces were cleaned off. After that, some decoration was added back, and the board ended with 10/13 of its spaces decorated. Which statement correctly explains how much decoration was added back?",Maths,4,Fractions,Adding & Subtracting Fractions,Students can solve word problems involving addition and subtraction of fractions,Analyzing,hard,5,"MCQ for Grade 4 Fractions: Adding & Subtracting Fractions, aligned to Students can solve word problems involving addition and subtraction of fractions.","[{""text"":""2/13 was added back because cleaning left 8/13, and 10/13 - 8/13 = 2/13."",""correct"":true},{""text"":""4/13 was added back because that was the amount cleaned off."",""correct"":false},{""text"":""6/13 was added back because 12/13 - 6/13 = 6/13."",""correct"":false},{""text"":""10/13 was added back because that is the final decorated amount."",""correct"":false}]","After 4/13 was cleaned off, the board had 12/13 - 4/13 = 8/13 decorated. It ended with 10/13 decorated, so the amount added back was 10/13 - 8/13 = 2/13. The answer is not 4/13 because adding back all 4/13 would return the board to 12/13. The choices 6/13 and 10/13 do not match the change from 8/13 to 10/13.","{""questionNumber"":""Q178"",""questionType"":""mcq"",""subject"":""Maths"",""grade"":4,""topic"":""Fractions"",""subtopic"":""Adding & Subtracting Fractions"",""learning_objective"":""Students can solve word problems involving addition and subtraction of fractions"",""focus"":""reverse_reasoning""}"
173,tf4iq5-sasff1zw-lscsw1ikr-q181-mcq,Q181,mcq,A gift box used 5/9 of a ribbon roll for bows and 2/9 more for curls. Then 1/9 of the roll was put back because it was not needed. A claim says the final amount used is 8/9 because all three fractions should be added. Which statement best explains the error in that claim?,Maths,4,Fractions,Adding & Subtracting Fractions,Students can solve word problems involving addition and subtraction of fractions,Analyzing,hard,4,"MCQ for Grade 4 Fractions: Adding & Subtracting Fractions, aligned to Students can solve word problems involving addition and subtraction of fractions.","[{""text"":""The claim treats the 1/9 put back as more ribbon used, but it should be subtracted, so the final amount used is 6/9."",""correct"":true},{""text"":""The claim forgets to add 5/9 and 2/9, so the final amount used is 1/9."",""correct"":false},{""text"":""The claim should subtract 2/9 from 5/9 first, so the final amount used is 4/9."",""correct"":false},{""text"":""The claim is correct because every number in the story should be added."",""correct"":false}]","First find the ribbon used: 5/9 + 2/9 = 7/9. Then 1/9 was put back, which means that part was not used after all, so subtract it: 7/9 - 1/9 = 6/9. The error is adding the 1/9 instead of subtracting it. The other choices ignore the meaning of 'put back' or do not use the story correctly.","{""questionNumber"":""Q181"",""questionType"":""mcq"",""subject"":""Maths"",""grade"":4,""topic"":""Fractions"",""subtopic"":""Adding & Subtracting Fractions"",""learning_objective"":""Students can solve word problems involving addition and subtraction of fractions"",""focus"":""multi-step reasoning""}"
174,tf4iq5-sasff1zw-lscsw1ikr-q187-mcq,Q187,mcq,"A cookie tin was 10/12 full. Then 4/12 was eaten, and later 3/12 more was added. Which explanation correctly shows why the tin ends 9/12 full and also points out the error in the incorrect methods?",Maths,4,Fractions,Adding & Subtracting Fractions,Students can solve word problems involving addition and subtraction of fractions,Evaluating,hard,4,"MCQ for Grade 4 Fractions: Adding & Subtracting Fractions, aligned to Students can solve word problems involving addition and subtraction of fractions.","[{""text"":""Subtract the part eaten first: 10/12 - 4/12 = 6/12. Then add the part put back: 6/12 + 3/12 = 9/12. Methods that get 17/12 or 6/12 treat eating or adding the wrong way, or ignore one of the changes."",""correct"":true},{""text"":""Add the two changes first: 4/12 + 3/12 = 7/12, then add that to 10/12 to get 17/12. This works because all amounts in the story should be combined."",""correct"":false},{""text"":""Subtract the smaller change from the larger change: 4/12 - 3/12 = 1/12, then subtract that from 10/12 to get 9/12. This works because only the difference between the changes matters."",""correct"":false},{""text"":""Only the eating matters because it happened first, so 10/12 - 4/12 = 6/12 is the final amount."",""correct"":false}]","The tin starts at 10/12 full. Eating 4/12 means subtract, giving 10/12 - 4/12 = 6/12. Then 3/12 more is added, so 6/12 + 3/12 = 9/12. Choice 2 is wrong because eating should not be added. Choice 3 gets 9/12 by using an invalid shortcut that does not follow the story's actual steps. Choice 4 ignores the later addition of 3/12.","{""questionNumber"":""Q187"",""questionType"":""mcq"",""subject"":""Maths"",""grade"":4,""topic"":""Fractions"",""subtopic"":""Adding & Subtracting Fractions"",""learning_objective"":""Students can solve word problems involving addition and subtraction of fractions"",""focus"":""evaluate_a_claim""}"
