rowNumber,queueId,questionNumber,questionType,questionText,subject,grade,topic,subtopic,learningObjective,bloomsLevel,difficultyLevel,difficultyRating,summary,options,explanation,generationMetadata
43,tvei4t7-seekm5z-lscsa1ybu-q43-mcq,Q43,mcq,"A jar holds k lollipops, and 1 more lollipop is added. If k = 8, choose the value of k + 1.",Maths,4,Variables & Expressions,Evaluating Expressions,Students can substitute a value for a variable and evaluate a simple expression,Applying,easy,1,"MCQ for Grade 4 Variables & Expressions: Evaluating Expressions, aligned to Students can substitute a value for a variable and evaluate a simple expression.","[{""text"":""7"",""correct"":false},{""text"":""8"",""correct"":false},{""text"":""9"",""correct"":true},{""text"":""18"",""correct"":false}]",Lovely work! Replace k with 8. Then k + 1 becomes 8 + 1 = 9.,"{""questionNumber"":""Q43"",""questionType"":""mcq"",""subject"":""Maths"",""grade"":4,""topic"":""Variables & Expressions"",""subtopic"":""Evaluating Expressions"",""learning_objective"":""Students can substitute a value for a variable and evaluate a simple expression"",""focus"":""evaluate k + 1 for k = 8""}"
44,tvei4t7-seekm5z-lscsa1ybu-q44-mcq,Q44,mcq,Look at the expression 12 - d when d = 7. Choose the correct result.,Maths,4,Variables & Expressions,Evaluating Expressions,Students can substitute a value for a variable and evaluate a simple expression,Applying,easy,1,"MCQ for Grade 4 Variables & Expressions: Evaluating Expressions, aligned to Students can substitute a value for a variable and evaluate a simple expression.","[{""text"":""5"",""correct"":true},{""text"":""6"",""correct"":false},{""text"":""7"",""correct"":false},{""text"":""19"",""correct"":false}]",Nice thinking! Put 7 in for d: 12 - 7 = 5. So 5 is the right answer.,"{""questionNumber"":""Q44"",""questionType"":""mcq"",""subject"":""Maths"",""grade"":4,""topic"":""Variables & Expressions"",""subtopic"":""Evaluating Expressions"",""learning_objective"":""Students can substitute a value for a variable and evaluate a simple expression"",""focus"":""evaluate 12 - d for d = 7""}"
45,tvei4t7-seekm5z-lscsa1ybu-q45-mcq,Q45,mcq,Choose the equation that matches 4n when n = 5.,Maths,4,Variables & Expressions,Evaluating Expressions,Students can substitute a value for a variable and evaluate a simple expression,Applying,easy,1,"MCQ for Grade 4 Variables & Expressions: Evaluating Expressions, aligned to Students can substitute a value for a variable and evaluate a simple expression.","[{""text"":""4n = 9"",""correct"":false},{""text"":""4n = 20"",""correct"":true},{""text"":""4n = 25"",""correct"":false},{""text"":""4n = 45"",""correct"":false}]","Awesome! 4n means 4 × 5, and that equals 20.","{""questionNumber"":""Q45"",""questionType"":""mcq"",""subject"":""Maths"",""grade"":4,""topic"":""Variables & Expressions"",""subtopic"":""Evaluating Expressions"",""learning_objective"":""Students can substitute a value for a variable and evaluate a simple expression"",""focus"":""evaluate 4n for n = 5""}"
46,tvei4t7-seekm5z-lscsa1ybu-q46-mcq,Q46,mcq,Pick the value of 15 - h when h = 6. A hamster nibbles 6 carrot sticks from 15.,Maths,4,Variables & Expressions,Evaluating Expressions,Students can substitute a value for a variable and evaluate a simple expression,Applying,easy,1,"MCQ for Grade 4 Variables & Expressions: Evaluating Expressions, aligned to Students can substitute a value for a variable and evaluate a simple expression.","[{""text"":""8"",""correct"":false},{""text"":""9"",""correct"":true},{""text"":""10"",""correct"":false},{""text"":""21"",""correct"":false}]",Well done! Replace h with 6. Then 15 - 6 = 9.,"{""questionNumber"":""Q46"",""questionType"":""mcq"",""subject"":""Maths"",""grade"":4,""topic"":""Variables & Expressions"",""subtopic"":""Evaluating Expressions"",""learning_objective"":""Students can substitute a value for a variable and evaluate a simple expression"",""focus"":""evaluate 15 - h for h = 6""}"
47,tvei4t7-seekm5z-lscsa1ybu-q47-mcq,Q47,mcq,Select the true statement about 3 + v when v = 4.,Maths,4,Variables & Expressions,Evaluating Expressions,Students can substitute a value for a variable and evaluate a simple expression,Applying,easy,1,"MCQ for Grade 4 Variables & Expressions: Evaluating Expressions, aligned to Students can substitute a value for a variable and evaluate a simple expression.","[{""text"":""3 + v = 6"",""correct"":false},{""text"":""3 + v = 7"",""correct"":true},{""text"":""3 + v = 12"",""correct"":false},{""text"":""3 + v = 34"",""correct"":false}]",Great job! Put 4 in place of v. Then 3 + 4 = 7.,"{""questionNumber"":""Q47"",""questionType"":""mcq"",""subject"":""Maths"",""grade"":4,""topic"":""Variables & Expressions"",""subtopic"":""Evaluating Expressions"",""learning_objective"":""Students can substitute a value for a variable and evaluate a simple expression"",""focus"":""evaluate 3 + v for v = 4""}"
48,tvei4t7-seekm5z-lscsa1ybu-q48-mcq,Q48,mcq,"A parrot has z shiny rings and finds 3 more. If z = 6, choose the value of z + 3.",Maths,4,Variables & Expressions,Evaluating Expressions,Students can substitute a value for a variable and evaluate a simple expression,Applying,easy,1,"MCQ for Grade 4 Variables & Expressions: Evaluating Expressions, aligned to Students can substitute a value for a variable and evaluate a simple expression.","[{""text"":""8"",""correct"":false},{""text"":""9"",""correct"":true},{""text"":""10"",""correct"":false},{""text"":""18"",""correct"":false}]",Excellent! Replace z with 6. Then 6 + 3 = 9.,"{""questionNumber"":""Q48"",""questionType"":""mcq"",""subject"":""Maths"",""grade"":4,""topic"":""Variables & Expressions"",""subtopic"":""Evaluating Expressions"",""learning_objective"":""Students can substitute a value for a variable and evaluate a simple expression"",""focus"":""evaluate z + 3 for z = 6""}"
49,tvei4t7-seekm5z-lscsa1ybu-q49-mcq,Q49,mcq,Which equation is correct for 5u when u = 2?,Maths,4,Variables & Expressions,Evaluating Expressions,Students can substitute a value for a variable and evaluate a simple expression,Applying,easy,1,"MCQ for Grade 4 Variables & Expressions: Evaluating Expressions, aligned to Students can substitute a value for a variable and evaluate a simple expression.","[{""text"":""5u = 7"",""correct"":false},{""text"":""5u = 10"",""correct"":true},{""text"":""5u = 12"",""correct"":false},{""text"":""5u = 52"",""correct"":false}]","Substitute u = 2 into 5u. This means 5 × 2 = 10, so 5u = 10 is correct. 52 is not correct because 5u means multiplication, not writing 5 and 2 together.","{""questionNumber"":""Q49"",""questionType"":""mcq"",""subject"":""Maths"",""grade"":4,""topic"":""Variables & Expressions"",""subtopic"":""Evaluating Expressions"",""learning_objective"":""Students can substitute a value for a variable and evaluate a simple expression"",""focus"":""evaluate 5u for u = 2""}"
50,tvei4t7-seekm5z-lscsa1ybu-q50-mcq,Q50,mcq,Choose the equation that matches 2s + 4 when s = 1.,Maths,4,Variables & Expressions,Evaluating Expressions,Students can substitute a value for a variable and evaluate a simple expression,Applying,easy,1,"MCQ for Grade 4 Variables & Expressions: Evaluating Expressions, aligned to Students can substitute a value for a variable and evaluate a simple expression.","[{""text"":""2s + 4 = 5"",""correct"":false},{""text"":""2s + 4 = 6"",""correct"":true},{""text"":""2s + 4 = 7"",""correct"":false},{""text"":""2s + 4 = 24"",""correct"":false}]",Great work! Put 1 in for s: 2 × 1 + 4 = 2 + 4 = 6.,"{""questionNumber"":""Q50"",""questionType"":""mcq"",""subject"":""Maths"",""grade"":4,""topic"":""Variables & Expressions"",""subtopic"":""Evaluating Expressions"",""learning_objective"":""Students can substitute a value for a variable and evaluate a simple expression"",""focus"":""evaluate 2s + 4 for s = 1""}"
51,tvei4t7-seekm5z-lscsa1ybu-q51-mcq,Q51,mcq,Choose the correct result for 11 - a when a = 3. A squirrel hides 11 nuts and uses 3.,Maths,4,Variables & Expressions,Evaluating Expressions,Students can substitute a value for a variable and evaluate a simple expression,Applying,easy,1,"MCQ for Grade 4 Variables & Expressions: Evaluating Expressions, aligned to Students can substitute a value for a variable and evaluate a simple expression.","[{""text"":""7"",""correct"":false},{""text"":""8"",""correct"":true},{""text"":""9"",""correct"":false},{""text"":""14"",""correct"":false}]",Nice job! Replace a with 3. Then 11 - 3 = 8.,"{""questionNumber"":""Q51"",""questionType"":""mcq"",""subject"":""Maths"",""grade"":4,""topic"":""Variables & Expressions"",""subtopic"":""Evaluating Expressions"",""learning_objective"":""Students can substitute a value for a variable and evaluate a simple expression"",""focus"":""evaluate 11 - a for a = 3""}"
52,tvei4t7-seekm5z-lscsa1ybu-q52-mcq,Q52,mcq,Decide which claim about 4 + e is true when e = 5.,Maths,4,Variables & Expressions,Evaluating Expressions,Students can substitute a value for a variable and evaluate a simple expression,Applying,easy,1,"MCQ for Grade 4 Variables & Expressions: Evaluating Expressions, aligned to Students can substitute a value for a variable and evaluate a simple expression.","[{""text"":""4 + e = 8"",""correct"":false},{""text"":""4 + e = 9"",""correct"":true},{""text"":""4 + e = 20"",""correct"":false},{""text"":""4 + e = 45"",""correct"":false}]","Super! Put 5 in for e, so 4 + 5 = 9. That makes 9 correct.","{""questionNumber"":""Q52"",""questionType"":""mcq"",""subject"":""Maths"",""grade"":4,""topic"":""Variables & Expressions"",""subtopic"":""Evaluating Expressions"",""learning_objective"":""Students can substitute a value for a variable and evaluate a simple expression"",""focus"":""evaluate 4 + e for e = 5""}"
53,tvei4t7-seekm5z-lscsa1ybu-q53-mcq,Q53,mcq,"A snack table has c cookie packs with 2 cookies in each pack. If c = 4, choose the value of 2c.",Maths,4,Variables & Expressions,Evaluating Expressions,Students can substitute a value for a variable and evaluate a simple expression,Applying,easy,1,"MCQ for Grade 4 Variables & Expressions: Evaluating Expressions, aligned to Students can substitute a value for a variable and evaluate a simple expression.","[{""text"":""6"",""correct"":false},{""text"":""8"",""correct"":true},{""text"":""10"",""correct"":false},{""text"":""24"",""correct"":false}]","Great thinking! 2c means 2 × 4, and that equals 8.","{""questionNumber"":""Q53"",""questionType"":""mcq"",""subject"":""Maths"",""grade"":4,""topic"":""Variables & Expressions"",""subtopic"":""Evaluating Expressions"",""learning_objective"":""Students can substitute a value for a variable and evaluate a simple expression"",""focus"":""evaluate 2c for c = 4""}"
54,tvei4t7-seekm5z-lscsa1ybu-q54-mcq,Q54,mcq,Look at the expression 13 - m when m = 9. Choose the correct answer.,Maths,4,Variables & Expressions,Evaluating Expressions,Students can substitute a value for a variable and evaluate a simple expression,Applying,easy,1,"MCQ for Grade 4 Variables & Expressions: Evaluating Expressions, aligned to Students can substitute a value for a variable and evaluate a simple expression.","[{""text"":""3"",""correct"":false},{""text"":""4"",""correct"":true},{""text"":""5"",""correct"":false},{""text"":""22"",""correct"":false}]",Well done! Replace m with 9. Then 13 - 9 = 4.,"{""questionNumber"":""Q54"",""questionType"":""mcq"",""subject"":""Maths"",""grade"":4,""topic"":""Variables & Expressions"",""subtopic"":""Evaluating Expressions"",""learning_objective"":""Students can substitute a value for a variable and evaluate a simple expression"",""focus"":""evaluate 13 - m for m = 9""}"
55,tvei4t7-seekm5z-lscsa1ybu-q55-mcq,Q55,mcq,Choose the equation that matches 6r when r = 3.,Maths,4,Variables & Expressions,Evaluating Expressions,Students can substitute a value for a variable and evaluate a simple expression,Applying,easy,1,"MCQ for Grade 4 Variables & Expressions: Evaluating Expressions, aligned to Students can substitute a value for a variable and evaluate a simple expression.","[{""text"":""6r = 9"",""correct"":false},{""text"":""6r = 18"",""correct"":true},{""text"":""6r = 36"",""correct"":false},{""text"":""6r = 63"",""correct"":false}]","Excellent! 6r means 6 × 3, and that equals 18.","{""questionNumber"":""Q55"",""questionType"":""mcq"",""subject"":""Maths"",""grade"":4,""topic"":""Variables & Expressions"",""subtopic"":""Evaluating Expressions"",""learning_objective"":""Students can substitute a value for a variable and evaluate a simple expression"",""focus"":""evaluate 6r for r = 3""}"
56,tvei4t7-seekm5z-lscsa1ybu-q56-mcq,Q56,mcq,Pick the value of 1 + q when q = 7. A game gives 1 star and q extra stars.,Maths,4,Variables & Expressions,Evaluating Expressions,Students can substitute a value for a variable and evaluate a simple expression,Applying,easy,1,"MCQ for Grade 4 Variables & Expressions: Evaluating Expressions, aligned to Students can substitute a value for a variable and evaluate a simple expression.","[{""text"":""7"",""correct"":false},{""text"":""8"",""correct"":true},{""text"":""9"",""correct"":false},{""text"":""17"",""correct"":false}]",Nice work! Put 7 in for q. Then 1 + 7 = 8.,"{""questionNumber"":""Q56"",""questionType"":""mcq"",""subject"":""Maths"",""grade"":4,""topic"":""Variables & Expressions"",""subtopic"":""Evaluating Expressions"",""learning_objective"":""Students can substitute a value for a variable and evaluate a simple expression"",""focus"":""evaluate 1 + q for q = 7""}"
57,tvei4t7-seekm5z-lscsa1ybu-q57-mcq,Q57,mcq,Choose the sentence that is correct about 14 - x when x = 8.,Maths,4,Variables & Expressions,Evaluating Expressions,Students can substitute a value for a variable and evaluate a simple expression,Applying,easy,1,"MCQ for Grade 4 Variables & Expressions: Evaluating Expressions, aligned to Students can substitute a value for a variable and evaluate a simple expression.","[{""text"":""14 - x = 5"",""correct"":false},{""text"":""14 - x = 6"",""correct"":true},{""text"":""14 - x = 8"",""correct"":false},{""text"":""14 - x = 22"",""correct"":false}]",Great! Replace x with 8. Then 14 - 8 = 6.,"{""questionNumber"":""Q57"",""questionType"":""mcq"",""subject"":""Maths"",""grade"":4,""topic"":""Variables & Expressions"",""subtopic"":""Evaluating Expressions"",""learning_objective"":""Students can substitute a value for a variable and evaluate a simple expression"",""focus"":""evaluate 14 - x for x = 8""}"
58,tvei4t7-seekm5z-lscsa1ybu-q58-mcq,Q58,mcq,"A basket has n oranges, and 5 more oranges roll in. If n = 4, choose the value of n + 5.",Maths,4,Variables & Expressions,Evaluating Expressions,Students can substitute a value for a variable and evaluate a simple expression,Applying,easy,1,"MCQ for Grade 4 Variables & Expressions: Evaluating Expressions, aligned to Students can substitute a value for a variable and evaluate a simple expression.","[{""text"":""8"",""correct"":false},{""text"":""9"",""correct"":true},{""text"":""10"",""correct"":false},{""text"":""20"",""correct"":false}]",You did it! Put 4 in place of n. Then 4 + 5 = 9.,"{""questionNumber"":""Q58"",""questionType"":""mcq"",""subject"":""Maths"",""grade"":4,""topic"":""Variables & Expressions"",""subtopic"":""Evaluating Expressions"",""learning_objective"":""Students can substitute a value for a variable and evaluate a simple expression"",""focus"":""evaluate n + 5 for n = 4""}"
59,tvei4t7-seekm5z-lscsa1ybu-q59-mcq,Q59,mcq,Choose the correct value of 3d when d = 7.,Maths,4,Variables & Expressions,Evaluating Expressions,Students can substitute a value for a variable and evaluate a simple expression,Applying,easy,1,"MCQ for Grade 4 Variables & Expressions: Evaluating Expressions, aligned to Students can substitute a value for a variable and evaluate a simple expression.","[{""text"":""10"",""correct"":false},{""text"":""21"",""correct"":true},{""text"":""24"",""correct"":false},{""text"":""37"",""correct"":false}]","Substitute d = 7 into 3d. Then 3 × 7 = 21, so the correct value is 21. 24 would be 3 × 8, not 3 × 7.","{""questionNumber"":""Q59"",""questionType"":""mcq"",""subject"":""Maths"",""grade"":4,""topic"":""Variables & Expressions"",""subtopic"":""Evaluating Expressions"",""learning_objective"":""Students can substitute a value for a variable and evaluate a simple expression"",""focus"":""evaluate 3d for d = 7""}"
60,tvei4t7-seekm5z-lscsa1ybu-q60-mcq,Q60,mcq,Choose the equation that matches 8 + b when b = 2.,Maths,4,Variables & Expressions,Evaluating Expressions,Students can substitute a value for a variable and evaluate a simple expression,Applying,easy,1,"MCQ for Grade 4 Variables & Expressions: Evaluating Expressions, aligned to Students can substitute a value for a variable and evaluate a simple expression.","[{""text"":""8 + b = 9"",""correct"":false},{""text"":""8 + b = 10"",""correct"":true},{""text"":""8 + b = 12"",""correct"":false},{""text"":""8 + b = 16"",""correct"":false}]",Brilliant! Put 2 in for b. Then 8 + 2 = 10.,"{""questionNumber"":""Q60"",""questionType"":""mcq"",""subject"":""Maths"",""grade"":4,""topic"":""Variables & Expressions"",""subtopic"":""Evaluating Expressions"",""learning_objective"":""Students can substitute a value for a variable and evaluate a simple expression"",""focus"":""evaluate 8 + b for b = 2""}"
61,tvei4t7-seekm5z-lscsa1ybu-q61-mcq,Q61,mcq,"Choose the correct result for 4x + 3 when x = 6, then add 2 more for the bonus stickers. Which total matches?",Maths,4,Variables & Expressions,Evaluating Expressions,Students can substitute a value for a variable and evaluate a simple expression,Applying,medium,3,"MCQ for Grade 4 Variables & Expressions: Evaluating Expressions, aligned to Students can substitute a value for a variable and evaluate a simple expression.","[{""text"":""27"",""correct"":false},{""text"":""29"",""correct"":true},{""text"":""30"",""correct"":false},{""text"":""33"",""correct"":false}]",Nice work! Put 6 in for x: 4 × 6 + 3 = 24 + 3 = 27. Then add 2 more to get 29. Some choices forgot the bonus 2 or mixed up the order.,"{""questionNumber"":""Q61"",""questionType"":""mcq"",""subject"":""Maths"",""grade"":4,""topic"":""Variables & Expressions"",""subtopic"":""Evaluating Expressions"",""learning_objective"":""Students can substitute a value for a variable and evaluate a simple expression"",""focus"":""multi_step_application""}"
62,tvei4t7-seekm5z-lscsa1ybu-q62-mcq,Q62,mcq,Select the true statement about the expression 2y + 5 when y = 4.,Maths,4,Variables & Expressions,Evaluating Expressions,Students can substitute a value for a variable and evaluate a simple expression,Understanding,medium,3,"MCQ for Grade 4 Variables & Expressions: Evaluating Expressions, aligned to Students can substitute a value for a variable and evaluate a simple expression.","[{""text"":""It means 2 + 4 + 5, so the value is 11."",""correct"":false},{""text"":""It means 2 groups of 4, then 5 more, so the value is 13."",""correct"":true},{""text"":""It means 24 + 5, so the value is 29."",""correct"":false},{""text"":""It means 2 groups of 5, then 4 more, so the value is 14."",""correct"":false}]",Great thinking! 2y means 2 groups of y. So 2 × 4 + 5 = 8 + 5 = 13. Some distractors treated 2y like 24 or switched the numbers.,"{""questionNumber"":""Q62"",""questionType"":""mcq"",""subject"":""Maths"",""grade"":4,""topic"":""Variables & Expressions"",""subtopic"":""Evaluating Expressions"",""learning_objective"":""Students can substitute a value for a variable and evaluate a simple expression"",""focus"":""representation_translation""}"
63,tvei4t7-seekm5z-lscsa1ybu-q63-mcq,Q63,mcq,"A toy box has t red cars and 7 blue cars. When t = 5, the total number of cars is shown by t + 7. Then 3 more cars are added. Choose the new total.",Maths,4,Variables & Expressions,Evaluating Expressions,Students can substitute a value for a variable and evaluate a simple expression,Applying,medium,3,"MCQ for Grade 4 Variables & Expressions: Evaluating Expressions, aligned to Students can substitute a value for a variable and evaluate a simple expression.","[{""text"":""12"",""correct"":false},{""text"":""14"",""correct"":false},{""text"":""15"",""correct"":true},{""text"":""17"",""correct"":false}]","Well done! First, t + 7 = 5 + 7 = 12. Then 3 more cars makes 15. A couple of choices stop too soon or add the wrong amount.","{""questionNumber"":""Q63"",""questionType"":""mcq"",""subject"":""Maths"",""grade"":4,""topic"":""Variables & Expressions"",""subtopic"":""Evaluating Expressions"",""learning_objective"":""Students can substitute a value for a variable and evaluate a simple expression"",""focus"":""context_interpretation""}"
64,tvei4t7-seekm5z-lscsa1ybu-q64-mcq,Q64,mcq,Evaluate 5n + 2 and 4n + 6 for n = 3. Which expression has the greater value?,Maths,4,Variables & Expressions,Evaluating Expressions,Students can substitute a value for a variable and evaluate a simple expression,Analyzing,medium,3,"MCQ for Grade 4 Variables & Expressions: Evaluating Expressions, aligned to Students can substitute a value for a variable and evaluate a simple expression.","[{""text"":""5n + 2 is greater."",""correct"":false},{""text"":""4n + 6 is greater."",""correct"":true},{""text"":""The two expressions have the same value."",""correct"":false},{""text"":""You cannot tell from n = 3."",""correct"":false}]","Substitute n = 3 into both expressions. 5n + 2 = 5 × 3 + 2 = 15 + 2 = 17. 4n + 6 = 4 × 3 + 6 = 12 + 6 = 18. Since 18 is greater than 17, 4n + 6 is greater. The expressions are not equal, and you can tell because n is given.","{""questionNumber"":""Q64"",""questionType"":""mcq"",""subject"":""Maths"",""grade"":4,""topic"":""Variables & Expressions"",""subtopic"":""Evaluating Expressions"",""learning_objective"":""Students can substitute a value for a variable and evaluate a simple expression"",""focus"":""compare_or_judge""}"
65,tvei4t7-seekm5z-lscsa1ybu-q65-mcq,Q65,mcq,"Choose the equation that matches this snack story: there are 3 packs with p crackers in each pack and 4 extra crackers. If p = 2, which option shows the correct value?",Maths,4,Variables & Expressions,Evaluating Expressions,Students can substitute a value for a variable and evaluate a simple expression,Applying,medium,3,"MCQ for Grade 4 Variables & Expressions: Evaluating Expressions, aligned to Students can substitute a value for a variable and evaluate a simple expression.","[{""text"":""3p + 4 = 10"",""correct"":true},{""text"":""3 + p + 4 = 9"",""correct"":false},{""text"":""p + 4 = 6"",""correct"":false},{""text"":""3p + 4 = 14"",""correct"":false}]","You’ve got it! 3 packs of 2 is 6, and 6 + 4 = 10. The story matches 3p + 4, not just adding the numbers once.","{""questionNumber"":""Q65"",""questionType"":""mcq"",""subject"":""Maths"",""grade"":4,""topic"":""Variables & Expressions"",""subtopic"":""Evaluating Expressions"",""learning_objective"":""Students can substitute a value for a variable and evaluate a simple expression"",""focus"":""operation_reasoning""}"
66,tvei4t7-seekm5z-lscsa1ybu-q66-mcq,Q66,mcq,"Pick the correct value of 6m - 5 when m = 4, and then double that result for a game score. Which score is right?",Maths,4,Variables & Expressions,Evaluating Expressions,Students can substitute a value for a variable and evaluate a simple expression,Applying,medium,3,"MCQ for Grade 4 Variables & Expressions: Evaluating Expressions, aligned to Students can substitute a value for a variable and evaluate a simple expression.","[{""text"":""14"",""correct"":false},{""text"":""19"",""correct"":false},{""text"":""38"",""correct"":true},{""text"":""43"",""correct"":false}]","Excellent! First, 6 × 4 - 5 = 24 - 5 = 19. Then double 19 to get 38. Some options forgot the doubling or skipped the subtraction.","{""questionNumber"":""Q66"",""questionType"":""mcq"",""subject"":""Maths"",""grade"":4,""topic"":""Variables & Expressions"",""subtopic"":""Evaluating Expressions"",""learning_objective"":""Students can substitute a value for a variable and evaluate a simple expression"",""focus"":""multi_step_application""}"
67,tvei4t7-seekm5z-lscsa1ybu-q67-mcq,Q67,mcq,Choose the sentence that is correct about b + b + 3 when b = 5.,Maths,4,Variables & Expressions,Evaluating Expressions,Students can substitute a value for a variable and evaluate a simple expression,Understanding,medium,3,"MCQ for Grade 4 Variables & Expressions: Evaluating Expressions, aligned to Students can substitute a value for a variable and evaluate a simple expression.","[{""text"":""It has the same value as 2 × 5 + 3, which is 13."",""correct"":true},{""text"":""It has the same value as 5 + 3, which is 8."",""correct"":false},{""text"":""It has the same value as 55 + 3, which is 58."",""correct"":false},{""text"":""It has the same value as 2 × 3 + 5, which is 11."",""correct"":false}]","Great job! b + b means 5 + 5, so it matches 2 × 5 + 3 = 13. Some choices forgot one b or joined digits together.","{""questionNumber"":""Q67"",""questionType"":""mcq"",""subject"":""Maths"",""grade"":4,""topic"":""Variables & Expressions"",""subtopic"":""Evaluating Expressions"",""learning_objective"":""Students can substitute a value for a variable and evaluate a simple expression"",""focus"":""representation_translation""}"
