rowNumber,queueId,questionNumber,questionType,questionText,subject,grade,topic,subtopic,learningObjective,bloomsLevel,difficultyLevel,difficultyRating,summary,options,explanation,generationMetadata
150,ttps1oex-sds1268-lscce1vem-q150-mcq,Q150,mcq,Choose the plan that matches both clues: a teddy bear picnic lasts 1 hour 32 minutes and finishes at 12:18 p.m.,Maths,4,Time Problem Solving,Duration & Schedules,Students can calculate elapsed time across hours and minutes,Analyzing,medium,3,"MCQ for Grade 4 Time Problem Solving: Duration & Schedules, aligned to Students can calculate elapsed time across hours and minutes.","[{""text"":""It starts at 10:56 a.m."",""correct"":false},{""text"":""It starts at 10:46 a.m."",""correct"":true},{""text"":""It starts at 11:06 a.m."",""correct"":false},{""text"":""It starts at 11:16 a.m."",""correct"":false}]","Brilliant job! Count back 1 hour from 12:18 to 11:18, then back 32 minutes to 10:46 a.m. That plan fits both clues.","{""questionNumber"":""Q150"",""questionType"":""mcq"",""subject"":""Maths"",""grade"":4,""topic"":""Time Problem Solving"",""subtopic"":""Duration & Schedules"",""learning_objective"":""Students can calculate elapsed time across hours and minutes"",""focus"":""constrained_selection""}"
151,ttps1oex-sds1268-lscce1vem-q151-mcq,Q151,mcq,Choose the correct result for a frog hop race that starts at 3:18 p.m. and ends at 5:07 p.m.,Maths,4,Time Problem Solving,Duration & Schedules,Students can calculate elapsed time across hours and minutes,Applying,medium,3,"MCQ for Grade 4 Time Problem Solving: Duration & Schedules, aligned to Students can calculate elapsed time across hours and minutes.","[{""text"":""1 hour 39 minutes"",""correct"":false},{""text"":""1 hour 49 minutes"",""correct"":true},{""text"":""2 hours 9 minutes"",""correct"":false},{""text"":""1 hour 59 minutes"",""correct"":false}]","Nice going! From 3:18 to 4:18 is 1 hour, then to 5:07 is 49 minutes. So the race lasts 1 hour 49 minutes.","{""questionNumber"":""Q151"",""questionType"":""mcq"",""subject"":""Maths"",""grade"":4,""topic"":""Time Problem Solving"",""subtopic"":""Duration & Schedules"",""learning_objective"":""Students can calculate elapsed time across hours and minutes"",""focus"":""multi_step_application""}"
152,ttps1oex-sds1268-lscce1vem-q152-mcq,Q152,mcq,Decide which claim about a candy shop visit is true if it starts at 12:36 p.m. and lasts 1 hour 44 minutes.,Maths,4,Time Problem Solving,Duration & Schedules,Students can calculate elapsed time across hours and minutes,Understanding,medium,3,"MCQ for Grade 4 Time Problem Solving: Duration & Schedules, aligned to Students can calculate elapsed time across hours and minutes.","[{""text"":""It ends at 2:10 p.m."",""correct"":false},{""text"":""It ends at 2:20 p.m."",""correct"":true},{""text"":""It ends at 1:20 p.m."",""correct"":false},{""text"":""It lasts 2 hours 4 minutes."",""correct"":false}]",Add 1 hour to 12:36 p.m. to get 1:36 p.m. Then add 44 minutes to get 2:20 p.m. So the true claim is that it ends at 2:20 p.m. The other options do not match adding 1 hour 44 minutes.,"{""questionNumber"":""Q152"",""questionType"":""mcq"",""subject"":""Maths"",""grade"":4,""topic"":""Time Problem Solving"",""subtopic"":""Duration & Schedules"",""learning_objective"":""Students can calculate elapsed time across hours and minutes"",""focus"":""context_interpretation""}"
153,ttps1oex-sds1268-lscce1vem-q153-mcq,Q153,mcq,A baby dragon puppet show ends at 6:14 p.m. after 58 minutes. Pick the time it began.,Maths,4,Time Problem Solving,Duration & Schedules,Students can calculate elapsed time across hours and minutes,Applying,medium,3,"MCQ for Grade 4 Time Problem Solving: Duration & Schedules, aligned to Students can calculate elapsed time across hours and minutes.","[{""text"":""5:06 p.m."",""correct"":false},{""text"":""5:16 p.m."",""correct"":true},{""text"":""5:24 p.m."",""correct"":false},{""text"":""4:56 p.m."",""correct"":false}]","Count back 58 minutes from 6:14 p.m. Go back 14 minutes to 6:00 p.m., then back 44 more minutes to 5:16 p.m. So the puppet show began at 5:16 p.m.","{""questionNumber"":""Q153"",""questionType"":""mcq"",""subject"":""Maths"",""grade"":4,""topic"":""Time Problem Solving"",""subtopic"":""Duration & Schedules"",""learning_objective"":""Students can calculate elapsed time across hours and minutes"",""focus"":""representation_translation""}"
154,ttps1oex-sds1268-lscce1vem-q154-mcq,Q154,mcq,"Look at this aquarium visit idea: from 10:26 a.m. to 12:01 p.m., someone says the visit lasted 1 hour 25 minutes because 10:26 to 11:26 is 1 hour and 11:26 to 12:01 is 25 minutes. Choose the best answer.",Maths,4,Time Problem Solving,Duration & Schedules,Students can calculate elapsed time across hours and minutes,Analyzing,medium,3,"MCQ for Grade 4 Time Problem Solving: Duration & Schedules, aligned to Students can calculate elapsed time across hours and minutes.","[{""text"":""The idea is correct. The visit lasted 1 hour 25 minutes."",""correct"":false},{""text"":""The idea is wrong because 11:26 to 12:01 is 35 minutes, so the visit lasted 1 hour 35 minutes."",""correct"":true},{""text"":""The idea is wrong because the visit lasted only 95 minutes, not 1 hour 35 minutes."",""correct"":false},{""text"":""The idea is wrong because 10:26 to 11:26 is 2 hours."",""correct"":false}]","Excellent checking! The first hour is right, but 11:26 to 12:01 is 35 minutes, not 25. So the total is 1 hour 35 minutes.","{""questionNumber"":""Q154"",""questionType"":""mcq"",""subject"":""Maths"",""grade"":4,""topic"":""Time Problem Solving"",""subtopic"":""Duration & Schedules"",""learning_objective"":""Students can calculate elapsed time across hours and minutes"",""focus"":""error_correction""}"
155,ttps1oex-sds1268-lscce1vem-q155-mcq,Q155,mcq,Choose the method that correctly solves this puzzle trail: it starts at 4:29 p.m. and finishes at 6:03 p.m.,Maths,4,Time Problem Solving,Duration & Schedules,Students can calculate elapsed time across hours and minutes,Analyzing,medium,3,"MCQ for Grade 4 Time Problem Solving: Duration & Schedules, aligned to Students can calculate elapsed time across hours and minutes.","[{""text"":""Go from 4:29 to 5:29 for 1 hour, then 5:29 to 6:03 for 34 minutes, so 1 hour 34 minutes."",""correct"":true},{""text"":""Go from 4:29 to 5:03 for 34 minutes, so the whole trail is 34 minutes."",""correct"":false},{""text"":""Go from 4:29 to 6:29 for 2 hours, so the whole trail is 2 hours."",""correct"":false},{""text"":""Add 29 and 3 to get 32 minutes, so the whole trail is 1 hour 32 minutes."",""correct"":false}]","Fantastic reasoning! Breaking at the same minutes helps: 4:29 to 5:29 is 1 hour, then to 6:03 is 34 minutes. Total time is 1 hour 34 minutes.","{""questionNumber"":""Q155"",""questionType"":""mcq"",""subject"":""Maths"",""grade"":4,""topic"":""Time Problem Solving"",""subtopic"":""Duration & Schedules"",""learning_objective"":""Students can calculate elapsed time across hours and minutes"",""focus"":""operation_reasoning""}"
156,ttps1oex-sds1268-lscce1vem-q156-mcq,Q156,mcq,Choose the correct result for a pirate treasure game that starts at 8:47 a.m. and lasts 1 hour 38 minutes.,Maths,4,Time Problem Solving,Duration & Schedules,Students can calculate elapsed time across hours and minutes,Applying,medium,3,"MCQ for Grade 4 Time Problem Solving: Duration & Schedules, aligned to Students can calculate elapsed time across hours and minutes.","[{""text"":""10:15 a.m."",""correct"":false},{""text"":""10:25 a.m."",""correct"":true},{""text"":""9:25 a.m."",""correct"":false},{""text"":""10:35 a.m."",""correct"":false}]","Add 1 hour to 8:47 a.m. to get 9:47 a.m. Then add 38 minutes. Since 13 minutes gets to 10:00 a.m., there are 25 minutes left, so the end time is 10:25 a.m. The other options come from adding the minutes incorrectly.","{""questionNumber"":""Q156"",""questionType"":""mcq"",""subject"":""Maths"",""grade"":4,""topic"":""Time Problem Solving"",""subtopic"":""Duration & Schedules"",""learning_objective"":""Students can calculate elapsed time across hours and minutes"",""focus"":""multi_step_application""}"
157,ttps1oex-sds1268-lscce1vem-q157-mcq,Q157,mcq,Select the true statement about a parrot dance from 2:14 p.m. to 3:36 p.m.,Maths,4,Time Problem Solving,Duration & Schedules,Students can calculate elapsed time across hours and minutes,Understanding,medium,3,"MCQ for Grade 4 Time Problem Solving: Duration & Schedules, aligned to Students can calculate elapsed time across hours and minutes.","[{""text"":""It lasts 1 hour 12 minutes."",""correct"":false},{""text"":""It lasts 1 hour 22 minutes."",""correct"":true},{""text"":""It lasts 2 hours 2 minutes."",""correct"":false},{""text"":""It ends 72 minutes after it starts."",""correct"":false}]","Nice work! From 2:14 to 3:14 is 1 hour, then to 3:36 is 22 minutes. So the total is 1 hour 22 minutes.","{""questionNumber"":""Q157"",""questionType"":""mcq"",""subject"":""Maths"",""grade"":4,""topic"":""Time Problem Solving"",""subtopic"":""Duration & Schedules"",""learning_objective"":""Students can calculate elapsed time across hours and minutes"",""focus"":""representation_translation""}"
158,ttps1oex-sds1268-lscce1vem-q158-mcq,Q158,mcq,"A robot painting club has two parts. First it runs from 1:05 p.m. to 1:52 p.m. Then it starts again at 2:10 p.m. and ends at 2:48 p.m. Choose the total time spent painting, not the break.",Maths,4,Time Problem Solving,Duration & Schedules,Students can calculate elapsed time across hours and minutes,Applying,medium,3,"MCQ for Grade 4 Time Problem Solving: Duration & Schedules, aligned to Students can calculate elapsed time across hours and minutes.","[{""text"":""1 hour 15 minutes"",""correct"":false},{""text"":""1 hour 25 minutes"",""correct"":true},{""text"":""1 hour 43 minutes"",""correct"":false},{""text"":""1 hour 53 minutes"",""correct"":false}]","Super careful thinking! The first part is 47 minutes. The second part is 38 minutes. Together that makes 85 minutes, or 1 hour 25 minutes.","{""questionNumber"":""Q158"",""questionType"":""mcq"",""subject"":""Maths"",""grade"":4,""topic"":""Time Problem Solving"",""subtopic"":""Duration & Schedules"",""learning_objective"":""Students can calculate elapsed time across hours and minutes"",""focus"":""context_interpretation""}"
159,ttps1oex-sds1268-lscce1vem-q159-mcq,Q159,mcq,Compare the two schedules. Bunny reading goes from 9:38 a.m. to 10:27 a.m. Dino drawing goes from 11:46 a.m. to 12:40 p.m. Pick the correct comparison.,Maths,4,Time Problem Solving,Duration & Schedules,Students can calculate elapsed time across hours and minutes,Analyzing,medium,3,"MCQ for Grade 4 Time Problem Solving: Duration & Schedules, aligned to Students can calculate elapsed time across hours and minutes.","[{""text"":""Bunny reading is longer by 5 minutes."",""correct"":false},{""text"":""Dino drawing is longer by 5 minutes."",""correct"":true},{""text"":""Both are 49 minutes long."",""correct"":false},{""text"":""Dino drawing is longer by 15 minutes."",""correct"":false}]",Great comparing! Bunny reading lasts 49 minutes. Dino drawing lasts 54 minutes. So dino drawing is longer by 5 minutes.,"{""questionNumber"":""Q159"",""questionType"":""mcq"",""subject"":""Maths"",""grade"":4,""topic"":""Time Problem Solving"",""subtopic"":""Duration & Schedules"",""learning_objective"":""Students can calculate elapsed time across hours and minutes"",""focus"":""compare_or_judge""}"
160,ttps1oex-sds1268-lscce1vem-q160-mcq,Q160,mcq,"Choose the plan that matches all the clues: a penguin photo walk starts after 10:00 a.m., ends before 12:00 p.m., and lasts exactly 1 hour 26 minutes.",Maths,4,Time Problem Solving,Duration & Schedules,Students can calculate elapsed time across hours and minutes,Analyzing,medium,3,"MCQ for Grade 4 Time Problem Solving: Duration & Schedules, aligned to Students can calculate elapsed time across hours and minutes.","[{""text"":""10:18 a.m. to 11:44 a.m."",""correct"":true},{""text"":""9:58 a.m. to 11:24 a.m."",""correct"":false},{""text"":""10:26 a.m. to 11:46 a.m."",""correct"":false},{""text"":""10:40 a.m. to 12:06 p.m."",""correct"":false}]","You checked all the clues so well! 10:18 a.m. to 11:44 a.m. is 1 hour 26 minutes, it starts after 10:00, and it ends before 12:00.","{""questionNumber"":""Q160"",""questionType"":""mcq"",""subject"":""Maths"",""grade"":4,""topic"":""Time Problem Solving"",""subtopic"":""Duration & Schedules"",""learning_objective"":""Students can calculate elapsed time across hours and minutes"",""focus"":""constrained_selection""}"
161,ttps1oex-sds1268-lscce1vem-q161-mcq,Q161,mcq,"Choose the correct trip time for this zoo ride: the monkey train leaves at 9:35 and gets back at 11:10. One idea says, ""From 9:35 to 10:35 is 1 hour, then to 11:10 is 35 minutes, so the ride is 1 hour 35 minutes."" Another idea says, ""It is 2 hours 25 minutes."" Pick the best answer.",Maths,4,Time Problem Solving,Duration & Schedules,Students can calculate elapsed time across hours and minutes,Evaluating,hard,4,"MCQ for Grade 4 Time Problem Solving: Duration & Schedules, aligned to Students can calculate elapsed time across hours and minutes.","[{""text"":""1 hour 35 minutes, because counting on by 1 hour and then 35 minutes is correct"",""correct"":true},{""text"":""2 hours 25 minutes, because 35 and 10 make 45 more minutes after 2 hours"",""correct"":false},{""text"":""1 hour 25 minutes, because 10 minus 35 is 25"",""correct"":false},{""text"":""35 minutes, because only the minutes change"",""correct"":false}]","Nice thinking! 9:35 to 10:35 is 1 hour, and 10:35 to 11:10 is 35 minutes. That makes 1 hour 35 minutes.","{""questionNumber"":""Q161"",""questionType"":""mcq"",""subject"":""Maths"",""grade"":4,""topic"":""Time Problem Solving"",""subtopic"":""Duration & Schedules"",""learning_objective"":""Students can calculate elapsed time across hours and minutes"",""focus"":""evaluate_a_claim""}"
162,ttps1oex-sds1268-lscce1vem-q162-mcq,Q162,mcq,A toy robot show starts at 2:48 p.m. and lasts 1 hour 27 minutes. Which explanation correctly shows both the ending time and why another method is wrong?,Maths,4,Time Problem Solving,Duration & Schedules,Students can calculate elapsed time across hours and minutes,Evaluating,hard,4,"MCQ for Grade 4 Time Problem Solving: Duration & Schedules, aligned to Students can calculate elapsed time across hours and minutes.","[{""text"":""It ends at 4:15 p.m., because 2:48 + 1 hour = 3:48 and 27 more minutes = 4:15. A result of 3:15 p.m. is wrong because 75 minutes must be regrouped as 1 hour 15 minutes."",""correct"":true},{""text"":""It ends at 3:15 p.m., because 48 + 27 = 75 and 2 + 1 = 3, so the answer keeps 3 as the hour."",""correct"":false},{""text"":""It ends at 4:05 p.m., because 48 + 27 = 65, so the minutes are 05."",""correct"":false},{""text"":""It ends at 4:25 p.m., because 2:48 + 27 minutes = 3:25, then 1 more hour = 4:25."",""correct"":false}]","Add the duration carefully. From 2:48 p.m., adding 1 hour gives 3:48 p.m. Adding 27 more minutes gives 4:15 p.m., because 12 minutes bring the time to 4:00 and 15 more minutes make 4:15. Option 1 is correct and also explains the common mistake in option 2: 75 minutes is 1 hour 15 minutes, so the hour must increase. Option 3 uses the wrong minute total, and option 4 incorrectly says 2:48 + 27 minutes is 3:25 when it is really 3:15.","{""questionNumber"":""Q162"",""questionType"":""mcq"",""subject"":""Maths"",""grade"":4,""topic"":""Time Problem Solving"",""subtopic"":""Duration & Schedules"",""learning_objective"":""Students can calculate elapsed time across hours and minutes"",""focus"":""reverse_reasoning""}"
163,ttps1oex-sds1268-lscce1vem-q164-mcq,Q164,mcq,"Look at these two ways to work out the time from 6:55 to 8:20 for a bedtime teddy story. Method 1 counts 6:55 to 7:00 = 5 minutes, 7:00 to 8:00 = 1 hour, 8:00 to 8:20 = 20 minutes. Method 2 says 20 minus 55 is 35 minutes, then add 2 hours to get 2 hours 35 minutes. Choose the best judgment.",Maths,4,Time Problem Solving,Duration & Schedules,Students can calculate elapsed time across hours and minutes,Evaluating,hard,4,"MCQ for Grade 4 Time Problem Solving: Duration & Schedules, aligned to Students can calculate elapsed time across hours and minutes.","[{""text"":""Only Method 1 is correct, and the elapsed time is 1 hour 25 minutes"",""correct"":true},{""text"":""Only Method 2 is correct, and the elapsed time is 2 hours 35 minutes"",""correct"":false},{""text"":""Both methods are correct, and the elapsed time is 1 hour 25 minutes"",""correct"":false},{""text"":""Both methods are wrong, because you cannot cross 7:00"",""correct"":false}]",You spotted it! Method 1 works: 5 minutes + 1 hour + 20 minutes = 1 hour 25 minutes. Method 2 mixes up subtracting minutes.,"{""questionNumber"":""Q164"",""questionType"":""mcq"",""subject"":""Maths"",""grade"":4,""topic"":""Time Problem Solving"",""subtopic"":""Duration & Schedules"",""learning_objective"":""Students can calculate elapsed time across hours and minutes"",""focus"":""compare_methods""}"
164,ttps1oex-sds1268-lscce1vem-q165-mcq,Q165,mcq,"Choose the method that correctly solves this snack-time puzzle: the picnic starts at 10:37 a.m. and ends at 12:05 p.m. One method jumps to 11:00, then 12:00, then 12:05. Another method says 12 minus 10 is 2 hours and 37 plus 5 is 42 minutes, so the answer is 2 hours 42 minutes.",Maths,4,Time Problem Solving,Duration & Schedules,Students can calculate elapsed time across hours and minutes,Evaluating,hard,4,"MCQ for Grade 4 Time Problem Solving: Duration & Schedules, aligned to Students can calculate elapsed time across hours and minutes.","[{""text"":""The jump-to-the-hour method is correct, and the picnic lasts 1 hour 28 minutes"",""correct"":true},{""text"":""The second method is correct, and the picnic lasts 2 hours 42 minutes"",""correct"":false},{""text"":""Both methods are correct, and the picnic lasts 1 hour 42 minutes"",""correct"":false},{""text"":""Neither method works; the picnic lasts 28 minutes"",""correct"":false}]","Excellent! 10:37 to 11:00 is 23 minutes, then 1 hour to 12:00, then 5 minutes more. That totals 1 hour 28 minutes.","{""questionNumber"":""Q165"",""questionType"":""mcq"",""subject"":""Maths"",""grade"":4,""topic"":""Time Problem Solving"",""subtopic"":""Duration & Schedules"",""learning_objective"":""Students can calculate elapsed time across hours and minutes"",""focus"":""compare_methods""}"
165,ttps1oex-sds1268-lscce1vem-q166-mcq,Q166,mcq,A sticker hunt begins at 1:58 p.m. and lasts 2 hours 16 minutes. Which answer gives the correct ending time and correctly explains why a common shortcut fails?,Maths,4,Time Problem Solving,Duration & Schedules,Students can calculate elapsed time across hours and minutes,Analyzing,hard,4,"MCQ for Grade 4 Time Problem Solving: Duration & Schedules, aligned to Students can calculate elapsed time across hours and minutes.","[{""text"":""4:14 p.m., because 1:58 + 2 hours = 3:58, and 16 more minutes = 4:14. A shortcut that writes 58 + 16 = 64 and keeps the hour the same is wrong because 64 minutes is 1 hour 4 minutes."",""correct"":true},{""text"":""4:04 p.m., because 58 + 16 = 64, so the minutes are 04 and the hour does not change again."",""correct"":false},{""text"":""3:14 p.m., because only the minutes change after 1:58."",""correct"":false},{""text"":""4:24 p.m., because 1:58 + 16 minutes = 2:24, then 2 more hours = 4:24."",""correct"":false}]","First add 2 hours: 1:58 p.m. becomes 3:58 p.m. Then add 16 minutes to reach 4:14 p.m. since 2 minutes get to 4:00 and 14 more minutes get to 4:14. Option 1 is correct and also explains the regrouping mistake: 64 minutes means 1 extra hour and 4 minutes. Option 2 ignores that extra hour, option 3 ignores the 2 hours, and option 4 adds 16 minutes incorrectly because 1:58 + 16 minutes is 2:14, not 2:24.","{""questionNumber"":""Q166"",""questionType"":""mcq"",""subject"":""Maths"",""grade"":4,""topic"":""Time Problem Solving"",""subtopic"":""Duration & Schedules"",""learning_objective"":""Students can calculate elapsed time across hours and minutes"",""focus"":""reverse_reasoning""}"
166,ttps1oex-sds1268-lscce1vem-q167-mcq,Q167,mcq,Two students compare these game times. Ring toss runs from 3:25 to 4:10. Ball pit fun runs from 5:40 to 6:30. Which claim is correct?,Maths,4,Time Problem Solving,Duration & Schedules,Students can calculate elapsed time across hours and minutes,Evaluating,hard,4,"MCQ for Grade 4 Time Problem Solving: Duration & Schedules, aligned to Students can calculate elapsed time across hours and minutes.","[{""text"":""Ball pit fun is longer by 5 minutes because ring toss lasts 45 minutes and ball pit fun lasts 50 minutes."",""correct"":true},{""text"":""Ring toss is longer by 15 minutes because 40 to 30 is 10 minutes and that makes the total bigger."",""correct"":false},{""text"":""Both activities last 45 minutes because each one crosses into the next hour."",""correct"":false},{""text"":""Ball pit fun is longer by 10 minutes because 5:40 to 6:30 is 55 minutes."",""correct"":false}]","Ring toss lasts from 3:25 to 4:10, which is 35 minutes to 4:00 and then 10 more minutes, so 45 minutes. Ball pit fun lasts from 5:40 to 6:30, which is 20 minutes to 6:00 and then 30 more minutes, so 50 minutes. Therefore ball pit fun is longer by 5 minutes. The other claims use incorrect elapsed times.","{""questionNumber"":""Q167"",""questionType"":""mcq"",""subject"":""Maths"",""grade"":4,""topic"":""Time Problem Solving"",""subtopic"":""Duration & Schedules"",""learning_objective"":""Students can calculate elapsed time across hours and minutes"",""focus"":""evaluate_a_claim""}"
167,ttps1oex-sds1268-lscce1vem-q168-mcq,Q168,mcq,"A hamster snack cart opens at 11:50 a.m. It sells snacks for 2 hours 35 minutes in total, and there is one 15-minute clean-up break in the middle when no snacks are sold. What time does the cart close?",Maths,4,Time Problem Solving,Duration & Schedules,Students can calculate elapsed time across hours and minutes,Analyzing,hard,5,"MCQ for Grade 4 Time Problem Solving: Duration & Schedules, aligned to Students can calculate elapsed time across hours and minutes.","[{""text"":""2:40 p.m."",""correct"":true},{""text"":""2:25 p.m."",""correct"":false},{""text"":""2:10 p.m."",""correct"":false},{""text"":""1:25 p.m."",""correct"":false}]","The cart sells snacks for 2 hours 35 minutes, and the 15-minute break is extra time because no snacks are sold during the break. So the total open time is 2 hours 35 minutes + 15 minutes = 2 hours 50 minutes. Starting at 11:50 a.m., 2 hours later is 1:50 p.m., and 50 more minutes is 2:40 p.m. So the cart closes at 2:40 p.m.","{""questionNumber"":""Q168"",""questionType"":""mcq"",""subject"":""Maths"",""grade"":4,""topic"":""Time Problem Solving"",""subtopic"":""Duration & Schedules"",""learning_objective"":""Students can calculate elapsed time across hours and minutes"",""focus"":""multi_constraint_problem""}"
168,ttps1oex-sds1268-lscce1vem-q169-mcq,Q169,mcq,Compare the two answers for the time from 7:42 to 9:05 in a bedtime cartoon plan. One answer is 1 hour 23 minutes. Another answer is 2 hours 37 minutes. Decide which comparison is correct.,Maths,4,Time Problem Solving,Duration & Schedules,Students can calculate elapsed time across hours and minutes,Evaluating,hard,4,"MCQ for Grade 4 Time Problem Solving: Duration & Schedules, aligned to Students can calculate elapsed time across hours and minutes.","[{""text"":""1 hour 23 minutes is correct, because 7:42 to 8:42 is 1 hour and then 23 more minutes"",""correct"":true},{""text"":""2 hours 37 minutes is correct, because 9 minus 7 is 2 and 42 + 5 is 47"",""correct"":false},{""text"":""Both are correct, because one uses hours and one uses minutes"",""correct"":false},{""text"":""Neither is correct, because the answer must be less than 1 hour"",""correct"":false}]","Lovely work! Counting on is best here: 7:42 to 8:42 is 1 hour, then to 9:05 is 23 minutes. Total: 1 hour 23 minutes.","{""questionNumber"":""Q169"",""questionType"":""mcq"",""subject"":""Maths"",""grade"":4,""topic"":""Time Problem Solving"",""subtopic"":""Duration & Schedules"",""learning_objective"":""Students can calculate elapsed time across hours and minutes"",""focus"":""evaluate_a_claim""}"
169,ttps1oex-sds1268-lscce1vem-q170-mcq,Q170,mcq,A bubble show lasts 1 hour 40 minutes and ends at 6:15 p.m. The show also started after 4:30 p.m. Which schedule could be correct?,Maths,4,Time Problem Solving,Duration & Schedules,Students can calculate elapsed time across hours and minutes,Analyzing,hard,4,"MCQ for Grade 4 Time Problem Solving: Duration & Schedules, aligned to Students can calculate elapsed time across hours and minutes.","[{""text"":""It starts at 4:35 p.m., so 1 hour later is 5:35 p.m. and 40 more minutes is 6:15 p.m."",""correct"":true},{""text"":""It starts at 4:25 p.m., so 1 hour later is 5:25 p.m. and 40 more minutes is 6:05 p.m."",""correct"":false},{""text"":""It starts at 4:45 p.m., so 1 hour later is 5:45 p.m. and 40 more minutes is 6:25 p.m."",""correct"":false},{""text"":""It starts at 5:35 p.m., so 40 minutes later is 6:15 p.m."",""correct"":false}]","Check both the duration and the extra condition. Starting at 4:35 p.m., 1 hour later is 5:35 p.m. and 40 more minutes is 6:15 p.m., and 4:35 p.m. is after 4:30 p.m. So this schedule could be correct. Option 2 ends at 6:05 p.m., option 3 ends at 6:25 p.m., and option 4 uses only 40 minutes instead of the full 1 hour 40 minutes.","{""questionNumber"":""Q170"",""questionType"":""mcq"",""subject"":""Maths"",""grade"":4,""topic"":""Time Problem Solving"",""subtopic"":""Duration & Schedules"",""learning_objective"":""Students can calculate elapsed time across hours and minutes"",""focus"":""reverse_reasoning""}"
