rowNumber,queueId,questionNumber,questionType,questionText,subject,grade,topic,subtopic,learningObjective,bloomsLevel,difficultyLevel,difficultyRating,summary,options,explanation,generationMetadata
145,tao1uc4-sd6157-lscir1jhx-q145-mcq,Q145,mcq,"Choose the equation that matches this sticker story: 65 animal stickers are shared equally among 8 children, and some stickers are left in the packet.",Maths,4,Arithmetic Operations,Division,Students can interpret remainders in context,Understanding,medium,3,"MCQ for Grade 4 Arithmetic Operations: Division, aligned to Students can interpret remainders in context.","[{""text"":""65 ÷ 8 = 8 remainder 1"",""correct"":true},{""text"":""65 ÷ 8 = 7 remainder 9"",""correct"":false},{""text"":""65 ÷ 8 = 8 remainder 8"",""correct"":false},{""text"":""65 ÷ 8 = 9 remainder 1"",""correct"":false}]","Excellent! 8 × 8 = 64, so 1 sticker is left. That makes 65 ÷ 8 = 8 remainder 1.","{""questionNumber"":""Q145"",""questionType"":""mcq"",""subject"":""Maths"",""grade"":4,""topic"":""Arithmetic Operations"",""subtopic"":""Division"",""learning_objective"":""Students can interpret remainders in context"",""focus"":""representation_translation""}"
146,tao1uc4-sd6157-lscir1jhx-q146-mcq,Q146,mcq,"Choose the correct result for this frog game: 92 jump tokens are packed into tubes of 11. A star is drawn on each full tube. How many stars are drawn, and how many tokens are left?",Maths,4,Arithmetic Operations,Division,Students can interpret remainders in context,Applying,medium,3,"MCQ for Grade 4 Arithmetic Operations: Division, aligned to Students can interpret remainders in context.","[{""text"":""8 stars and 4 tokens left"",""correct"":true},{""text"":""9 stars and 3 tokens left"",""correct"":false},{""text"":""8 stars and 3 tokens left"",""correct"":false},{""text"":""7 stars and 15 tokens left"",""correct"":false}]","Well done! 11 × 8 = 88, and 92 - 88 = 4. So 8 full tubes need 8 stars, with 4 tokens left.","{""questionNumber"":""Q146"",""questionType"":""mcq"",""subject"":""Maths"",""grade"":4,""topic"":""Arithmetic Operations"",""subtopic"":""Division"",""learning_objective"":""Students can interpret remainders in context"",""focus"":""multi_step_application""}"
147,tao1uc4-sd6157-lscir1jhx-q147-mcq,Q147,mcq,Seventy toy dinosaurs are shared equally into 9 crates. Which statement correctly interprets the result of the division?,Maths,4,Arithmetic Operations,Division,Students can interpret remainders in context,Analyzing,medium,3,"MCQ for Grade 4 Arithmetic Operations: Division, aligned to Students can interpret remainders in context.","[{""text"":""7 dinosaurs go in each crate, and 7 are left over."",""correct"":true},{""text"":""8 dinosaurs should be called the number in each crate because the leftovers are added to the quotient."",""correct"":false},{""text"":""8 dinosaurs go in each crate, and 2 are left over."",""correct"":false},{""text"":""70 ÷ 9 = 7 remainder 9."",""correct"":false}]","9 × 7 = 63, and 70 - 63 = 7, so 70 ÷ 9 = 7 remainder 7. That means 7 dinosaurs fit in each crate and 7 are left over. You cannot say 8 are in each crate because 9 × 8 = 72, which is more than 70. A remainder also must be less than 9, so remainder 9 is impossible.","{""questionNumber"":""Q147"",""questionType"":""mcq"",""subject"":""Maths"",""grade"":4,""topic"":""Arithmetic Operations"",""subtopic"":""Division"",""learning_objective"":""Students can interpret remainders in context"",""focus"":""constrained_selection""}"
148,tao1uc4-sd6157-lscir1jhx-q148-mcq,Q148,mcq,A bakery made 103 mini cookies. They are packed into jars with 13 cookies in each jar. Then the leftover cookies are wrapped in a napkin. Choose the best answer.,Maths,4,Arithmetic Operations,Division,Students can interpret remainders in context,Applying,medium,3,"MCQ for Grade 4 Arithmetic Operations: Division, aligned to Students can interpret remainders in context.","[{""text"":""7 full jars and 12 cookies in the napkin"",""correct"":true},{""text"":""8 full jars and 9 cookies in the napkin"",""correct"":false},{""text"":""7 full jars and 10 cookies in the napkin"",""correct"":false},{""text"":""6 full jars and 25 cookies in the napkin"",""correct"":false}]","Nice reasoning! 13 × 7 = 91, and 103 - 91 = 12. So there are 7 full jars and 12 cookies left.","{""questionNumber"":""Q148"",""questionType"":""mcq"",""subject"":""Maths"",""grade"":4,""topic"":""Arithmetic Operations"",""subtopic"":""Division"",""learning_objective"":""Students can interpret remainders in context"",""focus"":""context_interpretation""}"
149,tao1uc4-sd6157-lscir1jhx-q149-mcq,Q149,mcq,Compare the two results for 74 ÷ 6 in a marble game. One result is 12 remainder 2. Another result is 11 remainder 8. Pick the result that makes sense in the story.,Maths,4,Arithmetic Operations,Division,Students can interpret remainders in context,Evaluating,medium,3,"MCQ for Grade 4 Arithmetic Operations: Division, aligned to Students can interpret remainders in context.","[{""text"":""12 remainder 2, because the remainder must be smaller than 6"",""correct"":true},{""text"":""11 remainder 8, because 11 + 8 = 19"",""correct"":false},{""text"":""11 remainder 8, because the remainder can be bigger than the divisor"",""correct"":false},{""text"":""Both results fit the story"",""correct"":false}]","Great checking! In division by 6, the remainder must be less than 6. So 12 remainder 2 makes sense, but remainder 8 does not.","{""questionNumber"":""Q149"",""questionType"":""mcq"",""subject"":""Maths"",""grade"":4,""topic"":""Arithmetic Operations"",""subtopic"":""Division"",""learning_objective"":""Students can interpret remainders in context"",""focus"":""compare_or_judge""}"
150,tao1uc4-sd6157-lscir1jhx-q150-mcq,Q150,mcq,"What does this result tell us? 68 ÷ 10 = 6 remainder 8, and the story is about toy boats packed into boxes of 10.",Maths,4,Arithmetic Operations,Division,Students can interpret remainders in context,Understanding,medium,3,"MCQ for Grade 4 Arithmetic Operations: Division, aligned to Students can interpret remainders in context.","[{""text"":""6 full boxes are packed, and 8 boats do not fill another full box."",""correct"":true},{""text"":""8 full boxes are packed, and 6 boats are left."",""correct"":false},{""text"":""Each box gets 6 boats, and 8 more boxes are needed."",""correct"":false},{""text"":""10 full boxes are packed, and 8 boats are left."",""correct"":false}]","Yes! You read the remainder correctly. The 6 tells the number of full boxes, and the 8 tells how many boats are left over.","{""questionNumber"":""Q150"",""questionType"":""mcq"",""subject"":""Maths"",""grade"":4,""topic"":""Arithmetic Operations"",""subtopic"":""Division"",""learning_objective"":""Students can interpret remainders in context"",""focus"":""representation_translation""}"
151,tao1uc4-sd6157-lscir1jhx-q151-mcq,Q151,mcq,"Choose the correct result for this rabbit ribbon problem: 87 ribbons are tied into bunches of 14. After the full bunches are made, the extra ribbons stay loose. Pick the answer that fits.",Maths,4,Arithmetic Operations,Division,Students can interpret remainders in context,Applying,medium,3,"MCQ for Grade 4 Arithmetic Operations: Division, aligned to Students can interpret remainders in context.","[{""text"":""6 full bunches and 3 ribbons loose"",""correct"":true},{""text"":""7 full bunches and 1 ribbon loose"",""correct"":false},{""text"":""6 full bunches and 5 ribbons loose"",""correct"":false},{""text"":""5 full bunches and 17 ribbons loose"",""correct"":false}]","Lovely work! 14 × 6 = 84, and 87 - 84 = 3. So 6 full bunches can be made, with 3 ribbons left.","{""questionNumber"":""Q151"",""questionType"":""mcq"",""subject"":""Maths"",""grade"":4,""topic"":""Arithmetic Operations"",""subtopic"":""Division"",""learning_objective"":""Students can interpret remainders in context"",""focus"":""context_interpretation""}"
152,tao1uc4-sd6157-lscir1jhx-q152-mcq,Q152,mcq,"Ninety-six sweets are shared equally among 7 friends. After everyone gets the same number, the leftover sweets stay in the bag. Which sentence is correct?",Maths,4,Arithmetic Operations,Division,Students can interpret remainders in context,Understanding,medium,3,"MCQ for Grade 4 Arithmetic Operations: Division, aligned to Students can interpret remainders in context.","[{""text"":""Each friend gets 13 sweets, and 5 sweets are left."",""correct"":true},{""text"":""Each friend gets 14 sweets, and 2 sweets are left."",""correct"":false},{""text"":""Each friend gets 13 sweets, and 7 sweets are left."",""correct"":false},{""text"":""Each friend gets 12 sweets, and 12 sweets are left."",""correct"":false}]","7 × 13 = 91, and 96 - 91 = 5, so 96 ÷ 7 = 13 remainder 5. That means each friend gets 13 sweets and 5 stay in the bag. Choice 1 is correct. The other choices do not match the division, and some give a remainder that is too large.","{""questionNumber"":""Q152"",""questionType"":""mcq"",""subject"":""Maths"",""grade"":4,""topic"":""Arithmetic Operations"",""subtopic"":""Division"",""learning_objective"":""Students can interpret remainders in context"",""focus"":""constrained_selection""}"
153,tao1uc4-sd6157-lscir1jhx-q153-mcq,Q153,mcq,A toy museum has 118 shiny buttons. The buttons are packed into trays that hold 15 buttons each. Then the extra buttons are put in a tiny bag. Choose the answer that matches the story.,Maths,4,Arithmetic Operations,Division,Students can interpret remainders in context,Applying,medium,3,"MCQ for Grade 4 Arithmetic Operations: Division, aligned to Students can interpret remainders in context.","[{""text"":""7 full trays and 13 buttons in the bag"",""correct"":true},{""text"":""8 full trays and 6 buttons in the bag"",""correct"":false},{""text"":""7 full trays and 12 buttons in the bag"",""correct"":false},{""text"":""6 full trays and 28 buttons in the bag"",""correct"":false}]","Great job staying careful! 15 × 7 = 105, and 118 - 105 = 13. So there are 7 full trays and 13 extra buttons.","{""questionNumber"":""Q153"",""questionType"":""mcq"",""subject"":""Maths"",""grade"":4,""topic"":""Arithmetic Operations"",""subtopic"":""Division"",""learning_objective"":""Students can interpret remainders in context"",""focus"":""multi_step_application""}"
154,tao1uc4-sd6157-lscir1jhx-q154-mcq,Q154,mcq,Look at the expressions below for a shell necklace story with 83 shells packed into strings of 9. Choose the expression that can be used to check the correct division answer.,Maths,4,Arithmetic Operations,Division,Students can interpret remainders in context,Analyzing,medium,3,"MCQ for Grade 4 Arithmetic Operations: Division, aligned to Students can interpret remainders in context.","[{""text"":""9 × 9 + 2 = 83"",""correct"":true},{""text"":""9 × 8 + 3 = 83"",""correct"":false},{""text"":""9 × 10 - 2 = 83"",""correct"":false},{""text"":""9 × 7 + 11 = 83"",""correct"":false}]","Nice checking! 83 ÷ 9 = 9 remainder 2 because 9 × 9 = 81, and 81 + 2 = 83. That matches the story.","{""questionNumber"":""Q154"",""questionType"":""mcq"",""subject"":""Maths"",""grade"":4,""topic"":""Arithmetic Operations"",""subtopic"":""Division"",""learning_objective"":""Students can interpret remainders in context"",""focus"":""representation_translation""}"
155,tao1uc4-sd6157-lscir1jhx-q155-mcq,Q155,mcq,"How many full teams are formed and how many players wait in this playground game? There are 101 children, and each team has 12 children. Choose the answer that fits.",Maths,4,Arithmetic Operations,Division,Students can interpret remainders in context,Applying,medium,3,"MCQ for Grade 4 Arithmetic Operations: Division, aligned to Students can interpret remainders in context.","[{""text"":""8 full teams and 5 children wait"",""correct"":true},{""text"":""9 full teams and 3 children wait"",""correct"":false},{""text"":""8 full teams and 4 children wait"",""correct"":false},{""text"":""7 full teams and 17 children wait"",""correct"":false}]","You did it! 12 × 8 = 96, and 101 - 96 = 5. So 8 full teams are made, and 5 children are left waiting.","{""questionNumber"":""Q155"",""questionType"":""mcq"",""subject"":""Maths"",""grade"":4,""topic"":""Arithmetic Operations"",""subtopic"":""Division"",""learning_objective"":""Students can interpret remainders in context"",""focus"":""context_interpretation""}"
156,tao1uc4-sd6157-lscir1jhx-q156-mcq,Q156,mcq,"Choose the correct result for this treasure map problem: 109 gold star stamps are placed into books with 17 stamps on each page. After the full pages are filled, the extra stamps stay in the envelope.",Maths,4,Arithmetic Operations,Division,Students can interpret remainders in context,Applying,medium,3,"MCQ for Grade 4 Arithmetic Operations: Division, aligned to Students can interpret remainders in context.","[{""text"":""6 full pages and 7 stamps in the envelope"",""correct"":true},{""text"":""7 full pages and 4 stamps in the envelope"",""correct"":false},{""text"":""6 full pages and 5 stamps in the envelope"",""correct"":false},{""text"":""5 full pages and 24 stamps in the envelope"",""correct"":false}]","Excellent! 17 × 6 = 102, and 109 - 102 = 7. So 6 full pages are filled, and 7 stamps are left.","{""questionNumber"":""Q156"",""questionType"":""mcq"",""subject"":""Maths"",""grade"":4,""topic"":""Arithmetic Operations"",""subtopic"":""Division"",""learning_objective"":""Students can interpret remainders in context"",""focus"":""context_interpretation""}"
157,tao1uc4-sd6157-lscir1jhx-q157-mcq,Q157,mcq,Eighty-nine apples are shared equally into 11 picnic baskets. Which answer correctly explains the quotient and remainder in this story?,Maths,4,Arithmetic Operations,Division,Students can interpret remainders in context,Analyzing,medium,3,"MCQ for Grade 4 Arithmetic Operations: Division, aligned to Students can interpret remainders in context.","[{""text"":""8 apples go in each basket, and 1 apple is left over."",""correct"":true},{""text"":""9 apples go in each basket, and 10 apples are left over."",""correct"":false},{""text"":""8 apples go in each basket, and 11 apples are left over."",""correct"":false},{""text"":""7 apples go in each basket, and 12 apples are left over."",""correct"":false}]","11 × 8 = 88, and 89 - 88 = 1, so 89 ÷ 11 = 8 remainder 1. That means 8 apples in each basket and 1 apple left over. Choice 1 is correct. Choice 2 would need 99 apples. Choice 3 has a remainder equal to the divisor, which is not allowed. Choice 4 does not use the greatest possible equal share.","{""questionNumber"":""Q157"",""questionType"":""mcq"",""subject"":""Maths"",""grade"":4,""topic"":""Arithmetic Operations"",""subtopic"":""Division"",""learning_objective"":""Students can interpret remainders in context"",""focus"":""constrained_selection""}"
158,tao1uc4-sd6157-lscir1jhx-q158-mcq,Q158,mcq,A carnival prize table has 97 toy rings. They are packed into packets of 16. Then the leftover rings are clipped together. Choose the best answer.,Maths,4,Arithmetic Operations,Division,Students can interpret remainders in context,Applying,medium,3,"MCQ for Grade 4 Arithmetic Operations: Division, aligned to Students can interpret remainders in context.","[{""text"":""6 full packets and 1 ring clipped together"",""correct"":true},{""text"":""5 full packets and 17 rings clipped together"",""correct"":false},{""text"":""6 full packets and 7 rings clipped together"",""correct"":false},{""text"":""7 full packets and 1 ring clipped together"",""correct"":false}]","Great work! 16 × 6 = 96, and 97 - 96 = 1. So there are 6 full packets and 1 extra ring.","{""questionNumber"":""Q158"",""questionType"":""mcq"",""subject"":""Maths"",""grade"":4,""topic"":""Arithmetic Operations"",""subtopic"":""Division"",""learning_objective"":""Students can interpret remainders in context"",""focus"":""multi_step_application""}"
159,tao1uc4-sd6157-lscir1jhx-q159-mcq,Q159,mcq,Compare these two ideas for 62 ÷ 8 in a snack story. One idea says 7 remainder 6. Another idea says 8 remainder 2. Pick the idea that fits and tell why by choosing the best option.,Maths,4,Arithmetic Operations,Division,Students can interpret remainders in context,Evaluating,medium,3,"MCQ for Grade 4 Arithmetic Operations: Division, aligned to Students can interpret remainders in context.","[{""text"":""7 remainder 6, because 8 × 7 = 56 and 62 - 56 = 6"",""correct"":true},{""text"":""8 remainder 2, because 8 groups always means remainder 2"",""correct"":false},{""text"":""8 remainder 2, because 8 × 8 = 62"",""correct"":false},{""text"":""7 remainder 6, because the remainder can be the same as the divisor"",""correct"":false}]","Nice job explaining! 8 × 7 = 56, and 6 are left, so 62 ÷ 8 = 7 remainder 6. The other idea does not check correctly.","{""questionNumber"":""Q159"",""questionType"":""mcq"",""subject"":""Maths"",""grade"":4,""topic"":""Arithmetic Operations"",""subtopic"":""Division"",""learning_objective"":""Students can interpret remainders in context"",""focus"":""compare_or_judge""}"
160,tao1uc4-sd6157-lscir1jhx-q160-mcq,Q160,mcq,"What does this result tell us in a sharing story? 93 ÷ 12 = 7 remainder 9, and the story is about puppy treats shared equally among 12 bowls.",Maths,4,Arithmetic Operations,Division,Students can interpret remainders in context,Understanding,medium,3,"MCQ for Grade 4 Arithmetic Operations: Division, aligned to Students can interpret remainders in context.","[{""text"":""Each bowl gets 7 treats, and 9 treats are left over."",""correct"":true},{""text"":""7 bowls get 12 treats, and 9 bowls are left over."",""correct"":false},{""text"":""Each bowl gets 9 treats, and 7 treats are left over."",""correct"":false},{""text"":""12 bowls get 7 treats, and 12 treats are left over."",""correct"":false}]",Brilliant! The 7 means each of the 12 bowls gets 7 treats. The remainder 9 means 9 treats are left after sharing equally.,"{""questionNumber"":""Q160"",""questionType"":""mcq"",""subject"":""Maths"",""grade"":4,""topic"":""Arithmetic Operations"",""subtopic"":""Division"",""learning_objective"":""Students can interpret remainders in context"",""focus"":""representation_translation""}"
161,tao1uc4-sd6157-lscir1jhx-q162-mcq,Q162,mcq,A party planner has 47 cookies and boxes that hold 5 cookies each. Which statement best explains why one more full box cannot be made after filling as many full boxes as possible?,Maths,4,Arithmetic Operations,Division,Students can interpret remainders in context,Analyzing,hard,4,"MCQ for Grade 4 Arithmetic Operations: Division, aligned to Students can interpret remainders in context.","[{""text"":""47 ÷ 5 = 9 remainder 2, so 9 full boxes use 45 cookies and the 2 left are not enough to fill another box of 5."",""correct"":true},{""text"":""47 ÷ 5 = 9 remainder 2, so the 2 leftover cookies should be counted as a 10th full box."",""correct"":false},{""text"":""47 ÷ 5 = 9 remainder 2, so the 2 leftover cookies should be placed one each into 2 of the full boxes to make 10 full boxes."",""correct"":false},{""text"":""47 ÷ 5 = 5 remainder 9, so 5 full boxes and 9 left show that 10 boxes are possible."",""correct"":false}]","5 × 9 = 45, so 47 ÷ 5 = 9 remainder 2. A full box must contain 5 cookies. After 9 full boxes are made, only 2 cookies remain, and 2 is not enough for another full box. Choice 2 incorrectly turns leftovers into a full group. Choice 3 misunderstands that adding extras to boxes that are already full does not create a new full box. Choice 4 swaps the quotient and remainder, and a remainder of 9 is impossible when dividing by 5.","{""questionNumber"":""Q162"",""questionType"":""mcq"",""subject"":""Maths"",""grade"":4,""topic"":""Arithmetic Operations"",""subtopic"":""Division"",""learning_objective"":""Students can interpret remainders in context"",""focus"":""compare_methods""}"
162,tao1uc4-sd6157-lscir1jhx-q164-mcq,Q164,mcq,Two picnic plans describe packing 65 strawberries into cups of 7. Plan A says 9 full cups and 2 strawberries left. Plan B says 8 full cups and 9 strawberries left. Which evaluation is correct?,Maths,4,Arithmetic Operations,Division,Students can interpret remainders in context,Evaluating,hard,4,"MCQ for Grade 4 Arithmetic Operations: Division, aligned to Students can interpret remainders in context.","[{""text"":""Plan A is correct because 7 × 9 = 63 with 2 left, and Plan B is not valid because 9 is too large to be a remainder when dividing by 7."",""correct"":true},{""text"":""Plan B is correct because 8 full cups and 9 left also total 65."",""correct"":false},{""text"":""Both plans are correct because each plan uses all 65 strawberries."",""correct"":false},{""text"":""Neither plan is correct because 65 cannot be divided by 7."",""correct"":false}]","65 ÷ 7 = 9 remainder 2 because 7 × 9 = 63 and 65 - 63 = 2. That makes Plan A correct. Plan B is not a valid quotient-and-remainder result because a remainder must be less than 7, and 9 is too large. Also, if 9 strawberries are left, another full cup could still be made, so 8 full cups cannot be the best packing.","{""questionNumber"":""Q164"",""questionType"":""mcq"",""subject"":""Maths"",""grade"":4,""topic"":""Arithmetic Operations"",""subtopic"":""Division"",""learning_objective"":""Students can interpret remainders in context"",""focus"":""compare_methods""}"
163,tao1uc4-sd6157-lscir1jhx-q166-mcq,Q166,mcq,Ninety-four stickers are shared equally among 9 friends. The leftovers stay in the packet. Which evaluation of the answer 10 remainder 4 is correct?,Maths,4,Arithmetic Operations,Division,Students can interpret remainders in context,Evaluating,hard,4,"MCQ for Grade 4 Arithmetic Operations: Division, aligned to Students can interpret remainders in context.","[{""text"":""It is correct, because 9 × 10 = 90, so each friend gets 10 stickers and 4 stickers stay in the packet."",""correct"":true},{""text"":""It is not correct, because the 4 leftover stickers should be added to the 10 so each friend gets 14 stickers."",""correct"":false},{""text"":""It is not correct, because each friend gets 11 stickers and 5 stay in the packet."",""correct"":false},{""text"":""It is not correct, because when sharing among 9 friends the remainder must be 9."",""correct"":false}]","94 ÷ 9 = 10 remainder 4 because 9 × 10 = 90 and 94 - 90 = 4. Since the leftovers stay in the packet, each friend gets 10 stickers and 4 remain. Choice 2 is wrong because the remainder is not added to each friend's share. Choice 3 is wrong because 9 × 11 = 99, which is too many. Choice 4 is wrong because a remainder must be less than 9, not equal to 9.","{""questionNumber"":""Q166"",""questionType"":""mcq"",""subject"":""Maths"",""grade"":4,""topic"":""Arithmetic Operations"",""subtopic"":""Division"",""learning_objective"":""Students can interpret remainders in context"",""focus"":""evaluate_a_claim""}"
164,tao1uc4-sd6157-lscir1jhx-q168-mcq,Q168,mcq,"A playground box holds 4 balls. There are 39 balls to pack. One helper wrote, ""39 ÷ 4 = 9 remainder 3, so 10 full boxes are packed."" Choose the best answer.",Maths,4,Arithmetic Operations,Division,Students can interpret remainders in context,Analyzing,hard,4,"MCQ for Grade 4 Arithmetic Operations: Division, aligned to Students can interpret remainders in context.","[{""text"":""The mistake is calling the 10th box full. The answer is 9 full boxes and 3 balls left."",""correct"":true},{""text"":""The mistake is dividing by 4. It should be multiplied by 4."",""correct"":false},{""text"":""The mistake is the remainder. It should be 4."",""correct"":false},{""text"":""There is no mistake because any remainder makes a full box."",""correct"":false}]","Great spotting! A remainder means the last box is not full. So only 9 boxes are full, and 3 balls are left.","{""questionNumber"":""Q168"",""questionType"":""mcq"",""subject"":""Maths"",""grade"":4,""topic"":""Arithmetic Operations"",""subtopic"":""Division"",""learning_objective"":""Students can interpret remainders in context"",""focus"":""find_the_error""}"
165,tao1uc4-sd6157-lscir1jhx-q169-mcq,Q169,mcq,"A parade leader has 52 toy ducks and wants to arrange them in equal rows of 6. Only complete rows may go in the parade, and any extra ducks must wait at the side. Plan Red says there will be 8 full rows and 4 ducks waiting. Plan Blue says there will be 9 full rows because 8 remainder 4 is almost 9. Which plan is correct?",Maths,4,Arithmetic Operations,Division,Students can interpret remainders in context,Evaluating,hard,4,"MCQ for Grade 4 Arithmetic Operations: Division, aligned to Students can interpret remainders in context.","[{""text"":""Plan Red is correct because 52 ÷ 6 = 8 remainder 4, so only 8 complete rows can be made and 4 ducks must wait."",""correct"":true},{""text"":""Plan Blue is correct because any remainder means you can count one more full row."",""correct"":false},{""text"":""Both plans are correct because 8 rows and 9 rows are close to each other."",""correct"":false},{""text"":""Neither plan is correct because an even number of ducks cannot make rows of 6."",""correct"":false}]","52 ÷ 6 = 8 remainder 4 because 6 × 8 = 48 and 52 - 48 = 4. The 4 extra ducks are not enough to make another full row of 6, so only 8 complete rows can be in the parade. That is why Plan Red is correct and Plan Blue is not.","{""questionNumber"":""Q169"",""questionType"":""mcq"",""subject"":""Maths"",""grade"":4,""topic"":""Arithmetic Operations"",""subtopic"":""Division"",""learning_objective"":""Students can interpret remainders in context"",""focus"":""evaluate_a_claim""}"
