rowNumber,queueId,questionNumber,questionType,questionText,subject,grade,topic,subtopic,learningObjective,bloomsLevel,difficultyLevel,difficultyRating,summary,options,explanation,generationMetadata
103,ttps1oex-sds1268-lscce1vem-q103-mcq,Q103,mcq,A monkey puppet show starts at 12:38 p.m. and finishes at 2:14 p.m. Pick the best answer for how long it lasts.,Maths,4,Time Problem Solving,Duration & Schedules,Students can calculate elapsed time across hours and minutes,Applying,medium,3,"MCQ for Grade 4 Time Problem Solving: Duration & Schedules, aligned to Students can calculate elapsed time across hours and minutes.","[{""text"":""1 hour 26 minutes"",""correct"":false},{""text"":""1 hour 36 minutes"",""correct"":true},{""text"":""2 hours 36 minutes"",""correct"":false},{""text"":""36 minutes"",""correct"":false}]","Nice work! From 12:38 to 1:38 is 1 hour, then to 2:14 is 36 minutes. So the show lasts 1 hour 36 minutes.","{""questionNumber"":""Q103"",""questionType"":""mcq"",""subject"":""Maths"",""grade"":4,""topic"":""Time Problem Solving"",""subtopic"":""Duration & Schedules"",""learning_objective"":""Students can calculate elapsed time across hours and minutes"",""focus"":""context_interpretation""}"
104,ttps1oex-sds1268-lscce1vem-q104-mcq,Q104,mcq,Look at this worked idea for a bike ride from 4:47 p.m. to 6:02 p.m. Decide which answer is correct.,Maths,4,Time Problem Solving,Duration & Schedules,Students can calculate elapsed time across hours and minutes,Analyzing,medium,3,"MCQ for Grade 4 Time Problem Solving: Duration & Schedules, aligned to Students can calculate elapsed time across hours and minutes.","[{""text"":""It lasts 1 hour 15 minutes because from 4:47 to 5:47 is 1 hour, then from 5:47 to 6:02 is 15 minutes."",""correct"":true},{""text"":""It lasts 1 hour 15 minutes because 47 to 02 is 15 minutes."",""correct"":false},{""text"":""It lasts 2 hours 15 minutes because the ride goes into the next hour."",""correct"":false},{""text"":""It lasts 55 minutes because 60 - 47 = 13."",""correct"":false}]","Count on in parts. From 4:47 p.m. to 5:47 p.m. is 1 hour. From 5:47 p.m. to 6:02 p.m. is 15 minutes. So the total is 1 hour 15 minutes. Option 2 has the right total but wrong reasoning, because you cannot say 47 to 02 is 15 minutes without crossing the hour correctly.","{""questionNumber"":""Q104"",""questionType"":""mcq"",""subject"":""Maths"",""grade"":4,""topic"":""Time Problem Solving"",""subtopic"":""Duration & Schedules"",""learning_objective"":""Students can calculate elapsed time across hours and minutes"",""focus"":""error_correction""}"
105,ttps1oex-sds1268-lscce1vem-q105-mcq,Q105,mcq,"Choose the method that correctly solves this candy stall visit: start at 3:14 p.m., last 1 hour 49 minutes.",Maths,4,Time Problem Solving,Duration & Schedules,Students can calculate elapsed time across hours and minutes,Analyzing,medium,3,"MCQ for Grade 4 Time Problem Solving: Duration & Schedules, aligned to Students can calculate elapsed time across hours and minutes.","[{""text"":""Add 1 hour to get 4:14, then add 49 minutes to get 5:03 p.m."",""correct"":true},{""text"":""Add 1 hour to get 4:14, then add 49 minutes to get 4:63 p.m."",""correct"":false},{""text"":""Add 49 minutes first to get 3:53, then add 1 hour to get 4:53 p.m."",""correct"":false},{""text"":""Add 14 and 49 to get 63, so it ends at 4:63 p.m."",""correct"":false}]","Great job choosing the sensible method! 3:14 + 1 hour = 4:14, and 49 more minutes lands on 5:03 p.m.","{""questionNumber"":""Q105"",""questionType"":""mcq"",""subject"":""Maths"",""grade"":4,""topic"":""Time Problem Solving"",""subtopic"":""Duration & Schedules"",""learning_objective"":""Students can calculate elapsed time across hours and minutes"",""focus"":""operation_reasoning""}"
106,ttps1oex-sds1268-lscce1vem-q106-mcq,Q106,mcq,Pick the correct end time for a lego challenge that begins at 10:29 a.m. and lasts 1 hour 36 minutes.,Maths,4,Time Problem Solving,Duration & Schedules,Students can calculate elapsed time across hours and minutes,Applying,medium,3,"MCQ for Grade 4 Time Problem Solving: Duration & Schedules, aligned to Students can calculate elapsed time across hours and minutes.","[{""text"":""11:55 a.m."",""correct"":false},{""text"":""12:05 p.m."",""correct"":true},{""text"":""12:15 p.m."",""correct"":false},{""text"":""11:65 a.m."",""correct"":false}]",Super work! Add 1 hour to 10:29 to get 11:29. Then add 31 minutes to 12:00 and 5 more minutes to 12:05 p.m.,"{""questionNumber"":""Q106"",""questionType"":""mcq"",""subject"":""Maths"",""grade"":4,""topic"":""Time Problem Solving"",""subtopic"":""Duration & Schedules"",""learning_objective"":""Students can calculate elapsed time across hours and minutes"",""focus"":""multi_step_application""}"
107,ttps1oex-sds1268-lscce1vem-q107-mcq,Q107,mcq,Decide which claim about a pet parade from 1:58 p.m. to 3:12 p.m. is true.,Maths,4,Time Problem Solving,Duration & Schedules,Students can calculate elapsed time across hours and minutes,Understanding,medium,3,"MCQ for Grade 4 Time Problem Solving: Duration & Schedules, aligned to Students can calculate elapsed time across hours and minutes.","[{""text"":""It lasts 1 hour 4 minutes."",""correct"":false},{""text"":""It lasts 1 hour 14 minutes."",""correct"":true},{""text"":""It lasts 2 hours 14 minutes."",""correct"":false},{""text"":""It lasts 14 minutes."",""correct"":false}]","You’re doing great! From 1:58 to 2:58 is 1 hour, then to 3:12 is 14 minutes. Total: 1 hour 14 minutes.","{""questionNumber"":""Q107"",""questionType"":""mcq"",""subject"":""Maths"",""grade"":4,""topic"":""Time Problem Solving"",""subtopic"":""Duration & Schedules"",""learning_objective"":""Students can calculate elapsed time across hours and minutes"",""focus"":""representation_translation""}"
108,ttps1oex-sds1268-lscce1vem-q108-mcq,Q108,mcq,A treasure map game starts at 9:33 a.m. and ends at 11:08 a.m. Choose the length of the game.,Maths,4,Time Problem Solving,Duration & Schedules,Students can calculate elapsed time across hours and minutes,Applying,medium,3,"MCQ for Grade 4 Time Problem Solving: Duration & Schedules, aligned to Students can calculate elapsed time across hours and minutes.","[{""text"":""1 hour 25 minutes"",""correct"":false},{""text"":""1 hour 35 minutes"",""correct"":true},{""text"":""2 hours 35 minutes"",""correct"":false},{""text"":""35 minutes"",""correct"":false}]","Nice and steady! From 9:33 to 10:33 is 1 hour, then to 11:08 is 35 minutes. So the game lasts 1 hour 35 minutes.","{""questionNumber"":""Q108"",""questionType"":""mcq"",""subject"":""Maths"",""grade"":4,""topic"":""Time Problem Solving"",""subtopic"":""Duration & Schedules"",""learning_objective"":""Students can calculate elapsed time across hours and minutes"",""focus"":""word_context""}"
109,ttps1oex-sds1268-lscce1vem-q109-mcq,Q109,mcq,Compare these two fun rides. Mini train: 2:42 p.m. to 3:18 p.m. Bumper cars: 4:05 p.m. to 4:48 p.m. Decide which comparison is correct.,Maths,4,Time Problem Solving,Duration & Schedules,Students can calculate elapsed time across hours and minutes,Analyzing,medium,3,"MCQ for Grade 4 Time Problem Solving: Duration & Schedules, aligned to Students can calculate elapsed time across hours and minutes.","[{""text"":""Mini train is longer by 7 minutes."",""correct"":false},{""text"":""Bumper cars are longer by 7 minutes."",""correct"":true},{""text"":""Both rides last 43 minutes."",""correct"":false},{""text"":""Bumper cars are longer by 13 minutes."",""correct"":false}]",Great comparing! Mini train lasts 36 minutes. Bumper cars last 43 minutes. So bumper cars are longer by 7 minutes.,"{""questionNumber"":""Q109"",""questionType"":""mcq"",""subject"":""Maths"",""grade"":4,""topic"":""Time Problem Solving"",""subtopic"":""Duration & Schedules"",""learning_objective"":""Students can calculate elapsed time across hours and minutes"",""focus"":""compare_or_judge""}"
110,ttps1oex-sds1268-lscce1vem-q110-mcq,Q110,mcq,Choose the plan that matches all the clues: a dance practice lasts 1 hour 28 minutes and starts at 5:37 p.m.,Maths,4,Time Problem Solving,Duration & Schedules,Students can calculate elapsed time across hours and minutes,Applying,medium,3,"MCQ for Grade 4 Time Problem Solving: Duration & Schedules, aligned to Students can calculate elapsed time across hours and minutes.","[{""text"":""It ends at 6:55 p.m."",""correct"":false},{""text"":""It ends at 7:05 p.m."",""correct"":true},{""text"":""It ends at 7:15 p.m."",""correct"":false},{""text"":""It ends at 6:65 p.m."",""correct"":false}]","Brilliant! Add 1 hour to 5:37 to get 6:37, then add 28 minutes to get 7:05 p.m.","{""questionNumber"":""Q110"",""questionType"":""mcq"",""subject"":""Maths"",""grade"":4,""topic"":""Time Problem Solving"",""subtopic"":""Duration & Schedules"",""learning_objective"":""Students can calculate elapsed time across hours and minutes"",""focus"":""constrained_selection""}"
111,ttps1oex-sds1268-lscce1vem-q111-mcq,Q111,mcq,Choose the correct total time for a hamster maze that starts at 8:35 a.m. and ends at 10:05 a.m.,Maths,4,Time Problem Solving,Duration & Schedules,Students can calculate elapsed time across hours and minutes,Applying,medium,3,"MCQ for Grade 4 Time Problem Solving: Duration & Schedules, aligned to Students can calculate elapsed time across hours and minutes.","[{""text"":""1 hour 20 minutes"",""correct"":false},{""text"":""1 hour 30 minutes"",""correct"":true},{""text"":""2 hours 30 minutes"",""correct"":false},{""text"":""30 minutes"",""correct"":false}]","Nice work! From 8:35 to 9:35 is 1 hour, then to 10:05 is 30 minutes more. That makes 1 hour 30 minutes.","{""questionNumber"":""Q111"",""questionType"":""mcq"",""subject"":""Maths"",""grade"":4,""topic"":""Time Problem Solving"",""subtopic"":""Duration & Schedules"",""learning_objective"":""Students can calculate elapsed time across hours and minutes"",""focus"":""multi_step_application""}"
112,ttps1oex-sds1268-lscce1vem-q112-mcq,Q112,mcq,Select the true statement written in hours and minutes about a toy boat ride that begins at 1:45 p.m. and finishes at 3:20 p.m.,Maths,4,Time Problem Solving,Duration & Schedules,Students can calculate elapsed time across hours and minutes,Analyzing,medium,3,"MCQ for Grade 4 Time Problem Solving: Duration & Schedules, aligned to Students can calculate elapsed time across hours and minutes.","[{""text"":""The ride lasts 1 hour 25 minutes."",""correct"":false},{""text"":""The ride lasts 1 hour 35 minutes."",""correct"":true},{""text"":""The ride lasts 2 hours 20 minutes."",""correct"":false},{""text"":""The ride lasts 95 hours and minutes."",""correct"":false}]","From 1:45 p.m. to 2:45 p.m. is 1 hour. From 2:45 p.m. to 3:20 p.m. is 35 minutes. So the ride lasts 1 hour 35 minutes. Option 1 is 10 minutes too short, option 3 treats the end time like a duration, and option 4 is not a correct way to write a time in hours and minutes.","{""questionNumber"":""Q112"",""questionType"":""mcq"",""subject"":""Maths"",""grade"":4,""topic"":""Time Problem Solving"",""subtopic"":""Duration & Schedules"",""learning_objective"":""Students can calculate elapsed time across hours and minutes"",""focus"":""representation_translation""}"
113,ttps1oex-sds1268-lscce1vem-q113-mcq,Q113,mcq,A sticker swap starts at 4:18 p.m. and lasts 1 hour 26 minutes. Pick the time when it ends.,Maths,4,Time Problem Solving,Duration & Schedules,Students can calculate elapsed time across hours and minutes,Applying,medium,3,"MCQ for Grade 4 Time Problem Solving: Duration & Schedules, aligned to Students can calculate elapsed time across hours and minutes.","[{""text"":""5:34 p.m."",""correct"":false},{""text"":""5:44 p.m."",""correct"":true},{""text"":""6:44 p.m."",""correct"":false},{""text"":""4:44 p.m."",""correct"":false}]","Well done! Add 1 hour to 4:18 to get 5:18, then add 26 minutes to get 5:44 p.m.","{""questionNumber"":""Q113"",""questionType"":""mcq"",""subject"":""Maths"",""grade"":4,""topic"":""Time Problem Solving"",""subtopic"":""Duration & Schedules"",""learning_objective"":""Students can calculate elapsed time across hours and minutes"",""focus"":""context_interpretation""}"
114,ttps1oex-sds1268-lscce1vem-q114-mcq,Q114,mcq,Compare the two fun times. Bubble game: 9:25 a.m. to 10:10 a.m. Puppy video: 2:40 p.m. to 3:35 p.m. Choose the correct comparison.,Maths,4,Time Problem Solving,Duration & Schedules,Students can calculate elapsed time across hours and minutes,Analyzing,medium,3,"MCQ for Grade 4 Time Problem Solving: Duration & Schedules, aligned to Students can calculate elapsed time across hours and minutes.","[{""text"":""The bubble game is longer by 10 minutes."",""correct"":false},{""text"":""The puppy video is longer by 5 minutes."",""correct"":false},{""text"":""The puppy video is longer by 10 minutes."",""correct"":true},{""text"":""Both last 45 minutes."",""correct"":false}]",You’re doing great! Bubble game is 45 minutes. Puppy video is 55 minutes. So the puppy video is longer by 10 minutes.,"{""questionNumber"":""Q114"",""questionType"":""mcq"",""subject"":""Maths"",""grade"":4,""topic"":""Time Problem Solving"",""subtopic"":""Duration & Schedules"",""learning_objective"":""Students can calculate elapsed time across hours and minutes"",""focus"":""compare_or_judge""}"
115,ttps1oex-sds1268-lscce1vem-q115-mcq,Q115,mcq,"Choose the method that correctly solves this cookie baking time: start at 11:32 a.m., last 1 hour 47 minutes.",Maths,4,Time Problem Solving,Duration & Schedules,Students can calculate elapsed time across hours and minutes,Analyzing,medium,3,"MCQ for Grade 4 Time Problem Solving: Duration & Schedules, aligned to Students can calculate elapsed time across hours and minutes.","[{""text"":""Add 1 hour to get 12:32 p.m., then add 47 minutes to get 1:19 p.m."",""correct"":true},{""text"":""Add 47 to 32 and keep the hour the same to get 11:79 a.m."",""correct"":false},{""text"":""Add 1 hour to get 12:32 p.m., then add 47 minutes to get 12:79 p.m."",""correct"":false},{""text"":""Add 1 and 47 to make 148 minutes, so the end time is 12:48 p.m."",""correct"":false}]","Excellent job! 11:32 a.m. plus 1 hour is 12:32 p.m., and 47 more minutes is 1:19 p.m. The other methods forget to regroup the minutes.","{""questionNumber"":""Q115"",""questionType"":""mcq"",""subject"":""Maths"",""grade"":4,""topic"":""Time Problem Solving"",""subtopic"":""Duration & Schedules"",""learning_objective"":""Students can calculate elapsed time across hours and minutes"",""focus"":""operation_reasoning""}"
116,ttps1oex-sds1268-lscce1vem-q116-mcq,Q116,mcq,Choose the correct start time for a pony walk that ends at 5:12 p.m. after 1 hour 38 minutes.,Maths,4,Time Problem Solving,Duration & Schedules,Students can calculate elapsed time across hours and minutes,Applying,medium,3,"MCQ for Grade 4 Time Problem Solving: Duration & Schedules, aligned to Students can calculate elapsed time across hours and minutes.","[{""text"":""3:34 p.m."",""correct"":true},{""text"":""3:44 p.m."",""correct"":false},{""text"":""4:34 p.m."",""correct"":false},{""text"":""4:50 p.m."",""correct"":false}]","Nice! Work backward: 5:12 minus 38 minutes is 4:34, then minus 1 hour is 3:34 p.m.","{""questionNumber"":""Q116"",""questionType"":""mcq"",""subject"":""Maths"",""grade"":4,""topic"":""Time Problem Solving"",""subtopic"":""Duration & Schedules"",""learning_objective"":""Students can calculate elapsed time across hours and minutes"",""focus"":""multi_step_application""}"
117,ttps1oex-sds1268-lscce1vem-q117-mcq,Q117,mcq,Decide which claim about a lunch break from 12:55 p.m. to 2:10 p.m. is true.,Maths,4,Time Problem Solving,Duration & Schedules,Students can calculate elapsed time across hours and minutes,Analyzing,medium,3,"MCQ for Grade 4 Time Problem Solving: Duration & Schedules, aligned to Students can calculate elapsed time across hours and minutes.","[{""text"":""It lasts 1 hour 5 minutes."",""correct"":false},{""text"":""It lasts 1 hour 15 minutes."",""correct"":true},{""text"":""It lasts 2 hours 15 minutes."",""correct"":false},{""text"":""It lasts 55 minutes."",""correct"":false}]","Good job! From 12:55 to 1:55 is 1 hour, then to 2:10 is 15 minutes more. That makes 1 hour 15 minutes.","{""questionNumber"":""Q117"",""questionType"":""mcq"",""subject"":""Maths"",""grade"":4,""topic"":""Time Problem Solving"",""subtopic"":""Duration & Schedules"",""learning_objective"":""Students can calculate elapsed time across hours and minutes"",""focus"":""which_statement""}"
118,ttps1oex-sds1268-lscce1vem-q118-mcq,Q118,mcq,A parrot show begins at 10:27 a.m. and ends at 12:03 p.m. Choose the length of the show.,Maths,4,Time Problem Solving,Duration & Schedules,Students can calculate elapsed time across hours and minutes,Applying,medium,3,"MCQ for Grade 4 Time Problem Solving: Duration & Schedules, aligned to Students can calculate elapsed time across hours and minutes.","[{""text"":""1 hour 26 minutes"",""correct"":false},{""text"":""1 hour 36 minutes"",""correct"":true},{""text"":""2 hours 36 minutes"",""correct"":false},{""text"":""36 minutes"",""correct"":false}]","Great work! From 10:27 to 11:27 is 1 hour, then to 12:03 is 36 minutes. So the show lasts 1 hour 36 minutes.","{""questionNumber"":""Q118"",""questionType"":""mcq"",""subject"":""Maths"",""grade"":4,""topic"":""Time Problem Solving"",""subtopic"":""Duration & Schedules"",""learning_objective"":""Students can calculate elapsed time across hours and minutes"",""focus"":""context_interpretation""}"
119,ttps1oex-sds1268-lscce1vem-q119-mcq,Q119,mcq,"Look at this worked idea for a marble game from 3:48 p.m. to 5:02 p.m.: first go to 4:48, then to 5:02. Choose the correct total time.",Maths,4,Time Problem Solving,Duration & Schedules,Students can calculate elapsed time across hours and minutes,Analyzing,medium,3,"MCQ for Grade 4 Time Problem Solving: Duration & Schedules, aligned to Students can calculate elapsed time across hours and minutes.","[{""text"":""1 hour 4 minutes"",""correct"":false},{""text"":""1 hour 14 minutes"",""correct"":true},{""text"":""2 hours 14 minutes"",""correct"":false},{""text"":""14 minutes"",""correct"":false}]","Super thinking! 3:48 to 4:48 is 1 hour, and 4:48 to 5:02 is 14 minutes. Together that is 1 hour 14 minutes.","{""questionNumber"":""Q119"",""questionType"":""mcq"",""subject"":""Maths"",""grade"":4,""topic"":""Time Problem Solving"",""subtopic"":""Duration & Schedules"",""learning_objective"":""Students can calculate elapsed time across hours and minutes"",""focus"":""error_correction""}"
120,ttps1oex-sds1268-lscce1vem-q120-mcq,Q120,mcq,Choose the schedule that correctly matches a game that lasts 1 hour 32 minutes and ends at 4:45 p.m.,Maths,4,Time Problem Solving,Duration & Schedules,Students can calculate elapsed time across hours and minutes,Analyzing,medium,3,"MCQ for Grade 4 Time Problem Solving: Duration & Schedules, aligned to Students can calculate elapsed time across hours and minutes.","[{""text"":""3:13 p.m. to 4:45 p.m."",""correct"":true},{""text"":""3:23 p.m. to 4:45 p.m."",""correct"":false},{""text"":""2:13 p.m. to 4:45 p.m."",""correct"":false},{""text"":""3:13 p.m. to 4:35 p.m."",""correct"":false}]","Fantastic! Work backward from 4:45 p.m. Minus 32 minutes is 4:13, then minus 1 hour is 3:13 p.m.","{""questionNumber"":""Q120"",""questionType"":""mcq"",""subject"":""Maths"",""grade"":4,""topic"":""Time Problem Solving"",""subtopic"":""Duration & Schedules"",""learning_objective"":""Students can calculate elapsed time across hours and minutes"",""focus"":""constrained_selection""}"
121,ttps1oex-sds1268-lscce1vem-q121-mcq,Q121,mcq,Choose the correct result for a dragon kite show that starts at 2:36 p.m. and lasts 2 hours 18 minutes.,Maths,4,Time Problem Solving,Duration & Schedules,Students can calculate elapsed time across hours and minutes,Applying,medium,3,"MCQ for Grade 4 Time Problem Solving: Duration & Schedules, aligned to Students can calculate elapsed time across hours and minutes.","[{""text"":""4:44 p.m."",""correct"":false},{""text"":""4:54 p.m."",""correct"":true},{""text"":""5:18 p.m."",""correct"":false},{""text"":""3:54 p.m."",""correct"":false}]","Great! Add 2 hours to 2:36 to get 4:36, then add 18 minutes to get 4:54 p.m.","{""questionNumber"":""Q121"",""questionType"":""mcq"",""subject"":""Maths"",""grade"":4,""topic"":""Time Problem Solving"",""subtopic"":""Duration & Schedules"",""learning_objective"":""Students can calculate elapsed time across hours and minutes"",""focus"":""multi_step_application""}"
122,ttps1oex-sds1268-lscce1vem-q122-mcq,Q122,mcq,Choose the sentence that is correct about a slime-making session from 9:42 a.m. to 11:17 a.m.,Maths,4,Time Problem Solving,Duration & Schedules,Students can calculate elapsed time across hours and minutes,Understanding,medium,3,"MCQ for Grade 4 Time Problem Solving: Duration & Schedules, aligned to Students can calculate elapsed time across hours and minutes.","[{""text"":""It lasts 1 hour 25 minutes."",""correct"":false},{""text"":""It lasts 1 hour 35 minutes."",""correct"":true},{""text"":""It lasts 2 hours 35 minutes."",""correct"":false},{""text"":""It lasts 35 minutes."",""correct"":false}]","Nice one! From 9:42 to 10:42 is 1 hour, and from 10:42 to 11:17 is 35 minutes. So it lasts 1 hour 35 minutes.","{""questionNumber"":""Q122"",""questionType"":""mcq"",""subject"":""Maths"",""grade"":4,""topic"":""Time Problem Solving"",""subtopic"":""Duration & Schedules"",""learning_objective"":""Students can calculate elapsed time across hours and minutes"",""focus"":""representation_translation""}"
123,ttps1oex-sds1268-lscce1vem-q123-mcq,Q123,mcq,A robot dance starts at 6:14 p.m. and lasts 58 minutes. Pick the finishing time.,Maths,4,Time Problem Solving,Duration & Schedules,Students can calculate elapsed time across hours and minutes,Applying,medium,3,"MCQ for Grade 4 Time Problem Solving: Duration & Schedules, aligned to Students can calculate elapsed time across hours and minutes.","[{""text"":""6:52 p.m."",""correct"":false},{""text"":""7:02 p.m."",""correct"":false},{""text"":""7:12 p.m."",""correct"":true},{""text"":""7:22 p.m."",""correct"":false}]","From 6:14 p.m. to 7:00 p.m. is 46 minutes. Then 58 - 46 = 12 more minutes, so the finishing time is 7:12 p.m. The other options come from not regrouping the minutes correctly.","{""questionNumber"":""Q123"",""questionType"":""mcq"",""subject"":""Maths"",""grade"":4,""topic"":""Time Problem Solving"",""subtopic"":""Duration & Schedules"",""learning_objective"":""Students can calculate elapsed time across hours and minutes"",""focus"":""context_interpretation""}"
124,ttps1oex-sds1268-lscce1vem-q124-mcq,Q124,mcq,"Decide which comparison is correct for these snack times: cracker time is 1:18 p.m. to 2:06 p.m., and orange time is 4:35 p.m. to 5:20 p.m.",Maths,4,Time Problem Solving,Duration & Schedules,Students can calculate elapsed time across hours and minutes,Analyzing,medium,3,"MCQ for Grade 4 Time Problem Solving: Duration & Schedules, aligned to Students can calculate elapsed time across hours and minutes.","[{""text"":""Cracker time is longer by 3 minutes."",""correct"":true},{""text"":""Orange time is longer by 3 minutes."",""correct"":false},{""text"":""Both times are 48 minutes."",""correct"":false},{""text"":""Cracker time is longer by 13 minutes."",""correct"":false}]",Excellent! Cracker time is 48 minutes. Orange time is 45 minutes. So cracker time is longer by 3 minutes.,"{""questionNumber"":""Q124"",""questionType"":""mcq"",""subject"":""Maths"",""grade"":4,""topic"":""Time Problem Solving"",""subtopic"":""Duration & Schedules"",""learning_objective"":""Students can calculate elapsed time across hours and minutes"",""focus"":""compare_or_judge""}"
125,ttps1oex-sds1268-lscce1vem-q125-mcq,Q125,mcq,"Choose the method that correctly solves this puzzle room visit: end at 7:06 p.m., length 1 hour 29 minutes.",Maths,4,Time Problem Solving,Duration & Schedules,Students can calculate elapsed time across hours and minutes,Analyzing,medium,3,"MCQ for Grade 4 Time Problem Solving: Duration & Schedules, aligned to Students can calculate elapsed time across hours and minutes.","[{""text"":""Go back 29 minutes to 6:37 p.m., then back 1 hour to 5:37 p.m."",""correct"":true},{""text"":""Go back 1 hour to 6:06 p.m., then back 29 minutes to 5:47 p.m."",""correct"":false},{""text"":""Go back 29 minutes to 6:47 p.m., then back 1 hour to 5:47 p.m."",""correct"":false},{""text"":""Go back 1 hour 29 minutes to 6:77 p.m."",""correct"":false}]","Brilliant! Subtract 29 minutes from 7:06 to get 6:37, then subtract 1 hour to get 5:37 p.m.","{""questionNumber"":""Q125"",""questionType"":""mcq"",""subject"":""Maths"",""grade"":4,""topic"":""Time Problem Solving"",""subtopic"":""Duration & Schedules"",""learning_objective"":""Students can calculate elapsed time across hours and minutes"",""focus"":""operation_reasoning""}"
126,ttps1oex-sds1268-lscce1vem-q126-mcq,Q126,mcq,Choose the correct total time for a teddy bear picnic that starts at 10:50 a.m. and ends at 12:25 p.m.,Maths,4,Time Problem Solving,Duration & Schedules,Students can calculate elapsed time across hours and minutes,Applying,medium,3,"MCQ for Grade 4 Time Problem Solving: Duration & Schedules, aligned to Students can calculate elapsed time across hours and minutes.","[{""text"":""1 hour 15 minutes"",""correct"":false},{""text"":""1 hour 25 minutes"",""correct"":false},{""text"":""1 hour 35 minutes"",""correct"":true},{""text"":""2 hours 35 minutes"",""correct"":false}]","Great job! From 10:50 to 11:50 is 1 hour, then to 12:25 is 35 minutes more. So it lasts 1 hour 35 minutes.","{""questionNumber"":""Q126"",""questionType"":""mcq"",""subject"":""Maths"",""grade"":4,""topic"":""Time Problem Solving"",""subtopic"":""Duration & Schedules"",""learning_objective"":""Students can calculate elapsed time across hours and minutes"",""focus"":""multi_step_application""}"
