rowNumber,queueId,questionNumber,questionType,questionText,subject,grade,topic,subtopic,learningObjective,bloomsLevel,difficultyLevel,difficultyRating,summary,options,explanation,generationMetadata
1,tvei4t7-seekm5z-lscsa1ybu-q1-mcq,Q1,mcq,"A toy box follows the rule 4x + 3. When x = 5, the rule gives a starting number. Then 2 toy cars roll away. Ben says the final number is 18 because he did 4 + 5 + 3 + 2 + 4. Which answer is correct?",Maths,4,Variables & Expressions,Evaluating Expressions,Students can substitute a value for a variable and evaluate a simple expression,Analyzing,hard,4,"MCQ for Grade 4 Variables & Expressions: Evaluating Expressions, aligned to Students can substitute a value for a variable and evaluate a simple expression.","[{""text"":""Ben is correct. The final number is 18."",""correct"":false},{""text"":""Ben is not correct. The final number is 21."",""correct"":true},{""text"":""Ben is not correct. The final number is 23."",""correct"":false},{""text"":""Ben is not correct. The final number is 20."",""correct"":false}]","Substitute x = 5 into 4x + 3: 4(5) + 3 = 20 + 3 = 23. Then 2 roll away, so 23 - 2 = 21. Ben's method is wrong because 4x means 4 times 5, not 4 + 5. 23 is the value before 2 are taken away, and 20 ignores the +3 part of the rule.","{""questionNumber"":""Q1"",""questionType"":""mcq"",""subject"":""Maths"",""grade"":4,""topic"":""Variables & Expressions"",""subtopic"":""Evaluating Expressions"",""learning_objective"":""Students can substitute a value for a variable and evaluate a simple expression"",""focus"":""multi-step evaluation""}"
2,tvei4t7-seekm5z-lscsa1ybu-q2-mcq,Q2,mcq,Decide which claim about 3p + 4 when p = 6 is true after 5 extra stickers are added to the total.,Maths,4,Variables & Expressions,Evaluating Expressions,Students can substitute a value for a variable and evaluate a simple expression,Evaluating,hard,4,"MCQ for Grade 4 Variables & Expressions: Evaluating Expressions, aligned to Students can substitute a value for a variable and evaluate a simple expression.","[{""text"":""The final total is 22 because 3 × 6 + 4 + 5 = 27."",""correct"":false},{""text"":""The final total is 27 because 3 × 6 = 18, then 18 + 4 + 5 = 27."",""correct"":true},{""text"":""The final total is 23 because 3 + 6 + 4 + 5 = 18, then add 5 more."",""correct"":false},{""text"":""The final total is 31 because 3 × (6 + 4) + 5 = 35."",""correct"":false}]",Great job checking the claim! Put 6 in for p: 3 × 6 + 4 = 22. Then add 5 more to get 27. Option 2 is the careful one.,"{""questionNumber"":""Q2"",""questionType"":""mcq"",""subject"":""Maths"",""grade"":4,""topic"":""Variables & Expressions"",""subtopic"":""Evaluating Expressions"",""learning_objective"":""Students can substitute a value for a variable and evaluate a simple expression"",""focus"":""evaluate_a_claim""}"
3,tvei4t7-seekm5z-lscsa1ybu-q3-mcq,Q3,mcq,"A snack robot uses the rule 2m + 7 for one tray. The tray ends with 19 snack pieces, and nothing was added or taken away after using the rule. Four students guessed values for m:
A: m = 5 because 2 + 5 + 7 = 14
B: m = 6 because 2 × 6 + 7 = 19
C: m = 7 because 7 is already in the rule
D: m = 12 because 12 + 7 = 19
Which student is correct?",Maths,4,Variables & Expressions,Evaluating Expressions,Students can substitute a value for a variable and evaluate a simple expression,Analyzing,hard,4,"MCQ for Grade 4 Variables & Expressions: Evaluating Expressions, aligned to Students can substitute a value for a variable and evaluate a simple expression.","[{""text"":""Student A"",""correct"":false},{""text"":""Student B"",""correct"":true},{""text"":""Student C"",""correct"":false},{""text"":""Student D"",""correct"":false}]","Test the choices in the rule 2m + 7. If m = 6, then 2 × 6 + 7 = 12 + 7 = 19, so Student B is correct. Student A adds instead of multiplying. Student C notices the 7 in the rule but does not make the total 19. Student D uses 12 + 7, but the rule says 2m + 7, not m + 7.","{""questionNumber"":""Q3"",""questionType"":""mcq"",""subject"":""Maths"",""grade"":4,""topic"":""Variables & Expressions"",""subtopic"":""Evaluating Expressions"",""learning_objective"":""Students can substitute a value for a variable and evaluate a simple expression"",""focus"":""reverse_reasoning""}"
4,tvei4t7-seekm5z-lscsa1ybu-q4-mcq,Q4,mcq,Look at the expression 5n - 2 when n = 4. One way is 5 × 4 - 2. Another way is 5 × (4 - 2). Choose the best judgment.,Maths,4,Variables & Expressions,Evaluating Expressions,Students can substitute a value for a variable and evaluate a simple expression,Evaluating,hard,4,"MCQ for Grade 4 Variables & Expressions: Evaluating Expressions, aligned to Students can substitute a value for a variable and evaluate a simple expression.","[{""text"":""Both ways are correct and both give 18."",""correct"":false},{""text"":""Only 5 × 4 - 2 is correct, and it gives 18."",""correct"":true},{""text"":""Only 5 × (4 - 2) is correct, and it gives 10."",""correct"":false},{""text"":""Both ways are wrong because n should be added, not multiplied."",""correct"":false}]","Well spotted! In 5n - 2, n is only in the first part, so substitute first: 5 × 4 - 2 = 20 - 2 = 18. The brackets in 5 × (4 - 2) change the expression.","{""questionNumber"":""Q4"",""questionType"":""mcq"",""subject"":""Maths"",""grade"":4,""topic"":""Variables & Expressions"",""subtopic"":""Evaluating Expressions"",""learning_objective"":""Students can substitute a value for a variable and evaluate a simple expression"",""focus"":""compare_methods""}"
5,tvei4t7-seekm5z-lscsa1ybu-q5-mcq,Q5,mcq,"Each jump path has j stars and 2 bells. There are 3 paths. When j = 4, 1 bonus bell is added after all 3 paths are counted. Which method is correct?",Maths,4,Variables & Expressions,Evaluating Expressions,Students can substitute a value for a variable and evaluate a simple expression,Evaluating,hard,4,"MCQ for Grade 4 Variables & Expressions: Evaluating Expressions, aligned to Students can substitute a value for a variable and evaluate a simple expression.","[{""text"":""3(4 + 2) + 1 = 19, because each path has 6 items, then 1 more is added at the end."",""correct"":true},{""text"":""3(4 + 2 + 1) = 21, because the bonus bell should be added to each path."",""correct"":false},{""text"":""3 × 4 + 2 + 1 = 15, because the 2 bells are counted only once."",""correct"":false},{""text"":""3 + 4 + 2 + 1 = 10, because the numbers in the story should all be added once."",""correct"":false}]","Each path has 4 stars and 2 bells, so one path has 4 + 2 = 6 items. For 3 paths, 3 × 6 = 18. Then add 1 bonus bell after all the paths are counted: 18 + 1 = 19. So 3(4 + 2) + 1 is correct. The 21 method is wrong because it adds the bonus bell to every path, not once at the end. The 15 method counts the 2 bells only one time instead of on each path. The 10 method ignores that there are 3 full paths.","{""questionNumber"":""Q5"",""questionType"":""mcq"",""subject"":""Maths"",""grade"":4,""topic"":""Variables & Expressions"",""subtopic"":""Evaluating Expressions"",""learning_objective"":""Students can substitute a value for a variable and evaluate a simple expression"",""focus"":""compare_methods""}"
6,tvei4t7-seekm5z-lscsa1ybu-q6-mcq,Q6,mcq,"For the expression 6 + 2r with r = 3, the total is shared equally into 4 little gift bags. Mia says each bag gets 4 because she did 6 ÷ 4 first and then added 2r. Which answer correctly judges Mia's work?",Maths,4,Variables & Expressions,Evaluating Expressions,Students can substitute a value for a variable and evaluate a simple expression,Analyzing,hard,4,"MCQ for Grade 4 Variables & Expressions: Evaluating Expressions, aligned to Students can substitute a value for a variable and evaluate a simple expression.","[{""text"":""Mia is correct. Each bag gets 4."",""correct"":false},{""text"":""Mia is not correct. Each bag gets 3."",""correct"":true},{""text"":""Mia is not correct. Each bag gets 2."",""correct"":false},{""text"":""Mia is not correct. Each bag gets 12."",""correct"":false}]","First evaluate the expression: 6 + 2(3) = 6 + 6 = 12. Then share 12 equally into 4 bags: 12 ÷ 4 = 3. So each bag gets 3. Mia's mistake is dividing part of the expression too early. 2 is too small, and 12 is the total before sharing, not the amount in each bag.","{""questionNumber"":""Q6"",""questionType"":""mcq"",""subject"":""Maths"",""grade"":4,""topic"":""Variables & Expressions"",""subtopic"":""Evaluating Expressions"",""learning_objective"":""Students can substitute a value for a variable and evaluate a simple expression"",""focus"":""multi-step evaluation""}"
7,tvei4t7-seekm5z-lscsa1ybu-q7-mcq,Q7,mcq,"Select the true statement about 2q + 5 when q = 7, after 3 candies are taken away.",Maths,4,Variables & Expressions,Evaluating Expressions,Students can substitute a value for a variable and evaluate a simple expression,Evaluating,hard,4,"MCQ for Grade 4 Variables & Expressions: Evaluating Expressions, aligned to Students can substitute a value for a variable and evaluate a simple expression.","[{""text"":""The final number is 16 because 2 × 7 + 5 = 19, and 19 - 3 = 16."",""correct"":true},{""text"":""The final number is 14 because 2 × (7 - 3) + 5 = 13."",""correct"":false},{""text"":""The final number is 12 because 2 + 7 + 5 - 3 = 11."",""correct"":false},{""text"":""The final number is 19 because you do not use the 3."",""correct"":false}]","Lovely job! Substitute first: 2 × 7 + 5 = 14 + 5 = 19. Then take away 3, so 19 - 3 = 16.","{""questionNumber"":""Q7"",""questionType"":""mcq"",""subject"":""Maths"",""grade"":4,""topic"":""Variables & Expressions"",""subtopic"":""Evaluating Expressions"",""learning_objective"":""Students can substitute a value for a variable and evaluate a simple expression"",""focus"":""evaluate_a_claim""}"
8,tvei4t7-seekm5z-lscsa1ybu-q8-mcq,Q8,mcq,"A box of animal stickers follows the rule 3b + 1. After using the rule, 2 more stickers are added, and the box has 18 stickers. Which value of b makes the story true?",Maths,4,Variables & Expressions,Evaluating Expressions,Students can substitute a value for a variable and evaluate a simple expression,Analyzing,hard,4,"MCQ for Grade 4 Variables & Expressions: Evaluating Expressions, aligned to Students can substitute a value for a variable and evaluate a simple expression.","[{""text"":""b = 4, because 3 × 4 + 1 + 2 = 15"",""correct"":false},{""text"":""b = 5, because 3 × 5 + 1 + 2 = 18"",""correct"":true},{""text"":""b = 6, because 3 × 6 = 18"",""correct"":false},{""text"":""b = 7, because 7 + 1 + 2 = 10"",""correct"":false}]","The rule result plus 2 equals 18, so first subtract 2: 18 - 2 = 16. Now solve 3b + 1 = 16. Subtract 1 to get 15, then 15 ÷ 3 = 5, so b = 5. You can also check: 3 × 5 + 1 + 2 = 15 + 1 + 2 = 18. The other values do not make the total 18.","{""questionNumber"":""Q8"",""questionType"":""mcq"",""subject"":""Maths"",""grade"":4,""topic"":""Variables & Expressions"",""subtopic"":""Evaluating Expressions"",""learning_objective"":""Students can substitute a value for a variable and evaluate a simple expression"",""focus"":""reverse_reasoning""}"
9,tvei4t7-seekm5z-lscsa1ybu-q9-mcq,Q9,mcq,Compare the two results when t = 5: 2(t + 3) and 2t + 3. Then 1 balloon is added to each result. Choose the correct sentence.,Maths,4,Variables & Expressions,Evaluating Expressions,Students can substitute a value for a variable and evaluate a simple expression,Analyzing,hard,4,"MCQ for Grade 4 Variables & Expressions: Evaluating Expressions, aligned to Students can substitute a value for a variable and evaluate a simple expression.","[{""text"":""After adding 1 to each, the results are equal."",""correct"":false},{""text"":""After adding 1 to each, 2(t + 3) is bigger by 3."",""correct"":true},{""text"":""After adding 1 to each, 2t + 3 is bigger by 3."",""correct"":false},{""text"":""After adding 1 to each, 2t + 3 is bigger by 1."",""correct"":false}]",You’re thinking carefully! 2(5 + 3) = 16 and 2 × 5 + 3 = 13. Add 1 to each: 17 and 14. The first is bigger by 3.,"{""questionNumber"":""Q9"",""questionType"":""mcq"",""subject"":""Maths"",""grade"":4,""topic"":""Variables & Expressions"",""subtopic"":""Evaluating Expressions"",""learning_objective"":""Students can substitute a value for a variable and evaluate a simple expression"",""focus"":""compare_methods""}"
10,tvei4t7-seekm5z-lscsa1ybu-q10-mcq,Q10,mcq,"Each candy jar has c jelly beans and 4 gumdrops. There are 2 jars. When c = 6, 3 extra gumdrops are added later. Which expression and total match the story correctly?",Maths,4,Variables & Expressions,Evaluating Expressions,Students can substitute a value for a variable and evaluate a simple expression,Applying,hard,4,"MCQ for Grade 4 Variables & Expressions: Evaluating Expressions, aligned to Students can substitute a value for a variable and evaluate a simple expression.","[{""text"":""2(c + 4) + 3, and with c = 6 the total is 23."",""correct"":true},{""text"":""2c + 4 + 3, and with c = 6 the total is 19."",""correct"":false},{""text"":""2(c + 4 + 3), and with c = 6 the total is 26."",""correct"":false},{""text"":""c + 4 + 2 + 3, and with c = 6 the total is 15."",""correct"":false}]","Each jar has c + 4 items. Since there are 2 jars, that part is 2(c + 4). Then 3 extra gumdrops are added later, so the full expression is 2(c + 4) + 3. With c = 6, this is 2(6 + 4) + 3 = 2(10) + 3 = 23. The 19 option forgets that both jars have 4 gumdrops. The 26 option wrongly adds the 3 extras to each jar. The 15 option does not represent 2 full jars.","{""questionNumber"":""Q10"",""questionType"":""mcq"",""subject"":""Maths"",""grade"":4,""topic"":""Variables & Expressions"",""subtopic"":""Evaluating Expressions"",""learning_objective"":""Students can substitute a value for a variable and evaluate a simple expression"",""focus"":""multi_constraint_problem""}"
11,tvei4t7-seekm5z-lscsa1ybu-q11-mcq,Q11,mcq,"For the expression 4y - 1 with y = 3, the answer is then doubled for a game prize. Which student has the correct final score?
A: 10
B: 11
C: 22
D: 24",Maths,4,Variables & Expressions,Evaluating Expressions,Students can substitute a value for a variable and evaluate a simple expression,Analyzing,hard,4,"MCQ for Grade 4 Variables & Expressions: Evaluating Expressions, aligned to Students can substitute a value for a variable and evaluate a simple expression.","[{""text"":""Student A"",""correct"":false},{""text"":""Student B"",""correct"":false},{""text"":""Student C"",""correct"":true},{""text"":""Student D"",""correct"":false}]","First evaluate 4y - 1 when y = 3: 4(3) - 1 = 12 - 1 = 11. Then double 11 to get 22, so Student C is correct. Student B stopped before doubling. Student D likely doubled 12 before subtracting 1. Student A does not match the correct steps.","{""questionNumber"":""Q11"",""questionType"":""mcq"",""subject"":""Maths"",""grade"":4,""topic"":""Variables & Expressions"",""subtopic"":""Evaluating Expressions"",""learning_objective"":""Students can substitute a value for a variable and evaluate a simple expression"",""focus"":""multi-step evaluation""}"
12,tvei4t7-seekm5z-lscsa1ybu-q12-mcq,Q12,mcq,Decide which claim about 7 + k when k = 8 is true after the total is shared into 3 equal bowls.,Maths,4,Variables & Expressions,Evaluating Expressions,Students can substitute a value for a variable and evaluate a simple expression,Evaluating,hard,4,"MCQ for Grade 4 Variables & Expressions: Evaluating Expressions, aligned to Students can substitute a value for a variable and evaluate a simple expression.","[{""text"":""Each bowl gets 5 because 7 + 8 = 15 and 15 ÷ 3 = 5."",""correct"":true},{""text"":""Each bowl gets 3 because 8 ÷ 3 is about 3."",""correct"":false},{""text"":""Each bowl gets 7 because the variable stays the same."",""correct"":false},{""text"":""Each bowl gets 15 because sharing does not change the number."",""correct"":false}]",You got it! First 7 + 8 = 15. Then 15 shared into 3 equal bowls gives 5 in each bowl.,"{""questionNumber"":""Q12"",""questionType"":""mcq"",""subject"":""Maths"",""grade"":4,""topic"":""Variables & Expressions"",""subtopic"":""Evaluating Expressions"",""learning_objective"":""Students can substitute a value for a variable and evaluate a simple expression"",""focus"":""evaluate_a_claim""}"
13,tvei4t7-seekm5z-lscsa1ybu-q13-mcq,Q13,mcq,"A pirate snack pack uses the rule 5s - 2. After 4 crackers are added, the pack has 27 crackers. Which choice gives the correct value of s and a correct reason?",Maths,4,Variables & Expressions,Evaluating Expressions,Students can substitute a value for a variable and evaluate a simple expression,Analyzing,hard,5,"MCQ for Grade 4 Variables & Expressions: Evaluating Expressions, aligned to Students can substitute a value for a variable and evaluate a simple expression.","[{""text"":""s = 4, because 5 × 4 - 2 + 4 = 22"",""correct"":false},{""text"":""s = 5, because 5 × 5 - 2 + 4 = 27"",""correct"":true},{""text"":""s = 6, because 5 × 6 - 2 = 28"",""correct"":false},{""text"":""s = 7, because 27 - 2 = 25 and 25 + 5 = 30"",""correct"":false}]","The story says 4 crackers were added after the rule, so first undo that step: 27 - 4 = 23. Now the rule result must be 23, so 5s - 2 = 23. Add 2 to get 25, then divide by 5: s = 5. Check: 5 × 5 - 2 + 4 = 25 - 2 + 4 = 27. The other choices do not make the story true.","{""questionNumber"":""Q13"",""questionType"":""mcq"",""subject"":""Maths"",""grade"":4,""topic"":""Variables & Expressions"",""subtopic"":""Evaluating Expressions"",""learning_objective"":""Students can substitute a value for a variable and evaluate a simple expression"",""focus"":""reverse_reasoning""}"
14,tvei4t7-seekm5z-lscsa1ybu-q14-mcq,Q14,mcq,"Look at the worked-out steps for 3(a + 2) when a = 4, then 2 more stars are added: Step 1: 3(4 + 2). Step 2: 3 × 6 = 18. Step 3: 18 + 2 = 20. Choose the best judgment.",Maths,4,Variables & Expressions,Evaluating Expressions,Students can substitute a value for a variable and evaluate a simple expression,Evaluating,hard,4,"MCQ for Grade 4 Variables & Expressions: Evaluating Expressions, aligned to Students can substitute a value for a variable and evaluate a simple expression.","[{""text"":""All the steps are correct, and the final answer is 20."",""correct"":true},{""text"":""The first mistake is Step 1 because a should stay as a."",""correct"":false},{""text"":""The first mistake is Step 2 because 3 × 6 = 24."",""correct"":false},{""text"":""The first mistake is Step 3 because 18 + 2 = 19."",""correct"":false}]","Excellent checking! Replace a with 4, so 3(4 + 2) is right. Then 3 × 6 = 18, and 18 + 2 = 20. Every step works.","{""questionNumber"":""Q14"",""questionType"":""mcq"",""subject"":""Maths"",""grade"":4,""topic"":""Variables & Expressions"",""subtopic"":""Evaluating Expressions"",""learning_objective"":""Students can substitute a value for a variable and evaluate a simple expression"",""focus"":""evaluate_a_claim""}"
15,tvei4t7-seekm5z-lscsa1ybu-q15-mcq,Q15,mcq,"Each shelf has 2 trucks and d dolls. There are 4 shelves. When d = 3, 2 extra dolls are put on top after all 4 shelves are filled. Which method is correct?",Maths,4,Variables & Expressions,Evaluating Expressions,Students can substitute a value for a variable and evaluate a simple expression,Evaluating,hard,4,"MCQ for Grade 4 Variables & Expressions: Evaluating Expressions, aligned to Students can substitute a value for a variable and evaluate a simple expression.","[{""text"":""4(2 + 3) + 2 = 22, because each shelf has 5 toys, then 2 more are added once."",""correct"":true},{""text"":""4 × 2 + 3 + 2 = 13, because the dolls are counted only once."",""correct"":false},{""text"":""4(2 + 3 + 2) = 28, because the 2 extra dolls should be added on every shelf."",""correct"":false},{""text"":""2 + 3 + 4 + 2 = 11, because all the numbers in the story should be added once."",""correct"":false}]","Each shelf has 2 trucks and 3 dolls, so each shelf has 2 + 3 = 5 toys. Four shelves give 4 × 5 = 20. Then 2 extra dolls are added after the shelves are filled, so 20 + 2 = 22. The 13 method counts the 3 dolls only once instead of on each shelf. The 28 method adds the 2 extra dolls to every shelf, but they are added only once at the end. The 11 method ignores the 4 full shelves.","{""questionNumber"":""Q15"",""questionType"":""mcq"",""subject"":""Maths"",""grade"":4,""topic"":""Variables & Expressions"",""subtopic"":""Evaluating Expressions"",""learning_objective"":""Students can substitute a value for a variable and evaluate a simple expression"",""focus"":""compare_methods""}"
16,tvei4t7-seekm5z-lscsa1ybu-q16-mcq,Q16,mcq,"The expression is 2h + 9 with h = 4. Then 5 shells are taken away, and the rest are shared equally into 2 buckets. Liam says each bucket gets 8 because 2h + 9 = 17 and 17 ÷ 2 is about 8. Which answer is correct?",Maths,4,Variables & Expressions,Evaluating Expressions,Students can substitute a value for a variable and evaluate a simple expression,Analyzing,hard,4,"MCQ for Grade 4 Variables & Expressions: Evaluating Expressions, aligned to Students can substitute a value for a variable and evaluate a simple expression.","[{""text"":""Liam is correct. Each bucket gets 8."",""correct"":false},{""text"":""Liam is not correct. Each bucket gets 6."",""correct"":true},{""text"":""Liam is not correct. Each bucket gets 5."",""correct"":false},{""text"":""Liam is not correct. Each bucket gets 17."",""correct"":false}]","First evaluate the expression: 2(4) + 9 = 8 + 9 = 17. Then take away 5 shells: 17 - 5 = 12. Now share 12 equally into 2 buckets: 12 ÷ 2 = 6. Liam divided too early and forgot to subtract 5 first. 17 is the amount before taking shells away, and 5 is not the equal share.","{""questionNumber"":""Q16"",""questionType"":""mcq"",""subject"":""Maths"",""grade"":4,""topic"":""Variables & Expressions"",""subtopic"":""Evaluating Expressions"",""learning_objective"":""Students can substitute a value for a variable and evaluate a simple expression"",""focus"":""multi-step evaluation""}"
17,tvei4t7-seekm5z-lscsa1ybu-q17-mcq,Q17,mcq,"Select the true statement about 4g + 1 when g = 2 and 3g + 3 when g = 2, after 2 bonus points are added to both results.",Maths,4,Variables & Expressions,Evaluating Expressions,Students can substitute a value for a variable and evaluate a simple expression,Evaluating,hard,4,"MCQ for Grade 4 Variables & Expressions: Evaluating Expressions, aligned to Students can substitute a value for a variable and evaluate a simple expression.","[{""text"":""The first total stays bigger by 2."",""correct"":false},{""text"":""The two totals become equal."",""correct"":true},{""text"":""The second total becomes bigger by 2."",""correct"":false},{""text"":""Both totals become 11."",""correct"":false}]","Wonderful! 4g + 1 = 4(2) + 1 = 9, and 3g + 3 = 3(2) + 3 = 9. Add 2 to both, and both become 11. They are equal.","{""questionNumber"":""Q17"",""questionType"":""mcq"",""subject"":""Maths"",""grade"":4,""topic"":""Variables & Expressions"",""subtopic"":""Evaluating Expressions"",""learning_objective"":""Students can substitute a value for a variable and evaluate a simple expression"",""focus"":""compare_methods""}"
18,tvei4t7-seekm5z-lscsa1ybu-q18-mcq,Q18,mcq,"A pirate chest has g gold coins and then gets 5 more. If g = 2, choose the value of g + 5.",Maths,4,Variables & Expressions,Evaluating Expressions,Students can substitute a value for a variable and evaluate a simple expression,Applying,easy,1,"MCQ for Grade 4 Variables & Expressions: Evaluating Expressions, aligned to Students can substitute a value for a variable and evaluate a simple expression.","[{""text"":""10"",""correct"":false},{""text"":""25"",""correct"":false},{""text"":""7"",""correct"":true},{""text"":""3"",""correct"":false}]",Great! Put 2 in place of g. Then 2 + 5 = 7.,"{""questionNumber"":""Q18"",""questionType"":""mcq"",""subject"":""Maths"",""grade"":4,""topic"":""Variables & Expressions"",""subtopic"":""Evaluating Expressions"",""learning_objective"":""Students can substitute a value for a variable and evaluate a simple expression"",""focus"":""evaluate g + 5 in an adventure context""}"
19,tvei4t7-seekm5z-lscsa1ybu-q19-mcq,Q19,mcq,"Compare the two ways to work out 8 + 3c when c = 4, then subtract 5. Way 1 is 8 + 3(4) - 5. Way 2 is (8 + 3)(4 - 5). Choose the best answer.",Maths,4,Variables & Expressions,Evaluating Expressions,Students can substitute a value for a variable and evaluate a simple expression,Evaluating,hard,5,"MCQ for Grade 4 Variables & Expressions: Evaluating Expressions, aligned to Students can substitute a value for a variable and evaluate a simple expression.","[{""text"":""Way 1 is correct and gives 15."",""correct"":true},{""text"":""Way 2 is correct and gives 11."",""correct"":false},{""text"":""Both ways are correct and give 15."",""correct"":false},{""text"":""Both ways are wrong because c cannot be 4."",""correct"":false}]","Excellent checking! Substitute c = 4 into the expression: 8 + 3(4) - 5 = 8 + 12 - 5 = 15. Way 2 changes the expression, so it is not right.","{""questionNumber"":""Q19"",""questionType"":""mcq"",""subject"":""Maths"",""grade"":4,""topic"":""Variables & Expressions"",""subtopic"":""Evaluating Expressions"",""learning_objective"":""Students can substitute a value for a variable and evaluate a simple expression"",""focus"":""find_the_error""}"
