rowNumber,queueId,questionNumber,questionType,questionText,subject,grade,topic,subtopic,learningObjective,bloomsLevel,difficultyLevel,difficultyRating,summary,options,explanation,generationMetadata
47,tddi6yl9-sbclgs7qx-lscraskxs-q47-mcq,Q47,mcq,"A line graph of marbles won in games shows game 1 = 6, game 2 = 9, game 3 = 3, and game 4 = 8. Which game shows 3 marbles?",Maths,4,Data Display & Interpretation,Bar Charts & Line Graphs,Students can read and draw bar charts and line graphs,Understanding,easy,1,"MCQ for Grade 4 Data Display & Interpretation: Bar Charts & Line Graphs, aligned to Students can read and draw bar charts and line graphs.","[{""text"":""Game 1"",""correct"":false},{""text"":""Game 3"",""correct"":true},{""text"":""Game 4"",""correct"":false},{""text"":""Game 2"",""correct"":false}]","The graph shows game 3 = 3 marbles. Game 1 has 6, game 2 has 9, and game 4 has 8, so only game 3 matches 3 marbles.","{""questionNumber"":""Q47"",""questionType"":""mcq"",""subject"":""Maths"",""grade"":4,""topic"":""Data Display & Interpretation"",""subtopic"":""Bar Charts & Line Graphs"",""learning_objective"":""Students can read and draw bar charts and line graphs"",""focus"":""identify a true statement from line graph data""}"
48,tddi6yl9-sbclgs7qx-lscraskxs-q48-mcq,Q48,mcq,"A zoo café makes a line graph of banana muffins sold: Monday = 4, Tuesday = 7, Wednesday = 9, Thursday = 5. Pick the number sold on Wednesday.",Maths,4,Data Display & Interpretation,Bar Charts & Line Graphs,Students can read and draw bar charts and line graphs,Knowing,easy,1,"MCQ for Grade 4 Data Display & Interpretation: Bar Charts & Line Graphs, aligned to Students can read and draw bar charts and line graphs.","[{""text"":""4"",""correct"":false},{""text"":""5"",""correct"":false},{""text"":""7"",""correct"":false},{""text"":""9"",""correct"":true}]",Great reading! Wednesday is 9 on the line graph. You matched the day perfectly.,"{""questionNumber"":""Q48"",""questionType"":""mcq"",""subject"":""Maths"",""grade"":4,""topic"":""Data Display & Interpretation"",""subtopic"":""Bar Charts & Line Graphs"",""learning_objective"":""Students can read and draw bar charts and line graphs"",""focus"":""read a value from a line graph""}"
49,tddi6yl9-sbclgs7qx-lscraskxs-q49-mcq,Q49,mcq,Compare the two bars on this chart of toy boxes: puzzle box = 10 and block box = 6. Pick the correct comparison.,Maths,4,Data Display & Interpretation,Bar Charts & Line Graphs,Students can read and draw bar charts and line graphs,Understanding,easy,1,"MCQ for Grade 4 Data Display & Interpretation: Bar Charts & Line Graphs, aligned to Students can read and draw bar charts and line graphs.","[{""text"":""Puzzle box has fewer than block box."",""correct"":false},{""text"":""Block box has more than puzzle box."",""correct"":false},{""text"":""Puzzle box has more than block box."",""correct"":true},{""text"":""The two boxes are equal."",""correct"":false}]","Super job! 10 is more than 6, so the puzzle box bar is taller. Nice comparing!","{""questionNumber"":""Q49"",""questionType"":""mcq"",""subject"":""Maths"",""grade"":4,""topic"":""Data Display & Interpretation"",""subtopic"":""Bar Charts & Line Graphs"",""learning_objective"":""Students can read and draw bar charts and line graphs"",""focus"":""compare two values on a bar chart""}"
50,tddi6yl9-sbclgs7qx-lscraskxs-q50-mcq,Q50,mcq,"Choose the bar height that matches this candy jar chart fact: gummy bears = 13, jelly beans = 8, mints = 6, toffees = 9. Which candy should have a bar at 6?",Maths,4,Data Display & Interpretation,Bar Charts & Line Graphs,Students can read and draw bar charts and line graphs,Applying,easy,1,"MCQ for Grade 4 Data Display & Interpretation: Bar Charts & Line Graphs, aligned to Students can read and draw bar charts and line graphs.","[{""text"":""gummy bears"",""correct"":false},{""text"":""jelly beans"",""correct"":false},{""text"":""mints"",""correct"":true},{""text"":""toffees"",""correct"":false}]",Fantastic! Mints match the bar height of 6. The other candies have different numbers.,"{""questionNumber"":""Q50"",""questionType"":""mcq"",""subject"":""Maths"",""grade"":4,""topic"":""Data Display & Interpretation"",""subtopic"":""Bar Charts & Line Graphs"",""learning_objective"":""Students can read and draw bar charts and line graphs"",""focus"":""match category to bar height""}"
51,tddi6yl9-sbclgs7qx-lscraskxs-q51-mcq,Q51,mcq,"Pick the number shown for Tuesday in this line graph of toy drum beats: Monday = 3, Tuesday = 10, Wednesday = 7, Thursday = 8.",Maths,4,Data Display & Interpretation,Bar Charts & Line Graphs,Students can read and draw bar charts and line graphs,Knowing,easy,1,"MCQ for Grade 4 Data Display & Interpretation: Bar Charts & Line Graphs, aligned to Students can read and draw bar charts and line graphs.","[{""text"":""7"",""correct"":false},{""text"":""8"",""correct"":false},{""text"":""10"",""correct"":true},{""text"":""3"",""correct"":false}]",Great work! Tuesday is 10. You found the right day and value.,"{""questionNumber"":""Q51"",""questionType"":""mcq"",""subject"":""Maths"",""grade"":4,""topic"":""Data Display & Interpretation"",""subtopic"":""Bar Charts & Line Graphs"",""learning_objective"":""Students can read and draw bar charts and line graphs"",""focus"":""read a value from a line graph""}"
52,tddi6yl9-sbclgs7qx-lscraskxs-q52-mcq,Q52,mcq,"A bar chart of park animals seen shows ducks = 7, squirrels = 11, rabbits = 5, and butterflies = 9. Which animal was seen 11 times?",Maths,4,Data Display & Interpretation,Bar Charts & Line Graphs,Students can read and draw bar charts and line graphs,Understanding,easy,1,"MCQ for Grade 4 Data Display & Interpretation: Bar Charts & Line Graphs, aligned to Students can read and draw bar charts and line graphs.","[{""text"":""Rabbits"",""correct"":false},{""text"":""Squirrels"",""correct"":true},{""text"":""Ducks"",""correct"":false},{""text"":""Butterflies"",""correct"":false}]","Squirrels were seen 11 times. Ducks were seen 7 times, rabbits 5 times, and butterflies 9 times, so squirrels is the only correct answer.","{""questionNumber"":""Q52"",""questionType"":""mcq"",""subject"":""Maths"",""grade"":4,""topic"":""Data Display & Interpretation"",""subtopic"":""Bar Charts & Line Graphs"",""learning_objective"":""Students can read and draw bar charts and line graphs"",""focus"":""identify a true statement from bar chart data""}"
53,tddi6yl9-sbclgs7qx-lscraskxs-q53-mcq,Q53,mcq,"A game booth keeps a bar chart of prizes won: balls = 6, kites = 10, yo-yos = 4, whistles = 8. Choose the prize with 4 won.",Maths,4,Data Display & Interpretation,Bar Charts & Line Graphs,Students can read and draw bar charts and line graphs,Knowing,easy,1,"MCQ for Grade 4 Data Display & Interpretation: Bar Charts & Line Graphs, aligned to Students can read and draw bar charts and line graphs.","[{""text"":""balls"",""correct"":false},{""text"":""kites"",""correct"":false},{""text"":""yo-yos"",""correct"":true},{""text"":""whistles"",""correct"":false}]",You got it! Yo-yos have 4 won. That matches the chart perfectly.,"{""questionNumber"":""Q53"",""questionType"":""mcq"",""subject"":""Maths"",""grade"":4,""topic"":""Data Display & Interpretation"",""subtopic"":""Bar Charts & Line Graphs"",""learning_objective"":""Students can read and draw bar charts and line graphs"",""focus"":""identify category from bar chart value""}"
54,tddi6yl9-sbclgs7qx-lscraskxs-q54-mcq,Q54,mcq,"A line graph of fish crackers eaten shows snack 1 = 5, snack 2 = 8, snack 3 = 8, and snack 4 = 6. How do snack 2 and snack 3 compare?",Maths,4,Data Display & Interpretation,Bar Charts & Line Graphs,Students can read and draw bar charts and line graphs,Understanding,easy,1,"MCQ for Grade 4 Data Display & Interpretation: Bar Charts & Line Graphs, aligned to Students can read and draw bar charts and line graphs.","[{""text"":""Snack 2 is less than snack 3."",""correct"":false},{""text"":""Snack 3 is more than snack 2."",""correct"":false},{""text"":""Snack 2 and snack 3 are equal."",""correct"":true},{""text"":""Snack 2 is 2 less than snack 3."",""correct"":false}]","Snack 2 has 8 and snack 3 also has 8. Because the values are the same, snack 2 and snack 3 are equal. One is not more or less than the other.","{""questionNumber"":""Q54"",""questionType"":""mcq"",""subject"":""Maths"",""grade"":4,""topic"":""Data Display & Interpretation"",""subtopic"":""Bar Charts & Line Graphs"",""learning_objective"":""Students can read and draw bar charts and line graphs"",""focus"":""compare equal values on a line graph""}"
55,tddi6yl9-sbclgs7qx-lscraskxs-q55-mcq,Q55,mcq,Choose the point that matches this line graph fact for a cookie sale: Friday = 15 cookies.,Maths,4,Data Display & Interpretation,Bar Charts & Line Graphs,Students can read and draw bar charts and line graphs,Applying,easy,1,"MCQ for Grade 4 Data Display & Interpretation: Bar Charts & Line Graphs, aligned to Students can read and draw bar charts and line graphs.","[{""text"":""Friday at 12"",""correct"":false},{""text"":""Thursday at 15"",""correct"":false},{""text"":""Friday at 15"",""correct"":true},{""text"":""Saturday at 15"",""correct"":false}]",Wonderful! The matching point is Friday at 15. You checked both the day and the number.,"{""questionNumber"":""Q55"",""questionType"":""mcq"",""subject"":""Maths"",""grade"":4,""topic"":""Data Display & Interpretation"",""subtopic"":""Bar Charts & Line Graphs"",""learning_objective"":""Students can read and draw bar charts and line graphs"",""focus"":""match a line graph point to given data""}"
56,tddi6yl9-sbclgs7qx-lscraskxs-q56-mcq,Q56,mcq,"Choose the correct result for this bar chart of teddy bears in baskets: basket A = 14, basket B = 9, basket C = 11, basket D = 7. How many teddy bears are in basket C?",Maths,4,Data Display & Interpretation,Bar Charts & Line Graphs,Students can read and draw bar charts and line graphs,Knowing,easy,1,"MCQ for Grade 4 Data Display & Interpretation: Bar Charts & Line Graphs, aligned to Students can read and draw bar charts and line graphs.","[{""text"":""14"",""correct"":false},{""text"":""11"",""correct"":true},{""text"":""9"",""correct"":false},{""text"":""7"",""correct"":false}]",Great! Basket C has 11 teddy bears. You read the correct bar.,"{""questionNumber"":""Q56"",""questionType"":""mcq"",""subject"":""Maths"",""grade"":4,""topic"":""Data Display & Interpretation"",""subtopic"":""Bar Charts & Line Graphs"",""learning_objective"":""Students can read and draw bar charts and line graphs"",""focus"":""read a value from a bar chart""}"
57,tddi6yl9-sbclgs7qx-lscraskxs-q57-mcq,Q57,mcq,"A bar chart shows comic books = 8, puzzle books = 12, joke books = 6, and animal books = 10. Which type of book has 12?",Maths,4,Data Display & Interpretation,Bar Charts & Line Graphs,Students can read and draw bar charts and line graphs,Understanding,easy,1,"MCQ for Grade 4 Data Display & Interpretation: Bar Charts & Line Graphs, aligned to Students can read and draw bar charts and line graphs.","[{""text"":""Comic books"",""correct"":false},{""text"":""Puzzle books"",""correct"":true},{""text"":""Joke books"",""correct"":false},{""text"":""Animal books"",""correct"":false}]","Puzzle books have a value of 12. Comic books have 8, joke books have 6, and animal books have 10, so those choices do not match 12.","{""questionNumber"":""Q57"",""questionType"":""mcq"",""subject"":""Maths"",""grade"":4,""topic"":""Data Display & Interpretation"",""subtopic"":""Bar Charts & Line Graphs"",""learning_objective"":""Students can read and draw bar charts and line graphs"",""focus"":""identify a true statement from bar chart data""}"
58,tddi6yl9-sbclgs7qx-lscraskxs-q58-mcq,Q58,mcq,"A pet shop draws a line graph of hamster wheel spins: Monday = 9, Tuesday = 12, Wednesday = 11, Thursday = 13. Pick the number on Thursday.",Maths,4,Data Display & Interpretation,Bar Charts & Line Graphs,Students can read and draw bar charts and line graphs,Knowing,easy,1,"MCQ for Grade 4 Data Display & Interpretation: Bar Charts & Line Graphs, aligned to Students can read and draw bar charts and line graphs.","[{""text"":""13"",""correct"":true},{""text"":""12"",""correct"":false},{""text"":""11"",""correct"":false},{""text"":""9"",""correct"":false}]",Nice reading! Thursday is 13 on the line graph. You chose the correct value.,"{""questionNumber"":""Q58"",""questionType"":""mcq"",""subject"":""Maths"",""grade"":4,""topic"":""Data Display & Interpretation"",""subtopic"":""Bar Charts & Line Graphs"",""learning_objective"":""Students can read and draw bar charts and line graphs"",""focus"":""read a value from a line graph""}"
59,tddi6yl9-sbclgs7qx-lscraskxs-q59-mcq,Q59,mcq,Look at the bars for sandwich choices: cheese = 7 and jam = 7. Choose the correct comparison.,Maths,4,Data Display & Interpretation,Bar Charts & Line Graphs,Students can read and draw bar charts and line graphs,Understanding,easy,1,"MCQ for Grade 4 Data Display & Interpretation: Bar Charts & Line Graphs, aligned to Students can read and draw bar charts and line graphs.","[{""text"":""Cheese is more than jam."",""correct"":false},{""text"":""Jam is more than cheese."",""correct"":false},{""text"":""Cheese and jam are equal."",""correct"":true},{""text"":""Cheese is 1 less than jam."",""correct"":false}]","Great job! Both bars show 7, so they are equal. Neither one is bigger.","{""questionNumber"":""Q59"",""questionType"":""mcq"",""subject"":""Maths"",""grade"":4,""topic"":""Data Display & Interpretation"",""subtopic"":""Bar Charts & Line Graphs"",""learning_objective"":""Students can read and draw bar charts and line graphs"",""focus"":""compare equal values on a bar chart""}"
60,tddi6yl9-sbclgs7qx-lscraskxs-q60-mcq,Q60,mcq,"Choose the bar that matches this toy shelf chart fact: dolls = 5, robots = 8, trucks = 12, puzzles = 9. Which toy should have a bar height of 12?",Maths,4,Data Display & Interpretation,Bar Charts & Line Graphs,Students can read and draw bar charts and line graphs,Applying,easy,1,"MCQ for Grade 4 Data Display & Interpretation: Bar Charts & Line Graphs, aligned to Students can read and draw bar charts and line graphs.","[{""text"":""dolls"",""correct"":false},{""text"":""robots"",""correct"":false},{""text"":""trucks"",""correct"":true},{""text"":""puzzles"",""correct"":false}]",Excellent! Trucks match the bar height of 12. You connected the right label and number.,"{""questionNumber"":""Q60"",""questionType"":""mcq"",""subject"":""Maths"",""grade"":4,""topic"":""Data Display & Interpretation"",""subtopic"":""Bar Charts & Line Graphs"",""learning_objective"":""Students can read and draw bar charts and line graphs"",""focus"":""match category to bar height""}"
61,tddi6yl9-sbclgs7qx-lscraskxs-q61-mcq,Q61,mcq,"Choose the correct total for this toy car bar chart data: red = 8 cars, blue = 5 cars, green = 7 cars, yellow = 6 cars. Then pick the option that also tells how many more red cars than blue cars there are.",Maths,4,Data Display & Interpretation,Bar Charts & Line Graphs,Students can read and draw bar charts and line graphs,Applying,medium,2,"MCQ for Grade 4 Data Display & Interpretation: Bar Charts & Line Graphs, aligned to Students can read and draw bar charts and line graphs.","[{""text"":""26 total, and red has 3 more than blue"",""correct"":true},{""text"":""26 total, and red has 2 more than blue"",""correct"":false},{""text"":""25 total, and red has 3 more than blue"",""correct"":false},{""text"":""24 total, and red has 1 more than blue"",""correct"":false}]","Great job! 8 + 5 + 7 + 6 = 26, and 8 - 5 = 3. So the first option is correct.","{""questionNumber"":""Q61"",""questionType"":""mcq"",""subject"":""Maths"",""grade"":4,""topic"":""Data Display & Interpretation"",""subtopic"":""Bar Charts & Line Graphs"",""learning_objective"":""Students can read and draw bar charts and line graphs"",""focus"":""multi_step_application""}"
62,tddi6yl9-sbclgs7qx-lscraskxs-q62-mcq,Q62,mcq,"Select the true statement about this line graph data for cups of lemonade sold: Monday 10, Tuesday 14, Wednesday 14, Thursday 9, Friday 12.",Maths,4,Data Display & Interpretation,Bar Charts & Line Graphs,Students can read and draw bar charts and line graphs,Analyzing,medium,3,"MCQ for Grade 4 Data Display & Interpretation: Bar Charts & Line Graphs, aligned to Students can read and draw bar charts and line graphs.","[{""text"":""Sales went up every day."",""correct"":false},{""text"":""Tuesday and Wednesday have the same value, and Friday is 3 more than Thursday."",""correct"":true},{""text"":""Thursday is the highest day."",""correct"":false},{""text"":""Monday and Friday have the same value."",""correct"":false}]","Nice thinking! Tuesday and Wednesday are both 14, and Friday 12 is 3 more than Thursday 9.","{""questionNumber"":""Q62"",""questionType"":""mcq"",""subject"":""Maths"",""grade"":4,""topic"":""Data Display & Interpretation"",""subtopic"":""Bar Charts & Line Graphs"",""learning_objective"":""Students can read and draw bar charts and line graphs"",""focus"":""context_interpretation""}"
63,tddi6yl9-sbclgs7qx-lscraskxs-q63-mcq,Q63,mcq,"At the animal park, a bar chart shows parrots = 6, rabbits = 9, goats = 4, and ducks = 7. One more animal group must be added with 5 animals. Choose the new total for all the bars.",Maths,4,Data Display & Interpretation,Bar Charts & Line Graphs,Students can read and draw bar charts and line graphs,Applying,medium,2,"MCQ for Grade 4 Data Display & Interpretation: Bar Charts & Line Graphs, aligned to Students can read and draw bar charts and line graphs.","[{""text"":""26"",""correct"":false},{""text"":""30"",""correct"":false},{""text"":""31"",""correct"":true},{""text"":""32"",""correct"":false}]",Well done! First add the bars: 6 + 9 + 4 + 7 = 26. Then add 5 more to get 31.,"{""questionNumber"":""Q63"",""questionType"":""mcq"",""subject"":""Maths"",""grade"":4,""topic"":""Data Display & Interpretation"",""subtopic"":""Bar Charts & Line Graphs"",""learning_objective"":""Students can read and draw bar charts and line graphs"",""focus"":""representation_translation""}"
64,tddi6yl9-sbclgs7qx-lscraskxs-q64-mcq,Q64,mcq,"A line graph shows stickers collected: Week 1 = 11, Week 2 = 15, Week 3 = 13, Week 4 = 18. Which statement correctly describes both the greatest week-to-week increase and the week when the most stickers were collected?",Maths,4,Data Display & Interpretation,Bar Charts & Line Graphs,Students can read and draw bar charts and line graphs,Analyzing,medium,3,"MCQ for Grade 4 Data Display & Interpretation: Bar Charts & Line Graphs, aligned to Students can read and draw bar charts and line graphs.","[{""text"":""The greatest increase is 5 from Week 3 to Week 4, and Week 4 has the most stickers."",""correct"":true},{""text"":""The greatest increase is 4 from Week 1 to Week 2, and Week 2 has the most stickers."",""correct"":false},{""text"":""The greatest increase is 2 from Week 2 to Week 3, and Week 3 has the most stickers."",""correct"":false},{""text"":""There is no increase, and Week 1 has the most stickers."",""correct"":false}]","Find each change: Week 1 to Week 2 is 15 - 11 = 4, Week 2 to Week 3 is 13 - 15 = -2, and Week 3 to Week 4 is 18 - 13 = 5. The greatest increase is 5 from Week 3 to Week 4. The highest value on the graph is 18 in Week 4, so the correct statement is the first one.","{""questionNumber"":""Q64"",""questionType"":""mcq"",""subject"":""Maths"",""grade"":4,""topic"":""Data Display & Interpretation"",""subtopic"":""Bar Charts & Line Graphs"",""learning_objective"":""Students can read and draw bar charts and line graphs"",""focus"":""compare_or_judge""}"
65,tddi6yl9-sbclgs7qx-lscraskxs-q65-mcq,Q65,mcq,"Choose the set of bar heights that matches this snack chart rule: the apple bar is 7, the banana bar is 2 more than apple, the orange bar is 1 less than banana, and the grape bar is 3.",Maths,4,Data Display & Interpretation,Bar Charts & Line Graphs,Students can read and draw bar charts and line graphs,Applying,medium,3,"MCQ for Grade 4 Data Display & Interpretation: Bar Charts & Line Graphs, aligned to Students can read and draw bar charts and line graphs.","[{""text"":""Apple 7, Banana 9, Orange 8, Grape 3"",""correct"":true},{""text"":""Apple 7, Banana 8, Orange 7, Grape 3"",""correct"":false},{""text"":""Apple 6, Banana 8, Orange 7, Grape 3"",""correct"":false},{""text"":""Apple 7, Banana 9, Orange 9, Grape 3"",""correct"":false}]",Great work! Banana must be 9 because it is 2 more than 7. Orange is 8 because it is 1 less than 9.,"{""questionNumber"":""Q65"",""questionType"":""mcq"",""subject"":""Maths"",""grade"":4,""topic"":""Data Display & Interpretation"",""subtopic"":""Bar Charts & Line Graphs"",""learning_objective"":""Students can read and draw bar charts and line graphs"",""focus"":""constrained_selection""}"
66,tddi6yl9-sbclgs7qx-lscraskxs-q66-mcq,Q66,mcq,"Pick the missing Friday value for this line graph story about marbles won: Monday 5, Tuesday 8, Wednesday 8, Thursday 11, Friday ?. The total for all five days is 39.",Maths,4,Data Display & Interpretation,Bar Charts & Line Graphs,Students can read and draw bar charts and line graphs,Applying,medium,3,"MCQ for Grade 4 Data Display & Interpretation: Bar Charts & Line Graphs, aligned to Students can read and draw bar charts and line graphs.","[{""text"":""6"",""correct"":false},{""text"":""7"",""correct"":true},{""text"":""8"",""correct"":false},{""text"":""9"",""correct"":false}]",Nice job! Add the first four days: 5 + 8 + 8 + 11 = 32. Then 39 - 32 = 7 for Friday.,"{""questionNumber"":""Q66"",""questionType"":""mcq"",""subject"":""Maths"",""grade"":4,""topic"":""Data Display & Interpretation"",""subtopic"":""Bar Charts & Line Graphs"",""learning_objective"":""Students can read and draw bar charts and line graphs"",""focus"":""multi_step_application""}"
67,tddi6yl9-sbclgs7qx-lscraskxs-q67-mcq,Q67,mcq,"Choose the sentence that is correct about this bar chart data for pets at a show: cats 12, dogs 9, fish 12, birds 6.",Maths,4,Data Display & Interpretation,Bar Charts & Line Graphs,Students can read and draw bar charts and line graphs,Understanding,medium,2,"MCQ for Grade 4 Data Display & Interpretation: Bar Charts & Line Graphs, aligned to Students can read and draw bar charts and line graphs.","[{""text"":""Dogs are the greatest group."",""correct"":false},{""text"":""Cats and fish are equal, and together they make 24."",""correct"":true},{""text"":""Birds are 6 more than dogs."",""correct"":false},{""text"":""All four groups have different values."",""correct"":false}]","Excellent! Cats and fish are both 12, and 12 + 12 = 24.","{""questionNumber"":""Q67"",""questionType"":""mcq"",""subject"":""Maths"",""grade"":4,""topic"":""Data Display & Interpretation"",""subtopic"":""Bar Charts & Line Graphs"",""learning_objective"":""Students can read and draw bar charts and line graphs"",""focus"":""context_interpretation""}"
68,tddi6yl9-sbclgs7qx-lscraskxs-q68-mcq,Q68,mcq,"A playground score chart shows skipping rope = 13, hopscotch = 9, tag = 15, and swings = 11. One game was removed so the total score changed from 48 to 39. Which game was removed?",Maths,4,Data Display & Interpretation,Bar Charts & Line Graphs,Students can read and draw bar charts and line graphs,Analyzing,medium,3,"MCQ for Grade 4 Data Display & Interpretation: Bar Charts & Line Graphs, aligned to Students can read and draw bar charts and line graphs.","[{""text"":""Skipping rope"",""correct"":false},{""text"":""Hopscotch"",""correct"":true},{""text"":""Tag"",""correct"":false},{""text"":""Swings"",""correct"":false}]","First check the total: 13 + 9 + 15 + 11 = 48. The new total is 39, so the removed game must be worth 48 - 39 = 9. Hopscotch has a score of 9, so hopscotch was removed. The other games have values 13, 15, and 11, which would not leave a total of 39.","{""questionNumber"":""Q68"",""questionType"":""mcq"",""subject"":""Maths"",""grade"":4,""topic"":""Data Display & Interpretation"",""subtopic"":""Bar Charts & Line Graphs"",""learning_objective"":""Students can read and draw bar charts and line graphs"",""focus"":""error_correction""}"
69,tddi6yl9-sbclgs7qx-lscraskxs-q69-mcq,Q69,mcq,"A graph shows ice cream votes: vanilla = 7, chocolate = 12, strawberry = 10, and mango = 12. Which statement correctly identifies both how many more votes chocolate got than vanilla and which two flavours are tied for the highest?",Maths,4,Data Display & Interpretation,Bar Charts & Line Graphs,Students can read and draw bar charts and line graphs,Analyzing,medium,2,"MCQ for Grade 4 Data Display & Interpretation: Bar Charts & Line Graphs, aligned to Students can read and draw bar charts and line graphs.","[{""text"":""Chocolate got 5 more votes than vanilla, and chocolate and mango are tied for the highest."",""correct"":true},{""text"":""Chocolate got 2 more votes than vanilla, and strawberry and mango are tied for the highest."",""correct"":false},{""text"":""Chocolate got 5 more votes than vanilla, and chocolate is the only highest flavour."",""correct"":false},{""text"":""Chocolate got 4 more votes than vanilla, and vanilla and mango are tied for the highest."",""correct"":false}]","Chocolate has 12 votes and vanilla has 7 votes, so 12 - 7 = 5 more votes. The highest number is 12, and both chocolate and mango have 12, so they are tied for the highest. That makes the first statement correct.","{""questionNumber"":""Q69"",""questionType"":""mcq"",""subject"":""Maths"",""grade"":4,""topic"":""Data Display & Interpretation"",""subtopic"":""Bar Charts & Line Graphs"",""learning_objective"":""Students can read and draw bar charts and line graphs"",""focus"":""compare_or_judge""}"
